id,feed,title,body,score,num_comments,created_utc,permalink,url,text,ticker_counts,candidate_mentions,sentiment,engagement
1uyf2hb,hot,Momentum stocks seasonality chart,"In case you’re wondering why it feels like every higher beta growth stock you own is getting absolutely relentlessly annihilated.  -27.5% and probably higher after close today.  Higher than 2021 fed shutting the printer down.  July typically is a pullback but this is on the levels of dot com burst, with companies actually still making money.  TSM and ASML just had stellar quarters, mag 7 probably keeps spending.

Anyways, calls. Onward!",315,65,2026-07-16 20:56:20+00:00,https://www.reddit.com/r/wallstreetbets/comments/1uyf2hb/momentum_stocks_seasonality_chart/,https://i.redd.it/vlupvc6unndh1.jpeg,"Momentum stocks seasonality chart In case you’re wondering why it feels like every higher beta growth stock you own is getting absolutely relentlessly annihilated.  -27.5% and probably higher after close today.  Higher than 2021 fed shutting the printer down.  July typically is a pullback but this is on the levels of dot com burst, with companies actually still making money.  TSM and ASML just had stellar quarters, mag 7 probably keeps spending.

Anyways, calls. Onward!","Counter({'TSM': 1, 'ASML': 1})",2,0.4295,9.945396955613337
1uyezbt,hot,A few good trades greatly outnumbered by bad ones.,,162,46,2026-07-16 20:52:49+00:00,https://www.reddit.com/r/wallstreetbets/comments/1uyezbt/a_few_good_trades_greatly_outnumbered_by_bad_ones/,https://i.redd.it/6wdah9m7nndh1.jpeg,A few good trades greatly outnumbered by bad ones.,Counter(),0,-0.2177,8.94389780251682
1uydllp,hot,"What Are Your Moves Tomorrow, July 17, 2026",This post contains content not supported on old Reddit. [Click here to view the full post](https://sh.reddit.com/r/wallstreetbets/comments/1uydllp),207,13850,2026-07-16 20:00:37+00:00,https://www.reddit.com/r/wallstreetbets/comments/1uydllp/what_are_your_moves_tomorrow_july_17_2026/,https://www.reddit.com/r/wallstreetbets/comments/1uydllp/what_are_your_moves_tomorrow_july_17_2026/,"What Are Your Moves Tomorrow, July 17, 2026 This post contains content not supported on old Reddit. [Click here to view the full post](https://sh.reddit.com/r/wallstreetbets/comments/1uydllp)",Counter(),0,-0.2411,14.873650790876416
1uyd0rr,hot,"Thanks Elon for such great POS SPCX 😂😂,",SSPC is 2x Short SPCX etf ,779,167,2026-07-16 19:39:00+00:00,https://www.reddit.com/r/wallstreetbets/comments/1uyd0rr/thanks_elon_for_such_great_pos_spcx/,https://i.redd.it/1jiirmg1andh1.jpeg,"Thanks Elon for such great POS SPCX 😂😂, SSPC is 2x Short SPCX etf","Counter({'SPCX': 2, 'POS': 1, 'SSPC': 1})",4,0.7906,11.783257899086896
1uycjzg,hot,Gains evaporated,Sheeeeeeeeeeesh lol,69,19,2026-07-16 19:21:44+00:00,https://www.reddit.com/r/wallstreetbets/comments/1uycjzg/gains_evaporated/,https://i.redd.it/vdqfq7ly6ndh1.jpeg,Gains evaporated Sheeeeeeeeeeesh lol,Counter(),0,0.6369,7.244227515603351
1uybhze,hot,Truth Social to sell banks 'fastest' access to Trump's posts (Reuters),">Trump Media & Technology Group has unveiled a paid-for, licensed data feed that will give banks ​and trading firms ""the fastest"" access to posts from influential Truth Social ‌accounts, such as President Donald Trump's, whose posts often move global markets.

>The product, called 'Truth API', will deliver posts from the 10 most influential accounts to customers at a significantly ​faster pace than a regular push notification on the Truth Social ​platform, a spokesperson said.

Do you think it could be a useful trading signal?

Source: [https://www.reuters.com/technology/trump-media-unveils-data-feed-businesses-tracking-truth-social-posts-2026-07-16/](https://www.reuters.com/technology/trump-media-unveils-data-feed-businesses-tracking-truth-social-posts-2026-07-16/)",13825,1040,2026-07-16 18:42:41+00:00,https://www.reddit.com/r/wallstreetbets/comments/1uybhze/truth_social_to_sell_banks_fastest_access_to/,https://i.redd.it/1r8raaknzmdh1.png,"Truth Social to sell banks 'fastest' access to Trump's posts (Reuters) >Trump Media & Technology Group has unveiled a paid-for, licensed data feed that will give banks ​and trading firms ""the fastest"" access to posts from influential Truth Social ‌accounts, such as President Donald Trump's, whose posts often move global markets.

>The product, called 'Truth API', will deliver posts from the 10 most influential accounts to customers at a significantly ​faster pace than a regular push notification on the Truth Social ​platform, a spokesperson said.

Do you think it could be a useful trading signal?

Source: [https://www.reuters.com/technology/trump-media-unveils-data-feed-businesses-tracking-truth-social-posts-2026-07-16/](https://www.reuters.com/technology/trump-media-unveils-data-feed-businesses-tracking-truth-social-posts-2026-07-16/)",Counter({'API': 1}),1,0.9423,16.48224322512018
1uyaloz,hot,I'll join in the loss porn,Bottom when?,58,34,2026-07-16 18:10:31+00:00,https://www.reddit.com/r/wallstreetbets/comments/1uyaloz/ill_join_in_the_loss_porn/,https://i.redd.it/g4lnum69umdh1.jpeg,I'll join in the loss porn Bottom when?,Counter(),0,-0.0258,7.632885505395134
1uya9ug,hot,SNDK: I hold the power,"I could end all this pain suffering for all of you right now, by selling and flipping my position to short. Hell, I could have done it two hours ago. But I won't.",61,30,2026-07-16 17:59:06+00:00,https://www.reddit.com/r/wallstreetbets/comments/1uya9ug/sndk_i_hold_the_power/,https://i.redd.it/mu22ixs7smdh1.jpeg,"SNDK: I hold the power I could end all this pain suffering for all of you right now, by selling and flipping my position to short. Hell, I could have done it two hours ago. But I won't.",Counter({'SNDK': 1}),1,-0.7421,7.561121589530238
1uy9lp1,hot,What should I do with my MU calls?,"Bought ITM 1000 calls expiring 09/18 when MU was 1090. At this point, I’m not even looking for making profits. I just don’t want to be in deep loss. What should I do? Is there a different stock I should look into to neutralize my loss? MU has been declining for past 3 weeks.",270,405,2026-07-16 17:34:43+00:00,https://www.reddit.com/r/wallstreetbets/comments/1uy9lp1/what_should_i_do_with_my_mu_calls/,https://i.redd.it/rxhocg9vnmdh1.jpeg,"What should I do with my MU calls? Bought ITM 1000 calls expiring 09/18 when MU was 1090. At this point, I’m not even looking for making profits. I just don’t want to be in deep loss. What should I do? Is there a different stock I should look into to neutralize my loss? MU has been declining for past 3 weeks.",Counter(),0,-0.2359,11.608471980481433
1uy98lw,hot,+$158k on IBM calls,"Waited for 3rd red day on IBM and threw 200k at the bottom on 8/21 220c

Was planning on holding for a week or so but today’s action was a gift. $158k in a few hours

\- Regards",127,19,2026-07-16 17:21:54+00:00,https://www.reddit.com/r/wallstreetbets/comments/1uy98lw/158k_on_ibm_calls/,https://www.reddit.com/gallery/1uy98lw,"+$158k on IBM calls Waited for 3rd red day on IBM and threw 200k at the bottom on 8/21 220c

Was planning on holding for a week or so but today’s action was a gift. $158k in a few hours

\- Regards",Counter({'IBM': 2}),2,0.5927,7.847762537473608
1uy8a0f,hot,And I thought I’d be safe with shares only 😣,"Ok some leveraged but not thaaat much…  
(Keeping my wdc losses visible so I get reminded to not do it again)",125,118,2026-07-16 16:47:28+00:00,https://www.reddit.com/r/wallstreetbets/comments/1uy8a0f/and_i_thought_id_be_safe_with_shares_only/,https://i.redd.it/kd01yulffmdh1.jpeg,"And I thought I’d be safe with shares only 😣 Ok some leveraged but not thaaat much…  
(Keeping my wdc losses visible so I get reminded to not do it again)",Counter(),0,-0.1027,9.615405400063008
1uy7l7f,hot,I’ll take my nuggies crisp on The Moon TYSM,Basically catch me behind the Wendy’s dumpster on  Uranus or Mars,77,20,2026-07-16 16:22:17+00:00,https://www.reddit.com/r/wallstreetbets/comments/1uy7l7f/ill_take_my_nuggies_crisp_on_the_moon_tysm/,https://i.redd.it/h4nqc20yamdh1.jpeg,I’ll take my nuggies crisp on The Moon TYSM Basically catch me behind the Wendy’s dumpster on  Uranus or Mars,Counter({'TYSM': 1}),1,-0.1531,7.401231264413015
1uy7f50,hot,"Doubled down. $300,000 USD on $NFLX 🎲","EDIT: GUH  
  
I’ve decided to double down on my original position going into NFLX’s earnings. If you want the DD and to see the original position check my previous YOLO post: [here…](https://www.reddit.com/r/wallstreetbets/comments/1ut7wgf/450000_usd_on_msft_nflx_funded_entirely_by_meta/) But TLDR: I made the decision to invest in Netflix while on the comedown of some LSD that was gifted to me from a hot femboy. While I was tripping I also realized fear is just an illusion… it’s a fake cognitive emotion designed by the poor and force fed to us by society from birth.

I skimmed some gains off the MSFT position in the previous YOLO to fund this double down, but I'm still holding $280k in MSFT calls as well.

I highly recommend you inverse me. I’ve never actually paid for Netflix or any streaming subscriptions in my life... but despite me not doing so, I’m sure plenty of you regards happily fork over your Wendy’s pay checks to fund a lifestyle filled with subscriptions, which is exactly why I'm so confident in this ~~insider trade~~ “investment”.

A message for all the goy here still paying for streaming services instead of hosting your own Plex or Jellyfin server on a Linux/Docker stack: please don't ever learn how to self host pirated content… keep being good little consumers and paying monthly fees. God bless America and Godspeed.",715,469,2026-07-16 16:16:13+00:00,https://www.reddit.com/r/wallstreetbets/comments/1uy7f50/doubled_down_300000_usd_on_nflx/,https://www.reddit.com/gallery/1uy7f50,"Doubled down. $300,000 USD on $NFLX 🎲 EDIT: GUH  
  
I’ve decided to double down on my original position going into NFLX’s earnings. If you want the DD and to see the original position check my previous YOLO post: [here…](https://www.reddit.com/r/wallstreetbets/comments/1ut7wgf/450000_usd_on_msft_nflx_funded_entirely_by_meta/) But TLDR: I made the decision to invest in Netflix while on the comedown of some LSD that was gifted to me from a hot femboy. While I was tripping I also realized fear is just an illusion… it’s a fake cognitive emotion designed by the poor and force fed to us by society from birth.

I skimmed some gains off the MSFT position in the previous YOLO to fund this double down, but I'm still holding $280k in MSFT calls as well.

I highly recommend you inverse me. I’ve never actually paid for Netflix or any streaming subscriptions in my life... but despite me not doing so, I’m sure plenty of you regards happily fork over your Wendy’s pay checks to fund a lifestyle filled with subscriptions, which is exactly why I'm so confident in this ~~insider trade~~ “investment”.

A message for all the goy here still paying for streaming services instead of hosting your own Plex or Jellyfin server on a Linux/Docker stack: please don't ever learn how to self host pirated content… keep being good little consumers and paying monthly fees. God bless America and Godspeed.","Counter({'NFLX': 3, 'MSFT': 2, 'GUH': 1, 'LSD': 1})",7,0.9822,12.72641286166475
1uy75dz,hot,I still believe in the thesis,"September and October calls lookin real spicy rn.

I’m not convinced that it’s done yet.  I still have conviction; I’ll let it go to 0.",188,98,2026-07-16 16:06:33+00:00,https://www.reddit.com/r/wallstreetbets/comments/1uy75dz/i_still_believe_in_the_thesis/,https://i.redd.it/nych8md48mdh1.jpeg,"I still believe in the thesis September and October calls lookin real spicy rn.

I’m not convinced that it’s done yet.  I still have conviction; I’ll let it go to 0.",Counter(),0,-0.3089,9.836866865194231
1uy6vsq,hot,Ouch Ouch Ouch,"Luckily, there are all shares, but it stings looking at this.",216,91,2026-07-16 15:57:17+00:00,https://www.reddit.com/r/wallstreetbets/comments/1uy6vsq/ouch_ouch_ouch/,https://i.redd.it/h1tuly1c6mdh1.png,"Ouch Ouch Ouch Luckily, there are all shares, but it stings looking at this.",Counter(),0,0.4118,9.901685930589501
1uy6qwc,hot,NBIS MRVL BE devastated,"Threee stocks burned me alive..  
I might trim soon",48,40,2026-07-16 15:52:19+00:00,https://www.reddit.com/r/wallstreetbets/comments/1uy6qwc/nbis_mrvl_be_devastated/,https://i.redd.it/xofn0hfl5mdh1.jpeg,"NBIS MRVL BE devastated Threee stocks burned me alive..  
I might trim soon","Counter({'NBIS': 1, 'MRVL': 1})",2,-0.6124,7.605392364814934
1uy671t,hot,After dusting 30k in ARM I’m done.,,20,15,2026-07-16 15:32:01+00:00,https://www.reddit.com/r/wallstreetbets/comments/1uy671t/after_dusting_30k_in_arm_im_done/,https://i.redd.it/9pq2jyuy1mdh1.jpeg,After dusting 30k in ARM I’m done.,Counter({'ARM': 1}),1,0.0,5.817111159963204
1uy60lc,hot,My 1st YOLO has taken a shit,,105,61,2026-07-16 15:25:17+00:00,https://www.reddit.com/r/wallstreetbets/comments/1uy60lc/my_1st_yolo_has_taken_a_shit/,https://i.redd.it/mxfvujuq0mdh1.png,My 1st YOLO has taken a shit,Counter(),0,-0.1943,8.790573479157159
1uy5kgf,hot,Reddit (RDDT) Yolo,"I spend more time on this app than any other. In the AI age, they have both an authentic human platform as well as an immense amount of AI training data to monetize. I am a believer in this company and management. At a current market cap under $40B as the 9th most visited website in the world, they are immensely undervalued. They will only continue to crush earnings. Peace ✌️ ",24,6,2026-07-16 15:08:37+00:00,https://www.reddit.com/r/wallstreetbets/comments/1uy5kgf/reddit_rddt_yolo/,https://i.redd.it/th38logsxldh1.jpeg,"Reddit (RDDT) Yolo I spend more time on this app than any other. In the AI age, they have both an authentic human platform as well as an immense amount of AI training data to monetize. I am a believer in this company and management. At a current market cap under $40B as the 9th most visited website in the world, they are immensely undervalued. They will only continue to crush earnings. Peace ✌️",Counter({'RDDT': 1}),1,0.7269,5.164785973923514
1uy4o1n,hot,New Gambling Methods Inbound,"# ""Stocks and futures. Better together.

77 contracts, 55 stocks, 2 sizes – all hitting the markets on July 27.\* 

Trade Micro- and larger-sized Single Stock futures for precise exposure to leading U.S. stocks in the S&P 500, Nasdaq-100 and Russell 1000, all with the capital efficiency and flexibility of financially settled contracts"".",27,4,2026-07-16 14:36:18+00:00,https://www.reddit.com/r/wallstreetbets/comments/1uy4o1n/new_gambling_methods_inbound/,https://www.cmegroup.com/markets/equities/single-stock-futures.html,"New Gambling Methods Inbound # ""Stocks and futures. Better together.

77 contracts, 55 stocks, 2 sizes – all hitting the markets on July 27.\* 

Trade Micro- and larger-sized Single Stock futures for precise exposure to leading U.S. stocks in the S&P 500, Nasdaq-100 and Russell 1000, all with the capital efficiency and flexibility of financially settled contracts"".",Counter(),0,0.7783,4.941642422609304
1uy4h6z,hot,"enjoy my 15% to -20% loss, 80k lost till now",half of my port is both bb and sls,93,30,2026-07-16 14:29:01+00:00,https://www.reddit.com/r/wallstreetbets/comments/1uy4h6z/enjoy_my_15_to_20_loss_80k_lost_till_now/,https://www.reddit.com/gallery/1uy4h6z,"enjoy my 15% to -20% loss, 80k lost till now half of my port is both bb and sls",Counter(),0,-0.1027,7.97728198675515
1uy3q4e,hot,Completely forgot i still had some runners on this,,20,3,2026-07-16 14:00:40+00:00,https://www.reddit.com/r/wallstreetbets/comments/1uy3q4e/completely_forgot_i_still_had_some_runners_on_this/,https://i.redd.it/k5ami4holldh1.jpeg,Completely forgot i still had some runners on this,Counter(),0,0.0,4.430816798843313
1uy3c35,hot,I was leaving fun for a little bit :(,,35,37,2026-07-16 13:45:25+00:00,https://www.reddit.com/r/wallstreetbets/comments/1uy3c35/i_was_leaving_fun_for_a_little_bit/,https://www.reddit.com/gallery/1uy3c35,I was leaving fun for a little bit :(,Counter(),0,0.1725,7.221105098182496
1uy31ra,hot,Uber Makes $14.8B Takeover Bid for Delivery Hero,"Uber ($UBER) has agreed to acquire Germany’s Delivery Hero ($DHER) for $14.8 billion, offering shareholders €41.50 per share. The deal would combine Uber Eats with brands including foodpanda, PedidosYa and talabat, expanding Uber’s food-delivery reach across dozens of global markets. Delivery Hero’s operations in 14 overlapping countries will instead be sold to SSW Partners for $1.6 billion to reduce competition concerns, with the takeover expected to close in the second half of 2027.

  
Source - [https://www.theguardian.com/technology/2026/jul/16/uber-buy-germany-delivery-hero-148bn-global-deal](https://www.theguardian.com/technology/2026/jul/16/uber-buy-germany-delivery-hero-148bn-global-deal)",69,59,2026-07-16 13:33:56+00:00,https://www.reddit.com/r/wallstreetbets/comments/1uy31ra/uber_makes_148b_takeover_bid_for_delivery_hero/,https://www.reddit.com/r/wallstreetbets/comments/1uy31ra/uber_makes_148b_takeover_bid_for_delivery_hero/,"Uber Makes $14.8B Takeover Bid for Delivery Hero Uber ($UBER) has agreed to acquire Germany’s Delivery Hero ($DHER) for $14.8 billion, offering shareholders €41.50 per share. The deal would combine Uber Eats with brands including foodpanda, PedidosYa and talabat, expanding Uber’s food-delivery reach across dozens of global markets. Delivery Hero’s operations in 14 overlapping countries will instead be sold to SSW Partners for $1.6 billion to reduce competition concerns, with the takeover expected to close in the second half of 2027.

  
Source - [https://www.theguardian.com/technology/2026/jul/16/uber-buy-germany-delivery-hero-148bn-global-deal](https://www.theguardian.com/technology/2026/jul/16/uber-buy-germany-delivery-hero-148bn-global-deal)","Counter({'UBER': 2, 'DHER': 2, 'SSW': 1})",5,0.8971,8.34283980427146
1uy2m30,new,"$17k YOLO on Bitmine Immersion (BMNR), Bitcoin & Ethereum in secular bear market.","Tons of puts! The pop yesterday was solely due to some New Hampshire legislation. Bitcoin and Ethereum are both gonna get dragged down by generally lackluster interest, geopolitical headwinds, and a hawkish Fed. 🫡 This stock will return to the 14s with haste. 🐸🫂🐸",10,17,2026-07-16 13:16:30+00:00,https://www.reddit.com/r/wallstreetbets/comments/1uy2m30/17k_yolo_on_bitmine_immersion_bmnr_bitcoin/,https://i.redd.it/vh0ztapsdldh1.jpeg,"$17k YOLO on Bitmine Immersion (BMNR), Bitcoin & Ethereum in secular bear market. Tons of puts! The pop yesterday was solely due to some New Hampshire legislation. Bitcoin and Ethereum are both gonna get dragged down by generally lackluster interest, geopolitical headwinds, and a hawkish Fed. 🫡 This stock will return to the 14s with haste. 🐸🫂🐸",Counter({'BMNR': 1}),1,0.7118,5.288267030694535
1uy2k3v,hot,Taiwan computer chipmaker TSMC pledges another $100 billion to expand US chipmaking capacity,&#x200B;,1048,70,2026-07-16 13:14:17+00:00,https://www.reddit.com/r/wallstreetbets/comments/1uy2k3v/taiwan_computer_chipmaker_tsmc_pledges_another/,https://ca.finance.yahoo.com/news/taiwan-computer-chipmaker-tsmc-pledges-065247379.html,Taiwan computer chipmaker TSMC pledges another $100 billion to expand US chipmaking capacity &#x200B;,Counter({'TSMC': 1}),1,0.3182,11.218272485437613
1uy1gfa,hot,US probes Samsung for alleged infringement of Netlist's memory-chip patents,,251,32,2026-07-16 12:28:11+00:00,https://www.reddit.com/r/wallstreetbets/comments/1uy1gfa/us_probes_samsung_for_alleged_infringement_of/,https://www.reuters.com/world/asia-pacific/us-probes-samsung-alleged-infringement-netlists-memory-chip-patents-2026-07-16/,US probes Samsung for alleged infringement of Netlist's memory-chip patents,Counter(),0,-0.4767,9.025936648977904
1uxzcyk,hot,Free money arbitraging SK Hynix,"SK Hynix shares are currently trading at 33% premium on NASDAQ compared to KRX.

Short NASDAQ + Long KRX = free money

My example: 70 KRX shares - 700 NASDAQ ADR  
Total margin impact: +$66k  
Maximum profit: +$30k  
Annual cost of shorting: $86k \* 2.28% = -$2k  
Annual interest on net cash: $30k \* 3.5% = +$1k

Main risks:

* Brief premium spike due to difference in exchange trading hours. Let's say SKHY doubles overnight while KRX is sleeping. If I don't have enough portfolio value, it can result in a margin call.
* Lack of shortable SKHY shares - will increase the cost of shorting.

Thoughts?",87,56,2026-07-16 10:49:24+00:00,https://www.reddit.com/r/wallstreetbets/comments/1uxzcyk/free_money_arbitraging_sk_hynix/,https://i.redd.it/2c64jntcnkdh1.png,"Free money arbitraging SK Hynix SK Hynix shares are currently trading at 33% premium on NASDAQ compared to KRX.

Short NASDAQ + Long KRX = free money

My example: 70 KRX shares - 700 NASDAQ ADR  
Total margin impact: +$66k  
Maximum profit: +$30k  
Annual cost of shorting: $86k \* 2.28% = -$2k  
Annual interest on net cash: $30k \* 3.5% = +$1k

Main risks:

* Brief premium spike due to difference in exchange trading hours. Let's say SKHY doubles overnight while KRX is sleeping. If I don't have enough portfolio value, it can result in a margin call.
* Lack of shortable SKHY shares - will increase the cost of shorting.

Thoughts?","Counter({'KRX': 4, 'SKHY': 2, 'ADR': 1})",7,0.9545,8.520388082312756
1uxygra,hot,"Daily Discussion Thread for July 16, 2026",This post contains content not supported on old Reddit. [Click here to view the full post](https://sh.reddit.com/r/wallstreetbets/comments/1uxygra),192,15640,2026-07-16 10:01:07+00:00,https://www.reddit.com/r/wallstreetbets/comments/1uxygra/daily_discussion_thread_for_july_16_2026/,https://www.reddit.com/r/wallstreetbets/comments/1uxygra/daily_discussion_thread_for_july_16_2026/,"Daily Discussion Thread for July 16, 2026 This post contains content not supported on old Reddit. [Click here to view the full post](https://sh.reddit.com/r/wallstreetbets/comments/1uxygra)",Counter(),0,-0.2411,14.920341139579127
1uxxe6o,new,UnitedHealth Group Q2 Earnings Call Live Transcript,This post contains content not supported on old Reddit. [Click here to view the full post](https://sh.reddit.com/r/wallstreetbets/comments/1uxxe6o),28,29,2026-07-16 09:00:12+00:00,https://www.reddit.com/r/wallstreetbets/comments/1uxxe6o/unitedhealth_group_q2_earnings_call_live/,https://www.reddit.com/r/wallstreetbets/comments/1uxxe6o/unitedhealth_group_q2_earnings_call_live/,UnitedHealth Group Q2 Earnings Call Live Transcript This post contains content not supported on old Reddit. [Click here to view the full post](https://sh.reddit.com/r/wallstreetbets/comments/1uxxe6o),Counter(),0,-0.2411,6.76849321164863
1uxxb9g,hot,Switching to 0dte,"0dte is the way, made most of my losses back in the last month ",398,99,2026-07-16 08:55:32+00:00,https://www.reddit.com/r/wallstreetbets/comments/1uxxb9g/switching_to_0dte/,https://i.redd.it/zxxhu4l83kdh1.jpeg,"Switching to 0dte 0dte is the way, made most of my losses back in the last month",Counter(),0,-0.4522,10.594131602877955
1uxw2xs,hot,"where do you think semi conductors are headed to in 1 month, 6 month and a year from now?",,439,305,2026-07-16 07:43:23+00:00,https://www.reddit.com/r/wallstreetbets/comments/1uxw2xs/where_do_you_think_semi_conductors_are_headed_to/,https://i.redd.it/eyh27vccqjdh1.png,"where do you think semi conductors are headed to in 1 month, 6 month and a year from now?",Counter(),0,0.0,11.810359828864687
1uxqncm,hot,Volatility is Vitality 🥹,"Posting for a friend. Cheers 🫶

Ticker: MSTR

He bought stock and options in 2024. Paid off big time in just a couple months. 

Portfolio went up 5x (his all-time chart doesn’t show intra-week top). Top on Nov 21 2024 was $540,000. 

ALL the calls were rolled forward. 💀",271,80,2026-07-16 02:55:03+00:00,https://www.reddit.com/r/wallstreetbets/comments/1uxqncm/volatility_is_vitality/,https://www.reddit.com/gallery/1uxqncm,"Volatility is Vitality 🥹 Posting for a friend. Cheers 🫶

Ticker: MSTR

He bought stock and options in 2024. Paid off big time in just a couple months. 

Portfolio went up 5x (his all-time chart doesn’t show intra-week top). Top on Nov 21 2024 was $540,000. 

ALL the calls were rolled forward. 💀","Counter({'MSTR': 1, 'ALL': 1})",2,0.8555,10.000251220968437
