id,feed,title,body,score,num_comments,created_utc,permalink,url,text,ticker_counts,candidate_mentions,sentiment,engagement
1u1lejl,hot,I’m done (6k loss),I had a good run and almost started a comeback. I just went on the most insane tilt ever. So time to start finding good businesses and investing long term.,6,20,2026-06-09 23:26:27+00:00,https://www.reddit.com/r/wallstreetbets/comments/1u1lejl/im_done_6k_loss/,https://i.redd.it/ogiiwe4wcc6h1.jpeg,I’m done (6k loss) I had a good run and almost started a comeback. I just went on the most insane tilt ever. So time to start finding good businesses and investing long term.,Counter(),0,0.4228,4.990432586778736
1u1lbo0,hot,SPCX bout to see a lot of volatility,,3,8,2026-06-09 23:23:06+00:00,https://www.reddit.com/r/wallstreetbets/comments/1u1lbo0/spcx_bout_to_see_a_lot_of_volatility/,https://www.reddit.com/gallery/1u1lbo0,SPCX bout to see a lot of volatility,Counter({'SPCX': 1}),1,0.0,3.58351893845611
1u1lb8e,hot,2k to 50k,"Nothing beats caffeine like 0DTEs, see you next week.",37,29,2026-06-09 23:22:37+00:00,https://www.reddit.com/r/wallstreetbets/comments/1u1lb8e/2k_to_50k/,https://i.redd.it/svvvtsf7cc6h1.png,"2k to 50k Nothing beats caffeine like 0DTEs, see you next week.",Counter(),0,-0.2755,7.038783541388542
1u1kkj9,hot,Strikes against Iran... and oil taking +0.91%... Did I missed something?,"At the gas pump, to fill up I prefer really cheap oil but now that I have bought call options on SM Energy I admit to wanting the opposite, however the price of WTI below $90 given the circumstances, sorry I don't get it. Wti should be at $120!

After 100 days and the news of tonight ""American forces launched strikes against Iran “in response to yesterday’s downing of a U.S. Army Apache helicopter,” U.S. Central Command said"", I was expecting a much higher oil price 😳😳

",10,73,2026-06-09 22:51:23+00:00,https://www.reddit.com/r/wallstreetbets/comments/1u1kkj9/strikes_against_iran_and_oil_taking_091_did_i/,https://i.redd.it/t76zvgdi6c6h1.jpeg,"Strikes against Iran... and oil taking +0.91%... Did I missed something? At the gas pump, to fill up I prefer really cheap oil but now that I have bought call options on SM Energy I admit to wanting the opposite, however the price of WTI below $90 given the circumstances, sorry I don't get it. Wti should be at $120!

After 100 days and the news of tonight ""American forces launched strikes against Iran “in response to yesterday’s downing of a U.S. Army Apache helicopter,” U.S. Central Command said"", I was expecting a much higher oil price 😳😳",Counter({'WTI': 1}),1,-0.1882,6.70196036600254
1u1j2ym,hot,Good day for a college plebeian,Keep the volatility going!,0,6,2026-06-09 21:51:56+00:00,https://www.reddit.com/r/wallstreetbets/comments/1u1j2ym/good_day_for_a_college_plebeian/,https://i.redd.it/790t2431wb6h1.jpeg,Good day for a college plebeian Keep the volatility going!,Counter(),0,0.4926,1.9459101490553132
1u1izx4,hot,US strikes Iran in response to helicopter shootdown,"Oh boy, here we go again. Buckle up regards",1588,234,2026-06-09 21:48:44+00:00,https://www.reddit.com/r/wallstreetbets/comments/1u1izx4/us_strikes_iran_in_response_to_helicopter/,https://p.dw.com/p/5F2vi?at_medium=SocialMedia&at_campaign=Reddit&at_share_source=SharingButton&at_origin=Web,"US strikes Iran in response to helicopter shootdown Oh boy, here we go again. Buckle up regards",Counter(),0,-0.3612,12.830445680680874
1u1iyle,hot,Supermicro Announces Proposed $7.0 Billion of Equity and Equity-linked Financing Transactions To Fund AI Orders,"SMCI is known for shady accounting and despite almost getting delisted for not filing 10-k last year, has said they won’t change any accounting practices.

Then, 3 executives were arrested for smuggling Nvidia chips.

Today, they copied the Google playbook and diluted shares, using AI as an excuse. Somehow, bulls will still find this scam company doing what Google is doing as bullish",149,41,2026-06-09 21:47:16+00:00,https://www.reddit.com/r/wallstreetbets/comments/1u1iyle/supermicro_announces_proposed_70_billion_of/,https://ir.supermicro.com/news/news-details/2026/Supermicro-Announces-Proposed-7-0-Billion-of-Equity-and-Equity-linked-Financing-Transactions-To-Fund-AI-Orders/default.aspx,"Supermicro Announces Proposed $7.0 Billion of Equity and Equity-linked Financing Transactions To Fund AI Orders SMCI is known for shady accounting and despite almost getting delisted for not filing 10-k last year, has said they won’t change any accounting practices.

Then, 3 executives were arrested for smuggling Nvidia chips.

Today, they copied the Google playbook and diluted shares, using AI as an excuse. Somehow, bulls will still find this scam company doing what Google is doing as bullish",Counter({'SMCI': 1}),1,-0.8432,8.748304912379623
1u1i0yc,hot,Put 600 into margin account now that they removed peasant trading restrictions (still a lowly peasant),"SPX call at open, SPX puts on the way down, SPX calls again on the way up. What a difference not getting caught holding because I only have a few trades per day. ",41,9,2026-06-09 21:12:18+00:00,https://www.reddit.com/r/wallstreetbets/comments/1u1i0yc/put_600_into_margin_account_now_that_they_removed/,https://i.redd.it/hp7apikyob6h1.jpeg,"Put 600 into margin account now that they removed peasant trading restrictions (still a lowly peasant) SPX call at open, SPX puts on the way down, SPX calls again on the way up. What a difference not getting caught holding because I only have a few trades per day.",Counter({'SPX': 3}),3,-0.25,6.040254711277415
1u1h0ax,hot,UPST May Be On Its Last Leg,"TL;DR: it seems unlikely that Upstart will experience the glorious stock gains in 2020-2021 since those same rich conditions will not be repeated. Also, it appears they may be in trouble and need a bank charter to turn things around. The bank charter approval hinges on very crucial points where they are weak and so they will be unlikely to get an approval. The war is a catalyst causing more problems for Upstart. Inflation will rise and increase costs for their borrowers, which eats in to their ability to make repayments. The Fed will be forced to maintain or hike rates increasing critical strain on their borrowers and increasing delinquency rates.

The backdrop in 2020-2021: the Federal Funds Rate (FFR) was between 0% - 0.25% and the minimum reserve requirement ratio was 0. This caused the insane spike you see in M1 during that time period (because borrowing was virtually free and banks wanted to make as much money as possible). This also caused a bottleneck for everyday people like you and me who wanted loans. The traditional lending system was not created for this event. Rather, it was created for normal economic conditions. However, 2020-2021 was not a normal time period. It called for unconventional methods. Cue Upstart.

Upstart, as stated on its website, ""aim\[s\] to radically reduce the cost and complexity of borrowing for all Americans by using our proprietary AI models to remake the entire lending process.""

**Reduce** the **complexity** of borrowing.

That's exactly what it did during that time. It simplified the process and it captured market share in the lending space. There was an insatiable demand for loans and the old system could not simply process these loans fast enough. As a result, Upstart was able to capitalize on this inefficiency.

Q1 2021 - Q4 2021 saw unspeakable growth. Revenue grew 1,018% in Q2 2021 which saw an Adjusted EPS of $0.62. The revenue kept climbing and they kept beating Wall Street. Then, we started a new year with 2022 and the music stopped. Russia invaded Ukraine and we had an inflation problem. We were hiking the Federal Funds Rate and so down went Upstart.

Throughout 2022 - 2024, Upstart's revenues fluctuated, and their losses seemed somewhat minimal. Then, enter 2025, positive EPS and consistent revenue seeing the stock price rise up into the \~$80s. The effect of their stock price was compunded by the fall in inflation (though still elevated). Then, out of nowhere, we saw a sudden drop in stock price. Loans on the balance sheet. Sure, that's the reason the stock sold off. The truth is, the revenue is weak and they can barely hold on to the cash they earn. I guarantee you this isn't going to stop.

Their margins are razor thin no matter how much they earn in either rich conditions or poor. In 2021, their peak EPS was $0.61 with revenue at $305M. In the latest report Q1 2026, they had negative EPS of $0.08 with revenue at $308M. Upstart is no longer a ""new"" company anymore.

They have been in existence since 2012 and trading on the exchange for \~5 years now. Any revenue or EPS they report has to be 10X better for it to have any effect on the lay investor or speculator. I guarantee you, they will never achieve these numbers. However, they have a hail mary.

The **Bank Charter**.

**If** **approved**, they'll able to have access to deposit funding. They're currently backed by Private Credit partners. That's right, private credit. The one with the bubble at the moment. This could save them maybe 4-5%-improving bottom line. It reduces their regulatory complexity due to different states having different lending laws, rate caps, and licensing requirements. The charter bypasses these things. About 18 banking charter apps were filed in 2026. Nubank was approved within 4 months of applying.

**If not approved**, they're **stuck** with private credit concentration which doesn't help them one bit and keeps them **stuck** where they are. Ultimately, it will be their demise.

The bank charter is no guarantee and it's really their last hope. I imagine they won't get the approval.

The **active Securities Fraud Class Action**. The OCC, FDIC, and Federal Reserve conduct a character assessement and fitness review of each applicant. The pending Class Action stating Upstart made materially false and misleading statemetns about their AI model's accuracy **will be** flagged. Regulators **don't** approve banks run by management teams under active fraud litigation. The June 8, 2026 lead plaintiff deadline is coming up. This will make the case more formal and visible, which is happening right as the OCC is reviewing the application.

The **profitability requirements for de novo banks**. The OCC requires de novo banks demonstrate a credible path to sustained profitability (typically within 3 years). Upstart only returned to GAAP profitability in Q2 2025. Looking at the full earnings history, you can see Upstart is a loser. This will make their capital adequacy and business model highly questionable.

Upstart's application **requires 3 regulators**. Nubank applied to the OCC and FDIC only. The Federal Reserve wasn't a part of their applications. 3 different regulators and Upstart has no visible White House connection.

This is a favorable regulatory environment. Just look to the One Big Beautiful Bill. The administration seems to be a fan of less regulation. This is a now-or-never moment for Upstart. If they can't get the approval, they'll have to reapply. That can take up to 12-24 months. A new administration can change things and, by the looks of it, we might get one come 2028.

The **war**. It really is just a catalyst for Upstart's demise. It causes critical financial strain on their near-prime borrowers. Inflation up, jobs that fund these borrowers are down, and delinquncies can start to rise.

Let's face it, it's hard to say the war is ending anytime soon. The administration isn't fabricating chaos they can control. This is not in their hands unless they decide to nuke Iran (which won't happen). The Iranian Regime is a martyr government and doesn't need to win. They just need to cause bottlenecks or small disturbances in the SoH to disrupt shipping, which will increase inflation and force the Fed to hike rates or, at the very least, remain paused as a result. With the little tech the IRGC has, they seem to be very effective at doing that. Given the administration doesn't want to back down and neither the IRGC, this will be going on for a while. Let's say it ends tomorrow. Do you know how much of this we have to reverse? The economy isn't going to suddenly get better. As a result, the near prime borrowers won't either.

I've followed UPST for a long time now. It **had** a good run.

https://preview.redd.it/9xdpjgl7ib6h1.jpg?width=1170&format=pjpg&auto=webp&s=f8ba3a00f15d2edcc02023ea0c0f7cfa4d7443e2

",3,15,2026-06-09 20:35:00+00:00,https://www.reddit.com/r/wallstreetbets/comments/1u1h0ax/upst_may_be_on_its_last_leg/,https://www.reddit.com/r/wallstreetbets/comments/1u1h0ax/upst_may_be_on_its_last_leg/,"UPST May Be On Its Last Leg TL;DR: it seems unlikely that Upstart will experience the glorious stock gains in 2020-2021 since those same rich conditions will not be repeated. Also, it appears they may be in trouble and need a bank charter to turn things around. The bank charter approval hinges on very crucial points where they are weak and so they will be unlikely to get an approval. The war is a catalyst causing more problems for Upstart. Inflation will rise and increase costs for their borrowers, which eats in to their ability to make repayments. The Fed will be forced to maintain or hike rates increasing critical strain on their borrowers and increasing delinquency rates.

The backdrop in 2020-2021: the Federal Funds Rate (FFR) was between 0% - 0.25% and the minimum reserve requirement ratio was 0. This caused the insane spike you see in M1 during that time period (because borrowing was virtually free and banks wanted to make as much money as possible). This also caused a bottleneck for everyday people like you and me who wanted loans. The traditional lending system was not created for this event. Rather, it was created for normal economic conditions. However, 2020-2021 was not a normal time period. It called for unconventional methods. Cue Upstart.

Upstart, as stated on its website, ""aim\[s\] to radically reduce the cost and complexity of borrowing for all Americans by using our proprietary AI models to remake the entire lending process.""

**Reduce** the **complexity** of borrowing.

That's exactly what it did during that time. It simplified the process and it captured market share in the lending space. There was an insatiable demand for loans and the old system could not simply process these loans fast enough. As a result, Upstart was able to capitalize on this inefficiency.

Q1 2021 - Q4 2021 saw unspeakable growth. Revenue grew 1,018% in Q2 2021 which saw an Adjusted EPS of $0.62. The revenue kept climbing and they kept beating Wall Street. Then, we started a new year with 2022 and the music stopped. Russia invaded Ukraine and we had an inflation problem. We were hiking the Federal Funds Rate and so down went Upstart.

Throughout 2022 - 2024, Upstart's revenues fluctuated, and their losses seemed somewhat minimal. Then, enter 2025, positive EPS and consistent revenue seeing the stock price rise up into the \~$80s. The effect of their stock price was compunded by the fall in inflation (though still elevated). Then, out of nowhere, we saw a sudden drop in stock price. Loans on the balance sheet. Sure, that's the reason the stock sold off. The truth is, the revenue is weak and they can barely hold on to the cash they earn. I guarantee you this isn't going to stop.

Their margins are razor thin no matter how much they earn in either rich conditions or poor. In 2021, their peak EPS was $0.61 with revenue at $305M. In the latest report Q1 2026, they had negative EPS of $0.08 with revenue at $308M. Upstart is no longer a ""new"" company anymore.

They have been in existence since 2012 and trading on the exchange for \~5 years now. Any revenue or EPS they report has to be 10X better for it to have any effect on the lay investor or speculator. I guarantee you, they will never achieve these numbers. However, they have a hail mary.

The **Bank Charter**.

**If** **approved**, they'll able to have access to deposit funding. They're currently backed by Private Credit partners. That's right, private credit. The one with the bubble at the moment. This could save them maybe 4-5%-improving bottom line. It reduces their regulatory complexity due to different states having different lending laws, rate caps, and licensing requirements. The charter bypasses these things. About 18 banking charter apps were filed in 2026. Nubank was approved within 4 months of applying.

**If not approved**, they're **stuck** with private credit concentration which doesn't help them one bit and keeps them **stuck** where they are. Ultimately, it will be their demise.

The bank charter is no guarantee and it's really their last hope. I imagine they won't get the approval.

The **active Securities Fraud Class Action**. The OCC, FDIC, and Federal Reserve conduct a character assessement and fitness review of each applicant. The pending Class Action stating Upstart made materially false and misleading statemetns about their AI model's accuracy **will be** flagged. Regulators **don't** approve banks run by management teams under active fraud litigation. The June 8, 2026 lead plaintiff deadline is coming up. This will make the case more formal and visible, which is happening right as the OCC is reviewing the application.

The **profitability requirements for de novo banks**. The OCC requires de novo banks demonstrate a credible path to sustained profitability (typically within 3 years). Upstart only returned to GAAP profitability in Q2 2025. Looking at the full earnings history, you can see Upstart is a loser. This will make their capital adequacy and business model highly questionable.

Upstart's application **requires 3 regulators**. Nubank applied to the OCC and FDIC only. The Federal Reserve wasn't a part of their applications. 3 different regulators and Upstart has no visible White House connection.

This is a favorable regulatory environment. Just look to the One Big Beautiful Bill. The administration seems to be a fan of less regulation. This is a now-or-never moment for Upstart. If they can't get the approval, they'll have to reapply. That can take up to 12-24 months. A new administration can change things and, by the looks of it, we might get one come 2028.

The **war**. It really is just a catalyst for Upstart's demise. It causes critical financial strain on their near-prime borrowers. Inflation up, jobs that fund these borrowers are down, and delinquncies can start to rise.

Let's face it, it's hard to say the war is ending anytime soon. The administration isn't fabricating chaos they can control. This is not in their hands unless they decide to nuke Iran (which won't happen). The Iranian Regime is a martyr government and doesn't need to win. They just need to cause bottlenecks or small disturbances in the SoH to disrupt shipping, which will increase inflation and force the Fed to hike rates or, at the very least, remain paused as a result. With the little tech the IRGC has, they seem to be very effective at doing that. Given the administration doesn't want to back down and neither the IRGC, this will be going on for a while. Let's say it ends tomorrow. Do you know how much of this we have to reverse? The economy isn't going to suddenly get better. As a result, the near prime borrowers won't either.

I've followed UPST for a long time now. It **had** a good run.

https://preview.redd.it/9xdpjgl7ib6h1.jpg?width=1170&format=pjpg&auto=webp&s=f8ba3a00f15d2edcc02023ea0c0f7cfa4d7443e2","Counter({'OCC': 4, 'UPST': 2, 'FDIC': 2, 'IRGC': 2, 'FFR': 1, 'GAAP': 1})",12,0.9715,4.1588830833596715
1u1goa6,hot,Get yours laughs in,"This what I call a round trip of dreams and aspirations...

https://preview.redd.it/3sd1h41mfb6h1.jpg?width=1206&format=pjpg&auto=webp&s=be737b2dd4e52d2965ee65e45e48a7240abcc6e4

Ended the day up 20% but for a good 15 minutes I felt meaningful",79,11,2026-06-09 20:23:02+00:00,https://www.reddit.com/r/wallstreetbets/comments/1u1goa6/get_yours_laughs_in/,https://www.reddit.com/r/wallstreetbets/comments/1u1goa6/get_yours_laughs_in/,"Get yours laughs in This what I call a round trip of dreams and aspirations...

https://preview.redd.it/3sd1h41mfb6h1.jpg?width=1206&format=pjpg&auto=webp&s=be737b2dd4e52d2965ee65e45e48a7240abcc6e4

Ended the day up 20% but for a good 15 minutes I felt meaningful",Counter(),0,0.8674,6.866933284461881
1u1g1rf,hot,"What Are Your Moves Tomorrow, June 10, 2026",This post contains content not supported on old Reddit. [Click here to view the full post](https://sh.reddit.com/r/wallstreetbets/comments/1u1g1rf),156,4073,2026-06-09 20:00:37+00:00,https://www.reddit.com/r/wallstreetbets/comments/1u1g1rf/what_are_your_moves_tomorrow_june_10_2026/,https://www.reddit.com/r/wallstreetbets/comments/1u1g1rf/what_are_your_moves_tomorrow_june_10_2026/,"What Are Your Moves Tomorrow, June 10, 2026 This post contains content not supported on old Reddit. [Click here to view the full post](https://sh.reddit.com/r/wallstreetbets/comments/1u1g1rf)",Counter(),0,-0.2411,13.368626402135058
1u1fhyi,hot,Buying the panic only works in the short term,"I thought buying the bottom of a panic is the best scenario but it turned out a bit different. Best panic criteria I've found based on fear/greed and VIX ""score <= 5 for 3 trading days OR score <= 20 for 5 trading days OR VIX >= 35 for 1 trading days"" has slightly better returns and much smaller drawdown than random buying BUT over the long term investing monthly still wins.",20,6,2026-06-09 19:40:29+00:00,https://www.reddit.com/r/wallstreetbets/comments/1u1fhyi/buying_the_panic_only_works_in_the_short_term/,https://www.reddit.com/gallery/1u1fhyi,"Buying the panic only works in the short term I thought buying the bottom of a panic is the best scenario but it turned out a bit different. Best panic criteria I've found based on fear/greed and VIX ""score <= 5 for 3 trading days OR score <= 20 for 5 trading days OR VIX >= 35 for 1 trading days"" has slightly better returns and much smaller drawdown than random buying BUT over the long term investing monthly still wins.","Counter({'VIX': 2, 'BUT': 1})",3,0.8782,4.990432586778736
1u1f89r,hot,No thesis yolo HOOD calls,I thought I bought the dip.  YOLOing my savings on hood. Why? I can’t give you a reason besides Degen regard gambling at its finest and I need a down payment on a house.  I thought I bought the dip but I was wrong.  I’m either renting or printing.  Damn I missed the dip!  Haha,32,20,2026-06-09 19:30:49+00:00,https://www.reddit.com/r/wallstreetbets/comments/1u1f89r/no_thesis_yolo_hood_calls/,https://i.redd.it/sx9jbkmu6b6h1.jpeg,No thesis yolo HOOD calls I thought I bought the dip.  YOLOing my savings on hood. Why? I can’t give you a reason besides Degen regard gambling at its finest and I need a down payment on a house.  I thought I bought the dip but I was wrong.  I’m either renting or printing.  Damn I missed the dip!  Haha,Counter({'HOOD': 1}),1,-0.7809,6.541029999189903
1u1ewgh,hot,$8 to $2500 while shitting,"Started today with 8$ buying power. Took a shit and the $0.08 PUT I had yolo’d went tits up. I did the only logical thing possible and yolo’d again on ITM calls. Small win but i dont often see >20,000% returns ever.  Now time to invest this measly $2500 into SPCX shorts next week. ",1684,207,2026-06-09 19:19:03+00:00,https://www.reddit.com/r/wallstreetbets/comments/1u1ewgh/8_to_2500_while_shitting/,https://www.reddit.com/gallery/1u1ewgh,"$8 to $2500 while shitting Started today with 8$ buying power. Took a shit and the $0.08 PUT I had yolo’d went tits up. I did the only logical thing possible and yolo’d again on ITM calls. Small win but i dont often see >20,000% returns ever.  Now time to invest this measly $2500 into SPCX shorts next week.","Counter({'PUT': 1, 'SPCX': 1})",2,-0.3071,12.76705892248778
1u1ebob,hot,0DTE QQQ Puts+Calls,"  
After closing the Puts loaded up on Calls total gain \~$38k  
",54,14,2026-06-09 18:58:57+00:00,https://www.reddit.com/r/wallstreetbets/comments/1u1ebob/0dte_qqq_putscalls/,https://www.reddit.com/gallery/1u1ebob,"0DTE QQQ Puts+Calls   
After closing the Puts loaded up on Calls total gain \~$38k",Counter({'QQQ': 1}),1,0.5267,6.715383386334681
1u1e6ae,hot,"SpaceX IPO demand is approaching four times oversubscribed, source says",,913,247,2026-06-09 18:53:36+00:00,https://www.reddit.com/r/wallstreetbets/comments/1u1e6ae/spacex_ipo_demand_is_approaching_four_times/,https://www.reuters.com/world/spacex-ipo-demand-is-approaching-four-times-oversubscribed-source-says-2026-06-09/,"SpaceX IPO demand is approaching four times oversubscribed, source says",Counter(),0,-0.128,12.331259317619132
1u1cujz,hot,"Welp, I’m out ✌️",Odte spy put. My biggest gain ever. Gonna take a break from my gambling addiction for a few months. Good luck regards. ,1801,261,2026-06-09 18:06:29+00:00,https://www.reddit.com/r/wallstreetbets/comments/1u1cujz/welp_im_out/,https://i.redd.it/3q9h9x0tra6h1.jpeg,"Welp, I’m out ✌️ Odte spy put. My biggest gain ever. Gonna take a break from my gambling addiction for a few months. Good luck regards.",Counter(),0,0.8519,13.06499694192938
1u1cl7g,hot,the time is $NOW pt.2,i am once again full porting $now at these low levels. scared money don’t make money. just going off of vibes ,27,24,2026-06-09 17:57:49+00:00,https://www.reddit.com/r/wallstreetbets/comments/1u1cl7g/the_time_is_now_pt2/,https://i.redd.it/sv6luxh9qa6h1.jpeg,the time is $NOW pt.2 i am once again full porting $now at these low levels. scared money don’t make money. just going off of vibes,Counter({'NOW': 3}),3,-0.6124,6.551080335043404
