id,feed,title,body,score,num_comments,created_utc,permalink,url,text,ticker_counts,candidate_mentions,sentiment,engagement
1uesq9z,hot,Sold SPY for some WEN,"I had to sell some SPY to dollar cost average my options since I know they’re gonna print. WEN they do, you’ll be sorry",37,12,2026-06-24 22:54:26+00:00,https://www.reddit.com/r/wallstreetbets/comments/1uesq9z/sold_spy_for_some_wen/,https://www.reddit.com/gallery/1uesq9z,"Sold SPY for some WEN I had to sell some SPY to dollar cost average my options since I know they’re gonna print. WEN they do, you’ll be sorry","Counter({'SPY': 2, 'WEN': 2})",4,-0.0772,6.202535517187922
1ues2os,hot,"10000 shares of WEN across IRA and margin acct, literally can't fail right",Like the fundamentals are good enough for me not to get shafted,65,16,2026-06-24 22:27:15+00:00,https://www.reddit.com/r/wallstreetbets/comments/1ues2os/10000_shares_of_wen_across_ira_and_margin_acct/,https://www.reddit.com/gallery/1ues2os,"10000 shares of WEN across IRA and margin acct, literally can't fail right Like the fundamentals are good enough for me not to get shafted","Counter({'WEN': 1, 'IRA': 1})",2,0.7041,7.022868086082641
1uerxoo,hot,$WEN to the moon - 350K YOLO,50% of my portfolio. Lets take it to the moooon,497,148,2026-06-24 22:21:41+00:00,https://www.reddit.com/r/wallstreetbets/comments/1uerxoo/wen_to_the_moon_350k_yolo/,https://i.redd.it/xnmtpqh03b9h1.jpeg,$WEN to the moon - 350K YOLO 50% of my portfolio. Lets take it to the moooon,Counter({'WEN': 2}),2,0.4278,11.214546382970113
1uerhdg,hot,When will the Pain stop?,"I sold this call when MU was at $470 resistance 2 months ago and everyone was screaming “Top, TOP!, cyclical, Cyclical” and i thought it will never break $500.

And i was hoping this ER will do the same as it did 3 month ago after last ER. But i m cooked 💀. WHAT DO I EVEN DO???

That meme in the 2nd pic legit happened to me 😢.

Edit: Its not a covered call bcz I believed the bears.",166,334,2026-06-24 22:03:37+00:00,https://www.reddit.com/r/wallstreetbets/comments/1uerhdg/when_will_the_pain_stop/,https://www.reddit.com/gallery/1uerhdg,"When will the Pain stop? I sold this call when MU was at $470 resistance 2 months ago and everyone was screaming “Top, TOP!, cyclical, Cyclical” and i thought it will never break $500.

And i was hoping this ER will do the same as it did 3 month ago after last ER. But i m cooked 💀. WHAT DO I EVEN DO???

That meme in the 2nd pic legit happened to me 😢.

Edit: Its not a covered call bcz I believed the bears.","Counter({'TOP': 1, 'WHAT': 1, 'EVEN': 1})",3,-0.5996,10.93212434424182
1ueq95c,hot,Microsoft bagholders right now,,185,40,2026-06-24 21:16:33+00:00,https://www.reddit.com/r/wallstreetbets/comments/1ueq95c/microsoft_bagholders_right_now/,https://i.redd.it/3s68z9jcra9h1.jpeg,Microsoft bagholders right now,Counter(),0,0.0,8.939318740417509
1ueq24o,hot,If $MU opens above 1250 I will get an MU tattoo,"I’ll let top comment decide. No face,butt, or dick.",409,105,2026-06-24 21:09:17+00:00,https://www.reddit.com/r/wallstreetbets/comments/1ueq24o/if_mu_opens_above_1250_i_will_get_an_mu_tattoo/,https://www.reddit.com/r/wallstreetbets/comments/1ueq24o/if_mu_opens_above_1250_i_will_get_an_mu_tattoo/,"If $MU opens above 1250 I will get an MU tattoo I’ll let top comment decide. No face,butt, or dick.",Counter({'MU': 1}),1,-0.5719,10.67959625381042
1ueptjt,hot,For the people that thought the world was ending and MU earnings would be negative,"Yes, I had it ready and yes, I suck at photoshop.",409,68,2026-06-24 21:00:24+00:00,https://www.reddit.com/r/wallstreetbets/comments/1ueptjt/for_the_people_that_thought_the_world_was_ending/,https://i.redd.it/os39o5dboa9h1.jpeg,"For the people that thought the world was ending and MU earnings would be negative Yes, I had it ready and yes, I suck at photoshop.",Counter(),0,0.0772,10.250263664295613
1uepk0d,hot,Another victory for SNDK!,"This is the fourth time I’ve made a profit on a call option since I bought SNDK! Yesterday, countless people doubted me, but tonight I think I’ll open a bottle of fine red wine with my husband and dance a little to celebrate!",13,5,2026-06-24 20:50:23+00:00,https://www.reddit.com/r/wallstreetbets/comments/1uepk0d/another_victory_for_sndk/,https://www.reddit.com/gallery/1uepk0d,"Another victory for SNDK! This is the fourth time I’ve made a profit on a call option since I bought SNDK! Yesterday, countless people doubted me, but tonight I think I’ll open a bottle of fine red wine with my husband and dance a little to celebrate!",Counter({'SNDK': 2}),2,0.8446,4.430816798843313
1uepgkt,hot,BIG BALLZZZZZ,"I BOUGHT $MUU TODAY AT $805 (90 SHARES) LITERALLY MISSED TODAYS BOTTOM ($803) BY $2.  SHE IS NOW APPROACHING $1200 AH ON A MEGA BEAT.  I FIGURED THEY WERE SHAKING THE TREES AND STEALING STOP LOSSES.  I PUT MY SELL ORDER IN FOR  $1200 AH.  WILL IT HIT?  WOULD BE A +40K WIN 🏆 

I HAVE 173 SHARES

THANK YOU MICRON THANK YOU MUU",15,20,2026-06-24 20:46:50+00:00,https://www.reddit.com/r/wallstreetbets/comments/1uepgkt/big_ballzzzzz/,https://www.reddit.com/gallery/1uepgkt,"BIG BALLZZZZZ I BOUGHT $MUU TODAY AT $805 (90 SHARES) LITERALLY MISSED TODAYS BOTTOM ($803) BY $2.  SHE IS NOW APPROACHING $1200 AH ON A MEGA BEAT.  I FIGURED THEY WERE SHAKING THE TREES AND STEALING STOP LOSSES.  I PUT MY SELL ORDER IN FOR  $1200 AH.  WILL IT HIT?  WOULD BE A +40K WIN 🏆 

I HAVE 173 SHARES

THANK YOU MICRON THANK YOU MUU","Counter({'MUU': 3, 'THANK': 2, 'YOU': 2, 'BIG': 1, 'TODAY': 1, 'SHE': 1, 'NOW': 1, 'MEGA': 1, 'BEAT': 1, 'THEY': 1, 'WERE': 1, 'THE': 1, 'TREES': 1, 'AND': 1, 'STOP': 1, 'PUT': 1, 'ORDER': 1, 'FOR': 1, 'WILL': 1, 'HIT': 1, 'WOULD': 1, 'WIN': 1, 'HAVE': 1})",27,-0.3034,5.817111159963204
1uepc0q,hot,MU oppsies,Blew up my retirement account with micron. 50% losses in 2 days. Pls save me after hours so I can offload tomorrow. K thx ,29,45,2026-06-24 20:42:03+00:00,https://www.reddit.com/r/wallstreetbets/comments/1uepc0q/mu_oppsies/,https://www.reddit.com/gallery/1uepc0q,MU oppsies Blew up my retirement account with micron. 50% losses in 2 days. Pls save me after hours so I can offload tomorrow. K thx,Counter(),0,0.5106,7.229838778151251
1uepbkl,hot,"Micron tops Q3 earnings estimates, offers better-than-expected outlook and declares dividend",,194,46,2026-06-24 20:41:34+00:00,https://www.reddit.com/r/wallstreetbets/comments/1uepbkl/micron_tops_q3_earnings_estimates_offers/,https://finance.yahoo.com/technology/article/micron-tops-q3-earnings-estimates-offers-better-than-expected-outlook-and-declares-dividend-113000152.html,"Micron tops Q3 earnings estimates, offers better-than-expected outlook and declares dividend",Counter(),0,0.5106,9.123147160273806
1uep9z5,hot,We're so back,,24,5,2026-06-24 20:39:57+00:00,https://www.reddit.com/r/wallstreetbets/comments/1uep9z5/were_so_back/,https://www.reddit.com/gallery/1uep9z5,We're so back,Counter(),0,0.0,5.0106352940962555
1ueopcs,hot,WEN bagholders tomorrow,,2624,150,2026-06-24 20:18:11+00:00,https://www.reddit.com/r/wallstreetbets/comments/1ueopcs/wen_bagholders_tomorrow/,https://i.redd.it/o595uozwga9h1.png,WEN bagholders tomorrow,Counter({'WEN': 1}),1,0.0,12.890116011840648
1ueoncj,hot,Micron stock jumps 9% as soaring prices from memory crunch lead to quadrupling of revenue,,1411,203,2026-06-24 20:16:06+00:00,https://www.reddit.com/r/wallstreetbets/comments/1ueoncj/micron_stock_jumps_9_as_soaring_prices_from/,https://www.cnbc.com/2026/06/24/micron-mu-earnings-report-q3-2026.html,Micron stock jumps 9% as soaring prices from memory crunch lead to quadrupling of revenue,Counter(),0,0.0,12.570882411897404
1ueoipi,hot,MU Heads for the Moon!,,71,27,2026-06-24 20:11:12+00:00,https://www.reddit.com/r/wallstreetbets/comments/1ueoipi/mu_heads_for_the_moon/,https://i.redd.it/pep5w0mnfa9h1.png,MU Heads for the Moon!,Counter(),0,0.0,7.608870629191259
1ueoh1v,hot,The Banknote Printing Machine Starts Up,,8,6,2026-06-24 20:09:31+00:00,https://www.reddit.com/r/wallstreetbets/comments/1ueoh1v/the_banknote_printing_machine_starts_up/,https://i.redd.it/xq6afis6fa9h1.png,The Banknote Printing Machine Starts Up,Counter(),0,0.0,4.143134726391533
1ueogxd,hot,Micron doubles net income quarter to quarter,,54,9,2026-06-24 20:09:23+00:00,https://www.reddit.com/r/wallstreetbets/comments/1ueogxd/micron_doubles_net_income_quarter_to_quarter/,https://i.redd.it/2gk76pc6fa9h1.png,Micron doubles net income quarter to quarter,Counter(),0,0.0,6.309918278226517
1ueobrb,hot,41 billion++,"[https://investors.micron.com/news-releases/news-release-details/micron-technology-inc-reports-record-results-third-quarter](https://investors.micron.com/news-releases/news-release-details/micron-technology-inc-reports-record-results-third-quarter)

  
What a beat!!!",164,82,2026-06-24 20:03:58+00:00,https://www.reddit.com/r/wallstreetbets/comments/1ueobrb/41_billion/,https://www.reddit.com/r/wallstreetbets/comments/1ueobrb/41_billion/,"41 billion++ [https://investors.micron.com/news-releases/news-release-details/micron-technology-inc-reports-record-results-third-quarter](https://investors.micron.com/news-releases/news-release-details/micron-technology-inc-reports-record-results-third-quarter)

  
What a beat!!!",Counter(),0,0.0,9.52478608169718
1ueo8e6,hot,"What Are Your Moves Tomorrow, June 25, 2026",This post contains content not supported on old Reddit. [Click here to view the full post](https://sh.reddit.com/r/wallstreetbets/comments/1ueo8e6),148,5726,2026-06-24 20:00:37+00:00,https://www.reddit.com/r/wallstreetbets/comments/1ueo8e6/what_are_your_moves_tomorrow_june_25_2026/,https://www.reddit.com/r/wallstreetbets/comments/1ueo8e6/what_are_your_moves_tomorrow_june_25_2026/,"What Are Your Moves Tomorrow, June 25, 2026 This post contains content not supported on old Reddit. [Click here to view the full post](https://sh.reddit.com/r/wallstreetbets/comments/1ueo8e6)",Counter(),0,-0.2411,13.656893418339315
1ueny02,hot,"In 2023 Robinhood killed the chart that compared your portfolio to any stock you want, and called it ""temporary."" It's 2026.","In summer 2023, Robinhood added ""Returns Comparisons"" to the investing chart on the home screen. You could overlay your portfolio against VOO (S&P 500), BTC, ETH, and individual stocks, right on the main chart. It was genuinely useful. At a glance you knew whether your own picks were beating the index, or whether you'd have been better off just buying VOO.

On September 27, 2023, Robinhood sent an in-app announcement saying the feature was ""temporarily unavailable."" That was nearly three years ago. It never came back for self-directed accounts. The only place it survives is Robinhood Strategies, their paid managed account.

https://preview.redd.it/1hg7fpwejs8h1.png?width=762&format=png&auto=webp&s=0a3888a5d483e2f6062d56e4a73aca3b9ae36cee

This is the single most useful number for anyone who picks their own stocks, and every major competitor lets you do this. Robinhood did it better than most, right on the home screen, and then pulled it.

The ask: bring ""Returns Comparisons"" back to self-directed accounts, the same home-chart overlay against any stock, ETF, or crypto.

If anyone from Robinhood sees this: the feature already exists in Strategies, so this is mostly a matter of switching it back on for the rest of us.",132,22,2026-06-24 19:50:06+00:00,https://www.reddit.com/r/wallstreetbets/comments/1ueny02/in_2023_robinhood_killed_the_chart_that_compared/,https://www.reddit.com/r/wallstreetbets/comments/1ueny02/in_2023_robinhood_killed_the_chart_that_compared/,"In 2023 Robinhood killed the chart that compared your portfolio to any stock you want, and called it ""temporary."" It's 2026. In summer 2023, Robinhood added ""Returns Comparisons"" to the investing chart on the home screen. You could overlay your portfolio against VOO (S&P 500), BTC, ETH, and individual stocks, right on the main chart. It was genuinely useful. At a glance you knew whether your own picks were beating the index, or whether you'd have been better off just buying VOO.

On September 27, 2023, Robinhood sent an in-app announcement saying the feature was ""temporarily unavailable."" That was nearly three years ago. It never came back for self-directed accounts. The only place it survives is Robinhood Strategies, their paid managed account.

https://preview.redd.it/1hg7fpwejs8h1.png?width=762&format=png&auto=webp&s=0a3888a5d483e2f6062d56e4a73aca3b9ae36cee

This is the single most useful number for anyone who picks their own stocks, and every major competitor lets you do this. Robinhood did it better than most, right on the home screen, and then pulled it.

The ask: bring ""Returns Comparisons"" back to self-directed accounts, the same home-chart overlay against any stock, ETF, or crypto.

If anyone from Robinhood sees this: the feature already exists in Strategies, so this is mostly a matter of switching it back on for the rest of us.","Counter({'VOO': 2, 'BTC': 1, 'ETH': 1})",4,0.6222,8.025843344150903
1uenoxg,hot,Got assigned early on GOOGL,"Not too worried since I think it’ll bounce back, but guess I’m holding Google for a while. ",16,15,2026-06-24 19:40:52+00:00,https://www.reddit.com/r/wallstreetbets/comments/1uenoxg/got_assigned_early_on_googl/,https://i.redd.it/3f25sijbaa9h1.jpeg,"Got assigned early on GOOGL Not too worried since I think it’ll bounce back, but guess I’m holding Google for a while.",Counter({'GOOGL': 1}),1,0.1139,5.605802066295997
1uennqu,hot,Micron,Hope yall bought the dip bought a second contract today. ,22,30,2026-06-24 19:39:44+00:00,https://www.reddit.com/r/wallstreetbets/comments/1uennqu/micron/,https://i.redd.it/b2s1yjc4aa9h1.jpeg,Micron Hope yall bought the dip bought a second contract today.,Counter(),0,0.4404,6.569481420414296
1uenlb6,hot,MUney - full port life savings,"https://preview.redd.it/6xfc8ctf9a9h1.png?width=973&format=png&auto=webp&s=4be3d9f290960ca1dd9bff0f0311255da154dded

DD: MUney rhymes with Money",17,30,2026-06-24 19:37:28+00:00,https://www.reddit.com/r/wallstreetbets/comments/1uenlb6/muney_full_port_life_savings/,https://www.reddit.com/r/wallstreetbets/comments/1uenlb6/muney_full_port_life_savings/,"MUney - full port life savings https://preview.redd.it/6xfc8ctf9a9h1.png?width=973&format=png&auto=webp&s=4be3d9f290960ca1dd9bff0f0311255da154dded

DD: MUney rhymes with Money",Counter(),0,0.0,6.324358962381311
1uenban,hot,I might need some $HELP after this psychedelic yolo,Trading practically at cash. Massive peer disconnect.Stellar P2 results. FDA Breakthrough secured. White House and FDA on their side. Drug class validated.,27,30,2026-06-24 19:27:11+00:00,https://www.reddit.com/r/wallstreetbets/comments/1uenban/i_might_need_some_help_after_this_psychedelic_yolo/,https://i.redd.it/8wqnr4cq7a9h1.png,I might need some $HELP after this psychedelic yolo Trading practically at cash. Massive peer disconnect.Stellar P2 results. FDA Breakthrough secured. White House and FDA on their side. Drug class validated.,"Counter({'HELP': 2, 'FDA': 2})",4,0.6908,6.76619171466035
1uenarp,hot,Just put the fries in the bag 🍟,After hours party soon 50$ in a week ,415,67,2026-06-24 19:26:39+00:00,https://www.reddit.com/r/wallstreetbets/comments/1uenarp/just_put_the_fries_in_the_bag/,https://i.redd.it/megym37s7a9h1.jpeg,Just put the fries in the bag 🍟 After hours party soon 50$ in a week,Counter(),0,0.4019,10.250192965437371
1uemypq,hot,I'm official done done,"I've been getting squeezed all week and today I took the day off of work and admitted I have a gambling problem on top of other mental health issues. 

A month ago, I clawed my way out of of the red and manage to gain everything back + $5k. I only took out $12k and kept playing a managed to see the bottom again + another $7k I threw back in because I try to gain everything back and kept losing and losing. 

Its not the end of the world for me since I do make $100k+/year, but I got student loans I've been letting sit on the back burner. 

I need to go touch grass for a while and take a trip.",247,173,2026-06-24 19:14:50+00:00,https://www.reddit.com/r/wallstreetbets/comments/1uemypq/im_official_done_done/,https://www.reddit.com/gallery/1uemypq,"I'm official done done I've been getting squeezed all week and today I took the day off of work and admitted I have a gambling problem on top of other mental health issues. 

A month ago, I clawed my way out of of the red and manage to gain everything back + $5k. I only took out $12k and kept playing a managed to see the bottom again + another $7k I threw back in because I try to gain everything back and kept losing and losing. 

Its not the end of the world for me since I do make $100k+/year, but I got student loans I've been letting sit on the back burner. 

I need to go touch grass for a while and take a trip.",Counter(),0,0.2382,10.672484045379512
1uemv1o,hot,Hit back to back on 0dte 🙏,,18,2,2026-06-24 19:11:09+00:00,https://www.reddit.com/r/wallstreetbets/comments/1uemv1o/hit_back_to_back_on_0dte/,https://www.reddit.com/gallery/1uemv1o,Hit back to back on 0dte 🙏,Counter(),0,0.0,4.043051267834549
1uemsof,hot,I like the stock,"You know what they say, tendies or wendies. In this case, I choose both. ",495,81,2026-06-24 19:08:45+00:00,https://www.reddit.com/r/wallstreetbets/comments/1uemsof/i_like_the_stock/,https://i.redd.it/kv0p668l4a9h1.jpeg,"I like the stock You know what they say, tendies or wendies. In this case, I choose both.",Counter(),0,0.3612,10.613295173989181
1uemlvd,hot,"10,000 shares into Wendy’s bc the dumpster was already priced in 🚀🍔",\#wenning,317,46,2026-06-24 19:02:05+00:00,https://www.reddit.com/r/wallstreetbets/comments/1uemlvd/10000_shares_into_wendys_bc_the_dumpster_was/,https://i.redd.it/hwah55ee3a9h1.jpeg,"10,000 shares into Wendy’s bc the dumpster was already priced in 🚀🍔 \#wenning",Counter(),0,0.1531,9.612198984490234
1uemh8z,hot,"$MU to $800: Inversing WSB, then inversing myself","They  are in a lose-lose situation, between rock and a hard place, can't lie or beg, pretty much doomed no matter what they say.

For the regards out there, this is a butterfly where I risk $170 to make a max of $5000-$170 per spread.

**UPDATE: Read above again regards - this spread is risking $170...one hundred and seventy bucks, to make a maximum of $4830 if the stock is at $800. So while this spread is most likely going to zero, I will 100% guaranteed be OK after making a bet worth $170. I guarantee it.**

https://preview.redd.it/h7mk6jlb2a9h1.png?width=610&format=png&auto=webp&s=755c36b80258010243be42e4def81a9ebb5ac6f6",74,75,2026-06-24 18:57:30+00:00,https://www.reddit.com/r/wallstreetbets/comments/1uemh8z/mu_to_800_inversing_wsb_then_inversing_myself/,https://www.reddit.com/r/wallstreetbets/comments/1uemh8z/mu_to_800_inversing_wsb_then_inversing_myself/,"$MU to $800: Inversing WSB, then inversing myself They  are in a lose-lose situation, between rock and a hard place, can't lie or beg, pretty much doomed no matter what they say.

For the regards out there, this is a butterfly where I risk $170 to make a max of $5000-$170 per spread.

**UPDATE: Read above again regards - this spread is risking $170...one hundred and seventy bucks, to make a maximum of $4830 if the stock is at $800. So while this spread is most likely going to zero, I will 100% guaranteed be OK after making a bet worth $170. I guarantee it.**

https://preview.redd.it/h7mk6jlb2a9h1.png?width=610&format=png&auto=webp&s=755c36b80258010243be42e4def81a9ebb5ac6f6",Counter({'MU': 1}),1,-0.2656,8.648221453822641
