id,feed,title,body,score,num_comments,created_utc,permalink,url,text,ticker_counts,candidate_mentions,sentiment,engagement
1tydqbe,hot,IBKR: Agentic AI can now trade for you.,"Looks to be a new feature. At the moment it looks like you still control which instructions become orders, and when orders are submitted.

What are your thoughts? Will be interesting to see if this eventually evolves into being ""Algo trading for Retail"" if you can set sensible parameters. 

Either that, or absolute carnage if the AI bots recommend near identical orders, and a monolith of traders rise and fall in unison. ",451,140,2026-06-06 10:32:52+00:00,https://www.reddit.com/r/wallstreetbets/comments/1tydqbe/ibkr_agentic_ai_can_now_trade_for_you/,https://i.redd.it/do1mpgy44n5h1.jpeg,"IBKR: Agentic AI can now trade for you. Looks to be a new feature. At the moment it looks like you still control which instructions become orders, and when orders are submitted.

What are your thoughts? Will be interesting to see if this eventually evolves into being ""Algo trading for Retail"" if you can set sensible parameters. 

Either that, or absolute carnage if the AI bots recommend near identical orders, and a monolith of traders rise and fall in unison.",Counter({'IBKR': 1}),1,0.7717,11.0624420702104
1tydoii,hot,Should I go in and ask for a refund? I wasn’t informed stocks could go down,,4190,131,2026-06-06 10:30:08+00:00,https://www.reddit.com/r/wallstreetbets/comments/1tydoii/should_i_go_in_and_ask_for_a_refund_i_wasnt/,https://i.redd.it/jrsydicn3n5h1.jpeg,Should I go in and ask for a refund? I wasn’t informed stocks could go down,Counter(),0,0.0,13.223496570511442
1tydllc,hot,"SpaceX IPO running at two times oversubscribed, sources say",,1237,321,2026-06-06 10:25:13+00:00,https://www.reddit.com/r/wallstreetbets/comments/1tydllc/spacex_ipo_running_at_two_times_oversubscribed/,https://www.reuters.com/business/finance/spacex-ipo-running-two-times-oversubscribed-sources-say-2026-06-05/,"SpaceX IPO running at two times oversubscribed, sources say",Counter(),0,0.0,12.89580399878895
1tydi8g,new,I guess it’s all fine,,29,24,2026-06-06 10:19:45+00:00,https://www.reddit.com/r/wallstreetbets/comments/1tydi8g/i_guess_its_all_fine/,https://www.reddit.com/gallery/1tydi8g,I guess it’s all fine,Counter(),0,0.2023,6.620073206530356
1tydhxx,new,"How much money are you going to spend on SpaceX on DAY 1 specifically, once it starts trading?","I’m hoarding $150k in cash for SpaceX IPO. Even Cramer tweeted on Friday:

“If they allow market orders from non-participants there will be no one on the sell side!”

Thoughts? Opinions? Suggestions?

It doesn’t matter if you sell the same day. Just curious how much are you going to spend once it starts trading, PROVIDED IT DOES NOT TANK IMMEDIATELY like Cerebras.

Let the productive discussion begin.",0,96,2026-06-06 10:19:15+00:00,https://www.reddit.com/r/wallstreetbets/comments/1tydhxx/how_much_money_are_you_going_to_spend_on_spacex/,https://www.reddit.com/r/wallstreetbets/comments/1tydhxx/how_much_money_are_you_going_to_spend_on_spacex/,"How much money are you going to spend on SpaceX on DAY 1 specifically, once it starts trading? I’m hoarding $150k in cash for SpaceX IPO. Even Cramer tweeted on Friday:

“If they allow market orders from non-participants there will be no one on the sell side!”

Thoughts? Opinions? Suggestions?

It doesn’t matter if you sell the same day. Just curious how much are you going to spend once it starts trading, PROVIDED IT DOES NOT TANK IMMEDIATELY like Cerebras.

Let the productive discussion begin.","Counter({'DAY': 1, 'DOES': 1, 'NOT': 1, 'TANK': 1})",4,-0.3098,4.574710978503383
1tyd76v,hot,Never thought I'll be here.,But here I am. Quarter of a mill.,137,89,2026-06-06 10:01:40+00:00,https://www.reddit.com/r/wallstreetbets/comments/1tyd76v/never_thought_ill_be_here/,https://i.redd.it/a8cf7ipkym5h1.png,Never thought I'll be here. But here I am. Quarter of a mill.,Counter(),0,0.0,9.42706335548747
1tyd5v0,new,Rule 1 of WSB Club: No look backs,"Broke my own rule and then nearly broke the 'no crying in the casino' rule. Yay for 50% profit 😐, no one ever went broke taking profits right? 

At their peak, worth $13,840 and $7,640 at expiration. $460 outlay. ",7,13,2026-06-06 09:59:47+00:00,https://www.reddit.com/r/wallstreetbets/comments/1tyd5v0/rule_1_of_wsb_club_no_look_backs/,https://www.reddit.com/gallery/1tyd5v0,"Rule 1 of WSB Club: No look backs Broke my own rule and then nearly broke the 'no crying in the casino' rule. Yay for 50% profit 😐, no one ever went broke taking profits right? 

At their peak, worth $13,840 and $7,640 at expiration. $460 outlay.",Counter(),0,-0.7351,4.718498871295095
1tyb9y9,new,"Riding the wave 0DTE on SPY, AMD & AMZN",,6,0,2026-06-06 08:06:48+00:00,https://www.reddit.com/r/wallstreetbets/comments/1tyb9y9/riding_the_wave_0dte_on_spy_amd_amzn/,https://i.redd.it/mxiwpzw2em5h1.jpeg,"Riding the wave 0DTE on SPY, AMD & AMZN","Counter({'SPY': 1, 'AMD': 1, 'AMZN': 1})",3,0.0,1.9459101490553132
1tyb364,new,Bought 50 puts a day too early...,,42,19,2026-06-06 07:55:53+00:00,https://www.reddit.com/r/wallstreetbets/comments/1tyb364/bought_50_puts_a_day_too_early/,https://i.redd.it/d4fl3ra4cm5h1.jpeg,Bought 50 puts a day too early...,Counter(),0,0.0,6.756932389247553
1tyaufx,hot,No crying in the casino,BTC is putting it up my ass at the moment,932,113,2026-06-06 07:41:42+00:00,https://www.reddit.com/r/wallstreetbets/comments/1tyaufx/no_crying_in_the_casino/,https://i.redd.it/y6gdkzql9m5h1.png,No crying in the casino BTC is putting it up my ass at the moment,Counter({'BTC': 1}),1,-0.8316,11.57460364924184
1ty9kq7,hot,WSB traders after a record rally,"Problematic gamblers have my commiserations, but do US traders 'enjoy' losing?

Genuine question from a UK trader. I'm shocked how quickly the mood changes with US investors. Watched some Bloomberg/CNBC and the tone was dramatic and gloom. Like it triggered some fight or flight attitude.

Asia+EU will crash on Monday also, but people will be ""oh, ok, yes that's troublesome"". Not freaking out or start talking more loudly.

It's part of US trading culture to leverage more and take risk, but surely that makes you more stoic to mini crashes? 

Regards",1792,66,2026-06-06 06:29:23+00:00,https://www.reddit.com/r/wallstreetbets/comments/1ty9kq7/wsb_traders_after_a_record_rally/,https://i.redd.it/wektsluowl5h1.gif,"WSB traders after a record rally Problematic gamblers have my commiserations, but do US traders 'enjoy' losing?

Genuine question from a UK trader. I'm shocked how quickly the mood changes with US investors. Watched some Bloomberg/CNBC and the tone was dramatic and gloom. Like it triggered some fight or flight attitude.

Asia+EU will crash on Monday also, but people will be ""oh, ok, yes that's troublesome"". Not freaking out or start talking more loudly.

It's part of US trading culture to leverage more and take risk, but surely that makes you more stoic to mini crashes? 

Regards",Counter({'CNBC': 1}),1,-0.7968,11.696338092996099
1ty9jgz,hot,Depressed trader drinks himself to a happy place after losing billions in a week on speculative tech calls.,I fe,11708,395,2026-06-06 06:27:19+00:00,https://www.reddit.com/r/wallstreetbets/comments/1ty9jgz/depressed_trader_drinks_himself_to_a_happy_place/,https://v.redd.it/317xl5a7wl5h1,Depressed trader drinks himself to a happy place after losing billions in a week on speculative tech calls. I fe,Counter(),0,-0.2023,15.349527267103205
1ty9cq7,hot,I no longer have the money to pay for surgery to get my tear ducts removed so I don't cry in the casino,"Got greedy when AVGO was on its way up, chose to buy calls before earnings and thought they were going to have a blowout like DELL, AVGO fucked me in the ass",160,60,2026-06-06 06:16:51+00:00,https://www.reddit.com/r/wallstreetbets/comments/1ty9cq7/i_no_longer_have_the_money_to_pay_for_surgery_to/,https://i.redd.it/7hregzrgul5h1.png,"I no longer have the money to pay for surgery to get my tear ducts removed so I don't cry in the casino Got greedy when AVGO was on its way up, chose to buy calls before earnings and thought they were going to have a blowout like DELL, AVGO fucked me in the ass","Counter({'AVGO': 2, 'DELL': 1})",3,-0.816,9.192278229157775
1ty906x,hot,"With the ongoing oil crisis, here’s a throwback to the April 2020 crash",,161,25,2026-06-06 05:57:58+00:00,https://www.reddit.com/r/wallstreetbets/comments/1ty906x/with_the_ongoing_oil_crisis_heres_a_throwback_to/,https://www.reddit.com/gallery/1ty906x,"With the ongoing oil crisis, here’s a throwback to the April 2020 crash",Counter(),0,-0.7783,8.345692873253865
1ty8emg,new,Credit Spread 30-60DTE,"Started doing options since Mar, sticking to mostly Credit Spread only, 30 to 60 DTE and at 0.10 delta level. ",21,29,2026-06-06 05:25:35+00:00,https://www.reddit.com/r/wallstreetbets/comments/1ty8emg/credit_spread_3060dte/,https://i.redd.it/tj39rdlbll5h1.jpeg,"Credit Spread 30-60DTE Started doing options since Mar, sticking to mostly Credit Spread only, 30 to 60 DTE and at 0.10 delta level.",Counter({'DTE': 1}),1,0.6369,6.492239835020472
1ty7g56,new,Copper Hype or Real Deal? Did the US-Iran War Kill the Bull Case?,"Copper was flying  record $6.20/lb early 2026, driven by AI data centers, EVs, and tight supply. Then the US-Iran war hit, oil surged past $100, and copper got crushed to \~$5.34. Sentiment flipped fast.

But here's the thing  Iran only produces 1.5% of global copper. This isn't a supply story. It's macro fear.

The fundamentals haven't moved:

Mine supply growth is still near zero

AI data centers, EVs, and grid electrification are still hungry for copper

Supply deficits are projected to return from 2027 and widen through 2030

The war created short-term noise on a long-term structural story. 

The hype cooled. The thesis didn't break.

1-2 years out? Looks more like a compressed entry point than a dead trade.",0,8,2026-06-06 04:35:31+00:00,https://www.reddit.com/r/wallstreetbets/comments/1ty7g56/copper_hype_or_real_deal_did_the_usiran_war_kill/,https://www.reddit.com/r/wallstreetbets/comments/1ty7g56/copper_hype_or_real_deal_did_the_usiran_war_kill/,"Copper Hype or Real Deal? Did the US-Iran War Kill the Bull Case? Copper was flying  record $6.20/lb early 2026, driven by AI data centers, EVs, and tight supply. Then the US-Iran war hit, oil surged past $100, and copper got crushed to \~$5.34. Sentiment flipped fast.

But here's the thing  Iran only produces 1.5% of global copper. This isn't a supply story. It's macro fear.

The fundamentals haven't moved:

Mine supply growth is still near zero

AI data centers, EVs, and grid electrification are still hungry for copper

Supply deficits are projected to return from 2027 and widen through 2030

The war created short-term noise on a long-term structural story. 

The hype cooled. The thesis didn't break.

1-2 years out? Looks more like a compressed entry point than a dead trade.",Counter(),0,-0.9531,2.1972245773362196
1ty6pra,hot,A lil rough out there today,,1512,50,2026-06-06 03:58:47+00:00,https://www.reddit.com/r/wallstreetbets/comments/1ty6pra/a_lil_rough_out_there_today/,https://v.redd.it/xszvr7qt5l5h1,A lil rough out there today,Counter(),0,0.0,11.253675346512681
1ty5pek,hot,You guys have lost NOTHING compared to me,Seeing all these >15k losses trigger me ,247,289,2026-06-06 03:08:39+00:00,https://www.reddit.com/r/wallstreetbets/comments/1ty5pek/you_guys_have_lost_nothing_compared_to_me/,https://i.redd.it/9xpf493wwk5h1.jpeg,You guys have lost NOTHING compared to me Seeing all these >15k losses trigger me,Counter(),0,-0.6124,11.183309669145501
1ty5m7q,hot,Bear Day,Not made by AI. Made with MS paint.  ,1186,50,2026-06-06 03:04:14+00:00,https://www.reddit.com/r/wallstreetbets/comments/1ty5m7q/bear_day/,https://i.redd.it/e2697wn3wk5h1.png,Bear Day Not made by AI. Made with MS paint.,Counter(),0,0.0,11.011010027333993
1ty3j0n,hot,When your wife asks you your Coinbase investment THESIS this weekend....,,335,27,2026-06-06 01:23:47+00:00,https://www.reddit.com/r/wallstreetbets/comments/1ty3j0n/when_your_wife_asks_you_your_coinbase_investment/,https://v.redd.it/e5s4kwv0ek5h1,When your wife asks you your Coinbase investment THESIS this weekend....,Counter(),0,0.0,9.149315670138408
1ty1y9q,hot,"CNBC - Marvell Technology and Flex to join S&P 500 index, replacing Pool and Campbell's","Marvell Technology and Flex to join S&P 500 index, replacing Pool and Campbell's

https://www.cnbc.com/2026/06/05/marvell-technology-flex-sp-500-campbells-pool.html?\_\_source=androidappshare",426,109,2026-06-06 00:10:38+00:00,https://www.reddit.com/r/wallstreetbets/comments/1ty1y9q/cnbc_marvell_technology_and_flex_to_join_sp_500/,https://www.reddit.com/r/wallstreetbets/comments/1ty1y9q/cnbc_marvell_technology_and_flex_to_join_sp_500/,"CNBC - Marvell Technology and Flex to join S&P 500 index, replacing Pool and Campbell's Marvell Technology and Flex to join S&P 500 index, replacing Pool and Campbell's

https://www.cnbc.com/2026/06/05/marvell-technology-flex-sp-500-campbells-pool.html?\_\_source=androidappshare",Counter({'CNBC': 1}),1,0.5267,10.757264379021041
1ty1cai,hot,"My loss is your gain, or more like, my loss is your enjoyment...","Since the pandemic, I always thought ""This is way too high, it surely will go down"". And here are the results.

And yesterday, I thought on buying PUTs, and said to myself ""Bah, how many times do we have to teach you this lesson old man?""

They got me, got me good. Could have paid off the house, gotten a new car and a few travel expenses.

But hey, I wouldn't have been able to laugh at your comments in this post then 🤣",5720,712,2026-06-05 23:43:52+00:00,https://www.reddit.com/r/wallstreetbets/comments/1ty1cai/my_loss_is_your_gain_or_more_like_my_loss_is_your/,https://i.redd.it/mca9zmrcwj5h1.jpeg,"My loss is your gain, or more like, my loss is your enjoyment... Since the pandemic, I always thought ""This is way too high, it surely will go down"". And here are the results.

And yesterday, I thought on buying PUTs, and said to myself ""Bah, how many times do we have to teach you this lesson old man?""

They got me, got me good. Could have paid off the house, gotten a new car and a few travel expenses.

But hey, I wouldn't have been able to laugh at your comments in this post then 🤣",Counter(),0,0.8624,15.221380314682825
1ty16hy,hot,HOW TO NEVER LOSE MONEY (WSB HATES THIS ONE SIMPLE TRICK),"After years of intensive market research (blowing up $120K), I have finally discovered the secret.

Ready?

STOP PUTTING YOUR ENTIRE NET WORTH INTO A SINGLE WEEKLY OPTION.

I know. I know. This is controversial.

Some of you are currently reading this while holding 0DTE contracts that expire in 37 minutes and are already down 83%.

""But what if it goes up?""

Brother, what if it doesn't?

Every day I see someone turn $20,000 into $117 and then write a 14-page thesis explaining why the market is manipulated.

No, Chad. The market didn't manipulate you.

You bought calls on a stock that had already gone up 400% because a guy named ""QuantumBanana420"" posted three rocket emojis and a GIF of a gorilla.

Some groundbreaking financial concepts:

\- Rent money is not trading capital.

\- Margin is not free money.

\- A stop loss is cheaper than therapy.

\- If losing the trade would ruin your life, the position is too big.

\- If your DD starts with ""Imagine if..."" close the app immediately.

You don't need a 10,000% gain.

You need to stop chasing 10,000% gains after taking 95% losses.

The market is basically a machine that transfers money from impatient degenerates to slightly less impatient degenerates.

Anyway, none of this matters.

See you all tomorrow when I convince myself this time is different and buy contracts with an expiration date measured in hours.

Positions: Emotional damage.",1849,389,2026-06-05 23:37:06+00:00,https://www.reddit.com/r/wallstreetbets/comments/1ty16hy/how_to_never_lose_money_wsb_hates_this_one_simple/,https://www.reddit.com/r/wallstreetbets/comments/1ty16hy/how_to_never_lose_money_wsb_hates_this_one_simple/,"HOW TO NEVER LOSE MONEY (WSB HATES THIS ONE SIMPLE TRICK) After years of intensive market research (blowing up $120K), I have finally discovered the secret.

Ready?

STOP PUTTING YOUR ENTIRE NET WORTH INTO A SINGLE WEEKLY OPTION.

I know. I know. This is controversial.

Some of you are currently reading this while holding 0DTE contracts that expire in 37 minutes and are already down 83%.

""But what if it goes up?""

Brother, what if it doesn't?

Every day I see someone turn $20,000 into $117 and then write a 14-page thesis explaining why the market is manipulated.

No, Chad. The market didn't manipulate you.

You bought calls on a stock that had already gone up 400% because a guy named ""QuantumBanana420"" posted three rocket emojis and a GIF of a gorilla.

Some groundbreaking financial concepts:

\- Rent money is not trading capital.

\- Margin is not free money.

\- A stop loss is cheaper than therapy.

\- If losing the trade would ruin your life, the position is too big.

\- If your DD starts with ""Imagine if..."" close the app immediately.

You don't need a 10,000% gain.

You need to stop chasing 10,000% gains after taking 95% losses.

The market is basically a machine that transfers money from impatient degenerates to slightly less impatient degenerates.

Anyway, none of this matters.

See you all tomorrow when I convince myself this time is different and buy contracts with an expiration date measured in hours.

Positions: Emotional damage.","Counter({'HOW': 1, 'NEVER': 1, 'LOSE': 1, 'MONEY': 1, 'HATES': 1, 'THIS': 1, 'ONE': 1, 'TRICK': 1, 'STOP': 1, 'YOUR': 1, 'NET': 1, 'WORTH': 1, 'INTO': 1, 'GIF': 1})",14,-0.9899,13.489087657196063
1ty0rmu,hot,Now this is a loss,"All the babies crying over $200 and $2000 was pissing me off. Here, this is a loss. Still not crying though. Lambo or ramen bitches! 

https://preview.redd.it/wiipu2unrj5h1.png?width=1479&format=png&auto=webp&s=0cf8409fa2b33fc8ade287586bcfb01870544afe

https://preview.redd.it/0qkzxsnprj5h1.png?width=487&format=png&auto=webp&s=1a873414b8c2648da5d2de09bed4e3ae3929ed46

https://preview.redd.it/0s827c7qrj5h1.png?width=486&format=png&auto=webp&s=0b6ddb1dbc9df2b9919d08b5a4a6e878c991f1c9

",2330,325,2026-06-05 23:19:22+00:00,https://www.reddit.com/r/wallstreetbets/comments/1ty0rmu/now_this_is_a_loss/,https://www.reddit.com/r/wallstreetbets/comments/1ty0rmu/now_this_is_a_loss/,"Now this is a loss All the babies crying over $200 and $2000 was pissing me off. Here, this is a loss. Still not crying though. Lambo or ramen bitches! 

https://preview.redd.it/wiipu2unrj5h1.png?width=1479&format=png&auto=webp&s=0cf8409fa2b33fc8ade287586bcfb01870544afe

https://preview.redd.it/0qkzxsnprj5h1.png?width=487&format=png&auto=webp&s=1a873414b8c2648da5d2de09bed4e3ae3929ed46

https://preview.redd.it/0s827c7qrj5h1.png?width=486&format=png&auto=webp&s=0b6ddb1dbc9df2b9919d08b5a4a6e878c991f1c9",Counter(),0,-0.9534,13.540950020402466
1txzt2n,hot,We know who crash the market,,16209,200,2026-06-05 22:39:16+00:00,https://www.reddit.com/r/wallstreetbets/comments/1txzt2n/we_know_who_crash_the_market/,https://i.redd.it/f6oksklrkj5h1.png,We know who crash the market,Counter(),0,-0.4019,14.996688522788798
1txz3vi,hot,"This might have contributed to the selloff today. Kraft, McDonald’s, Whirlpool CEOs all issue same dire warning about US consumers.","# ‘Running out of money’: Kraft, McDonald’s, Whirlpool CEOs all issue same dire warning about US consumers. Get ready now

  
So my take on the market crash today was from this more than anything else.

""Whirlpool’s North America chief Juan Carlos Puente added that “consumer sentiment collapsing to record lows” due to the Iran war prevented demand from recovering after winter storms, leading to “recession-level industry contractions,” with discretionary demand down roughly 15%.""

""Even the fitness industry is feeling the impact. Planet Fitness (NASDAQ:PLNT) shares just suffered their biggest drop on record after management slashed its revenue outlook and canceled planned price increases.""

",12625,1951,2026-06-05 22:10:14+00:00,https://www.reddit.com/r/wallstreetbets/comments/1txz3vi/this_might_have_contributed_to_the_selloff_today/,https://finance.yahoo.com/economy/articles/running-money-kraft-mcdonald-whirlpool-113500450.html,"This might have contributed to the selloff today. Kraft, McDonald’s, Whirlpool CEOs all issue same dire warning about US consumers. # ‘Running out of money’: Kraft, McDonald’s, Whirlpool CEOs all issue same dire warning about US consumers. Get ready now

  
So my take on the market crash today was from this more than anything else.

""Whirlpool’s North America chief Juan Carlos Puente added that “consumer sentiment collapsing to record lows” due to the Iran war prevented demand from recovering after winter storms, leading to “recession-level industry contractions,” with discretionary demand down roughly 15%.""

""Even the fitness industry is feeling the impact. Planet Fitness (NASDAQ:PLNT) shares just suffered their biggest drop on record after management slashed its revenue outlook and canceled planned price increases.""",Counter({'PLNT': 1}),1,-0.9538,17.02012322590061
1txxmjn,top,"My head is aching, my legs are shaking",Never felt this alive ,592,284,2026-06-05 21:11:25+00:00,https://www.reddit.com/r/wallstreetbets/comments/1txxmjn/my_head_is_aching_my_legs_are_shaking/,https://i.redd.it/plj5l2k55j5h1.jpeg,"My head is aching, my legs are shaking Never felt this alive",Counter(),0,-0.2263,12.037683579266377
1txxg7n,hot,Anthropic calls for global freeze in AI development,Anthropic pumping and dumping AI stocks,3916,486,2026-06-05 21:04:37+00:00,https://www.reddit.com/r/wallstreetbets/comments/1txxg7n/anthropic_calls_for_global_freeze_in_ai/,https://www.telegraph.co.uk/business/2026/06/04/worlds-most-valuable-ai-start-up-calls-for-global-freeze-in/,Anthropic calls for global freeze in AI development Anthropic pumping and dumping AI stocks,Counter(),0,-0.2732,14.46134545674842
1txx1lr,hot,$14k -> $172k in 40 minutes on SPX Puts,Insert Gay Bear dance party gif,940,135,2026-06-05 20:49:08+00:00,https://www.reddit.com/r/wallstreetbets/comments/1txx1lr/14k_172k_in_40_minutes_on_spx_puts/,https://i.redd.it/hqlmk1w21j5h1.png,$14k -> $172k in 40 minutes on SPX Puts Insert Gay Bear dance party gif,Counter({'SPX': 1}),1,0.4019,11.75959802532143
1txx1a2,hot,Gay Bears Tonight,,1000,41,2026-06-05 20:48:46+00:00,https://www.reddit.com/r/wallstreetbets/comments/1txx1a2/gay_bears_tonight/,https://v.redd.it/u8vm01q31j5h1,Gay Bears Tonight,Counter(),0,0.0,10.646424397598588
1txwdzk,hot,US administration discussing government stake in OpenAI,Americans about to discover the benefits of communism,1207,158,2026-06-05 20:24:11+00:00,https://www.reddit.com/r/wallstreetbets/comments/1txwdzk/us_administration_discussing_government_stake_in/,https://www.cnbc.com/2026/06/05/trump-open-ai-altman-stake.html,US administration discussing government stake in OpenAI Americans about to discover the benefits of communism,Counter(),0,0.3818,12.165625580714991
1txucra,hot,Google Buying Computing From SpaceX in $920-Million-a-Month Deal,,3504,529,2026-06-05 19:09:08+00:00,https://www.reddit.com/r/wallstreetbets/comments/1txucra/google_buying_computing_from_spacex_in/,https://www.bloomberg.com/news/articles/2026-06-05/google-buying-computing-from-spacex-in-920-million-a-month-deal,Google Buying Computing From SpaceX in $920-Million-a-Month Deal,Counter(),0,0.0,14.434822806014857
1txu7lr,hot,400k poorer in 24 hrs,lol rip now we btd ,2069,387,2026-06-05 19:03:52+00:00,https://www.reddit.com/r/wallstreetbets/comments/1txu7lr/400k_poorer_in_24_hrs/,https://i.redd.it/yrq0xreeii5h1.jpeg,400k poorer in 24 hrs lol rip now we btd,Counter(),0,-0.4215,13.596309225882688
1txtfkm,hot,Bears on parade,CLOSE THE CASINO NOW!!!,1751,90,2026-06-05 18:35:44+00:00,https://www.reddit.com/r/wallstreetbets/comments/1txtfkm/bears_on_parade/,https://v.redd.it/7xocdx57di5h1,Bears on parade CLOSE THE CASINO NOW!!!,"Counter({'CLOSE': 1, 'THE': 1, 'NOW': 1})",3,0.0,11.979372778013186
