id,feed,title,body,score,num_comments,created_utc,permalink,url,text,ticker_counts,candidate_mentions,sentiment,engagement
1v1zuci,hot,.,,855,41,2026-07-20 22:16:57+00:00,https://www.reddit.com/r/wallstreetbets/comments/1v1zuci/_/,https://i.redd.it/bgk64c5vlgeh1.jpeg,.,Counter(),0,0.0,10.48993999442511
1v1x04r,hot,Will he blow it up again before getting back to even?,Stay tuned to find out. Bottomed out at $1200 last week. ,138,15,2026-07-20 20:26:48+00:00,https://www.reddit.com/r/wallstreetbets/comments/1v1x04r/will_he_blow_it_up_again_before_getting_back_to/,https://i.redd.it/sjdasss72geh1.jpeg,Will he blow it up again before getting back to even? Stay tuned to find out. Bottomed out at $1200 last week.,Counter(),0,0.0,7.707062655370473
1v1wwa7,hot,SPCX puts - early assignment,"One of the shittiest trade ever.. Wondering if I'll get this shit assigned (it's deep in the money already)? Long call will be worth nothing in a few days once they start unlocking. 

Stock might go down even further to 75-80 range next month (today it closed at 119)... By the end of this year below 40.... Moral of the story - do not open IBKR app drunk. Do not mix trading and drinks 🤣",49,34,2026-07-20 20:22:50+00:00,https://www.reddit.com/r/wallstreetbets/comments/1v1wwa7/spcx_puts_early_assignment/,https://i.redd.it/7mkqb69i1geh1.png,"SPCX puts - early assignment One of the shittiest trade ever.. Wondering if I'll get this shit assigned (it's deep in the money already)? Long call will be worth nothing in a few days once they start unlocking. 

Stock might go down even further to 75-80 range next month (today it closed at 119)... By the end of this year below 40.... Moral of the story - do not open IBKR app drunk. Do not mix trading and drinks 🤣","Counter({'SPCX': 1, 'IBKR': 1})",2,-0.8793,7.4673710669175595
1v1wb98,hot,"What Are Your Moves Tomorrow, July 21, 2026",This post contains content not supported on old Reddit. [Click here to view the full post](https://sh.reddit.com/r/wallstreetbets/comments/1v1wb98),122,2279,2026-07-20 20:01:31+00:00,https://www.reddit.com/r/wallstreetbets/comments/1v1wb98/what_are_your_moves_tomorrow_july_21_2026/,https://www.reddit.com/r/wallstreetbets/comments/1v1wb98/what_are_your_moves_tomorrow_july_21_2026/,"What Are Your Moves Tomorrow, July 21, 2026 This post contains content not supported on old Reddit. [Click here to view the full post](https://sh.reddit.com/r/wallstreetbets/comments/1v1wb98)",Counter(),0,-0.2411,12.544115077320903
1v1wan4,hot,"Which one of you, regards, did this technical analysis of Bitcoin?",,1200,91,2026-07-20 20:00:56+00:00,https://www.reddit.com/r/wallstreetbets/comments/1v1wan4/which_one_of_you_regards_did_this_technical/,https://i.redd.it/a2ihim3zpfeh1.jpeg,"Which one of you, regards, did this technical analysis of Bitcoin?",Counter(),0,0.0,11.612698399129023
1v1u6rz,hot,"Magic the Gathering ($HAS) ER pre-market Tuesday, UB product strength and 2027 revealed sets show a WotC focused on growth and big names","WOTC parent Hasbro (HAS) is going to report earnings pre-market 7/21/2026. I expect a beat above expectations as MTG's growth is likely outpacing the analyist consensus views.

For those unaware, Hasbro at this point is basically a mostly deadweight traditional toys/games business, and WOTC. WOTC and magic the gathering are powering almost all the earnings growth. All the toys business has to do, is recover from the tariff shock and analysts will largely ignore any negative sentiment attached to it.

2026 sets: Magic growth is huge. I've talked with plenty of LGSs over the past few months and the trend has been that Marvel Superheroes is selling much better than anticipated which makes sense as everyone was wary of SPM trends. But MSH is doing very well, and I would say there's the possibility it de-thrones LOTR as the 2nd best selling set of all time until The Hobbit releases. Reality Fracture looks to have good sentiment online currently. Star Trek is showing that WOTC is willing to take risks like autographed cards to pull in collectors from outside the direct MTG or TCG playerbase and reach for people into more traditional trading cards like Pokemon/Topps collectors. I expect Star Trek to outperform reddit sentiment.

2027 In-universe sets: All smash hits it looks like from the social media reaction. WOTC has really zero'd in on the blend of nostalia and novelty that they need. Expect CBBs to continue to sell out immediately and everyone being big-mad that they can't buy them at 'msrp'.

2027 Universe-beyond sets: Nintendo signing is a clear signal this could be the 'set that beats Final Fantasy' that Mark Rosewater has hinted at. But there's also the potential for massive properties like WoW, SW, or Elder Scrolls, etc... that would have broad massive audiences built in.

Distribution vs. Direct Selling on Amazon: WOTC looks to have been trying to capture more of the revenue chain by direct selling more products on Amazon. This means that instead of traditional TCG distribution capturing 25-35% of the margin on a product, Amazon is only capturing 10-15% and WOTC is getting that extra chunk.

Distribution model benefits from ancillary products: Because TCG printing is limited by production speeds and facilities (much like datacenters), for every 1000 play boosters you can make, you can either produce 33.33... (repeating of course) play booster boxes, or 4-5x as many bundles, gift bundles, singleton packs, scene boxes, warehouse boxes, and beginner boxes. Likely this is a way to incentivize stores to buy up as much of the ancillary products as they can from distribution to get access to higher CBB allocation. The net result is WOTC sells more broad SKUs and isn't relying on hardcore MTG people cracking play boxes or drafting.

Positions: CBBs in FF, BRO, MSH, SPM, LOTR, $HAS Aug 80Cs, Sept 110Cs, Jan 90Cs, Mar 110Cs, Jun 110Cs, Jan 120Cs. https://imgur.com/a/k3ywvBm

Previous thread(s):
 
https://www.reddit.com/r/wallstreetbets/comments/1srvqx8/magic_the_gathering_owner_hasbro_has_earnings/

https://www.reddit.com/r/mtgfinance/comments/1r0ertm/mtg_and_dd_parent_company_hasbro_has_reports/",11,35,2026-07-20 18:44:21+00:00,https://www.reddit.com/r/wallstreetbets/comments/1v1u6rz/magic_the_gathering_has_er_premarket_tuesday_ub/,https://www.reddit.com/r/wallstreetbets/comments/1v1u6rz/magic_the_gathering_has_er_premarket_tuesday_ub/,"Magic the Gathering ($HAS) ER pre-market Tuesday, UB product strength and 2027 revealed sets show a WotC focused on growth and big names WOTC parent Hasbro (HAS) is going to report earnings pre-market 7/21/2026. I expect a beat above expectations as MTG's growth is likely outpacing the analyist consensus views.

For those unaware, Hasbro at this point is basically a mostly deadweight traditional toys/games business, and WOTC. WOTC and magic the gathering are powering almost all the earnings growth. All the toys business has to do, is recover from the tariff shock and analysts will largely ignore any negative sentiment attached to it.

2026 sets: Magic growth is huge. I've talked with plenty of LGSs over the past few months and the trend has been that Marvel Superheroes is selling much better than anticipated which makes sense as everyone was wary of SPM trends. But MSH is doing very well, and I would say there's the possibility it de-thrones LOTR as the 2nd best selling set of all time until The Hobbit releases. Reality Fracture looks to have good sentiment online currently. Star Trek is showing that WOTC is willing to take risks like autographed cards to pull in collectors from outside the direct MTG or TCG playerbase and reach for people into more traditional trading cards like Pokemon/Topps collectors. I expect Star Trek to outperform reddit sentiment.

2027 In-universe sets: All smash hits it looks like from the social media reaction. WOTC has really zero'd in on the blend of nostalia and novelty that they need. Expect CBBs to continue to sell out immediately and everyone being big-mad that they can't buy them at 'msrp'.

2027 Universe-beyond sets: Nintendo signing is a clear signal this could be the 'set that beats Final Fantasy' that Mark Rosewater has hinted at. But there's also the potential for massive properties like WoW, SW, or Elder Scrolls, etc... that would have broad massive audiences built in.

Distribution vs. Direct Selling on Amazon: WOTC looks to have been trying to capture more of the revenue chain by direct selling more products on Amazon. This means that instead of traditional TCG distribution capturing 25-35% of the margin on a product, Amazon is only capturing 10-15% and WOTC is getting that extra chunk.

Distribution model benefits from ancillary products: Because TCG printing is limited by production speeds and facilities (much like datacenters), for every 1000 play boosters you can make, you can either produce 33.33... (repeating of course) play booster boxes, or 4-5x as many bundles, gift bundles, singleton packs, scene boxes, warehouse boxes, and beginner boxes. Likely this is a way to incentivize stores to buy up as much of the ancillary products as they can from distribution to get access to higher CBB allocation. The net result is WOTC sells more broad SKUs and isn't relying on hardcore MTG people cracking play boxes or drafting.

Positions: CBBs in FF, BRO, MSH, SPM, LOTR, $HAS Aug 80Cs, Sept 110Cs, Jan 90Cs, Mar 110Cs, Jun 110Cs, Jan 120Cs. https://imgur.com/a/k3ywvBm

Previous thread(s):
 
https://www.reddit.com/r/wallstreetbets/comments/1srvqx8/magic_the_gathering_owner_hasbro_has_earnings/

https://www.reddit.com/r/mtgfinance/comments/1r0ertm/mtg_and_dd_parent_company_hasbro_has_reports/","Counter({'WOTC': 8, 'HAS': 5, 'MTG': 3, 'TCG': 3, 'SPM': 2, 'MSH': 2, 'LOTR': 2, 'CBB': 1, 'BRO': 1})",27,0.9967,6.068425588244111
1v1u1gc,hot,Kick the put?,Got this for insurance but have a hunch the hyperscalers are going to announce sustained or elevated capex. Do I just hold it though and basically pay the insurance or kick it and live or die by the next two weeks?,41,22,2026-07-20 18:39:05+00:00,https://www.reddit.com/r/wallstreetbets/comments/1v1u1gc/kick_the_put/,https://i.redd.it/q7mdi7xzifeh1.jpeg,Kick the put? Got this for insurance but have a hunch the hyperscalers are going to announce sustained or elevated capex. Do I just hold it though and basically pay the insurance or kick it and live or die by the next two weeks?,Counter(),0,-0.8079,6.873163834212518
1v1sg9e,hot,$BMNR to the moon 🚀,4 year cycle. Tom Lee just started buying back shares again. Eth at ath = bmnr at $50+ minimum. This is the way,40,26,2026-07-20 17:43:17+00:00,https://www.reddit.com/r/wallstreetbets/comments/1v1sg9e/bmnr_to_the_moon/,https://i.redd.it/zitljwi19feh1.jpeg,$BMNR to the moon 🚀 4 year cycle. Tom Lee just started buying back shares again. Eth at ath = bmnr at $50+ minimum. This is the way,Counter({'BMNR': 2}),2,0.296,7.009408932708637
1v1ri1r,hot,Judge puts temporary pause on Paramount-Warner Bros. merger,,833,64,2026-07-20 17:09:27+00:00,https://www.reddit.com/r/wallstreetbets/comments/1v1ri1r/judge_puts_temporary_pause_on_paramountwarner/,https://www.nbcnews.com/business/media/judge-puts-temporary-pause-paramount-warner-bros-merger-rcna587804,Judge puts temporary pause on Paramount-Warner Bros. merger,Counter(),0,0.0,10.900620672254384
1v1q0e3,hot,"$214K USD Value In Shares Yolo $AMPG | 36,200 Shares @ 5.90 Cost Basis","I've been getting my butt kicked by $BE and the $SPY.  
I am parking my port into $AMPG.

The stock seems solid, that's about all the DD I can provide.  
This is a $214K dollar Yolo (I have to put this to satisfy the auto-mod).

https://preview.redd.it/jdndws50teeh1.png?width=870&format=png&auto=webp&s=292b0d57681406ae84547c49566c6be4975d503e

  
It wicked off the 50sma on the 1d chart.

https://preview.redd.it/eehnc273teeh1.png?width=1232&format=png&auto=webp&s=d173f855fc848484bbd5f730b1948eac1e5cffe9

The plan right now is to sell => 9.00  
Or maybe sell before Google earnings... not sure yet.",18,44,2026-07-20 16:15:28+00:00,https://www.reddit.com/r/wallstreetbets/comments/1v1q0e3/214k_usd_value_in_shares_yolo_ampg_36200_shares/,https://www.reddit.com/r/wallstreetbets/comments/1v1q0e3/214k_usd_value_in_shares_yolo_ampg_36200_shares/,"$214K USD Value In Shares Yolo $AMPG | 36,200 Shares @ 5.90 Cost Basis I've been getting my butt kicked by $BE and the $SPY.  
I am parking my port into $AMPG.

The stock seems solid, that's about all the DD I can provide.  
This is a $214K dollar Yolo (I have to put this to satisfy the auto-mod).

https://preview.redd.it/jdndws50teeh1.png?width=870&format=png&auto=webp&s=292b0d57681406ae84547c49566c6be4975d503e

  
It wicked off the 50sma on the 1d chart.

https://preview.redd.it/eehnc273teeh1.png?width=1232&format=png&auto=webp&s=d173f855fc848484bbd5f730b1948eac1e5cffe9

The plan right now is to sell => 9.00  
Or maybe sell before Google earnings... not sure yet.","Counter({'AMPG': 4, 'SPY': 2, 'BE': 1})",7,0.8224,6.75110146893676
1v1nnml,hot,Google's recent dump and upcoming earnings play,"**TL;DR:** GOOGL lost $200B in about 30 hours because a model is late and some engineers changed badges. This started the morning after Buffett told CNBC the $31B stake was his idea, including a $10B check written straight to Google funding the exact capex everyone is scared of. META meanwhile gained $125B this month on a leaked memo about maybe renting out spare GPUs someday. Google's actual cloud did $20B last quarter, up 63%, record margins, $462B backlog, and they're turning away customers because they can't build compute fast enough. Earnings Wednesday, 25x forward, expectations conveniently reset. Sold the machine, bought the memo.

July 15, Buffett goes on CNBC and says the thing nobody expected. The $31 billion Alphabet position everyone assumed was Greg Abel flexing his new job? ""I initiated it."" Said not buying sooner was a mistake, said Google is more likely to succeed than 90-95% of Wall Street's picks. Stock ran from the 358 area to close near 372 and kept climbing the next morning, touching 380.

Then Bloomberg landed midsession on the 16th. Gemini 3.5 Pro months behind schedule, coding benchmarks came in soft. The stock collapsed the same day, $200 billion gone, and kept bleeding through the 17th down to a 344 low. From 380 to 344 in roughly 30 hours of trading. Revenue estimates moved zero dollars.

The delay stacked on a month of exodus headlines. Shazeer back to OpenAI. John Jumper, the Nobel guy, off to Anthropic with two more researchers behind him. Except 3.5 Pro finished its training runs before any of them cleaned out their desks. Whatever those departures cost shows up in 2027's models. The market sold this quarter on next year's org chart.

Two weeks earlier Meta showed what headlines are worth when they point the other way. Stock jumps 9%, $125 billion in a session, on a report with unnamed sources and nothing announced that they might build a cloud business to sell excess compute. Zuck's own framing of the opportunity: we may have overbuilt. A hundred twenty five billion dollars for ""we bought too many GPUs and might rent out the extras.""

Google can't relate. Their cloud did $20 billion last quarter, up 63%, fastest of any major provider, operating margin at a record 32.9%, backlog nearly doubled to $462 billion with over half converting to revenue inside 24 months. And they're turning deals away. Not losing them, declining them, because they can't build capacity fast enough. Monday's bounce was a report that they're etching Gemini directly into next-gen silicon for 6-10x better power per token, built specifically to fix the shortage that's forcing them to say no to money. They're also selling TPUs to third parties now, with multiple gigawatts committed to Anthropic and Broadcom. Meta wants to enter the cloud business someday. Google is rationing theirs.

The delayed model canceled none of that backlog. Not one contract.

The leaderboard fear has the shelf life of milk anyway. Chinese labs keep compressing the frontier within weeks through distillation, Kimi and friends proved model rank doesn't hold. The durable war is cost per token and distribution, and Google owns every layer: silicon, data centers, models, three billion users. The AI subscription revenue people wring their hands over is a rounding error next to cloud and ads.

The capex is the real bear case and it deserves respect. $180-190 billion guided this year. Q1 free cash flow down 47%. Buybacks paused. Anthropic concentration in the backlog. If cloud growth prints below roughly 55% Wednesday the conversion story cracks and this whole thing gets rethought. Watch that one number.

That June tranche of Buffett's stake, though. It wasn't open market buying. It was a $10 billion private placement, shares purchased directly from Alphabet, cash going straight into the AI buildout. The spending that terrifies the market has Omaha's signature on the check. The man does not fund bonfires.

One more wrinkle in Wednesday's print. Alphabet marks its SpaceX and Anthropic stakes to market. SpaceX went public in June, repricing that stake off its old private mark. Anthropic closed a $65 billion round in late May at a $965 billion valuation, up from $380 billion in March. Both revaluations land inside Q2. Last quarter's paper gains already made the headline EPS look absurd. This quarter's paper is bigger, on both barrels, and the algos reading the wire at 4:01 don't read footnotes.

Stock's at 351 today, closer to last week's low than its high, coiled at the same level it sat before the Q1 print. That one went 350 to 408 on the report before round tripping the whole move. Same coil. Bigger catalyst.

Badge counts and memos got traded all month. Wednesday the machine reports.

At the end of the day: calls.

Not financial advice. The author is highly regarded and drives his own short bus.

Position: GOOGL 380C 7/24, many contracts.",228,77,2026-07-20 14:47:38+00:00,https://www.reddit.com/r/wallstreetbets/comments/1v1nnml/googles_recent_dump_and_upcoming_earnings_play/,https://www.reddit.com/r/wallstreetbets/comments/1v1nnml/googles_recent_dump_and_upcoming_earnings_play/,"Google's recent dump and upcoming earnings play **TL;DR:** GOOGL lost $200B in about 30 hours because a model is late and some engineers changed badges. This started the morning after Buffett told CNBC the $31B stake was his idea, including a $10B check written straight to Google funding the exact capex everyone is scared of. META meanwhile gained $125B this month on a leaked memo about maybe renting out spare GPUs someday. Google's actual cloud did $20B last quarter, up 63%, record margins, $462B backlog, and they're turning away customers because they can't build compute fast enough. Earnings Wednesday, 25x forward, expectations conveniently reset. Sold the machine, bought the memo.

July 15, Buffett goes on CNBC and says the thing nobody expected. The $31 billion Alphabet position everyone assumed was Greg Abel flexing his new job? ""I initiated it."" Said not buying sooner was a mistake, said Google is more likely to succeed than 90-95% of Wall Street's picks. Stock ran from the 358 area to close near 372 and kept climbing the next morning, touching 380.

Then Bloomberg landed midsession on the 16th. Gemini 3.5 Pro months behind schedule, coding benchmarks came in soft. The stock collapsed the same day, $200 billion gone, and kept bleeding through the 17th down to a 344 low. From 380 to 344 in roughly 30 hours of trading. Revenue estimates moved zero dollars.

The delay stacked on a month of exodus headlines. Shazeer back to OpenAI. John Jumper, the Nobel guy, off to Anthropic with two more researchers behind him. Except 3.5 Pro finished its training runs before any of them cleaned out their desks. Whatever those departures cost shows up in 2027's models. The market sold this quarter on next year's org chart.

Two weeks earlier Meta showed what headlines are worth when they point the other way. Stock jumps 9%, $125 billion in a session, on a report with unnamed sources and nothing announced that they might build a cloud business to sell excess compute. Zuck's own framing of the opportunity: we may have overbuilt. A hundred twenty five billion dollars for ""we bought too many GPUs and might rent out the extras.""

Google can't relate. Their cloud did $20 billion last quarter, up 63%, fastest of any major provider, operating margin at a record 32.9%, backlog nearly doubled to $462 billion with over half converting to revenue inside 24 months. And they're turning deals away. Not losing them, declining them, because they can't build capacity fast enough. Monday's bounce was a report that they're etching Gemini directly into next-gen silicon for 6-10x better power per token, built specifically to fix the shortage that's forcing them to say no to money. They're also selling TPUs to third parties now, with multiple gigawatts committed to Anthropic and Broadcom. Meta wants to enter the cloud business someday. Google is rationing theirs.

The delayed model canceled none of that backlog. Not one contract.

The leaderboard fear has the shelf life of milk anyway. Chinese labs keep compressing the frontier within weeks through distillation, Kimi and friends proved model rank doesn't hold. The durable war is cost per token and distribution, and Google owns every layer: silicon, data centers, models, three billion users. The AI subscription revenue people wring their hands over is a rounding error next to cloud and ads.

The capex is the real bear case and it deserves respect. $180-190 billion guided this year. Q1 free cash flow down 47%. Buybacks paused. Anthropic concentration in the backlog. If cloud growth prints below roughly 55% Wednesday the conversion story cracks and this whole thing gets rethought. Watch that one number.

That June tranche of Buffett's stake, though. It wasn't open market buying. It was a $10 billion private placement, shares purchased directly from Alphabet, cash going straight into the AI buildout. The spending that terrifies the market has Omaha's signature on the check. The man does not fund bonfires.

One more wrinkle in Wednesday's print. Alphabet marks its SpaceX and Anthropic stakes to market. SpaceX went public in June, repricing that stake off its old private mark. Anthropic closed a $65 billion round in late May at a $965 billion valuation, up from $380 billion in March. Both revaluations land inside Q2. Last quarter's paper gains already made the headline EPS look absurd. This quarter's paper is bigger, on both barrels, and the algos reading the wire at 4:01 don't read footnotes.

Stock's at 351 today, closer to last week's low than its high, coiled at the same level it sat before the Q1 print. That one went 350 to 408 on the report before round tripping the whole move. Same coil. Bigger catalyst.

Badge counts and memos got traded all month. Wednesday the machine reports.

At the end of the day: calls.

Not financial advice. The author is highly regarded and drives his own short bus.

Position: GOOGL 380C 7/24, many contracts.","Counter({'GOOGL': 2, 'CNBC': 2, 'META': 1})",5,0.5019,9.790430830243832
1v1n2z4,hot,"1DTE Realized 20K Loss, SPY Puts","220 contracts    IN @ .98  
220 contracts OUT @ .05

This is a 20K realized loss for 1DTE that I opened on Friday afternoon.

https://preview.redd.it/6t9phllp9eeh1.png?width=1353&format=png&auto=webp&s=9cb94ff742d1eb0fca25778e44f151645242f8d9

Bears always get killed...

Enjoy the loss pr0n you filthy disgusting animals.",156,72,2026-07-20 14:25:57+00:00,https://www.reddit.com/r/wallstreetbets/comments/1v1n2z4/1dte_realized_20k_loss_spy_puts/,https://www.reddit.com/r/wallstreetbets/comments/1v1n2z4/1dte_realized_20k_loss_spy_puts/,"1DTE Realized 20K Loss, SPY Puts 220 contracts    IN @ .98  
220 contracts OUT @ .05

This is a 20K realized loss for 1DTE that I opened on Friday afternoon.

https://preview.redd.it/6t9phllp9eeh1.png?width=1353&format=png&auto=webp&s=9cb94ff742d1eb0fca25778e44f151645242f8d9

Bears always get killed...

Enjoy the loss pr0n you filthy disgusting animals.","Counter({'SPY': 1, 'OUT': 1})",2,-0.7269,9.346705246496699
1v1izs3,hot,Thank y'all for eating so much pizza,,136,34,2026-07-20 11:37:11+00:00,https://www.reddit.com/r/wallstreetbets/comments/1v1izs3/thank_yall_for_eating_so_much_pizza/,https://www.reddit.com/gallery/1v1izs3,Thank y'all for eating so much pizza,Counter(),0,0.3612,8.475328987317539
1v1i898,hot,"Hut 8 signs $9.8 billion AI data center lease, fully commercializes Texas campus",,252,58,2026-07-20 10:58:54+00:00,https://www.reddit.com/r/wallstreetbets/comments/1v1i898/hut_8_signs_98_billion_ai_data_center_lease_fully/,https://kfgo.com/2026/07/20/hut-8-signs-9-8-billion-ai-data-center-lease-fully-commercializes-texas-campus/,"Hut 8 signs $9.8 billion AI data center lease, fully commercializes Texas campus",Counter(),0,0.0,9.610926932633241
1v1h5gh,hot,"Daily Discussion Thread for July 20, 2026",This post contains content not supported on old Reddit. [Click here to view the full post](https://sh.reddit.com/r/wallstreetbets/comments/1v1h5gh),233,9138,2026-07-20 10:00:37+00:00,https://www.reddit.com/r/wallstreetbets/comments/1v1h5gh/daily_discussion_thread_for_july_20_2026/,https://www.reddit.com/r/wallstreetbets/comments/1v1h5gh/daily_discussion_thread_for_july_20_2026/,"Daily Discussion Thread for July 20, 2026 This post contains content not supported on old Reddit. [Click here to view the full post](https://sh.reddit.com/r/wallstreetbets/comments/1v1h5gh)",Counter(),0,-0.2411,14.575627364629904
