id,feed,title,body,score,num_comments,created_utc,permalink,url,text,ticker_counts,candidate_mentions,sentiment,engagement
1v04637,hot,"Am I crazy, or is everyone sleeping on SMG?","Maybe I’m missing something, so tell me why this trade is dumb.

Large parts of the U.S. are dealing with drought and lawns are getting absolutely cooked. Assuming we get rain in late summer or early fall, millions of homeowners are going to want to repair or completely reseed their lawns.

Wouldn’t that make **Scotts Miracle-Gro (SMG)** one of the most obvious beneficiaries?

Yeah, I know they already popped recently after analyst upgrades and better earnings, but is the market actually pricing in a potentially huge fall grass seed season?

Questions:  
How much of SMG’s revenue comes from grass seed and lawn repair products?  
Has weather-driven demand ever materially moved the stock before?  
If this thesis is wrong, what’s the biggest flaw?  
Are there better plays than SMG? Maybe SITE or CENT?

Looking for people who actually know the lawn industry or have followed this stock. Convince me I’m wrong before I throw money at it.",0,54,2026-07-18 18:56:46+00:00,https://www.reddit.com/r/wallstreetbets/comments/1v04637/am_i_crazy_or_is_everyone_sleeping_on_smg/,https://www.reddit.com/r/wallstreetbets/comments/1v04637/am_i_crazy_or_is_everyone_sleeping_on_smg/,"Am I crazy, or is everyone sleeping on SMG? Maybe I’m missing something, so tell me why this trade is dumb.

Large parts of the U.S. are dealing with drought and lawns are getting absolutely cooked. Assuming we get rain in late summer or early fall, millions of homeowners are going to want to repair or completely reseed their lawns.

Wouldn’t that make **Scotts Miracle-Gro (SMG)** one of the most obvious beneficiaries?

Yeah, I know they already popped recently after analyst upgrades and better earnings, but is the market actually pricing in a potentially huge fall grass seed season?

Questions:  
How much of SMG’s revenue comes from grass seed and lawn repair products?  
Has weather-driven demand ever materially moved the stock before?  
If this thesis is wrong, what’s the biggest flaw?  
Are there better plays than SMG? Maybe SITE or CENT?

Looking for people who actually know the lawn industry or have followed this stock. Convince me I’m wrong before I throw money at it.","Counter({'SMG': 4, 'SITE': 1, 'CENT': 1})",6,0.4821,4.007333185232471
1uzzzab,hot,Anyone else have a 20% rule?,"It’s a weird kind of learned behavior, but whenever I see this notification it almost always follows with a reversal.  So most of the time I will seriously consider immediately selling.  Only once on Robinhood have I seen a 50% notification.

I always long my options and will hold past 20% in those cases, but it’s a philosophical lead indicator for me.  Just wondering if anyone does the same thing.",318,185,2026-07-18 16:12:59+00:00,https://www.reddit.com/r/wallstreetbets/comments/1uzzzab/anyone_else_have_a_20_rule/,https://www.reddit.com/gallery/1uzzzab,"Anyone else have a 20% rule? It’s a weird kind of learned behavior, but whenever I see this notification it almost always follows with a reversal.  So most of the time I will seriously consider immediately selling.  Only once on Robinhood have I seen a 50% notification.

I always long my options and will hold past 20% in those cases, but it’s a philosophical lead indicator for me.  Just wondering if anyone does the same thing.",Counter(),0,-0.34,10.990937776498047
1uzzl3w,hot,Recover or same fate again?,This part of my life... this part right here? This is called happiness. ,39,26,2026-07-18 15:57:46+00:00,https://www.reddit.com/r/wallstreetbets/comments/1uzzl3w/recover_or_same_fate_again/,https://www.reddit.com/gallery/1uzzl3w,Recover or same fate again? This part of my life... this part right here? This is called happiness.,Counter(),0,0.6072,6.984716320118265
1uzwzxw,hot,"Nvidia! Earnings calls, AI monetization, and CapEx discussion from big boys will KILL AI hardware bubble theory","Calls on Nvidia?  What's your bet?  I think after Google announces July 22nd and Meta Microsoft on the 29th Nvidia will be adopted by pension fund laggers.

!banbet NVDA 220 30d

Did I do that bb right?",93,72,2026-07-18 14:13:23+00:00,https://www.reddit.com/r/wallstreetbets/comments/1uzwzxw/nvidia_earnings_calls_ai_monetization_and_capex/,https://i.redd.it/xnhhxqsrxzdh1.png,"Nvidia! Earnings calls, AI monetization, and CapEx discussion from big boys will KILL AI hardware bubble theory Calls on Nvidia?  What's your bet?  I think after Google announces July 22nd and Meta Microsoft on the 29th Nvidia will be adopted by pension fund laggers.

!banbet NVDA 220 30d

Did I do that bb right?","Counter({'KILL': 1, 'NVDA': 1})",2,-0.8204,8.833754223418396
1uzwwvt,hot,IBIT Options on M & W discontinued?,"For several months I have been selling covered calls on IBIT every M, W, and F.  However, I don't see any listed Monday or Wednesdays going forward.  I use Etrade.  Does anyone know if they have been cut back to just weeklies (Fridays)?  If so, why?  I called Etrade and the gentleman I talked with did not know why and said they were very high volume so he was also surprised to not find them any longer.  ",18,6,2026-07-18 14:10:02+00:00,https://www.reddit.com/r/wallstreetbets/comments/1uzwwvt/ibit_options_on_m_w_discontinued/,https://www.reddit.com/r/wallstreetbets/comments/1uzwwvt/ibit_options_on_m_w_discontinued/,"IBIT Options on M & W discontinued? For several months I have been selling covered calls on IBIT every M, W, and F.  However, I don't see any listed Monday or Wednesdays going forward.  I use Etrade.  Does anyone know if they have been cut back to just weeklies (Fridays)?  If so, why?  I called Etrade and the gentleman I talked with did not know why and said they were very high volume so he was also surprised to not find them any longer.",Counter({'IBIT': 2}),2,-0.1877,4.890349128221754
1uzwgxi,hot,"Analysts: ""Oh yeah? We're going to the moon without your stocks, then. Fuck your stocks""",,0,20,2026-07-18 13:51:32+00:00,https://www.reddit.com/r/wallstreetbets/comments/1uzwgxi/analysts_oh_yeah_were_going_to_the_moon_without/,https://i.redd.it/qrq07ocoszdh1.jpeg,"Analysts: ""Oh yeah? We're going to the moon without your stocks, then. Fuck your stocks""",Counter(),0,-0.3182,3.044522437723423
1uzt6bk,new,Don't overcomplicate AI investing,"Do you believe AI is transformational technology?

Do you believe we are building something equally or more intelligent than homo sapiens?

Do you think it is as important as nukes in terms of cyber defense and geopolitics? 

Do you think everyone needs sovereign AI not to depend on other countries?

If the answer above is yes then:

What do you need for this to happen?

Answer:

Energy and silicon. 

So invest in anything that is needed for the future above.

Now if you think AI is like excel just pay Michael Burrys substack and watch how society transforms from the sidelines.",0,91,2026-07-18 11:15:44+00:00,https://www.reddit.com/r/wallstreetbets/comments/1uzt6bk/dont_overcomplicate_ai_investing/,https://www.reddit.com/r/wallstreetbets/comments/1uzt6bk/dont_overcomplicate_ai_investing/,"Don't overcomplicate AI investing Do you believe AI is transformational technology?

Do you believe we are building something equally or more intelligent than homo sapiens?

Do you think it is as important as nukes in terms of cyber defense and geopolitics? 

Do you think everyone needs sovereign AI not to depend on other countries?

If the answer above is yes then:

What do you need for this to happen?

Answer:

Energy and silicon. 

So invest in anything that is needed for the future above.

Now if you think AI is like excel just pay Michael Burrys substack and watch how society transforms from the sidelines.",Counter(),0,0.9377,4.5217885770490405
1uzsslr,hot,GOOGL earnings 7/22 the GAAP number is going to look insane,"

The GAAP EPS estimate is $2.89. Google is going to report something closer to $7 (maybe $5-7 because I trusted Gemini math, and yes I recognize the irony).

Google owns \~5-6% of SpaceX. SpaceX IPO'd June 12, and on June 30 SPCX closed at $170.86, valuing it \~$2.25T. Google's Chunk was \~$113B at quarter end, up from \~$40B last quarter. That \~$70B jump runs through the income statement as a gain. After tax and share count it could be up to and additional $4.50 to EPS on top of the $2.89 GAAP estimates being reported. That's IF Google actually fully reported it in Q1 and historically they have downplayed these bets while they could. Now that it's a tangible asset they are legally required to report it at face value end of Q2.

Analysts don't put it in the estimate. It's a below-the-line mark tied for their closing price on one day, so nobody forecasts it. But the thing is, there's now a real asset that can be sold or borroewed against on the not so distant horizon. Pre-IPO it was a locked private stake. Now it's liquid, and the lockup lapses in December. For a stock whose bear case is capex eating free cash flow, that's a real asset.

Idk about you but when news outlets start reporting on up to a 142% earnings beat (GAAP or not, headlines don't care), people will pay attention.

My play remains firmly bullish. I rolled mostly into Aug 21 [as I said I planned to in my previous post.](https://www.reddit.com/r/wallstreetbets/comments/1uey3dp/googl_dd_and_amateur_analysis/) I still aim for a target range of $380+ though that's been unfortunately pulled down a bit by the model delay news (which I hope is cleanly resolved with a real timeline at earnings). 

Positions attached (it was a bloody day and I would be lying if I said those 4 calls with the 7/24 expiration weren't completely forgottten). 

Not financial advice.",209,196,2026-07-18 10:55:17+00:00,https://www.reddit.com/r/wallstreetbets/comments/1uzsslr/googl_earnings_722_the_gaap_number_is_going_to/,https://www.reddit.com/gallery/1uzsslr,"GOOGL earnings 7/22 the GAAP number is going to look insane 

The GAAP EPS estimate is $2.89. Google is going to report something closer to $7 (maybe $5-7 because I trusted Gemini math, and yes I recognize the irony).

Google owns \~5-6% of SpaceX. SpaceX IPO'd June 12, and on June 30 SPCX closed at $170.86, valuing it \~$2.25T. Google's Chunk was \~$113B at quarter end, up from \~$40B last quarter. That \~$70B jump runs through the income statement as a gain. After tax and share count it could be up to and additional $4.50 to EPS on top of the $2.89 GAAP estimates being reported. That's IF Google actually fully reported it in Q1 and historically they have downplayed these bets while they could. Now that it's a tangible asset they are legally required to report it at face value end of Q2.

Analysts don't put it in the estimate. It's a below-the-line mark tied for their closing price on one day, so nobody forecasts it. But the thing is, there's now a real asset that can be sold or borroewed against on the not so distant horizon. Pre-IPO it was a locked private stake. Now it's liquid, and the lockup lapses in December. For a stock whose bear case is capex eating free cash flow, that's a real asset.

Idk about you but when news outlets start reporting on up to a 142% earnings beat (GAAP or not, headlines don't care), people will pay attention.

My play remains firmly bullish. I rolled mostly into Aug 21 [as I said I planned to in my previous post.](https://www.reddit.com/r/wallstreetbets/comments/1uey3dp/googl_dd_and_amateur_analysis/) I still aim for a target range of $380+ though that's been unfortunately pulled down a bit by the model delay news (which I hope is cleanly resolved with a real timeline at earnings). 

Positions attached (it was a bloody day and I would be lying if I said those 4 calls with the 7/24 expiration weren't completely forgottten). 

Not financial advice.","Counter({'GAAP': 4, 'GOOGL': 1, 'SPCX': 1})",6,0.9001,10.630311259455457
1uzrx6o,hot,321k SPACEX PUTS GAINS REALIZED.,Good luck. ,4338,223,2026-07-18 10:04:18+00:00,https://www.reddit.com/r/wallstreetbets/comments/1uzrx6o/321k_spacex_puts_gains_realized/,https://i.redd.it/l0wj1atbpydh1.jpeg,321k SPACEX PUTS GAINS REALIZED. Good luck.,Counter({'GAINS': 1}),1,0.8415,13.787045237653391
1uzqg80,hot,Loss porn for July +130% YTD -> 10% in 2 weeks,"Would you believe I managed to do this SELLING puts?

Bull market until July, got greedy and stupid and oversold puts on margin.

1st July was my peak and I had 80 contracts of CRWV at 90 out. META article dropped the price 20% in like 2 days.

Decided to eat my losses and full port into RKLB at 84 and sell CC on that at cost basis. Worked fantastically for a week until the entire space sector and most of the rest of the market died and I got margin called.

Decided to liquidate my account instead of my broker doing it and start again and this time not trading like a complete retard.",176,71,2026-07-18 08:37:12+00:00,https://www.reddit.com/r/wallstreetbets/comments/1uzqg80/loss_porn_for_july_130_ytd_10_in_2_weeks/,https://www.reddit.com/gallery/1uzqg80,"Loss porn for July +130% YTD -> 10% in 2 weeks Would you believe I managed to do this SELLING puts?

Bull market until July, got greedy and stupid and oversold puts on margin.

1st July was my peak and I had 80 contracts of CRWV at 90 out. META article dropped the price 20% in like 2 days.

Decided to eat my losses and full port into RKLB at 84 and sell CC on that at cost basis. Worked fantastically for a week until the entire space sector and most of the rest of the market died and I got margin called.

Decided to liquidate my account instead of my broker doing it and start again and this time not trading like a complete retard.","Counter({'YTD': 1, 'CRWV': 1, 'META': 1, 'RKLB': 1})",4,-0.9136,9.452815851589884
1uzowes,hot,Big W this month,,89,38,2026-07-18 07:06:56+00:00,https://www.reddit.com/r/wallstreetbets/comments/1uzowes/big_w_this_month/,https://www.reddit.com/gallery/1uzowes,Big W this month,Counter(),0,0.0,8.163371316459912
1uzoi3e,hot,First one is free,,617,148,2026-07-18 06:44:55+00:00,https://www.reddit.com/r/wallstreetbets/comments/1uzoi3e/first_one_is_free/,https://www.reddit.com/gallery/1uzoi3e,First one is free,Counter(),0,0.5106,11.430434763403149
1uzk1r3,hot,Every Release of Shrek Happens Right Before a Market Top,"Every release of Shrek has been followed by a local top, and every other Shrek release has coincided with a market crash (Shrek 1 and Shrek 3).

If the pattern holds, we should go full bull until June 30, 2027, which should follow with a big market crash.

Full port calls. Joinemigo ",4506,237,2026-07-18 02:52:47+00:00,https://www.reddit.com/r/wallstreetbets/comments/1uzk1r3/every_release_of_shrek_happens_right_before_a/,https://i.redd.it/j5esm078kwdh1.jpeg,"Every Release of Shrek Happens Right Before a Market Top Every release of Shrek has been followed by a local top, and every other Shrek release has coincided with a market crash (Shrek 1 and Shrek 3).

If the pattern holds, we should go full bull until June 30, 2027, which should follow with a big market crash.

Full port calls. Joinemigo",Counter(),0,-0.4215,13.885657696362124
1uzj20b,hot,Full porting META calls,,46,30,2026-07-18 02:04:42+00:00,https://www.reddit.com/r/wallstreetbets/comments/1uzj20b/full_porting_meta_calls/,https://i.redd.it/38ibcpjrbwdh1.jpeg,Full porting META calls,Counter({'META': 1}),1,0.0,7.284134806195205
1uzhglm,hot,10k gains SPY Options,Just straight scalping em.,32,13,2026-07-18 00:48:48+00:00,https://www.reddit.com/r/wallstreetbets/comments/1uzhglm/10k_gains_spy_options/,https://www.reddit.com/gallery/1uzhglm,10k gains SPY Options Just straight scalping em.,Counter({'SPY': 1}),1,0.5106,6.135564891081739
1uzgyew,hot,Welp that’s my life screwed up forever,"Kept trying to recover what I lost, then 0DTEs, now I’m broke with debt… classic",8258,1217,2026-07-18 00:25:24+00:00,https://www.reddit.com/r/wallstreetbets/comments/1uzgyew/welp_thats_my_life_screwed_up_forever/,https://i.redd.it/r6pfdqr1uvdh1.jpeg,"Welp that’s my life screwed up forever Kept trying to recover what I lost, then 0DTEs, now I’m broke with debt… classic",Counter(),0,-0.8074,16.12402424208056
1uzfta2,hot,Fully Regarted,"Was on a roll until I got too greedy. Flipped SNDK, QQQ, SMCI, and SPCX today but didn’t set a stop loss during my 12:40 meeting ☠️",80,63,2026-07-17 23:34:56+00:00,https://www.reddit.com/r/wallstreetbets/comments/1uzfta2/fully_regarted/,https://www.reddit.com/gallery/1uzfta2,"Fully Regarted Was on a roll until I got too greedy. Flipped SNDK, QQQ, SMCI, and SPCX today but didn’t set a stop loss during my 12:40 meeting ☠️","Counter({'SNDK': 1, 'QQQ': 1, 'SMCI': 1, 'SPCX': 1})",4,-0.7506,8.55333223803211
1uzfino,hot,10x returns on my SPXC puts. Sorry I let you all down and didnt 20x like I promised.,[I wanted a 20x. ](https://www.reddit.com/r/wallstreetbets/s/ITuOQ7JelN)I was [diamond handed af.  ](https://www.reddit.com/r/wallstreetbets/comments/1uujmwy/comment/oxbga9i/?context=3&utm_source=share&utm_medium=web3x&utm_name=web3xcss&utm_term=1&utm_content=share_button)Didnt take enough [screenshots](https://www.reddit.com/r/wallstreetbets/comments/1uujmwy/comment/oxbgxi8/?context=3&utm_source=share&utm_medium=web3x&utm_name=web3xcss&utm_term=1&utm_content=share_button) along the way. Went from [0k to like 350k](https://www.reddit.com/r/wallstreetbets/s/Fo1ylgFupP) back down to 100k and now im at 500k+. Deleted the app. See you all monday once I reinstall.  ,1736,169,2026-07-17 23:22:06+00:00,https://www.reddit.com/r/wallstreetbets/comments/1uzfino/10x_returns_on_my_spxc_puts_sorry_i_let_you_all/,https://i.redd.it/4eijp9ythvdh1.png,10x returns on my SPXC puts. Sorry I let you all down and didnt 20x like I promised. [I wanted a 20x. ](https://www.reddit.com/r/wallstreetbets/s/ITuOQ7JelN)I was [diamond handed af.  ](https://www.reddit.com/r/wallstreetbets/comments/1uujmwy/comment/oxbga9i/?context=3&utm_source=share&utm_medium=web3x&utm_name=web3xcss&utm_term=1&utm_content=share_button)Didnt take enough [screenshots](https://www.reddit.com/r/wallstreetbets/comments/1uujmwy/comment/oxbgxi8/?context=3&utm_source=share&utm_medium=web3x&utm_name=web3xcss&utm_term=1&utm_content=share_button) along the way. Went from [0k to like 350k](https://www.reddit.com/r/wallstreetbets/s/Fo1ylgFupP) back down to 100k and now im at 500k+. Deleted the app. See you all monday once I reinstall.,Counter({'SPXC': 1}),1,-0.7176,12.595713203291368
1uze2ls,hot,The dip keeps dippin,Lookin for a big bounce ,33,27,2026-07-17 22:21:32+00:00,https://www.reddit.com/r/wallstreetbets/comments/1uze2ls/the_dip_keeps_dippin/,https://i.redd.it/twy40p6y7vdh1.jpeg,The dip keeps dippin Lookin for a big bounce,Counter(),0,0.0,6.858565034791365
1uze16s,hot,Good day today . $SPX,,41,21,2026-07-17 22:19:51+00:00,https://www.reddit.com/r/wallstreetbets/comments/1uze16s/good_day_today_spx/,https://www.reddit.com/gallery/1uze16s,Good day today . $SPX,Counter({'SPX': 2}),2,0.4404,6.828712071641684
1uzdpkx,hot,What a roller coaster....,Biggest swing I've had so far. Finally made some regard gains.,215,94,2026-07-17 22:06:15+00:00,https://www.reddit.com/r/wallstreetbets/comments/1uzdpkx/what_a_roller_coaster/,https://www.reddit.com/gallery/1uzdpkx,What a roller coaster.... Biggest swing I've had so far. Finally made some regard gains.,Counter(),0,0.34,9.929155299284705
1uzcr3x,new,It might be time to go to space (press X to doubt),"The thesis is simple: remember all those shares of SPCX you weren’t allocated at $135 at IPO? Imagine how many other regards out there missed out and are going to think this is a great deal under IPO price.

There’s a quick catalyst on the way with the starship launch on Monday. It’ll get more eyes on the stock and help people find out about this wonderful deal they’re being offered. As long as this launch isn’t aborted and doesn’t blow up, it’ll serve as a catalyst to fuel to rally. 

Lastly, no way Musk doesn’t tweet something outrageously positive soon (think back to “$1 trillion revenue in 2030”) when the stock’s fallen this much. 

To be clear, I’m not advocating for HODLing this forever. Get in, catch the bounce up past IPO price, and get out before insider shares unlock mid-August. 

Positions: 250 shares at $123.16",0,26,2026-07-17 21:27:17+00:00,https://www.reddit.com/r/wallstreetbets/comments/1uzcr3x/it_might_be_time_to_go_to_space_press_x_to_doubt/,https://i.redd.it/4izv86r9yudh1.jpeg,"It might be time to go to space (press X to doubt) The thesis is simple: remember all those shares of SPCX you weren’t allocated at $135 at IPO? Imagine how many other regards out there missed out and are going to think this is a great deal under IPO price.

There’s a quick catalyst on the way with the starship launch on Monday. It’ll get more eyes on the stock and help people find out about this wonderful deal they’re being offered. As long as this launch isn’t aborted and doesn’t blow up, it’ll serve as a catalyst to fuel to rally. 

Lastly, no way Musk doesn’t tweet something outrageously positive soon (think back to “$1 trillion revenue in 2030”) when the stock’s fallen this much. 

To be clear, I’m not advocating for HODLing this forever. Get in, catch the bounce up past IPO price, and get out before insider shares unlock mid-August. 

Positions: 250 shares at $123.16",Counter({'SPCX': 1}),1,0.942,3.295836866004329
1uzc7bo,hot,June & July can get Fked,I just know that win is right around the corner just gotta keep full porting options. Maybe August will be better? 🤡,142,40,2026-07-17 21:05:35+00:00,https://www.reddit.com/r/wallstreetbets/comments/1uzc7bo/june_july_can_get_fked/,https://i.redd.it/hdbf7eheuudh1.jpeg,June & July can get Fked I just know that win is right around the corner just gotta keep full porting options. Maybe August will be better? 🤡,Counter(),0,0.7717,8.676416696964214
1uzc3hw,hot,In a matter of 6 months,"Started the year with 6 figures invested in SLV & miner leaps, lost 80%. Then went to tech calls, made some lost most. 

Slides 2/3 are the last 2 positions I’m holding. 

MU will either save my port or finish the job. 

If you’re having a bad day/week/month I hope this made it feel less bad.

No cry casino 🫡",416,172,2026-07-17 21:01:27+00:00,https://www.reddit.com/r/wallstreetbets/comments/1uzc3hw/in_a_matter_of_6_months/,https://www.reddit.com/gallery/1uzc3hw,"In a matter of 6 months Started the year with 6 figures invested in SLV & miner leaps, lost 80%. Then went to tech calls, made some lost most. 

Slides 2/3 are the last 2 positions I’m holding. 

MU will either save my port or finish the job. 

If you’re having a bad day/week/month I hope this made it feel less bad.

No cry casino 🫡",Counter({'SLV': 1}),1,-0.8465,11.18637781629658
1uzbjry,hot,Fuck my Stupid Chud Life (SPY),"Put 2k into my account yesterday and turned it into 3k for this morning. 

Turned the 3k into 9k. 

Turned the 9k into 560 after selling 0DTE 741c at around 8:40 and then buying 0DTE 741p immediately after. 

I’ll be back Monday to do it again :)",342,268,2026-07-17 20:40:47+00:00,https://www.reddit.com/r/wallstreetbets/comments/1uzbjry/fuck_my_stupid_chud_life_spy/,https://www.reddit.com/gallery/1uzbjry,"Fuck my Stupid Chud Life (SPY) Put 2k into my account yesterday and turned it into 3k for this morning. 

Turned the 3k into 9k. 

Turned the 9k into 560 after selling 0DTE 741c at around 8:40 and then buying 0DTE 741p immediately after. 

I’ll be back Monday to do it again :)",Counter({'SPY': 1}),1,-0.5994,11.432441826767779
1uzbet6,hot,I might be regarded,Nflx yolo. Why? No reason,16,15,2026-07-17 20:35:29+00:00,https://www.reddit.com/r/wallstreetbets/comments/1uzbet6/i_might_be_regarded/,https://i.redd.it/hczq3f11pudh1.jpeg,I might be regarded Nflx yolo. Why? No reason,Counter(),0,-0.0258,5.605802066295997
1uzb0kt,hot,Biggest L in a while,"Made 40k on meta calls 2 weeks ago. Just to lose it all this week. 

Currently extra leveraged on ORCL 7/31 100c (22 contracts) ",48,16,2026-07-17 20:20:33+00:00,https://www.reddit.com/r/wallstreetbets/comments/1uzb0kt/biggest_l_in_a_while/,https://www.reddit.com/gallery/1uzb0kt,"Biggest L in a while Made 40k on meta calls 2 weeks ago. Just to lose it all this week. 

Currently extra leveraged on ORCL 7/31 100c (22 contracts)",Counter({'ORCL': 1}),1,-0.4019,6.725033642166842
1uzahhv,hot,Weekend Discussion Thread for the Weekend of July 18-19,This post contains content not supported on old Reddit. [Click here to view the full post](https://sh.reddit.com/r/wallstreetbets/comments/1uzahhv),178,13054,2026-07-17 20:00:37+00:00,https://www.reddit.com/r/wallstreetbets/comments/1uzahhv/weekend_discussion_thread_for_the_weekend_of_july/,https://www.reddit.com/r/wallstreetbets/comments/1uzahhv/weekend_discussion_thread_for_the_weekend_of_july/,Weekend Discussion Thread for the Weekend of July 18-19 This post contains content not supported on old Reddit. [Click here to view the full post](https://sh.reddit.com/r/wallstreetbets/comments/1uzahhv),Counter(),0,-0.2411,14.664312286973985
