id,feed,title,body,score,num_comments,created_utc,permalink,url,text,ticker_counts,candidate_mentions,sentiment,engagement
1tu9txn,hot,My two month gain,I did move to more of a cash position as well as stock and now longer term options. ,8,3,2026-06-01 23:39:19+00:00,https://www.reddit.com/r/wallstreetbets/comments/1tu9txn/my_two_month_gain/,https://i.redd.it/jbco3w9wbr4h1.jpeg,My two month gain I did move to more of a cash position as well as stock and now longer term options.,Counter(),0,0.6705,3.58351893845611
1tu8xj0,hot,Holy Phucking Excrement,Letting go of these tomorrow. Only wish is that I had bought more. ,14,13,2026-06-01 23:02:25+00:00,https://www.reddit.com/r/wallstreetbets/comments/1tu8xj0/holy_phucking_excrement/,https://i.redd.it/qvnr3u9b5r4h1.jpeg,Holy Phucking Excrement Letting go of these tomorrow. Only wish is that I had bought more.,Counter(),0,0.4019,5.347107530717469
1tu8mbi,hot,"Buy & Hold 2X leveraged strategies are normal, right?",,4,1,2026-06-01 22:50:13+00:00,https://www.reddit.com/r/wallstreetbets/comments/1tu8mbi/buy_hold_2x_leveraged_strategies_are_normal_right/,https://i.redd.it/lhy3xbw43r4h1.jpeg,"Buy & Hold 2X leveraged strategies are normal, right?",Counter(),0,0.0,2.3025850929940455
1tu8hmg,hot,Early bird gains for ants,,21,11,2026-06-01 22:45:03+00:00,https://www.reddit.com/r/wallstreetbets/comments/1tu8hmg/early_bird_gains_for_ants/,https://www.reddit.com/gallery/1tu8hmg,Early bird gains for ants,Counter(),0,0.34,5.575949103146316
1tu88lf,hot,Any oil traders here?,"Anyone trading oil and thing wti is a bit low now given all the geopolitics 

https://crudematerial.com/when-19-becomes-background-noise/",10,27,2026-06-01 22:35:26+00:00,https://www.reddit.com/r/wallstreetbets/comments/1tu88lf/any_oil_traders_here/,https://www.reddit.com/r/wallstreetbets/comments/1tu88lf/any_oil_traders_here/,"Any oil traders here? Anyone trading oil and thing wti is a bit low now given all the geopolitics 

https://crudematerial.com/when-19-becomes-background-noise/",Counter(),0,-0.2732,5.730099782973575
1tu7m1s,hot,GTLB Earnings YOLO,Gitlab have earnings tomorrow after market. Sorry regards only Shares not options.,9,6,2026-06-01 22:11:56+00:00,https://www.reddit.com/r/wallstreetbets/comments/1tu7m1s/gtlb_earnings_yolo/,https://i.redd.it/v0qfrl3bwq4h1.jpeg,GTLB Earnings YOLO Gitlab have earnings tomorrow after market. Sorry regards only Shares not options.,Counter({'GTLB': 1}),1,0.5766,4.248495242049359
1tu70e0,hot,God Bless Jensen,Lucked out and bought at the bottom on Thursday. Sold the Jun exp. call to lock in some gains (if it’s good enough to screenshot…).,6,10,2026-06-01 21:49:53+00:00,https://www.reddit.com/r/wallstreetbets/comments/1tu70e0/god_bless_jensen/,https://www.reddit.com/gallery/1tu70e0,God Bless Jensen Lucked out and bought at the bottom on Thursday. Sold the Jun exp. call to lock in some gains (if it’s good enough to screenshot…).,Counter(),0,0.9022,4.343805421853684
1tu6w3x,hot,"$FLNC DD - If $NVDA is selling shovels, then $FLNC is selling power bars to the laborers using them.","You’ve heard of AI, right? Well, AI needs data centers. And data centers need power... A LOT of power. And data centers don’t use that power evenly. When workloads ramp, power demand can spike instantly, and the power grid isn’t built to handle those swings.

Now that your peanut brain understands that, let me tell you about where Fluence Energy ($FLNC) comes in.

Fluence makes big batteries that act like a bank for the data centers. They store power when power supply is steady and demand is low, then release it when demand spikes. This keeps data centers from overloading the grid, reduces outages, and helps data centers avoid paying peak power costs.

Sounds like a good idea, right? Well, Nvidia ($NVDA) and Siemens ($SIEGY) announced today that they think so too.

Fluence just teamed up with them to create a blueprint for next-gen AI data centers. These are massive facilities designed to run heavy AI workloads. Fluence’s role is to integrate their Smartstack battery storage into those systems so the data centers can handle the power swings.

If AI is going to keep growing at this breakneck pace, it’s going to require a massive buildout of power infrastructure. There’s a lot of focus on chips/software/applications, but data centers can’t run without reliable electricity, and that’s becoming a bottleneck.

Fluence isn’t the flashy part of the trade, but it’s one of the more direct ways to play the “AI needs power” thesis. If Nvidia is selling shovels, then Fluence is selling protein bars to the laborers using them.

As of their recent Q2 ER, they’re guiding toward positive EBITDA for the full year, with expected revenue between $3.2B – $3.6B.

More important though is the fact that they’re sitting on $5.6B backlog, which gives them multiple years of revenue visibility. They’ve already booked about $2B in orders this year, which is double last year’s pace.

Oh, and did I mention that their market cap is still less than $5B even after the 40% gain they saw today after the $NVDA/$SIEGY news release? Or that they likely had about 25% short interest as of end of May? Or that they’re not even at an ATH yet even after the news today?

TLDR: AI want power, Fluence store power to make AI go brr. Me like companies that work with Nvidia.

Positions: 6/18 $25C’s, 6/18 $30C’s, 6/18 $34C’s, 534 shares.",8,18,2026-06-01 21:45:35+00:00,https://www.reddit.com/r/wallstreetbets/comments/1tu6w3x/flnc_dd_if_nvda_is_selling_shovels_then_flnc_is/,https://www.reddit.com/r/wallstreetbets/comments/1tu6w3x/flnc_dd_if_nvda_is_selling_shovels_then_flnc_is/,"$FLNC DD - If $NVDA is selling shovels, then $FLNC is selling power bars to the laborers using them. You’ve heard of AI, right? Well, AI needs data centers. And data centers need power... A LOT of power. And data centers don’t use that power evenly. When workloads ramp, power demand can spike instantly, and the power grid isn’t built to handle those swings.

Now that your peanut brain understands that, let me tell you about where Fluence Energy ($FLNC) comes in.

Fluence makes big batteries that act like a bank for the data centers. They store power when power supply is steady and demand is low, then release it when demand spikes. This keeps data centers from overloading the grid, reduces outages, and helps data centers avoid paying peak power costs.

Sounds like a good idea, right? Well, Nvidia ($NVDA) and Siemens ($SIEGY) announced today that they think so too.

Fluence just teamed up with them to create a blueprint for next-gen AI data centers. These are massive facilities designed to run heavy AI workloads. Fluence’s role is to integrate their Smartstack battery storage into those systems so the data centers can handle the power swings.

If AI is going to keep growing at this breakneck pace, it’s going to require a massive buildout of power infrastructure. There’s a lot of focus on chips/software/applications, but data centers can’t run without reliable electricity, and that’s becoming a bottleneck.

Fluence isn’t the flashy part of the trade, but it’s one of the more direct ways to play the “AI needs power” thesis. If Nvidia is selling shovels, then Fluence is selling protein bars to the laborers using them.

As of their recent Q2 ER, they’re guiding toward positive EBITDA for the full year, with expected revenue between $3.2B – $3.6B.

More important though is the fact that they’re sitting on $5.6B backlog, which gives them multiple years of revenue visibility. They’ve already booked about $2B in orders this year, which is double last year’s pace.

Oh, and did I mention that their market cap is still less than $5B even after the 40% gain they saw today after the $NVDA/$SIEGY news release? Or that they likely had about 25% short interest as of end of May? Or that they’re not even at an ATH yet even after the news today?

TLDR: AI want power, Fluence store power to make AI go brr. Me like companies that work with Nvidia.

Positions: 6/18 $25C’s, 6/18 $30C’s, 6/18 $34C’s, 534 shares.","Counter({'FLNC': 6, 'NVDA': 6, 'SIEGY': 4, 'LOT': 1})",17,0.9868,5.14166355650266
1tu6t3c,hot,My $6.5M Anthropic IPO play - Owning the AI Infrastructure! Hut 8 $HUT,"I am fully ported ($6.5M) into Hut 8, who is Anthropic's data center development partner. They have access to energy (nearly 9 GW pipeline) and are building the infrastructure behind the AI revolution. Anthropic announced their first site with Hut 8 in Decemeber, and I expect many more to come.",72,27,2026-06-01 21:42:42+00:00,https://www.reddit.com/r/wallstreetbets/comments/1tu6t3c/my_65m_anthropic_ipo_play_owning_the_ai/,https://i.redd.it/uy5d3ra3rq4h1.png,"My $6.5M Anthropic IPO play - Owning the AI Infrastructure! Hut 8 $HUT I am fully ported ($6.5M) into Hut 8, who is Anthropic's data center development partner. They have access to energy (nearly 9 GW pipeline) and are building the infrastructure behind the AI revolution. Anthropic announced their first site with Hut 8 in Decemeber, and I expect many more to come.",Counter({'HUT': 2}),2,0.5848,7.622663951323595
1tu5tym,hot,69% of portfolio NBIS $275 calls June 5,2/5 of my life savings,23,21,2026-06-01 21:07:07+00:00,https://www.reddit.com/r/wallstreetbets/comments/1tu5tym/69_of_portfolio_nbis_275_calls_june_5/,https://i.redd.it/ydjr1nsqkq4h1.jpeg,69% of portfolio NBIS $275 calls June 5 2/5 of my life savings,Counter({'NBIS': 1}),1,0.0,6.269096283706261
1tu5te2,hot,The SaaSpocalypse is over - 50k+ in gains on SaaS Names,"RIP the SaaSpocalypse. SaaS has had a rough couple months with IGV drawing down 36% from Oct 2025 to April 2026. Absolutely indiscriminate selling with no-one able to escape it no matter the fundamentals.  Textbook over reaction.

Heres the reality: Fundamentals and earnings are still strong for alot of SaaS companies. Fears about reductions in total seats are overblown - Most of the companies firing people are the ones incinerating cash and looking for ways to compensate(ie META). And generally I see AI as a tailwind for software:  it makes creating and managing software exponentially easier and cheaper, but not trivial. And thats the key: building secure, reliable, and scalable software for companies is still not trivial and cant be vibed coded without skilled engineers doing the driving. And expect software to get more AI integrated and complex: this takes even more skilled engineers. Maybe Vibe coding is not that big of a threat to these SaaS companies?

I tested the impacts of vibe coding the only way i knew how: vibe coding a shit ton. I consider myself a moderately skilled engineer: Computer engineering degree from top 10 university and 5 years experience working in data science/data engineering. My findings: Vibe coding is easy and fun as shit but you still need to know what the fuck is going on and there are a shit ton of bugs. The initial coding is easy, but I spend most of my time finding and remediating bugs, then making sure those bug fixes didn't break more shit. Key takeaway here: vibe coding is easy but vibe coding production grade software is not. Maybe this changes over time, but in the intermediate term, vibe coding doesn't replace companies with teams of professional software engineers.

So the fundamentals were still strong and the market was being irrational about the impacts of AI which equals opportunity. I went into this with a mental stop below the 76.70 on IGV: Multiple daily closes below this level means reevaluating the position. Maybe 10% max downside to 50%+ upside when IGV was at 80. Amazing risk to reward.  In mid February I started accumulating SaaS exposure through Jan 2027 IGV 102 calls. Over the past couple months i've just been accumulating more IGV calls and adding more exposure through my favorite SaaS names: MSFT, NOW and PLTR. Doubled down on NOW after everyones favorite president added.

Anyways, last few days have been major validation of my thesis. The price action for these companies have gone from dogshit near the march bottom to pretty damn good with monthly bullish engulfing candles on Fridays close. This rally might have legs just looking at the price action. But I'm only partially a degenerate so taking some profits here.  Did some Trims and rolls this morning with most of my positions up 200-350%. Realized 30k in gains but leaving the majority of this position on.

SaaS companies that can move quickly to embrace AI will see decent returns moving forward in my opinion. But earnings have to follow. If i don't see any meaningful earnings growth in these SaaS names, I’ll reduce further or cut the position.",13,5,2026-06-01 21:06:33+00:00,https://www.reddit.com/r/wallstreetbets/comments/1tu5te2/the_saaspocalypse_is_over_50k_in_gains_on_saas/,https://www.reddit.com/gallery/1tu5te2,"The SaaSpocalypse is over - 50k+ in gains on SaaS Names RIP the SaaSpocalypse. SaaS has had a rough couple months with IGV drawing down 36% from Oct 2025 to April 2026. Absolutely indiscriminate selling with no-one able to escape it no matter the fundamentals.  Textbook over reaction.

Heres the reality: Fundamentals and earnings are still strong for alot of SaaS companies. Fears about reductions in total seats are overblown - Most of the companies firing people are the ones incinerating cash and looking for ways to compensate(ie META). And generally I see AI as a tailwind for software:  it makes creating and managing software exponentially easier and cheaper, but not trivial. And thats the key: building secure, reliable, and scalable software for companies is still not trivial and cant be vibed coded without skilled engineers doing the driving. And expect software to get more AI integrated and complex: this takes even more skilled engineers. Maybe Vibe coding is not that big of a threat to these SaaS companies?

I tested the impacts of vibe coding the only way i knew how: vibe coding a shit ton. I consider myself a moderately skilled engineer: Computer engineering degree from top 10 university and 5 years experience working in data science/data engineering. My findings: Vibe coding is easy and fun as shit but you still need to know what the fuck is going on and there are a shit ton of bugs. The initial coding is easy, but I spend most of my time finding and remediating bugs, then making sure those bug fixes didn't break more shit. Key takeaway here: vibe coding is easy but vibe coding production grade software is not. Maybe this changes over time, but in the intermediate term, vibe coding doesn't replace companies with teams of professional software engineers.

So the fundamentals were still strong and the market was being irrational about the impacts of AI which equals opportunity. I went into this with a mental stop below the 76.70 on IGV: Multiple daily closes below this level means reevaluating the position. Maybe 10% max downside to 50%+ upside when IGV was at 80. Amazing risk to reward.  In mid February I started accumulating SaaS exposure through Jan 2027 IGV 102 calls. Over the past couple months i've just been accumulating more IGV calls and adding more exposure through my favorite SaaS names: MSFT, NOW and PLTR. Doubled down on NOW after everyones favorite president added.

Anyways, last few days have been major validation of my thesis. The price action for these companies have gone from dogshit near the march bottom to pretty damn good with monthly bullish engulfing candles on Fridays close. This rally might have legs just looking at the price action. But I'm only partially a degenerate so taking some profits here.  Did some Trims and rolls this morning with most of my positions up 200-350%. Realized 30k in gains but leaving the majority of this position on.

SaaS companies that can move quickly to embrace AI will see decent returns moving forward in my opinion. But earnings have to follow. If i don't see any meaningful earnings growth in these SaaS names, I’ll reduce further or cut the position.","Counter({'IGV': 5, 'NOW': 2, 'RIP': 1, 'META': 1, 'MSFT': 1, 'PLTR': 1})",11,0.9811,4.430816798843313
1tu5s1t,hot,"Alphabet Inc. (NASDAQ: GOOG, GOOGL) announced plans to raise $80 billion through equity offerings.","Alphabet Inc. (NASDAQ: GOOG, GOOGL) announced plans to raise $80 billion through equity offerings to fund investments in artificial intelligence infrastructure and compute capacity.

The Mountain View, California-based company said the offerings will consist of $30 billion in concurrent underwritten public offerings and a $40 billion at-the-market offering program for Class A Common Stock and Class C Capital Stock expected to begin in the third quarter of 2026.

The underwritten offerings include $15 billion in depositary shares representing mandatory convertible preferred stock and $15 billion in Class A Common Stock and Class C Capital Stock.

Berkshire Hathaway Inc. has agreed to invest $10 billion in Alphabet through a private placement, comprised of $5 billion in Class A Common Stock at $351.81 per share and $5 billion in Class C Capital Stock at $348.20 per share. This adds to Berkshire Hathaway's position built since the third quarter of 2025.

Alphabet said it intends to use proceeds from the concurrent offerings and private placement for general corporate purposes, including capital expenditures to scale AI infrastructure and global compute. The company expects to use approximately $30 billion of the at-the-market program proceeds to meet 2026 calendar year tax obligations related to employee equity award vesting.

The company reported 2026 capital expenditures are expected to be $180-$190 billion, with 2027 capital expenditures expected to significantly increase. Alphabet generated $174 billion of operating cash flow over the 12 months ended March 31, 2026.

Alphabet reported first quarter 2026 revenue of $110 billion, representing 22% year-over-year growth. Google Cloud revenue grew 63% year-over-year with backlog nearly doubling quarter-over-quarter to more than $460 billion.",524,112,2026-06-01 21:05:18+00:00,https://www.reddit.com/r/wallstreetbets/comments/1tu5s1t/alphabet_inc_nasdaq_goog_googl_announced_plans_to/,https://www.cnbc.com/2026/06/01/alphabet-to-raise-80-billion-from-stock-sales-to-fund-ai-buildout.html,"Alphabet Inc. (NASDAQ: GOOG, GOOGL) announced plans to raise $80 billion through equity offerings. Alphabet Inc. (NASDAQ: GOOG, GOOGL) announced plans to raise $80 billion through equity offerings to fund investments in artificial intelligence infrastructure and compute capacity.

The Mountain View, California-based company said the offerings will consist of $30 billion in concurrent underwritten public offerings and a $40 billion at-the-market offering program for Class A Common Stock and Class C Capital Stock expected to begin in the third quarter of 2026.

The underwritten offerings include $15 billion in depositary shares representing mandatory convertible preferred stock and $15 billion in Class A Common Stock and Class C Capital Stock.

Berkshire Hathaway Inc. has agreed to invest $10 billion in Alphabet through a private placement, comprised of $5 billion in Class A Common Stock at $351.81 per share and $5 billion in Class C Capital Stock at $348.20 per share. This adds to Berkshire Hathaway's position built since the third quarter of 2025.

Alphabet said it intends to use proceeds from the concurrent offerings and private placement for general corporate purposes, including capital expenditures to scale AI infrastructure and global compute. The company expects to use approximately $30 billion of the at-the-market program proceeds to meet 2026 calendar year tax obligations related to employee equity award vesting.

The company reported 2026 capital expenditures are expected to be $180-$190 billion, with 2027 capital expenditures expected to significantly increase. Alphabet generated $174 billion of operating cash flow over the 12 months ended March 31, 2026.

Alphabet reported first quarter 2026 revenue of $110 billion, representing 22% year-over-year growth. Google Cloud revenue grew 63% year-over-year with backlog nearly doubling quarter-over-quarter to more than $460 billion.","Counter({'GOOG': 2, 'GOOGL': 2})",4,0.9552,10.990786081303964
