id,feed,title,body,score,num_comments,created_utc,permalink,url,text,ticker_counts,candidate_mentions,sentiment,engagement
1udxz3t,hot,I'm kinda sweating,"So... i was fortunate enough to catch mainly the RKLB, ASTS run. I also made some profit (way less) on other stocks like ONDS, RCAT, PL, SLS, POET, OPTX, AMPX, and some others).

Nontheless, the majority of these have been stuck around the same price (some days better, some days worse) for the past month.

I also had some money on another type of stocks like NBIS, MU, SNDK, etc.

SO I DID WHAT ANYONE WOULD DO IN MY SITUATION:

obviously transfered all my funds to: NBIS, MU, SNDK, MU, STX, WDC, ASML.

Now seriously... how f\*ck\*d am i? ",98,102,2026-06-24 00:08:04+00:00,https://www.reddit.com/r/wallstreetbets/comments/1udxz3t/im_kinda_sweating/,https://www.reddit.com/r/wallstreetbets/comments/1udxz3t/im_kinda_sweating/,"I'm kinda sweating So... i was fortunate enough to catch mainly the RKLB, ASTS run. I also made some profit (way less) on other stocks like ONDS, RCAT, PL, SLS, POET, OPTX, AMPX, and some others).

Nontheless, the majority of these have been stuck around the same price (some days better, some days worse) for the past month.

I also had some money on another type of stocks like NBIS, MU, SNDK, etc.

SO I DID WHAT ANYONE WOULD DO IN MY SITUATION:

obviously transfered all my funds to: NBIS, MU, SNDK, MU, STX, WDC, ASML.

Now seriously... how f\*ck\*d am i?","Counter({'NBIS': 2, 'SNDK': 2, 'RKLB': 1, 'ASTS': 1, 'ONDS': 1, 'RCAT': 1, 'SLS': 1, 'POET': 1, 'OPTX': 1, 'AMPX': 1, 'DID': 1, 'WHAT': 1, 'WOULD': 1, 'STX': 1, 'WDC': 1, 'ASML': 1})",18,0.8934,9.229848838364227
1udxmw7,hot,Why $SNDK will moon in the coming weeks,"It's got what plants crave! MU earnings tomorrow AfterMarket, 

Positions: 51 shares at $1977.73 avg",37,42,2026-06-23 23:53:41+00:00,https://www.reddit.com/r/wallstreetbets/comments/1udxmw7/why_sndk_will_moon_in_the_coming_weeks/,https://i.redd.it/q8tj32iie49h1.jpeg,"Why $SNDK will moon in the coming weeks It's got what plants crave! MU earnings tomorrow AfterMarket, 

Positions: 51 shares at $1977.73 avg",Counter({'SNDK': 2}),2,0.3595,7.398786275419948
1udxdsb,hot,Its not THAT hard,See,161,35,2026-06-23 23:42:32+00:00,https://www.reddit.com/r/wallstreetbets/comments/1udxdsb/its_not_that_hard/,https://i.redd.it/e5auhcwic49h1.jpeg,Its not THAT hard See,Counter({'THAT': 1}),1,0.0762,8.671115273688493
1udutsi,hot,"Apple and Disney had conversations about merging, says Bob Iger",,2237,215,2026-06-23 21:56:59+00:00,https://www.reddit.com/r/wallstreetbets/comments/1udutsi/apple_and_disney_had_conversations_about_merging/,https://9to5mac.com/2026/06/23/apple-and-disney-had-conversations-about-merging-says-bob-iger/,"Apple and Disney had conversations about merging, says Bob Iger",Counter(),0,0.0,13.088616296556037
1udusnu,hot,Why I think Infleqtion $INFQ might be a big winner and everyone sleeps on it,"I will try to summarise what I think it s relevant and important right now and you can deep dive

1. Collab with Nvidia

Infleqtion has a collab with Nvidia working at NVQlink - [https://www.youtube.com/watch?v=CYLn56Vc2XA](https://www.youtube.com/watch?v=CYLn56Vc2XA) check video and you can see Infleqtion and Quantinuum as well there

2. USA GOV 100m$ LOI based on milestones + getting ownership in it

3. [https://infleqtion.com/infleqtion-launches-americas-quantum-space-initiative-to-accelerate-the-future-of-quantum-enabled-space-infrastructure/](https://infleqtion.com/infleqtion-launches-americas-quantum-space-initiative-to-accelerate-the-future-of-quantum-enabled-space-infrastructure/)

4. Yesterday, Trump signed a big beautiful executive order basically showing to everyone "" Quantum is the next sector"". Alright, but why INFQ the big winner?

[https://www.youtube.com/watch?v=tyHDaIN6aio](https://www.youtube.com/watch?v=tyHDaIN6aio)  check this video

You ll see something weird imo. You have IBM CEO, Google President and Chief Investment Officer, both behemots and , on the right INFLEQTION CEO, a 3b , basically no name to the investing world.  I don't know about you boys, but being in that room there besides IBM and Google looks bullish af to me.

Also, check this : [https://breakingdefense.com/2026/06/executive-order-jumpstarts-pentagons-quantum-sensor-projects/](https://breakingdefense.com/2026/06/executive-order-jumpstarts-pentagons-quantum-sensor-projects/)

The Pentagon has been field-testing quantum sensors — but EO 14411 orders it to deploy some of those sensors to operational forces in just 27 months. “Within 60 days of the date of this order, the Secretary of War shall identify at least three next-generation quantum sensor projects to prioritize in order to field these sensors by September 30, 2028,” 

Who is Secretary of War? Pete Hesgeth, and who is in the same room with INFQ CEO ? Well, Pete Hesgeth. There is a high af chance INFQ will and a deal here.

"" But isnt INFQ quantum computing?"" It is , BUUT, they also sell Quantum Clocks and Quantum sensors TODAY commercially .

Full list of customers and collabs:  [https://infleqtion.com/](https://infleqtion.com/) , notable, Nvidia, USA Army, DARPA, NASA, USA Airforce

CEO is also optimistic af after yesterday meeting: [https://x.com/i/status/2069523488713675183](https://x.com/i/status/2069523488713675183)

CEO also has experience with Wallstreet, he was in the  capital venture business and they chose to invest in Infleqtion bcs they liked the company and tech and then was chosen as CEO in 2023. You have a CEO with Wallstreet, Politics experience that loves the company and their tech and said he fully believes this is a generational company. ( [https://www.youtube.com/watch?v=vGbbjz4vKCg](https://www.youtube.com/watch?v=vGbbjz4vKCg) ) he also explains his sensors tech

Now , you have this post today: [https://x.com/diu\_x/status/2069505395903664204?s=46&t=7sB\_8UTokWceXywlcGNFUA](https://x.com/diu_x/status/2069505395903664204?s=46&t=7sB_8UTokWceXywlcGNFUA)

"" Farseer seeks innovative commercial solutions to prototype and demonstrate advanced, quantum-enabled sensing and timing platforms to address warfighter needs. It is structured across four primary Lines of Effort (LoE), each focused on critical mission use cases:

\- Magnetometers

\- Gravimeters

\- Portable clocks, and

\- Component technologies for spiral enhancements to quantum sensing and timing solutions.""

LITERALLY INFQ technology being listed as critical

Now, you have all of this combined, you have 3.2b MKT cap and a company that both does Quantum sensing commercially and researching Quantum Computing.  A 3.2b company present in the White House besides 4t Google and 250b IBM

Position: 2000 shares at 15.11 ( averaged down since I found out about them when Trump announced the LOI backing and DDed them)",40,36,2026-06-23 21:55:44+00:00,https://www.reddit.com/r/wallstreetbets/comments/1udusnu/why_i_think_infleqtion_infq_might_be_a_big_winner/,https://www.reddit.com/r/wallstreetbets/comments/1udusnu/why_i_think_infleqtion_infq_might_be_a_big_winner/,"Why I think Infleqtion $INFQ might be a big winner and everyone sleeps on it I will try to summarise what I think it s relevant and important right now and you can deep dive

1. Collab with Nvidia

Infleqtion has a collab with Nvidia working at NVQlink - [https://www.youtube.com/watch?v=CYLn56Vc2XA](https://www.youtube.com/watch?v=CYLn56Vc2XA) check video and you can see Infleqtion and Quantinuum as well there

2. USA GOV 100m$ LOI based on milestones + getting ownership in it

3. [https://infleqtion.com/infleqtion-launches-americas-quantum-space-initiative-to-accelerate-the-future-of-quantum-enabled-space-infrastructure/](https://infleqtion.com/infleqtion-launches-americas-quantum-space-initiative-to-accelerate-the-future-of-quantum-enabled-space-infrastructure/)

4. Yesterday, Trump signed a big beautiful executive order basically showing to everyone "" Quantum is the next sector"". Alright, but why INFQ the big winner?

[https://www.youtube.com/watch?v=tyHDaIN6aio](https://www.youtube.com/watch?v=tyHDaIN6aio)  check this video

You ll see something weird imo. You have IBM CEO, Google President and Chief Investment Officer, both behemots and , on the right INFLEQTION CEO, a 3b , basically no name to the investing world.  I don't know about you boys, but being in that room there besides IBM and Google looks bullish af to me.

Also, check this : [https://breakingdefense.com/2026/06/executive-order-jumpstarts-pentagons-quantum-sensor-projects/](https://breakingdefense.com/2026/06/executive-order-jumpstarts-pentagons-quantum-sensor-projects/)

The Pentagon has been field-testing quantum sensors — but EO 14411 orders it to deploy some of those sensors to operational forces in just 27 months. “Within 60 days of the date of this order, the Secretary of War shall identify at least three next-generation quantum sensor projects to prioritize in order to field these sensors by September 30, 2028,” 

Who is Secretary of War? Pete Hesgeth, and who is in the same room with INFQ CEO ? Well, Pete Hesgeth. There is a high af chance INFQ will and a deal here.

"" But isnt INFQ quantum computing?"" It is , BUUT, they also sell Quantum Clocks and Quantum sensors TODAY commercially .

Full list of customers and collabs:  [https://infleqtion.com/](https://infleqtion.com/) , notable, Nvidia, USA Army, DARPA, NASA, USA Airforce

CEO is also optimistic af after yesterday meeting: [https://x.com/i/status/2069523488713675183](https://x.com/i/status/2069523488713675183)

CEO also has experience with Wallstreet, he was in the  capital venture business and they chose to invest in Infleqtion bcs they liked the company and tech and then was chosen as CEO in 2023. You have a CEO with Wallstreet, Politics experience that loves the company and their tech and said he fully believes this is a generational company. ( [https://www.youtube.com/watch?v=vGbbjz4vKCg](https://www.youtube.com/watch?v=vGbbjz4vKCg) ) he also explains his sensors tech

Now , you have this post today: [https://x.com/diu\_x/status/2069505395903664204?s=46&t=7sB\_8UTokWceXywlcGNFUA](https://x.com/diu_x/status/2069505395903664204?s=46&t=7sB_8UTokWceXywlcGNFUA)

"" Farseer seeks innovative commercial solutions to prototype and demonstrate advanced, quantum-enabled sensing and timing platforms to address warfighter needs. It is structured across four primary Lines of Effort (LoE), each focused on critical mission use cases:

\- Magnetometers

\- Gravimeters

\- Portable clocks, and

\- Component technologies for spiral enhancements to quantum sensing and timing solutions.""

LITERALLY INFQ technology being listed as critical

Now, you have all of this combined, you have 3.2b MKT cap and a company that both does Quantum sensing commercially and researching Quantum Computing.  A 3.2b company present in the White House besides 4t Google and 250b IBM

Position: 2000 shares at 15.11 ( averaged down since I found out about them when Trump announced the LOI backing and DDed them)","Counter({'INFQ': 7, 'IBM': 3, 'LOI': 2, 'GOV': 1, 'BUUT': 1, 'TODAY': 1, 'DARPA': 1, 'NASA': 1, 'MKT': 1})",18,0.9706,7.324489979348533
1uduc49,hot,"Alphabet added to Dow Jones Industrial Average, replacing Verizon",,2861,161,2026-06-23 21:37:29+00:00,https://www.reddit.com/r/wallstreetbets/comments/1uduc49/alphabet_added_to_dow_jones_industrial_average/,https://www.cnbc.com/2026/06/23/alphabet-verizon-dow-djia.html?__source=iosappshare%7Ccom.apple.UIKit.activity.CopyToPasteboard,"Alphabet added to Dow Jones Industrial Average, replacing Verizon",Counter(),0,0.0,13.04687229534878
1udu6si,hot,"Hot off the press, Alphabet is coming to the DOW",Hot of the press!,407,80,2026-06-23 21:31:38+00:00,https://www.reddit.com/r/wallstreetbets/comments/1udu6si/hot_off_the_press_alphabet_is_coming_to_the_dow/,https://i.redd.it/68hemlo3p39h1.jpeg,"Hot off the press, Alphabet is coming to the DOW Hot of the press!",Counter({'DOW': 1}),1,0.0,10.4057163290766
1udtdb8,hot,Cerebras reports 92% revenue growth in chipmaker's first earnings report since IPO,,712,99,2026-06-23 21:00:01+00:00,https://www.reddit.com/r/wallstreetbets/comments/1udtdb8/cerebras_reports_92_revenue_growth_in_chipmakers/,https://www.cnbc.com/2026/06/23/cerebras-cbrs-q1-earnings-report-2026.html,Cerebras reports 92% revenue growth in chipmaker's first earnings report since IPO,Counter(),0,0.3818,11.174651606402389
1udsuoa,hot,$MSTU yolo,Ok you degens. Time to draw a line in the sand with this bitcoin drawdown. All in ,23,28,2026-06-23 20:40:02+00:00,https://www.reddit.com/r/wallstreetbets/comments/1udsuoa/mstu_yolo/,https://i.redd.it/byblkrryf39h1.jpeg,$MSTU yolo Ok you degens. Time to draw a line in the sand with this bitcoin drawdown. All in,Counter({'MSTU': 2}),2,0.5106,6.54534966033442
1udrt3c,hot,"What Are Your Moves Tomorrow, June 24, 2026",This post contains content not supported on old Reddit. [Click here to view the full post](https://sh.reddit.com/r/wallstreetbets/comments/1udrt3c),354,9989,2026-06-23 20:00:37+00:00,https://www.reddit.com/r/wallstreetbets/comments/1udrt3c/what_are_your_moves_tomorrow_june_24_2026/,https://www.reddit.com/r/wallstreetbets/comments/1udrt3c/what_are_your_moves_tomorrow_june_24_2026/,"What Are Your Moves Tomorrow, June 24, 2026 This post contains content not supported on old Reddit. [Click here to view the full post](https://sh.reddit.com/r/wallstreetbets/comments/1udrt3c)",Counter(),0,-0.2411,15.081457661118016
1udrsow,hot,MSFT YOLO,,89,16,2026-06-23 20:00:15+00:00,https://www.reddit.com/r/wallstreetbets/comments/1udrsow/msft_yolo/,https://i.redd.it/l562va8v839h1.jpeg,MSFT YOLO,Counter({'MSFT': 1}),1,0.2732,7.333023014386481
1udraqp,hot,"Service NOW, now is its time. With earnings coming up, buying under 100$ is litterally almost at the very bottom, its all up from here.",,280,174,2026-06-23 19:41:38+00:00,https://www.reddit.com/r/wallstreetbets/comments/1udraqp/service_now_now_is_its_time_with_earnings_coming/,https://i.redd.it/riexy4nj539h1.jpeg,"Service NOW, now is its time. With earnings coming up, buying under 100$ is litterally almost at the very bottom, its all up from here.",Counter({'NOW': 1}),1,0.0,10.80314064325726
1udr5up,hot,Will these print?,Bought 1130 call when it hit $1120… dipped immediately after i bought those calls. ,115,118,2026-06-23 19:36:28+00:00,https://www.reddit.com/r/wallstreetbets/comments/1udr5up/will_these_print/,https://i.redd.it/w7xnecem439h1.jpeg,Will these print? Bought 1130 call when it hit $1120… dipped immediately after i bought those calls.,Counter(),0,0.0,9.532713684217894
1udqd2p,hot,"MSFT $40,000 YOLO","Actual cost basis for the shares is \~$412 due to a few sold calls that expired worthless. Hoping for a run up back to $420 or so, in addition to an IV spike going in to the July earnings. Wish me luck!",73,57,2026-06-23 19:07:36+00:00,https://www.reddit.com/r/wallstreetbets/comments/1udqd2p/msft_40000_yolo/,https://i.redd.it/hfmbgm2hz29h1.jpeg,"MSFT $40,000 YOLO Actual cost basis for the shares is \~$412 due to a few sold calls that expired worthless. Hoping for a run up back to $420 or so, in addition to an IV spike going in to the July earnings. Wish me luck!",Counter({'MSFT': 1}),1,0.8728,8.364508103750588
1udnrz1,new,What Are the Most Interesting AI Stocks to Buy Beyond the Obvious Names?,"Whenever the topic of AI stocks to buy comes up, the conversation usually revolves around the same handful of companies.

Nvidia, Microsoft, AMD, Meta, and a few other big names dominate almost every discussion.

What I'm more interested in are the second-order beneficiaries of AI growth.

The companies providing data center infrastructure, networking equipment, power and cooling solutions, semiconductor equipment, cybersecurity, cloud services, or enterprise software that benefits from increasing AI adoption.

My thinking is that as AI spending continues to grow, a significant portion of the value could flow to the businesses supporting the ecosystem rather than just the companies building the models.

For those investing in the AI space, what companies are on your watchlist beyond the obvious names, and what's the investment thesis behind them?",23,217,2026-06-23 17:34:22+00:00,https://www.reddit.com/r/wallstreetbets/comments/1udnrz1/what_are_the_most_interesting_ai_stocks_to_buy/,https://www.reddit.com/r/wallstreetbets/comments/1udnrz1/what_are_the_most_interesting_ai_stocks_to_buy/,"What Are the Most Interesting AI Stocks to Buy Beyond the Obvious Names? Whenever the topic of AI stocks to buy comes up, the conversation usually revolves around the same handful of companies.

Nvidia, Microsoft, AMD, Meta, and a few other big names dominate almost every discussion.

What I'm more interested in are the second-order beneficiaries of AI growth.

The companies providing data center infrastructure, networking equipment, power and cooling solutions, semiconductor equipment, cybersecurity, cloud services, or enterprise software that benefits from increasing AI adoption.

My thinking is that as AI spending continues to grow, a significant portion of the value could flow to the businesses supporting the ecosystem rather than just the companies building the models.

For those investing in the AI space, what companies are on your watchlist beyond the obvious names, and what's the investment thesis behind them?",Counter({'AMD': 1}),1,0.962,8.562548893137034
1udlpaw,hot,Trading on the throne,Been scalping SPX&QQQ during my daily throne sessions. Great way to start the day,72,13,2026-06-23 16:18:43+00:00,https://www.reddit.com/r/wallstreetbets/comments/1udlpaw/trading_on_the_throne/,https://i.redd.it/f7q5m29c529h1.jpeg,Trading on the throne Been scalping SPX&QQQ during my daily throne sessions. Great way to start the day,"Counter({'SPX': 1, 'QQQ': 1})",2,0.6249,6.92951677076365
1udjz9z,new,FLUT: Gambling on a Gambling,"I saw my friend bet on Qatar vs Canada in the WC26, he made 6x

He was using this shit FLUT platform, so I dog into it.

https://preview.redd.it/jzgjslu2t19h1.png?width=493&format=png&auto=webp&s=5b56ab31c1a35c06ff21beb78122628943a43e3a

They are Draftking but for retards, easy to use and user friendly.

The problem: earnings collapse + leverage

FLUT's decline is one of the more dramatic in the large-cap gaming space over the past year. The stock peaked near $314 in August 2025 and has since lost roughly two-thirds of its value. The driver is a combination of sharply deteriorating earnings estimates, rising leverage, and a Moody's credit outlook downgrade — all compounding each other.

The were trading around 300 now its a 100 in a single year, why?

https://preview.redd.it/mvkjtgr7t19h1.png?width=1077&format=png&auto=webp&s=1b6b23227d9000f423405a6e54d6b01cab1b5b81

1. shit earnings + EPS estimates cut from $6.4 to $5.3

2. higher leverage

3. Foodys downgrade: Ba1 (negative)

4. exit india 

5. 5.1% short + Two Sigma holding a 2.42% short position.

6. London delisting (Jun 12, 2026)

What does it mean ? nothing , WC26 will skyrocket them

The Bet: FIFA World Cup will shoot revenue tailwind for FanDuel and international brands. 

Next earnings are on 7 Aug 26.

Position:

https://preview.redd.it/z67sa3r3u19h1.png?width=670&format=png&auto=webp&s=7455432e0c286ece984b2f5a2be5f57f93d08542

",33,26,2026-06-23 15:16:07+00:00,https://www.reddit.com/r/wallstreetbets/comments/1udjz9z/flut_gambling_on_a_gambling/,https://www.reddit.com/r/wallstreetbets/comments/1udjz9z/flut_gambling_on_a_gambling/,"FLUT: Gambling on a Gambling I saw my friend bet on Qatar vs Canada in the WC26, he made 6x

He was using this shit FLUT platform, so I dog into it.

https://preview.redd.it/jzgjslu2t19h1.png?width=493&format=png&auto=webp&s=5b56ab31c1a35c06ff21beb78122628943a43e3a

They are Draftking but for retards, easy to use and user friendly.

The problem: earnings collapse + leverage

FLUT's decline is one of the more dramatic in the large-cap gaming space over the past year. The stock peaked near $314 in August 2025 and has since lost roughly two-thirds of its value. The driver is a combination of sharply deteriorating earnings estimates, rising leverage, and a Moody's credit outlook downgrade — all compounding each other.

The were trading around 300 now its a 100 in a single year, why?

https://preview.redd.it/mvkjtgr7t19h1.png?width=1077&format=png&auto=webp&s=1b6b23227d9000f423405a6e54d6b01cab1b5b81

1. shit earnings + EPS estimates cut from $6.4 to $5.3

2. higher leverage

3. Foodys downgrade: Ba1 (negative)

4. exit india 

5. 5.1% short + Two Sigma holding a 2.42% short position.

6. London delisting (Jun 12, 2026)

What does it mean ? nothing , WC26 will skyrocket them

The Bet: FIFA World Cup will shoot revenue tailwind for FanDuel and international brands. 

Next earnings are on 7 Aug 26.

Position:

https://preview.redd.it/z67sa3r3u19h1.png?width=670&format=png&auto=webp&s=7455432e0c286ece984b2f5a2be5f57f93d08542","Counter({'FLUT': 3, 'FIFA': 1})",4,-0.8823,6.822197390620491
1udiyb9,hot,"I ran the math, believe it or not, calls.","https://preview.redd.it/eves6sngj19h1.jpg?width=1255&format=pjpg&auto=webp&s=821a7db4707da82a97aba45cb8f32915d2d7cc19

https://preview.redd.it/dpte3sngj19h1.jpg?width=1259&format=pjpg&auto=webp&s=cfb5e253ef72429e12bd1fe09520f76cff2fe0a9

I know it's stupid, but math says 66% of the time here market go up within the next month. Really not a good 🐻 case.

It ends up looking a bit more scary from Sept-Oct if you swap to weekly timeframes, which I am not going to rule out. I really don't think markets will crash, because everyone learned what valuations are. If they crash it's due to a liquidity crisis, that's it.

Edit: Since people asked and I'm too lazy to reply to everyone. MHC is a Z score system based on derivatives of multiple technical indicators that retail and hedgies use, because I got tired of figuring out which one actually works. n = number of days it showed up from whatever historical data you give it. Statistical part = what happened when you got the same MHC reading. Daily and weekly composite signals are based on the thresholds in those derivatives. This is mainly qtardation with extra steps and a PhD with no student loans.",1842,286,2026-06-23 14:38:04+00:00,https://www.reddit.com/r/wallstreetbets/comments/1udiyb9/i_ran_the_math_believe_it_or_not_calls/,https://www.reddit.com/r/wallstreetbets/comments/1udiyb9/i_ran_the_math_believe_it_or_not_calls/,"I ran the math, believe it or not, calls. https://preview.redd.it/eves6sngj19h1.jpg?width=1255&format=pjpg&auto=webp&s=821a7db4707da82a97aba45cb8f32915d2d7cc19

https://preview.redd.it/dpte3sngj19h1.jpg?width=1259&format=pjpg&auto=webp&s=cfb5e253ef72429e12bd1fe09520f76cff2fe0a9

I know it's stupid, but math says 66% of the time here market go up within the next month. Really not a good 🐻 case.

It ends up looking a bit more scary from Sept-Oct if you swap to weekly timeframes, which I am not going to rule out. I really don't think markets will crash, because everyone learned what valuations are. If they crash it's due to a liquidity crisis, that's it.

Edit: Since people asked and I'm too lazy to reply to everyone. MHC is a Z score system based on derivatives of multiple technical indicators that retail and hedgies use, because I got tired of figuring out which one actually works. n = number of days it showed up from whatever historical data you give it. Statistical part = what happened when you got the same MHC reading. Daily and weekly composite signals are based on the thresholds in those derivatives. This is mainly qtardation with extra steps and a PhD with no student loans.",Counter({'MHC': 2}),2,-0.9873,13.178632173429445
1udh5pj,hot,Constellation Energy to supply nuclear power to Walmart facility under 15-year deal,,682,68,2026-06-23 13:28:07+00:00,https://www.reddit.com/r/wallstreetbets/comments/1udh5pj/constellation_energy_to_supply_nuclear_power_to/,https://www.reuters.com/business/energy/constellation-energy-supply-nuclear-power-walmart-facility-under-15-year-deal-2026-06-23/,Constellation Energy to supply nuclear power to Walmart facility under 15-year deal,Counter(),0,0.2732,10.76060136416805
