id,feed,title,body,score,num_comments,created_utc,permalink,url,text,ticker_counts,candidate_mentions,sentiment,engagement
1uxqi11,hot,ASTS - see y'all in 31 days after the wash sale expires.,"Welp lucky me, I SOLD 4,000 shares of ASTS at $67 between yesterday and this morning as it immediately plumbed lower - proof attached of the largest single trade. My god the positive news both ASTS and RKLB posted in recent weeks, yet getting absolutely savaged as Musk's bag holders drain the sector, slowly learn'n what that huge inbound share lockup expiration in a few weeks is gonna do to them - come on retail, lift them bags!! Then ASTS dilutes after hours despite assurances the last raise would suffice. Gonna have to get those sats up boys and actual revenue inbound before my money returns.   
  
See y'all in 31 days when the wash sale expires, bet I'm not wrong and I have gains to fully offset this. Who knows, tomorrow is another day. ",168,78,2026-07-16 02:47:54+00:00,https://www.reddit.com/r/wallstreetbets/comments/1uxqi11/asts_see_yall_in_31_days_after_the_wash_sale/,https://i.redd.it/ojtvi85p7idh1.jpeg,"ASTS - see y'all in 31 days after the wash sale expires. Welp lucky me, I SOLD 4,000 shares of ASTS at $67 between yesterday and this morning as it immediately plumbed lower - proof attached of the largest single trade. My god the positive news both ASTS and RKLB posted in recent weeks, yet getting absolutely savaged as Musk's bag holders drain the sector, slowly learn'n what that huge inbound share lockup expiration in a few weeks is gonna do to them - come on retail, lift them bags!! Then ASTS dilutes after hours despite assurances the last raise would suffice. Gonna have to get those sats up boys and actual revenue inbound before my money returns.   
  
See y'all in 31 days when the wash sale expires, bet I'm not wrong and I have gains to fully offset this. Who knows, tomorrow is another day.","Counter({'ASTS': 4, 'SOLD': 1, 'RKLB': 1})",6,0.9044,9.499346567390095
1uxq7sd,new,~$157k on TSMC earnings,,82,33,2026-07-16 02:34:14+00:00,https://www.reddit.com/r/wallstreetbets/comments/1uxq7sd/157k_on_tsmc_earnings/,https://i.redd.it/ow1zrozz6idh1.jpeg,~$157k on TSMC earnings,Counter({'TSMC': 1}),1,0.0,7.94520113241276
1uxq1y4,new,I’m going to be cooked tomorrow; NFLX earnings,,112,132,2026-07-16 02:26:24+00:00,https://www.reddit.com/r/wallstreetbets/comments/1uxq1y4/im_going_to_be_cooked_tomorrow_nflx_earnings/,https://i.redd.it/95ik8aet5idh1.jpeg,I’m going to be cooked tomorrow; NFLX earnings,Counter({'NFLX': 1}),1,0.0,9.617736946934095
1uxpzuj,new,Space has not been good to me,Been in this position 6 months ago and came back can I do it again?,108,53,2026-07-16 02:23:35+00:00,https://www.reddit.com/r/wallstreetbets/comments/1uxpzuj/space_has_not_been_good_to_me/,https://i.redd.it/zo6umx6b5idh1.jpeg,Space has not been good to me Been in this position 6 months ago and came back can I do it again?,Counter(),0,-0.3412,8.680331928793418
1uxpvnp,hot,Decided to speed run it,"https://preview.redd.it/86599bvr1idh1.png?width=1179&format=png&auto=webp&s=f8bc6365b11f83fc8b651137dd7cb8a64646a7df

https://preview.redd.it/bo3920jt1idh1.png?width=1179&format=png&auto=webp&s=6307fb544c5e8fb9e1e8a0da6263ac6088fd35ea

Saw a bunch of people complaining about losses lately and I’m like, “thats not a loss lol”

account is a couple years old but most of the losses happened in the last two years. 

got my first big hit in August of 25 on ASTS. Made 40k on my first play. Pretty much down hill after that. 

Options, speculative stocks, futures; pretty much fucked up everything I touched.

  
it wasn’t all at once, I make a good amount and just kept dumping in more when I lost and didn’t realize how bad it was. 

I still have a couple of retirement accounts that are pretty well funded but my bank account is pretty much wiped out.

  
I actually had $40 about a week ago (tiny little bump up on the chart lol) so there’s that. 

not sure what else to say. this was a huge amount of money for me. looking back I realize I have fucked up, bad. some days are good but some are really hard to cope.   


post memes or whatever it is you people do with this stuff

",169,95,2026-07-16 02:17:52+00:00,https://www.reddit.com/r/wallstreetbets/comments/1uxpvnp/decided_to_speed_run_it/,https://www.reddit.com/r/wallstreetbets/comments/1uxpvnp/decided_to_speed_run_it/,"Decided to speed run it https://preview.redd.it/86599bvr1idh1.png?width=1179&format=png&auto=webp&s=f8bc6365b11f83fc8b651137dd7cb8a64646a7df

https://preview.redd.it/bo3920jt1idh1.png?width=1179&format=png&auto=webp&s=6307fb544c5e8fb9e1e8a0da6263ac6088fd35ea

Saw a bunch of people complaining about losses lately and I’m like, “thats not a loss lol”

account is a couple years old but most of the losses happened in the last two years. 

got my first big hit in August of 25 on ASTS. Made 40k on my first play. Pretty much down hill after that. 

Options, speculative stocks, futures; pretty much fucked up everything I touched.

  
it wasn’t all at once, I make a good amount and just kept dumping in more when I lost and didn’t realize how bad it was. 

I still have a couple of retirement accounts that are pretty well funded but my bank account is pretty much wiped out.

  
I actually had $40 about a week ago (tiny little bump up on the chart lol) so there’s that. 

not sure what else to say. this was a huge amount of money for me. looking back I realize I have fucked up, bad. some days are good but some are really hard to cope.   


post memes or whatever it is you people do with this stuff",Counter({'ASTS': 1}),1,-0.4988,9.700146628518098
1uxphrv,new,How much profit is too much,"Made a bit more than anticipated this week and not sure what to do. Play long term or continue the options, whats a good balance. ",0,39,2026-07-16 02:00:24+00:00,https://www.reddit.com/r/wallstreetbets/comments/1uxphrv/how_much_profit_is_too_much/,https://i.redd.it/kc7cm5d61idh1.jpeg,"How much profit is too much Made a bit more than anticipated this week and not sure what to do. Play long term or continue the options, whats a good balance.",Counter(),0,0.7382,3.6888794541139363
1uxosah,new,"Yea, I don’t even want that first home.",FHSA stands for First Home Saving Account,104,57,2026-07-16 01:27:36+00:00,https://www.reddit.com/r/wallstreetbets/comments/1uxosah/yea_i_dont_even_want_that_first_home/,https://i.redd.it/0hplz86xuhdh1.png,"Yea, I don’t even want that first home. FHSA stands for First Home Saving Account",Counter({'FHSA': 1}),1,0.0772,8.714403360703942
1uxnp8b,hot,You're not a True Regard until the casino itself is concerned for you,"This was all from MU calls over the past several weeks. Every down day I thought it was going to rebound a bit but it never did. I made a lot of this with this ""strategy"", no specific numbers or indicators, just vibes), but in the end, those same vibes killed me. 

I'm done.",2311,159,2026-07-16 00:38:46+00:00,https://www.reddit.com/r/wallstreetbets/comments/1uxnp8b/youre_not_a_true_regard_until_the_casino_itself/,https://i.redd.it/1o6havebmhdh1.jpeg,"You're not a True Regard until the casino itself is concerned for you This was all from MU calls over the past several weeks. Every down day I thought it was going to rebound a bit but it never did. I made a lot of this with this ""strategy"", no specific numbers or indicators, just vibes), but in the end, those same vibes killed me. 

I'm done.",Counter(),0,-0.8937,12.821042045026095
1uxnecp,hot,125K to 1K: Enjoy my loss porn,"I worked hard to save up money, started investing in stocks since the pandemic. Friends introduced me to options. You can see the chart thereafter. 

I honestly thought I would figure it out eventually but I'm just another regard. Lost everything that I had. I lost money in bull markets, bear markets, all markets. 

This feels terrible. Its difficult to digest this. I hope I can forgot this and move on with my life.

If anyone who's reading this is trading options and dont know what you are doing, please stop. Its not going to end well. Take whatever loss you have and leave this casino.",17610,2041,2026-07-16 00:25:17+00:00,https://www.reddit.com/r/wallstreetbets/comments/1uxnecp/125k_to_1k_enjoy_my_loss_porn/,https://i.redd.it/wqyybof7khdh1.jpeg,"125K to 1K: Enjoy my loss porn I worked hard to save up money, started investing in stocks since the pandemic. Friends introduced me to options. You can see the chart thereafter. 

I honestly thought I would figure it out eventually but I'm just another regard. Lost everything that I had. I lost money in bull markets, bear markets, all markets. 

This feels terrible. Its difficult to digest this. I hope I can forgot this and move on with my life.

If anyone who's reading this is trading options and dont know what you are doing, please stop. Its not going to end well. Take whatever loss you have and leave this casino.",Counter(),0,-0.5842,17.3979639845197
1uxlj2e,hot,HISTORIC SELL-OFF FOR MOMENTUM IN JULY,"Goldman Sachs High-Beta Momentum Index down -24% month-to-date through first half of July, the worst performance since Apr 2009.

Morgan Stanley Tech Momentum Index 17-day rate of change down -35%, worst ever recorded thru 27-year history.",1002,233,2026-07-15 23:06:21+00:00,https://www.reddit.com/r/wallstreetbets/comments/1uxlj2e/historic_selloff_for_momentum_in_july/,https://i.redd.it/90xnw9e46hdh1.jpeg,"HISTORIC SELL-OFF FOR MOMENTUM IN JULY Goldman Sachs High-Beta Momentum Index down -24% month-to-date through first half of July, the worst performance since Apr 2009.

Morgan Stanley Tech Momentum Index 17-day rate of change down -35%, worst ever recorded thru 27-year history.","Counter({'OFF': 1, 'FOR': 1, 'JULY': 1})",3,-0.8481,12.366071903319638
1uxk83o,hot,AST SpaceMobile Announces Proposed Private Offering of $1.0 Billion of Convertible Senior Notes Due 2034,In case anyone curious about ah drop,735,220,2026-07-15 22:15:03+00:00,https://www.reddit.com/r/wallstreetbets/comments/1uxk83o/ast_spacemobile_announces_proposed_private/,https://www.businesswire.com/news/home/20260715000369/en/AST-SpaceMobile-Announces-Proposed-Private-Offering-of-%241.0-Billion-of-Convertible-Senior-Notes-Due-2034,AST SpaceMobile Announces Proposed Private Offering of $1.0 Billion of Convertible Senior Notes Due 2034 In case anyone curious about ah drop,Counter({'AST': 1}),1,0.0516,11.99939282024663
1uxitse,hot,19.1K > 65.8K > 11K on semiconductors,"SNDK, MU, STX took me to the top and it all came crashing down. I don’t really care if I lose my last 11k I’m just tired.",1109,229,2026-07-15 21:24:11+00:00,https://www.reddit.com/r/wallstreetbets/comments/1uxitse/191k_658k_11k_on_semiconductors/,https://i.redd.it/lscwue1wngdh1.jpeg,"19.1K > 65.8K > 11K on semiconductors SNDK, MU, STX took me to the top and it all came crashing down. I don’t really care if I lose my last 11k I’m just tired.","Counter({'SNDK': 1, 'STX': 1})",2,-0.1458,12.450194603229576
1uxij43,hot,"I made a terrible mistake. Thought I was buying calls that expired on Friday, not 0DTE",,1432,369,2026-07-15 21:13:32+00:00,https://www.reddit.com/r/wallstreetbets/comments/1uxij43/i_made_a_terrible_mistake_thought_i_was_buying/,https://i.redd.it/my0nksgxlgdh1.png,"I made a terrible mistake. Thought I was buying calls that expired on Friday, not 0DTE",Counter(),0,-0.6705,13.181028433466441
1uxhwn2,top,Can’t even get a baconator…,A series of unfortunate events,143,54,2026-07-15 20:48:42+00:00,https://www.reddit.com/r/wallstreetbets/comments/1uxhwn2/cant_even_get_a_baconator/,https://i.redd.it/9zj96iekhgdh1.jpeg,Can’t even get a baconator… A series of unfortunate events,Counter(),0,-0.4588,8.977146484808472
1uxht1z,top,19 and lost it all to space 15k-> chump change,"I was swing trading RKLB and ASTS for a while and felt pretty good about big gains in just a few months. Preceding SpaceX they both ripped and I was so excited because I thought with just a little more I could avoid having to take out student loans the next 3 years. This was going to set me up well. And then on IPO everything dumped. Surely it was only momentary, it was going to come back. So I ported into asts calls (I’ve mostly only traded stocks) but it didn’t come back. I held onto shares on margin for the next month, waiting for the bounce but it never came. I had a margin call every week and finally today they diluted and sealed the deal.

I started trading when I was 14. I’ve kept relatively consistent good gains and have safely managed my mom’s savings in a different account for the last 3 years. However, I fell in love with volatility, quick gains and wistful thinking.

My mom has cancer now and it hurts to know that this could have really helped me to pay tuition and lifted stress off of her. It feels like I won’t experience that kind of financial security for a very long time. I, we, are not fucked but this could have done a lot. ",308,219,2026-07-15 20:44:23+00:00,https://www.reddit.com/r/wallstreetbets/comments/1uxht1z/19_and_lost_it_all_to_space_15k_chump_change/,https://www.reddit.com/gallery/1uxht1z,"19 and lost it all to space 15k-> chump change I was swing trading RKLB and ASTS for a while and felt pretty good about big gains in just a few months. Preceding SpaceX they both ripped and I was so excited because I thought with just a little more I could avoid having to take out student loans the next 3 years. This was going to set me up well. And then on IPO everything dumped. Surely it was only momentary, it was going to come back. So I ported into asts calls (I’ve mostly only traded stocks) but it didn’t come back. I held onto shares on margin for the next month, waiting for the bounce but it never came. I had a margin call every week and finally today they diluted and sealed the deal.

I started trading when I was 14. I’ve kept relatively consistent good gains and have safely managed my mom’s savings in a different account for the last 3 years. However, I fell in love with volatility, quick gains and wistful thinking.

My mom has cancer now and it hurts to know that this could have really helped me to pay tuition and lifted stress off of her. It feels like I won’t experience that kind of financial security for a very long time. I, we, are not fucked but this could have done a lot.","Counter({'RKLB': 1, 'ASTS': 1})",2,0.9742,11.126968823250106
1uxgwj3,top,"'Finance
Anthropic moves closer to mega-IPO as bankers line up investor meetings'",,345,103,2026-07-15 20:08:07+00:00,https://www.reddit.com/r/wallstreetbets/comments/1uxgwj3/finance_anthropic_moves_closer_to_megaipo_as/,https://www.cnbc.com/2026/07/15/anthropic-ipo-banks-investor-meetings.html,"'Finance
Anthropic moves closer to mega-IPO as bankers line up investor meetings'",Counter(),0,0.0,10.490829674199096
1uxgqd3,top,"What Are Your Moves Tomorrow, July 16, 2026",This post contains content not supported on old Reddit. [Click here to view the full post](https://sh.reddit.com/r/wallstreetbets/comments/1uxgqd3),172,8283,2026-07-15 20:01:41+00:00,https://www.reddit.com/r/wallstreetbets/comments/1uxgqd3/what_are_your_moves_tomorrow_july_16_2026/,https://www.reddit.com/r/wallstreetbets/comments/1uxgqd3/what_are_your_moves_tomorrow_july_16_2026/,"What Are Your Moves Tomorrow, July 16, 2026 This post contains content not supported on old Reddit. [Click here to view the full post](https://sh.reddit.com/r/wallstreetbets/comments/1uxgqd3)",Counter(),0,-0.2411,14.175372817013255
1uxd33b,hot,Warren Buffett on the market today: 'It's tough to find values when everybody is preferring gambling',,8329,377,2026-07-15 17:45:36+00:00,https://www.reddit.com/r/wallstreetbets/comments/1uxd33b/warren_buffett_on_the_market_today_its_tough_to/,https://www.cnbc.com/2026/07/15/warren-buffett-on-the-market-today-its-tough-to-find-values-when-everybody-is-preferring-gambling.html,Warren Buffett on the market today: 'It's tough to find values when everybody is preferring gambling',Counter(),0,0.296,14.962512930780477
1ux1g46,top,"Daily Discussion Thread for July 15, 2026",This post contains content not supported on old Reddit. [Click here to view the full post](https://sh.reddit.com/r/wallstreetbets/comments/1ux1g46),219,12653,2026-07-15 10:00:44+00:00,https://www.reddit.com/r/wallstreetbets/comments/1ux1g46/daily_discussion_thread_for_july_15_2026/,https://www.reddit.com/r/wallstreetbets/comments/1ux1g46/daily_discussion_thread_for_july_15_2026/,"Daily Discussion Thread for July 15, 2026 This post contains content not supported on old Reddit. [Click here to view the full post](https://sh.reddit.com/r/wallstreetbets/comments/1ux1g46)",Counter(),0,-0.2411,14.83935619605919
1ux1czb,top,Sk Hynix leveraged HNX3,Will this ever get back to 2200 from 300? Sk Hynix is rising but this is still losing money?,258,94,2026-07-15 09:55:57+00:00,https://www.reddit.com/r/wallstreetbets/comments/1ux1czb/sk_hynix_leveraged_hnx3/,https://i.redd.it/2ektlgt39ddh1.jpeg,Sk Hynix leveraged HNX3 Will this ever get back to 2200 from 300? Sk Hynix is rising but this is still losing money?,Counter(),0,-0.5803,10.110704953300079
1uwwi5e,top,ASML hikes sales forecast for second time this year on strong AI chip demand,,542,48,2026-07-15 05:22:08+00:00,https://www.reddit.com/r/wallstreetbets/comments/1uwwi5e/asml_hikes_sales_forecast_for_second_time_this/,https://www.cnbc.com/2026/07/15/asml-2q-earnings-ai-chips-orders.html,ASML hikes sales forecast for second time this year on strong AI chip demand,Counter({'ASML': 1}),1,0.4215,10.188929618044561
1uwv16k,top,i have completely lost my mind,"was at 11.5k at ath in  my account and then semis started dumping at the end of june so i sold my whole portfolio for dram calls expecting early july to be a good. calls started losing value so fast, account dropped down to 3k and i tried getting baxk my capital from yoloing 0tdes and here we are. i work in fast food so the climb back up is going to be ungodly miserable Lol!",1767,609,2026-07-15 04:06:40+00:00,https://www.reddit.com/r/wallstreetbets/comments/1uwv16k/i_have_completely_lost_my_mind/,https://i.redd.it/1fdnhljsibdh1.jpeg,"i have completely lost my mind was at 11.5k at ath in  my account and then semis started dumping at the end of june so i sold my whole portfolio for dram calls expecting early july to be a good. calls started losing value so fast, account dropped down to 3k and i tried getting baxk my capital from yoloing 0tdes and here we are. i work in fast food so the climb back up is going to be ungodly miserable Lol!",Counter(),0,-0.4376,13.891063200364947
1uwuiby,top,Stripe/Advent Offer to Buy PayPal,Stripe/Advent offer to buy PayPal for more than $53 billion,405,117,2026-07-15 03:41:06+00:00,https://www.reddit.com/r/wallstreetbets/comments/1uwuiby/stripeadvent_offer_to_buy_paypal/,https://www.reuters.com/business/finance/stripe-advent-offer-buy-paypal-more-than-53-billion-sources-say-2026-07-15/,Stripe/Advent Offer to Buy PayPal Stripe/Advent offer to buy PayPal for more than $53 billion,Counter(),0,0.0,10.777037784067398
1uwsh0e,top,Not sure if this is loss or gain porn. -30k to break even.,"Was down 30k on 0DTE puts. Absolute idiot and will never touch them again. I won it all back. Literally betting corn predictions and now green. I lost probably 10 years of My life today but to come  
Back from 7k is a miracle. ",600,176,2026-07-15 02:03:51+00:00,https://www.reddit.com/r/wallstreetbets/comments/1uwsh0e/not_sure_if_this_is_loss_or_gain_porn_30k_to/,https://www.reddit.com/gallery/1uwsh0e,"Not sure if this is loss or gain porn. -30k to break even. Was down 30k on 0DTE puts. Absolute idiot and will never touch them again. I won it all back. Literally betting corn predictions and now green. I lost probably 10 years of My life today but to come  
Back from 7k is a miracle.",Counter(),0,0.7021,11.574744667109037
1uwsgsj,top,Found Mick Jagger Inadvertently Giving a DD for SpaceX When Being Interviewed for His New Album,,554,69,2026-07-15 02:03:35+00:00,https://www.reddit.com/r/wallstreetbets/comments/1uwsgsj/found_mick_jagger_inadvertently_giving_a_dd_for/,https://v.redd.it/ww6uz0mawadh1,Found Mick Jagger Inadvertently Giving a DD for SpaceX When Being Interviewed for His New Album,Counter(),0,0.34,10.567463355795795
1uwqi7h,top,"""One of us""","Well, I guess I will contribute.

I am delusional. I have lost myself my self-belief  and my self-respect throughout this journey. 

God bless all of you who have made your time in Market pay off.

God bless all of you who haven't as well, because I know this side of the fence.

Thank you guys for all the interactions, I feel kind of numb. I know it's my fault, but I want to get better. I've never been as stressed out, and I predictably and obviously learned that the market can turn you into a shell of who you were just over a year ago.

 Now cheer me up guys, tell me I still have $10 and that I can get right back in there, and I might put my clowns you back on.",230,209,2026-07-15 00:34:00+00:00,https://www.reddit.com/r/wallstreetbets/comments/1uwqi7h/one_of_us/,https://i.redd.it/54g6gzdtgadh1.jpeg,"""One of us"" Well, I guess I will contribute.

I am delusional. I have lost myself my self-belief  and my self-respect throughout this journey. 

God bless all of you who have made your time in Market pay off.

God bless all of you who haven't as well, because I know this side of the fence.

Thank you guys for all the interactions, I feel kind of numb. I know it's my fault, but I want to get better. I've never been as stressed out, and I predictably and obviously learned that the market can turn you into a shell of who you were just over a year ago.

 Now cheer me up guys, tell me I still have $10 and that I can get right back in there, and I might put my clowns you back on.",Counter(),0,0.9267,10.78952524123926
1uwow9k,top,"Down 200k on SpaceX, -35.52% on my Roth IRA for 112k, another 80k loss via options in my regular trading account","https://preview.redd.it/212zzlg54adh1.png?width=927&format=png&auto=webp&s=acfe80c9a8fab0398d5186790d23bc61030c0516

https://preview.redd.it/5n2fi6ib4adh1.png?width=971&format=png&auto=webp&s=f52372e484668e71de15f9ede770bafdb3779e2d

So my Roth IRA is down 25%, I went and made a few options trades in Robinhood that also went the other way. The first was a 150/160 call I placed a couple weeks ago, that current value is in the second screenshot (down 50k). I placed another 135/145 trade today which is down 30k.   


https://preview.redd.it/7xz7ajgg4adh1.png?width=933&format=png&auto=webp&s=7f36199211b75b8e52850757b7f0c0c9ede88dce

",14469,2988,2026-07-14 23:24:55+00:00,https://www.reddit.com/r/wallstreetbets/comments/1uwow9k/down_200k_on_spacex_3552_on_my_roth_ira_for_112k/,https://i.redd.it/imqcnwah4adh1.png,"Down 200k on SpaceX, -35.52% on my Roth IRA for 112k, another 80k loss via options in my regular trading account https://preview.redd.it/212zzlg54adh1.png?width=927&format=png&auto=webp&s=acfe80c9a8fab0398d5186790d23bc61030c0516

https://preview.redd.it/5n2fi6ib4adh1.png?width=971&format=png&auto=webp&s=f52372e484668e71de15f9ede770bafdb3779e2d

So my Roth IRA is down 25%, I went and made a few options trades in Robinhood that also went the other way. The first was a 150/160 call I placed a couple weeks ago, that current value is in the second screenshot (down 50k). I placed another 135/145 trade today which is down 30k.   


https://preview.redd.it/7xz7ajgg4adh1.png?width=933&format=png&auto=webp&s=7f36199211b75b8e52850757b7f0c0c9ede88dce",Counter({'IRA': 2}),2,0.163,17.582526981909467
1uwo588,top,IBM shares plunge 25% as customers shift spending to AI,,2327,242,2026-07-14 22:54:47+00:00,https://www.reddit.com/r/wallstreetbets/comments/1uwo588/ibm_shares_plunge_25_as_customers_shift_spending/,https://www.ft.com/content/da478c37-7a32-415d-9f30-3b2981149f95?syn-25a6b1a6=1,IBM shares plunge 25% as customers shift spending to AI,Counter({'IBM': 1}),1,0.296,13.245826252191875
1uwo56n,top,Samsung Weighs U.S. ADR Listing,,181,25,2026-07-14 22:54:44+00:00,https://www.reddit.com/r/wallstreetbets/comments/1uwo56n/samsung_weighs_us_adr_listing/,https://www.tradingview.com/news/gurufocus:329ccce1d094b:0-samsung-weighs-u-s-adr-listing/,Samsung Weighs U.S. ADR Listing,Counter({'ADR': 1}),1,0.0,8.462103225098277
