id,feed,title,body,score,num_comments,created_utc,permalink,url,text,ticker_counts,candidate_mentions,sentiment,engagement
1uwmgqv,top,WSB History: Meet the Legend,"Welcome to the first installment of Meet the Legend, a series meant to be dedicated to the absolute disgusting real life degenerates of history, who, if they were a part of this community, would have been made honorary Mods and Gods. 

The first inductee is a legendary man who goes by the name Bill ""Mothafukkin"" Hwang, real name Sung Kook Hwang, a degenerate Korean (yes, the country known for getting into heavy debt and leveraged investing into semiconductors today) investor who trained under the infamous ""Tiger Management"" school of degenerate investing, which no doubt set up the foundation for his love of leveraging to the tits and reckless betting. He was one of Robertson's beloved ""Tiger Cubs""

A little bit of his personal life: He worked as a cuck at McDonalds to fund his education. Probably took it like a champ out back and put the fries in the bag. He is married to a Becky Hwang, who probably gives good neck. Oh Becky!

He is also a profeessed devout and faithful Christian, which he tried to use to reduce his sentence 🤣

This ass chap is known for the Archegos Capital Management collapse, a ""family office"" which is structured to be less regulated than a normal hedge fund (because which fucking gambling degenerate doesn't love not having the SEC tell them ""no, you cannot leverage yourself 25x""). He managed $10B usd in assets, and used total return swaps to leverage himself to the absolute titties. Because he traded in swaps, there were less disclosure requirements which meant he could hide his shit from the public. 

The reason this man is the first inductee is because he managed to turn a $10B initial position and make it into an over $100B at its peak and he was rumored to have been worth $30B himself. He was believed to have been leveraged at a 5:1 ratio. However, the market turned against him and it turned into roughly $30B in losses when he got margin called. What a goddamn fucking retard!

Everything was going good during the latter half of 2020-2021 for stocks. The GREATEST BULL RUN IN HISTORY, some might even say. Viacom had 3x during 2021 up til that March, and that's when everything turned to shit for this man. Viacom, in all their fuckwit wisdom, decided to do a secondary offering which plummeted the stock down 30%. Unbeknownst to everyone in the fucking world, Viacom was a huge holding of this man's play house. And that is when the beautiful, fair, and ever so lovely Margin came calling our handsome man, Bill Mothafuggin Hwang.

The beauty is that because of the way the company and investments were structured, the banks and brokers and lenders at the esteemed shitholes such as Nomura, Goldman Sachs, Credit Suisse, UBS, and Morgan Stanley didn't even know each of them had lent this guy cash. The first time margin came a calling he said ""nonsense"". Banks kept calling so he setup a meeting.

He got them all in a call and said ""Don't worry guys, margin called, but I deleted the app and everything is okey dokey smokey"". When everone hung up the call, agreeing to do things together while holding hands and believing in the power of friendship, Goldman then proceeded to liquidate his position before the others and let them hold the bags. Morgan Stanley sold over $5B to their hedge fund buddy bagholders, telling them it was part of a margin call, but conveniently left out that dumping would continue the next day. Things got so bad, Credit Suisse had losses >5.5 billion and shut down their prime brokerage business unit. 💀Fookin legend. At the time of the margin call, he got liquidated with $20B in losses (imagine seeing -$20Billion in the app when you wake up).

What stocks did this guy even buy swaps of? He held shit cos such as the like of ViacomCBS, Baidu, Vipshop, Farfetch, Discovery, Texas Capital Bancshares Inc, Tencent Music Entertainment, IQIYI, among other media and Chinese stocks. On the day he got cucked by margin, the stocks were down over 20%.

Oh, and on July 10, 2024 a jury found him guilty of 11 of the 12 charges he got hit with by the Feds. He was sentenced in November of 2024 to serve 18 years in prison but has posted his $100 million bail, and appealed for a pardon in Jan 2026 to 🌮 (hope he greased the palm enough and has the backing of the Evangelical pastors!). 

FREE BILL MOFUKKIN HWANG! FREE MY MAN!

Edit 1: Added a tldr below


TLDR; Bill ""fookin legend"" Hwang. Had $10B and leveraged to the tits. 5x margin, AT LEAST, and got margin called. Helped caused a bank to go bankrupt and caused billions in losses. Read the story",1432,166,2026-07-14 21:49:22+00:00,https://www.reddit.com/r/wallstreetbets/comments/1uwmgqv/wsb_history_meet_the_legend/,https://i.redd.it/rf7uq66hn9dh1.jpeg,"WSB History: Meet the Legend Welcome to the first installment of Meet the Legend, a series meant to be dedicated to the absolute disgusting real life degenerates of history, who, if they were a part of this community, would have been made honorary Mods and Gods. 

The first inductee is a legendary man who goes by the name Bill ""Mothafukkin"" Hwang, real name Sung Kook Hwang, a degenerate Korean (yes, the country known for getting into heavy debt and leveraged investing into semiconductors today) investor who trained under the infamous ""Tiger Management"" school of degenerate investing, which no doubt set up the foundation for his love of leveraging to the tits and reckless betting. He was one of Robertson's beloved ""Tiger Cubs""

A little bit of his personal life: He worked as a cuck at McDonalds to fund his education. Probably took it like a champ out back and put the fries in the bag. He is married to a Becky Hwang, who probably gives good neck. Oh Becky!

He is also a profeessed devout and faithful Christian, which he tried to use to reduce his sentence 🤣

This ass chap is known for the Archegos Capital Management collapse, a ""family office"" which is structured to be less regulated than a normal hedge fund (because which fucking gambling degenerate doesn't love not having the SEC tell them ""no, you cannot leverage yourself 25x""). He managed $10B usd in assets, and used total return swaps to leverage himself to the absolute titties. Because he traded in swaps, there were less disclosure requirements which meant he could hide his shit from the public. 

The reason this man is the first inductee is because he managed to turn a $10B initial position and make it into an over $100B at its peak and he was rumored to have been worth $30B himself. He was believed to have been leveraged at a 5:1 ratio. However, the market turned against him and it turned into roughly $30B in losses when he got margin called. What a goddamn fucking retard!

Everything was going good during the latter half of 2020-2021 for stocks. The GREATEST BULL RUN IN HISTORY, some might even say. Viacom had 3x during 2021 up til that March, and that's when everything turned to shit for this man. Viacom, in all their fuckwit wisdom, decided to do a secondary offering which plummeted the stock down 30%. Unbeknownst to everyone in the fucking world, Viacom was a huge holding of this man's play house. And that is when the beautiful, fair, and ever so lovely Margin came calling our handsome man, Bill Mothafuggin Hwang.

The beauty is that because of the way the company and investments were structured, the banks and brokers and lenders at the esteemed shitholes such as Nomura, Goldman Sachs, Credit Suisse, UBS, and Morgan Stanley didn't even know each of them had lent this guy cash. The first time margin came a calling he said ""nonsense"". Banks kept calling so he setup a meeting.

He got them all in a call and said ""Don't worry guys, margin called, but I deleted the app and everything is okey dokey smokey"". When everone hung up the call, agreeing to do things together while holding hands and believing in the power of friendship, Goldman then proceeded to liquidate his position before the others and let them hold the bags. Morgan Stanley sold over $5B to their hedge fund buddy bagholders, telling them it was part of a margin call, but conveniently left out that dumping would continue the next day. Things got so bad, Credit Suisse had losses >5.5 billion and shut down their prime brokerage business unit. 💀Fookin legend. At the time of the margin call, he got liquidated with $20B in losses (imagine seeing -$20Billion in the app when you wake up).

What stocks did this guy even buy swaps of? He held shit cos such as the like of ViacomCBS, Baidu, Vipshop, Farfetch, Discovery, Texas Capital Bancshares Inc, Tencent Music Entertainment, IQIYI, among other media and Chinese stocks. On the day he got cucked by margin, the stocks were down over 20%.

Oh, and on July 10, 2024 a jury found him guilty of 11 of the 12 charges he got hit with by the Feds. He was sentenced in November of 2024 to serve 18 years in prison but has posted his $100 million bail, and appealed for a pardon in Jan 2026 to 🌮 (hope he greased the palm enough and has the backing of the Evangelical pastors!). 

FREE BILL MOFUKKIN HWANG! FREE MY MAN!

Edit 1: Added a tldr below


TLDR; Bill ""fookin legend"" Hwang. Had $10B and leveraged to the tits. 5x margin, AT LEAST, and got margin called. Helped caused a bank to go bankrupt and caused billions in losses. Read the story","Counter({'FREE': 2, 'BULL': 1, 'RUN': 1, 'UBS': 1, 'IQIYI': 1, 'BILL': 1, 'HWANG': 1, 'MAN': 1, 'LEAST': 1})",10,0.8288,12.385519240244928
1uwjkdt,top,"What Are Your Moves Tomorrow, July 15, 2026",This post contains content not supported on old Reddit. [Click here to view the full post](https://sh.reddit.com/r/wallstreetbets/comments/1uwjkdt),190,6848,2026-07-14 20:00:38+00:00,https://www.reddit.com/r/wallstreetbets/comments/1uwjkdt/what_are_your_moves_tomorrow_july_15_2026/,https://www.reddit.com/r/wallstreetbets/comments/1uwjkdt/what_are_your_moves_tomorrow_july_15_2026/,"What Are Your Moves Tomorrow, July 15, 2026 This post contains content not supported on old Reddit. [Click here to view the full post](https://sh.reddit.com/r/wallstreetbets/comments/1uwjkdt)",Counter(),0,-0.2411,14.084131363244536
1uw7d8k,top,JUNE U.S. 🇺🇸 INFLATION DATA:,"CPI 3.5% YoY, (Est. 3.8%)  
CPI -0.4% MoM, (Est. 0.0%)

Core CPI 2.6% YoY, (Est. 2.9%)  
Core CPI 0.0% MoM, (Est. 0.2%)",2788,454,2026-07-14 12:32:27+00:00,https://www.reddit.com/r/wallstreetbets/comments/1uw7d8k/june_us_inflation_data/,https://www.bls.gov/news.release/cpi.nr0.htm,"JUNE U.S. 🇺🇸 INFLATION DATA: CPI 3.5% YoY, (Est. 3.8%)  
CPI -0.4% MoM, (Est. 0.0%)

Core CPI 2.6% YoY, (Est. 2.9%)  
Core CPI 0.0% MoM, (Est. 0.2%)","Counter({'CPI': 4, 'JUNE': 1, 'DATA': 1})",6,0.0,14.05373580657844
1uw5tdf,top,IBM expects second-quarter revenue below estimates. Results in SaaS sell-off,,1036,219,2026-07-14 11:20:18+00:00,https://www.reddit.com/r/wallstreetbets/comments/1uw5tdf/ibm_expects_secondquarter_revenue_below_estimates/,https://finance.yahoo.com/markets/stocks/articles/ibm-expects-second-quarter-revenue-111029599.html,IBM expects second-quarter revenue below estimates. Results in SaaS sell-off,Counter({'IBM': 1}),1,0.0,12.337714754581889
1uw5o85,top,"South Korea's margin call to receivables ratio has spiked to ~5%, the 3rd-highest level ever.","This ratio measures the share of outstanding margin loans that has been flagged for a margin call, where brokers demand additional collateral or forcibly liquidate positions after prices move against borrowers.

This is more than 4 times its typical range of \~1% to 2% over the past 2 years.

Furthermore, brokerage receivables, the total value of outstanding margin loans, have exceeded KRW 2,000 billion (\~$1.34 billion), up from a typical range of KRW 900-1,000 billion (\~$640 million).

This comes as South Korean retail investors have piled into leveraged ETFs at a pace unlike anything seen before.

Meanwhile, \~1.2 million trading accounts have triggered margin calls, with 320,000–360,000 ultimately forcibly liquidated by brokers.

This means hundreds of thousands of retail investors have had their positions forcibly closed, with some still owing money to their brokers after liquidation.

This is becoming one of the most painful unwinds for retail investors in history.",434,80,2026-07-14 11:12:48+00:00,https://www.reddit.com/r/wallstreetbets/comments/1uw5o85/south_koreas_margin_call_to_receivables_ratio_has/,https://i.redd.it/eagewlmwh6dh1.jpeg,"South Korea's margin call to receivables ratio has spiked to ~5%, the 3rd-highest level ever. This ratio measures the share of outstanding margin loans that has been flagged for a margin call, where brokers demand additional collateral or forcibly liquidate positions after prices move against borrowers.

This is more than 4 times its typical range of \~1% to 2% over the past 2 years.

Furthermore, brokerage receivables, the total value of outstanding margin loans, have exceeded KRW 2,000 billion (\~$1.34 billion), up from a typical range of KRW 900-1,000 billion (\~$640 million).

This comes as South Korean retail investors have piled into leveraged ETFs at a pace unlike anything seen before.

Meanwhile, \~1.2 million trading accounts have triggered margin calls, with 320,000–360,000 ultimately forcibly liquidated by brokers.

This means hundreds of thousands of retail investors have had their positions forcibly closed, with some still owing money to their brokers after liquidation.

This is becoming one of the most painful unwinds for retail investors in history.",Counter({'KRW': 2}),2,0.8363,10.469795185761123
1uw4ap2,top,"Daily Discussion Thread for July 14, 2026",This post contains content not supported on old Reddit. [Click here to view the full post](https://sh.reddit.com/r/wallstreetbets/comments/1uw4ap2),208,11801,2026-07-14 10:00:37+00:00,https://www.reddit.com/r/wallstreetbets/comments/1uw4ap2/daily_discussion_thread_for_july_14_2026/,https://www.reddit.com/r/wallstreetbets/comments/1uw4ap2/daily_discussion_thread_for_july_14_2026/,"Daily Discussion Thread for July 14, 2026 This post contains content not supported on old Reddit. [Click here to view the full post](https://sh.reddit.com/r/wallstreetbets/comments/1uw4ap2)",Counter(),0,-0.2411,14.718358539581924
1uw428z,top,Haven't even touched semis..,,168,149,2026-07-14 09:47:07+00:00,https://www.reddit.com/r/wallstreetbets/comments/1uw428z/havent_even_touched_semis/,https://www.reddit.com/gallery/1uw428z,Haven't even touched semis..,Counter(),0,0.0,10.14053400901933
1uw2heg,top,So where are y'all now?,,9965,371,2026-07-14 08:14:14+00:00,https://www.reddit.com/r/wallstreetbets/comments/1uw2heg/so_where_are_yall_now/,https://i.redd.it/or5e2yg0m5dh1.png,So where are y'all now?,Counter(),0,0.0,15.125828433114496
1uw26mp,top,Why do we need so much more memory now than last year?,"All the memory stocks have gone fucking crazy over the last year and now that the pump is slowing down I’m starting to wonder how much of this memory is actually needed. I understand that Ai is expanding and they need more memory for it, but do we really need 600% more memory? That seems like kinda growth and I find it hard to believe that Ai needs 6x more memory this year than last year. I’m probably just regarded but I think this might be overvalued as fuck ",282,192,2026-07-14 07:57:00+00:00,https://www.reddit.com/r/wallstreetbets/comments/1uw26mp/why_do_we_need_so_much_more_memory_now_than_last/,https://www.reddit.com/r/wallstreetbets/comments/1uw26mp/why_do_we_need_so_much_more_memory_now_than_last/,"Why do we need so much more memory now than last year? All the memory stocks have gone fucking crazy over the last year and now that the pump is slowing down I’m starting to wonder how much of this memory is actually needed. I understand that Ai is expanding and they need more memory for it, but do we really need 600% more memory? That seems like kinda growth and I find it hard to believe that Ai needs 6x more memory this year than last year. I’m probably just regarded but I think this might be overvalued as fuck",Counter(),0,-0.3283,10.908137086548123
1uvzfj6,top,Does this mean they owe me money?,"Opened my wealthsimple account and to my surprise there is a million dollar balance, am I the monthly millionaire?",1978,220,2026-07-14 05:21:21+00:00,https://www.reddit.com/r/wallstreetbets/comments/1uvzfj6/does_this_mean_they_owe_me_money/,https://i.redd.it/zqm2glf7r4dh1.jpeg,"Does this mean they owe me money? Opened my wealthsimple account and to my surprise there is a million dollar balance, am I the monthly millionaire?",Counter(),0,0.3527,12.988509647120317
1uvmgiq,top,"What Are Your Moves Tomorrow, July 14, 2026",This post contains content not supported on old Reddit. [Click here to view the full post](https://sh.reddit.com/r/wallstreetbets/comments/1uvmgiq),239,8704,2026-07-13 20:00:37+00:00,https://www.reddit.com/r/wallstreetbets/comments/1uvmgiq/what_are_your_moves_tomorrow_july_14_2026/,https://www.reddit.com/r/wallstreetbets/comments/1uvmgiq/what_are_your_moves_tomorrow_july_14_2026/,"What Are Your Moves Tomorrow, July 14, 2026 This post contains content not supported on old Reddit. [Click here to view the full post](https://sh.reddit.com/r/wallstreetbets/comments/1uvmgiq)",Counter(),0,-0.2411,14.55229177554428
1uvl6an,top,If bank earnings go well tomorrow I’ll go to the semi finals tomorrow and put all the single day profit on the dictator,"Definitely already priced in, and this Iran stirrup will fry me, but that’s why I’m a pussy and I’m in shares and will likely be in the nose bleeds best case scenario and worst case will just hold. I’m not even going to give it the yolo tag",141,51,2026-07-13 19:15:22+00:00,https://www.reddit.com/r/wallstreetbets/comments/1uvl6an/if_bank_earnings_go_well_tomorrow_ill_go_to_the/,https://i.redd.it/3pey7t93r1dh1.jpeg,"If bank earnings go well tomorrow I’ll go to the semi finals tomorrow and put all the single day profit on the dictator Definitely already priced in, and this Iran stirrup will fry me, but that’s why I’m a pussy and I’m in shares and will likely be in the nose bleeds best case scenario and worst case will just hold. I’m not even going to give it the yolo tag",Counter(),0,0.8381,8.907070776182689
1uvkc85,top,Memory stocks for the last 3 weeks,(Not OC - someone posted here before and I stole it),13225,315,2026-07-13 18:45:51+00:00,https://www.reddit.com/r/wallstreetbets/comments/1uvkc85/memory_stocks_for_the_last_3_weeks/,https://v.redd.it/wc8hncmtl1dh1,Memory stocks for the last 3 weeks (Not OC - someone posted here before and I stole it),Counter(),0,0.0,15.24568208182152
1uvk8zi,top,What does this mean?,,1387,245,2026-07-13 18:42:39+00:00,https://www.reddit.com/r/wallstreetbets/comments/1uvk8zi/what_does_this_mean/,https://i.redd.it/nufb3s49l1dh1.jpeg,What does this mean?,Counter(),0,0.0,12.740950676999113
1uvjeiu,top,DDR5 prices stagnating - timing the top for memory,"Anyone notice that ddr5 ram prices have gone sideways since Jan 2026?

I know because I bought RAM then, and if you compare now they haven’t gone up at all. Pangoly confirms this for the past 180 days.

https://pangoly.com/en/price-trends/ram/32gb-ddr5?r=US

Demand destruction is real, as is new software techniques to reduce RAM requirements (quantization, lightning index, etc). Even OpenAI announced they have found ways to increase efficiency 50% in their new model - imagine requiring half the RAM overnight for inference. It’s natural progression and evolution for software as hardware and algorithms improve. The volatility we’re seeing now in the market is a reflection of the underlying risk and fear we’re headed to a peak in price in the near future.

While I think memory prices will stay elevated for a while, we are going to soon see growth QoQ that are single digits in the next twelve months. See, markets usually sell off on cyclical commodities several months before the peak price, and compressed PE at the peak is expected vs a large PE.

Just something to keep in mind for those going yolo in memory. There is a reason why memory prices are so elastic on the way up…",487,166,2026-07-13 18:12:52+00:00,https://www.reddit.com/r/wallstreetbets/comments/1uvjeiu/ddr5_prices_stagnating_timing_the_top_for_memory/,https://www.reddit.com/r/wallstreetbets/comments/1uvjeiu/ddr5_prices_stagnating_timing_the_top_for_memory/,"DDR5 prices stagnating - timing the top for memory Anyone notice that ddr5 ram prices have gone sideways since Jan 2026?

I know because I bought RAM then, and if you compare now they haven’t gone up at all. Pangoly confirms this for the past 180 days.

https://pangoly.com/en/price-trends/ram/32gb-ddr5?r=US

Demand destruction is real, as is new software techniques to reduce RAM requirements (quantization, lightning index, etc). Even OpenAI announced they have found ways to increase efficiency 50% in their new model - imagine requiring half the RAM overnight for inference. It’s natural progression and evolution for software as hardware and algorithms improve. The volatility we’re seeing now in the market is a reflection of the underlying risk and fear we’re headed to a peak in price in the near future.

While I think memory prices will stay elevated for a while, we are going to soon see growth QoQ that are single digits in the next twelve months. See, markets usually sell off on cyclical commodities several months before the peak price, and compressed PE at the peak is expected vs a large PE.

Just something to keep in mind for those going yolo in memory. There is a reason why memory prices are so elastic on the way up…",Counter({'RAM': 3}),3,0.6767,11.308309218269903
1uvj64t,top,$840k full port MSFT YOLO,"It seemed cheap. Sentiment is bad. It prints money. If you use a computer, then you use MSFT. Not sure what Azure does. Come @ me bro.

EDIT: LMAO it keeps going up, top kek

EDIT 2: 7/14/26: Sold yesterday before close. How fucking lucky am I? I sold bc Trump was making an announcement at 9PM yesterday, and i was afraid it was going to be him dropping the ""N word"". Turns out I lucked out on IBM terrible preliminary ER tanking MSFT.  Looking to scalp some hardware today. ",833,252,2026-07-13 18:04:45+00:00,https://www.reddit.com/r/wallstreetbets/comments/1uvj64t/840k_full_port_msft_yolo/,https://i.redd.it/aa8bbophe1dh1.jpeg,"$840k full port MSFT YOLO It seemed cheap. Sentiment is bad. It prints money. If you use a computer, then you use MSFT. Not sure what Azure does. Come @ me bro.

EDIT: LMAO it keeps going up, top kek

EDIT 2: 7/14/26: Sold yesterday before close. How fucking lucky am I? I sold bc Trump was making an announcement at 9PM yesterday, and i was afraid it was going to be him dropping the ""N word"". Turns out I lucked out on IBM terrible preliminary ER tanking MSFT.  Looking to scalp some hardware today.","Counter({'MSFT': 3, 'LMAO': 1, 'IBM': 1})",5,0.7715,12.259622891086266
1uvipvm,top,"$80,000 $HOOD YOLO",Vlad owes me for my losses. Need ATH,129,86,2026-07-13 17:48:51+00:00,https://www.reddit.com/r/wallstreetbets/comments/1uvipvm/80000_hood_yolo/,https://i.redd.it/b9skzvlnb1dh1.jpeg,"$80,000 $HOOD YOLO Vlad owes me for my losses. Need ATH",Counter({'HOOD': 2}),2,0.0343,9.333442569110165
1uvhyxm,top,Today's Market,This candlestick chart is dropping so hard it’s almost breaking through the floor of my house,7728,407,2026-07-13 17:22:43+00:00,https://www.reddit.com/r/wallstreetbets/comments/1uvhyxm/todays_market/,https://i.redd.it/9npl2ker61dh1.png,Today's Market This candlestick chart is dropping so hard it’s almost breaking through the floor of my house,Counter(),0,-0.2183,14.964001941511032
1uvh3qp,top,12 States File Lawsuit To Block $110 Billion Paramount-Warner Bros. Merger,,1463,133,2026-07-13 16:52:05+00:00,https://www.reddit.com/r/wallstreetbets/comments/1uvh3qp/12_states_file_lawsuit_to_block_110_billion/,https://www.nbcnews.com/business/media/12-states-file-lawsuit-block-110-billion-paramount-warner-bros-merger-rcna587286,12 States File Lawsuit To Block $110 Billion Paramount-Warner Bros. Merger,Counter(),0,-0.5859,12.186767494472168
