id,feed,title,body,score,num_comments,created_utc,permalink,url,text,ticker_counts,candidate_mentions,sentiment,engagement
1u0olvx,new,You regards really need to read these articles on the Trump accounts app.,,1,0,2026-06-08 23:37:29+00:00,https://www.reddit.com/r/wallstreetbets/comments/1u0olvx/you_regards_really_need_to_read_these_articles_on/,https://i.redd.it/d5fb8f7y956h1.png,You regards really need to read these articles on the Trump accounts app.,Counter(),0,0.0,0.6931471805599453
1u0lj13,hot,OpenAI confidentially files IPO paperwork,"Source: [https://finance.yahoo.com/markets/article/openai-confidentially-files-ipo-paperwork-212841298.html](https://finance.yahoo.com/markets/article/openai-confidentially-files-ipo-paperwork-212841298.html)

OpenAI (OPAI.PVT) on Monday said it filed confidential paperwork for an initial public offering (IPO), setting up one of the most anticipated market debuts in years.

The company said it hasn't decided on timing yet, and that it may take a while ""because there are things we want to do that are likely easier as a private company.""

In March, OpenAI said had a post money valuation of $852 billion.

The announcement sets up a showdown with rival Anthropic (ANTH.PVT), which filed confidential paperwork for its own IPO last week. Anthropic was last valued at $965 billion.

OpenAI's filing comes just weeks after CEO Sam Altman and president Greg Brockman defeated their former colleague and fellow co-founder Elon Musk in his lawsuit against the duo. Musk accused Altman and Brockman of unjustly enriching themselves by turning the once nonprofit company into a for-profit business.

But a California jury found that Musk filed his suit outside of the statute of limitations. Judge Yvonne Gonzalez Rogers of the US District Court for the Northern District of California accepted the jury's verdict, handing Musk the loss.

In a post on his social media site X, the Tesla and SpaceX CEO indicated that he will appeal the verdict to the US Court of Appeals for the Ninth Circuit, describing the outcome as a ""calendar technicality"" rather than a ruling on the merits of the case.

OpenAI's win was the last major obstacle standing in the company's way of going public.

The IPO could prove to be a windfall for Microsoft (MSFT), one of OpenAI's largest backers. In October, the companies amended the terms of their existing partnership, allowing the ChatGPT developer to transition to a for-profit.

Under the terms of that deal, Microsoft received 27% of the OpenAI Group PBC, valued at $135 billion at that time, while OpenAI's nonprofit arm received a $130 billion stake in the for-profit entity.

But the relationship between the two companies has soured since Microsoft invested its initial $1 billion in OpenAI in 2019. The Windows maker would reportedly invest upwards of $13 billion in the company, with Microsoft gaining exclusive access to OpenAI's intellectual property and models.

The pair continued to run into trouble with Microsoft's computing capacity, which OpenAI depended on to grow its user base and train and run newer, more powerful AI models.

In April, the companies again amended their agreement, allowing OpenAI to license its IP and models to other cloud businesses.

OpenAI still has a good deal of work ahead. The company is burning through cash as it continues to build out its data center capacity, and Wall Street has repeatedly raised questions about how it will pay for the effort in the long run.

Altman and company are also facing stiff competition from Anthropic and Google (GOOGL, GOOG), which debuted its Gemini 3.5 family of AI models at its recent Google I/O conference.

Now, OpenAI will find out the market's appetite for that kind of risk.",912,186,2026-06-08 21:32:46+00:00,https://www.reddit.com/r/wallstreetbets/comments/1u0lj13/openai_confidentially_files_ipo_paperwork/,https://www.reddit.com/r/wallstreetbets/comments/1u0lj13/openai_confidentially_files_ipo_paperwork/,"OpenAI confidentially files IPO paperwork Source: [https://finance.yahoo.com/markets/article/openai-confidentially-files-ipo-paperwork-212841298.html](https://finance.yahoo.com/markets/article/openai-confidentially-files-ipo-paperwork-212841298.html)

OpenAI (OPAI.PVT) on Monday said it filed confidential paperwork for an initial public offering (IPO), setting up one of the most anticipated market debuts in years.

The company said it hasn't decided on timing yet, and that it may take a while ""because there are things we want to do that are likely easier as a private company.""

In March, OpenAI said had a post money valuation of $852 billion.

The announcement sets up a showdown with rival Anthropic (ANTH.PVT), which filed confidential paperwork for its own IPO last week. Anthropic was last valued at $965 billion.

OpenAI's filing comes just weeks after CEO Sam Altman and president Greg Brockman defeated their former colleague and fellow co-founder Elon Musk in his lawsuit against the duo. Musk accused Altman and Brockman of unjustly enriching themselves by turning the once nonprofit company into a for-profit business.

But a California jury found that Musk filed his suit outside of the statute of limitations. Judge Yvonne Gonzalez Rogers of the US District Court for the Northern District of California accepted the jury's verdict, handing Musk the loss.

In a post on his social media site X, the Tesla and SpaceX CEO indicated that he will appeal the verdict to the US Court of Appeals for the Ninth Circuit, describing the outcome as a ""calendar technicality"" rather than a ruling on the merits of the case.

OpenAI's win was the last major obstacle standing in the company's way of going public.

The IPO could prove to be a windfall for Microsoft (MSFT), one of OpenAI's largest backers. In October, the companies amended the terms of their existing partnership, allowing the ChatGPT developer to transition to a for-profit.

Under the terms of that deal, Microsoft received 27% of the OpenAI Group PBC, valued at $135 billion at that time, while OpenAI's nonprofit arm received a $130 billion stake in the for-profit entity.

But the relationship between the two companies has soured since Microsoft invested its initial $1 billion in OpenAI in 2019. The Windows maker would reportedly invest upwards of $13 billion in the company, with Microsoft gaining exclusive access to OpenAI's intellectual property and models.

The pair continued to run into trouble with Microsoft's computing capacity, which OpenAI depended on to grow its user base and train and run newer, more powerful AI models.

In April, the companies again amended their agreement, allowing OpenAI to license its IP and models to other cloud businesses.

OpenAI still has a good deal of work ahead. The company is burning through cash as it continues to build out its data center capacity, and Wall Street has repeatedly raised questions about how it will pay for the effort in the long run.

Altman and company are also facing stiff competition from Anthropic and Google (GOOGL, GOOG), which debuted its Gemini 3.5 family of AI models at its recent Google I/O conference.

Now, OpenAI will find out the market's appetite for that kind of risk.","Counter({'PVT': 2, 'OPAI': 1, 'ANTH': 1, 'MSFT': 1, 'PBC': 1, 'GOOGL': 1, 'GOOG': 1})",8,0.9812,12.047844497449555
1u0k3px,hot,DONT WEAR YOUR SMARTWATCH WHILE TRADING!,"Today while trading, I was holding the swipe up to execute the trade (holding it so it doesn't execute right away), then I rested my hand next to my other hand (where I wear my watch) and the watch NFC connected with my phone and executed the trade at a loss. 

The second photo is what happened when my phone got near my watch to execute the trade.",98,88,2026-06-08 20:39:44+00:00,https://www.reddit.com/r/wallstreetbets/comments/1u0k3px/dont_wear_your_smartwatch_while_trading/,https://www.reddit.com/gallery/1u0k3px,"DONT WEAR YOUR SMARTWATCH WHILE TRADING! Today while trading, I was holding the swipe up to execute the trade (holding it so it doesn't execute right away), then I rested my hand next to my other hand (where I wear my watch) and the watch NFC connected with my phone and executed the trade at a loss. 

The second photo is what happened when my phone got near my watch to execute the trade.","Counter({'DONT': 1, 'WEAR': 1, 'YOUR': 1, 'WHILE': 1, 'NFC': 1})",5,-0.1593,9.083756219866729
1u0jygx,hot,How to trade,Am I doing it right 🥲,141,36,2026-06-08 20:34:10+00:00,https://www.reddit.com/r/wallstreetbets/comments/1u0jygx/how_to_trade/,https://i.redd.it/k5ublnv8d46h1.jpeg,How to trade Am I doing it right 🥲,Counter(),0,0.0,8.566744970245486
1u0jlqc,hot,APLD Full Port Gain,"I’ve been selling puts on APLD for a few weeks, finally got assigned last Friday. I made a bunch of money holding it until the pop after market today. 

It was like 50% of my portfolio, if it crashed I was FUCKED. 😂 ",49,21,2026-06-08 20:21:13+00:00,https://www.reddit.com/r/wallstreetbets/comments/1u0jlqc/apld_full_port_gain/,https://i.redd.it/feakfuoxa46h1.jpeg,"APLD Full Port Gain I’ve been selling puts on APLD for a few weeks, finally got assigned last Friday. I made a bunch of money holding it until the pop after market today. 

It was like 50% of my portfolio, if it crashed I was FUCKED. 😂",Counter({'APLD': 2}),2,-0.0601,7.0030654587864625
1u0jedl,hot,You could say I’m into trading,,940,45,2026-06-08 20:13:59+00:00,https://www.reddit.com/r/wallstreetbets/comments/1u0jedl/you_could_say_im_into_trading/,https://i.redd.it/r9wuy55n946h1.jpeg,You could say I’m into trading,Counter(),0,0.0,10.675584536074474
1u0j5p5,hot,"First time day trading with PDT gone, doubled my account today. SPY puts Friday and today. All intraday trades, wins in red boxes.",still down \~50% all time,75,54,2026-06-08 20:05:33+00:00,https://www.reddit.com/r/wallstreetbets/comments/1u0j5p5/first_time_day_trading_with_pdt_gone_doubled_my/,https://www.reddit.com/gallery/1u0j5p5,"First time day trading with PDT gone, doubled my account today. SPY puts Friday and today. All intraday trades, wins in red boxes. still down \~50% all time",Counter({'SPY': 1}),1,0.5719,8.338066525518801
1u0j402,hot,"Fuck the AI buildout, I'm buying calls on cattle because of this little shit","https://preview.redd.it/8papaobe746h1.png?width=300&format=png&auto=webp&s=b6952be7845af117ff18716eccf974764d986a8f

This screwworm is going to do what oil couldn't - pop the AI bubble

Edit: [https://www.youtube.com/watch?v=t1\_MI\_5FHoc](https://www.youtube.com/watch?v=t1_MI_5FHoc) Trump wants to keep beef prices down. Hedge funds drive the futures prices down and the farmers get paid less. If the futures prices go up, the costs of paying the producers more get passed on to the consumer. Costlier beef makes the price of chicken tendies go up, and causes the consumer price index to skyrocket. Warsh is forced to raise rates. The cheap debt for the AI buildout disappears, and the bubble pops.

Now we just have to figure out how to do this wihout recieving 40000 lbs of beef at our doorsteps.",2456,328,2026-06-08 20:03:50+00:00,https://www.reddit.com/r/wallstreetbets/comments/1u0j402/fuck_the_ai_buildout_im_buying_calls_on_cattle/,https://www.reddit.com/r/wallstreetbets/comments/1u0j402/fuck_the_ai_buildout_im_buying_calls_on_cattle/,"Fuck the AI buildout, I'm buying calls on cattle because of this little shit https://preview.redd.it/8papaobe746h1.png?width=300&format=png&auto=webp&s=b6952be7845af117ff18716eccf974764d986a8f

This screwworm is going to do what oil couldn't - pop the AI bubble

Edit: [https://www.youtube.com/watch?v=t1\_MI\_5FHoc](https://www.youtube.com/watch?v=t1_MI_5FHoc) Trump wants to keep beef prices down. Hedge funds drive the futures prices down and the farmers get paid less. If the futures prices go up, the costs of paying the producers more get passed on to the consumer. Costlier beef makes the price of chicken tendies go up, and causes the consumer price index to skyrocket. Warsh is forced to raise rates. The cheap debt for the AI buildout disappears, and the bubble pops.

Now we just have to figure out how to do this wihout recieving 40000 lbs of beef at our doorsteps.",Counter(),0,-0.9398,13.602754123286552
1u0j0s9,hot,"What Are Your Moves Tomorrow, June 9, 2026",This post contains content not supported on old Reddit. [Click here to view the full post](https://sh.reddit.com/r/wallstreetbets/comments/1u0j0s9),289,2312,2026-06-08 20:00:37+00:00,https://www.reddit.com/r/wallstreetbets/comments/1u0j0s9/what_are_your_moves_tomorrow_june_9_2026/,https://www.reddit.com/r/wallstreetbets/comments/1u0j0s9/what_are_your_moves_tomorrow_june_9_2026/,"What Are Your Moves Tomorrow, June 9, 2026 This post contains content not supported on old Reddit. [Click here to view the full post](https://sh.reddit.com/r/wallstreetbets/comments/1u0j0s9)",Counter(),0,-0.2411,13.416181585211959
1u0ixe1,hot,Am I doing good? 🥺,"Tbh, I really don’t know what the hell im doing 😇",30,71,2026-06-08 19:57:22+00:00,https://www.reddit.com/r/wallstreetbets/comments/1u0ixe1/am_i_doing_good/,https://www.reddit.com/gallery/1u0ixe1,"Am I doing good? 🥺 Tbh, I really don’t know what the hell im doing 😇",Counter(),0,-0.4019,7.710653323501202
1u0ic8d,hot,150k FIG YOLO not going well. Already down,"Holding over 5,000 shares at a $30 avg across 3 accounts.  FML",172,84,2026-06-08 19:36:24+00:00,https://www.reddit.com/r/wallstreetbets/comments/1u0ic8d/150k_fig_yolo_not_going_well_already_down/,https://i.redd.it/5p8r5jnx246h1.jpeg,"150k FIG YOLO not going well. Already down Holding over 5,000 shares at a $30 avg across 3 accounts.  FML","Counter({'FIG': 1, 'FML': 1})",2,0.4971,9.595942850988095
1u0hjte,hot,9k IBM loss,,50,37,2026-06-08 19:08:52+00:00,https://www.reddit.com/r/wallstreetbets/comments/1u0hjte/9k_ibm_loss/,https://i.imgur.com/itA9HKX.jpeg,9k IBM loss,Counter({'IBM': 1}),1,-0.3182,7.569411792450712
1u0gf58,hot,Why wasn't I told that no oil tankers allowed to cross Hormuz or Bab el Mandab meant oil went down in price?,,475,90,2026-06-08 18:30:29+00:00,https://www.reddit.com/r/wallstreetbets/comments/1u0gf58/why_wasnt_i_told_that_no_oil_tankers_allowed_to/,https://i.redd.it/0lzuwg0rq36h1.png,Why wasn't I told that no oil tankers allowed to cross Hormuz or Bab el Mandab meant oil went down in price?,Counter(),0,0.2235,10.67627736074827
1u0fem9,hot,If your not 90% down what are you even doing,"Lost everything 80% in 2021 and the rest 10% on random shit but hey , at least now I learn to not buy meme stocks and trade on er. Btw I am up 600% ytd 281-2.1k . Who know I might end up even in 2 years.",507,99,2026-06-08 17:56:08+00:00,https://www.reddit.com/r/wallstreetbets/comments/1u0fem9/if_your_not_90_down_what_are_you_even_doing/,https://i.redd.it/8ib7y8r1l36h1.jpeg,"If your not 90% down what are you even doing Lost everything 80% in 2021 and the rest 10% on random shit but hey , at least now I learn to not buy meme stocks and trade on er. Btw I am up 600% ytd 281-2.1k . Who know I might end up even in 2 years.",Counter(),0,-0.4497,10.835651633566574
1u0fcmb,hot,"PDT Gone, trading good (QQQ calls)","After Friday’s put gains, I decided to trade the bounce on QQQ.  Might have been a little early on Friday but QQQ came through.  Just gonna ride off into the sunset for now, Godspeed regards  ",107,20,2026-06-08 17:54:31+00:00,https://www.reddit.com/r/wallstreetbets/comments/1u0fcmb/pdt_gone_trading_good_qqq_calls/,https://www.reddit.com/gallery/1u0fcmb,"PDT Gone, trading good (QQQ calls) After Friday’s put gains, I decided to trade the bounce on QQQ.  Might have been a little early on Friday but QQQ came through.  Just gonna ride off into the sunset for now, Godspeed regards",Counter({'QQQ': 3}),3,0.3919,7.7266536648476425
1u0ekp2,hot,Bought SPY Puts at today's top🐻,Nice Lil 336% gains for the ber,196,31,2026-06-08 17:27:34+00:00,https://www.reddit.com/r/wallstreetbets/comments/1u0ekp2/bought_spy_puts_at_todays_top/,https://i.redd.it/qppyie4yf36h1.jpeg,Bought SPY Puts at today's top🐻 Nice Lil 336% gains for the ber,Counter({'SPY': 1}),1,0.6369,8.748939631537715
1u0e86f,hot,Im regarded,"well i picked the wrong stocks now my mental health is at the lowest point in my life. last time i do stock picking, clearly this game is designed as a scam to screw people over.

fuck the analysts too, 600 on MSFT, you make me laugh. downgrade that pos to 350",484,153,2026-06-08 17:15:37+00:00,https://www.reddit.com/r/wallstreetbets/comments/1u0e86f/im_regarded/,https://i.redd.it/w3gx16wid36h1.png,"Im regarded well i picked the wrong stocks now my mental health is at the lowest point in my life. last time i do stock picking, clearly this game is designed as a scam to screw people over.

fuck the analysts too, 600 on MSFT, you make me laugh. downgrade that pos to 350",Counter({'MSFT': 1}),1,-0.7096,11.221101493351114
1u0e59a,hot,"It's over, I thought I had a chance today but no","I checked my horoscope which confirmed I'll have some gains but ended up with a 70% loss trading 0 DTEs 3 minutes ago, I'm an international student and some of the money isn't even mine, it's my parents'. On facetime my mum looks at me with pride in her eyes. All I've done is fuck up over and over. I don't even feel alive right now. My master's program is coming to an end by the end of summer and all I have to show are fuck ups. 

I thought I learnt the lesson 3 months ago when the exact same thing happened. 

I hate myself over how much disappointment & suffering I've brought upon them, all they wanted was to feel pride in my achievements and here I am. 

I have a gambling problem. ",379,204,2026-06-08 17:12:54+00:00,https://www.reddit.com/r/wallstreetbets/comments/1u0e59a/its_over_i_thought_i_had_a_chance_today_but_no/,https://i.redd.it/e0t3k54cd36h1.jpeg,"It's over, I thought I had a chance today but no I checked my horoscope which confirmed I'll have some gains but ended up with a 70% loss trading 0 DTEs 3 minutes ago, I'm an international student and some of the money isn't even mine, it's my parents'. On facetime my mum looks at me with pride in her eyes. All I've done is fuck up over and over. I don't even feel alive right now. My master's program is coming to an end by the end of summer and all I have to show are fuck ups. 

I thought I learnt the lesson 3 months ago when the exact same thing happened. 

I hate myself over how much disappointment & suffering I've brought upon them, all they wanted was to feel pride in my achievements and here I am. 

I have a gambling problem.",Counter(),0,-0.9807,11.263181231858841
1u0d8be,hot,$GLXY YOLO,"(Not a space stock even though the ticker sounds like it)

$GLXY CEO was interviewed over the weekend (June 6) on a podcast and says that they have the largest data center in North America and that they are going to do a deal by July 4 (or end of summer at the latest). After that deal, they will have over 1.6 GW of capacity leased out.

Video below, segment starts at 16:10

https://youtu.be/8KgCb6RvxcI?si=E7o-K47SwjqqtLc8

Position:

6,686 shares @ $29.03",44,12,2026-06-08 16:40:36+00:00,https://www.reddit.com/r/wallstreetbets/comments/1u0d8be/glxy_yolo/,https://i.redd.it/0vmu59nk736h1.jpeg,"$GLXY YOLO (Not a space stock even though the ticker sounds like it)

$GLXY CEO was interviewed over the weekend (June 6) on a podcast and says that they have the largest data center in North America and that they are going to do a deal by July 4 (or end of summer at the latest). After that deal, they will have over 1.6 GW of capacity leased out.

Video below, segment starts at 16:10

https://youtu.be/8KgCb6RvxcI?si=E7o-K47SwjqqtLc8

Position:

6,686 shares @ $29.03",Counter({'GLXY': 4}),4,0.7603,6.371611847231856
1u0ce6x,hot,0DTE SPX is the only way? 374% Gain,"https://preview.redd.it/a933o4es136h1.png?width=508&format=png&auto=webp&s=40c0f9a5930659200aac12de7dbebeb7a8c21c36

Title sums it up, never tried this and saw a lot of posts losing their entire portfolios on these things. I got to thinking someone has to be on the other side of these making bank. Started 3 weeks ago resetting account to 50k after some Space gains. 

I obviously have gotten extremely lucky and am going to try and stay away for a little while. Rode out most of 2025 as a bear but recently just wanted to vibe day to day instead of watching it crumble slowly. 

https://preview.redd.it/ujgymr6n136h1.png?width=2126&format=png&auto=webp&s=693c2f986711fb226b97e5869fb26363044da280

  
Hopefully screenshots explain what goin on, theres a few hundred trades so cant tell you what days or contracts. This somewhat sums up what kind of stuff was going on. I would just DCA down and then hope it went up.

https://preview.redd.it/5f7t3yf1236h1.png?width=1386&format=png&auto=webp&s=a83edcc6fa7d409baabe66938932d94829e9b003

",511,153,2026-06-08 16:10:39+00:00,https://www.reddit.com/r/wallstreetbets/comments/1u0ce6x/0dte_spx_is_the_only_way_374_gain/,https://www.reddit.com/r/wallstreetbets/comments/1u0ce6x/0dte_spx_is_the_only_way_374_gain/,"0DTE SPX is the only way? 374% Gain https://preview.redd.it/a933o4es136h1.png?width=508&format=png&auto=webp&s=40c0f9a5930659200aac12de7dbebeb7a8c21c36

Title sums it up, never tried this and saw a lot of posts losing their entire portfolios on these things. I got to thinking someone has to be on the other side of these making bank. Started 3 weeks ago resetting account to 50k after some Space gains. 

I obviously have gotten extremely lucky and am going to try and stay away for a little while. Rode out most of 2025 as a bear but recently just wanted to vibe day to day instead of watching it crumble slowly. 

https://preview.redd.it/ujgymr6n136h1.png?width=2126&format=png&auto=webp&s=693c2f986711fb226b97e5869fb26363044da280

  
Hopefully screenshots explain what goin on, theres a few hundred trades so cant tell you what days or contracts. This somewhat sums up what kind of stuff was going on. I would just DCA down and then hope it went up.

https://preview.redd.it/5f7t3yf1236h1.png?width=1386&format=png&auto=webp&s=a83edcc6fa7d409baabe66938932d94829e9b003","Counter({'SPX': 1, 'DCA': 1})",2,0.9101,11.275277227453138
1u0bojo,hot,SpaceX is buying Tesla - Double Down,"**The Bet:**

Now 223 (up from 115) contracts of the Tesla December 18, 2026 $990 calls now at $3.61 — the single most profitable option out of roughly 8,000 different contracts on the entire Tesla chain in the event of a surprise purchase announcement.

**The Setup**:

Elon has repeatedly said he views advanced AI and humanoid robots like Optimus as a potential existential risk to humanity. He tried to secure 25% voting control at Tesla to protect his ability to steer that future. When he couldn’t get it, he built absolute control in SpaceX instead. He can sign a definitive purchase agreement wherein Tesla shareholders receive SpaceX shares for their Tesla shares.

After the announcement the shares will trade in lock-step until the deal closes approximately six months later.

1 + 1 = 3

**The Payoff:**

Selling all options at extrinsic value + hyper IV on the day of the announcement.",1046,198,2026-06-08 15:45:58+00:00,https://www.reddit.com/r/wallstreetbets/comments/1u0bojo/spacex_is_buying_tesla_double_down/,https://i.redd.it/ljbhgkstx26h1.jpeg,"SpaceX is buying Tesla - Double Down **The Bet:**

Now 223 (up from 115) contracts of the Tesla December 18, 2026 $990 calls now at $3.61 — the single most profitable option out of roughly 8,000 different contracts on the entire Tesla chain in the event of a surprise purchase announcement.

**The Setup**:

Elon has repeatedly said he views advanced AI and humanoid robots like Optimus as a potential existential risk to humanity. He tried to secure 25% voting control at Tesla to protect his ability to steer that future. When he couldn’t get it, he built absolute control in SpaceX instead. He can sign a definitive purchase agreement wherein Tesla shareholders receive SpaceX shares for their Tesla shares.

After the announcement the shares will trade in lock-step until the deal closes approximately six months later.

1 + 1 = 3

**The Payoff:**

Selling all options at extrinsic value + hyper IV on the day of the announcement.",Counter(),0,0.9726,12.246989035595028
1u0audl,hot,Thanks paper hand,Your contribution to my networth is recognized,17,1,2026-06-08 15:15:43+00:00,https://www.reddit.com/r/wallstreetbets/comments/1u0audl/thanks_paper_hand/,https://i.redd.it/n0vhjxhfs26h1.jpeg,Thanks paper hand Your contribution to my networth is recognized,Counter(),0,0.7269,3.58351893845611
1u0aqq4,hot,All in on MSTR,Yolo on MSTR. Corn is going to bounce back and Saylor is taking me to the promise land. ,194,120,2026-06-08 15:11:57+00:00,https://www.reddit.com/r/wallstreetbets/comments/1u0aqq4/all_in_on_mstr/,https://i.redd.it/8ljyj3oor26h1.jpeg,All in on MSTR Yolo on MSTR. Corn is going to bounce back and Saylor is taking me to the promise land.,Counter({'MSTR': 2}),2,0.5267,10.068790104160488
1u0a7jw,hot,At least the adds at IBKR are honest.,,1332,64,2026-06-08 14:52:56+00:00,https://www.reddit.com/r/wallstreetbets/comments/1u0a7jw/at_least_the_adds_at_ibkr_are_honest/,https://i.redd.it/ghztu96do26h1.jpeg,At least the adds at IBKR are honest.,Counter({'IBKR': 1}),1,0.5106,11.369574590074347
