id,feed,title,body,score,num_comments,created_utc,permalink,url,text,ticker_counts,candidate_mentions,sentiment,engagement
1tv4ans,top,We are about to see THE MOST epic rugpull in human history.,"What is the narrative right now? 

It's ""YOU MUST INVEST EVERYTHING IN AI OR BE LEFT BEHIND AS HUMANS ASCENDING INTO THE MATRIX... EXCEPT A GOOD KIND"".

It is complimented by: ""SELL ALL OTHER ASSETS, IN THE FUTURE YOU WILL NOT NEED REAL ESTATE, GOLD, LAND, OR ANYTHING TANGIBLE. ELON WILL PROVIDE YOU WIFI AND ROBOTAXIS AND ROBOT SEX SLAVES POWERED BY MYTHOS TECH""

Nothing could be further from the truth.

It's true that LLMs are pretty amazing. They save a lot of time on work, and more importantly can be used to make some actual breakthroughs in research, can probably drone strike kids in the middle east pretty accurately, etc... but for the average person they are largely **useless** beyond being a very advanced and more thorough google searches that contextualizes your search requests for you.

Also, the stock market literally is a casino for people who don't ""gamble"". Just like martinis are drinks for people who don't want to look like alcoholics (FYI zoomies a martini is straight vodka or gin, with a tiny bit of dry white wine, or sometimes none at all, it's literally just 2-3 shots of liquor).

This means that the house ALWAYS wins. And the way the house wins with stocks is by pulling all your resources in.... then dumping the living hell out of you.

We are absolutely in an AI bubble. Maybe 15% of what is being said will actually come true in the next decade. Why? Because we're reaching a point where the cost of improving AI is far outweighing it's benefit.

For example, a sex chat bot probably takes a few cups of water to run while you goon. But a sex robot? Using TSMC NIVDIA GPU's in her brain to calculate trillions of interactions with the physical environment so she doesn't rip your dick off with the wrong gyration? **IT WOULD CONSUME LAKES**

Do you understand? We're not going much further in the next two decades without hitting a wall where going any further would destroy our environment. Like actually, not in an Al Gore way. People don't understand how much energy and water data centers use, how incredibly destructive they are.

This is why people like Musk are saying we're going to build data centers on the moon. Like how stupid do you have to be to believe this? Even dumber than the people who think we're going to create a colony on mars before 2100.

It's all a scam, and this is the greatest one yet, and the rug is getting loaded up right now. Literally my mom's friends were talking about how they want to sell their house to invest in Micron.

Micron went from 100 billion to 1.1 trillion MC in 8 months. That's regarded.

And now, you see Jason Huang making the rounds on CNBC (boomer tube) telling people that buying into Nivida and Micron is going to be like owning google at the ground floor.

LOL WHAT? Micron is worth like 10 billion and it's valued at 1.1 trillion. Is leather jacket man saying that Micron is going to hit 30 trillion MC within 10 years, following google's post IPO rise?

Seriously guys, watch out. People have gotten drunk off the recent AI rises but this is simply not going to continue. I genuinely believe this is the last rug pull to end all rug pulls. Once everyone sells their assets to buy Nividia and Micron stock, they will rug and release a Hentai virus 2.0 which will solve the issue of having to give UBI to all the regards who sold their homes to buy TSMC at $800/share",9118,1609,2026-06-02 21:10:16+00:00,https://www.reddit.com/r/wallstreetbets/comments/1tv4ans/we_are_about_to_see_the_most_epic_rugpull_in/,https://www.reddit.com/r/wallstreetbets/comments/1tv4ans/we_are_about_to_see_the_most_epic_rugpull_in/,"We are about to see THE MOST epic rugpull in human history. What is the narrative right now? 

It's ""YOU MUST INVEST EVERYTHING IN AI OR BE LEFT BEHIND AS HUMANS ASCENDING INTO THE MATRIX... EXCEPT A GOOD KIND"".

It is complimented by: ""SELL ALL OTHER ASSETS, IN THE FUTURE YOU WILL NOT NEED REAL ESTATE, GOLD, LAND, OR ANYTHING TANGIBLE. ELON WILL PROVIDE YOU WIFI AND ROBOTAXIS AND ROBOT SEX SLAVES POWERED BY MYTHOS TECH""

Nothing could be further from the truth.

It's true that LLMs are pretty amazing. They save a lot of time on work, and more importantly can be used to make some actual breakthroughs in research, can probably drone strike kids in the middle east pretty accurately, etc... but for the average person they are largely **useless** beyond being a very advanced and more thorough google searches that contextualizes your search requests for you.

Also, the stock market literally is a casino for people who don't ""gamble"". Just like martinis are drinks for people who don't want to look like alcoholics (FYI zoomies a martini is straight vodka or gin, with a tiny bit of dry white wine, or sometimes none at all, it's literally just 2-3 shots of liquor).

This means that the house ALWAYS wins. And the way the house wins with stocks is by pulling all your resources in.... then dumping the living hell out of you.

We are absolutely in an AI bubble. Maybe 15% of what is being said will actually come true in the next decade. Why? Because we're reaching a point where the cost of improving AI is far outweighing it's benefit.

For example, a sex chat bot probably takes a few cups of water to run while you goon. But a sex robot? Using TSMC NIVDIA GPU's in her brain to calculate trillions of interactions with the physical environment so she doesn't rip your dick off with the wrong gyration? **IT WOULD CONSUME LAKES**

Do you understand? We're not going much further in the next two decades without hitting a wall where going any further would destroy our environment. Like actually, not in an Al Gore way. People don't understand how much energy and water data centers use, how incredibly destructive they are.

This is why people like Musk are saying we're going to build data centers on the moon. Like how stupid do you have to be to believe this? Even dumber than the people who think we're going to create a colony on mars before 2100.

It's all a scam, and this is the greatest one yet, and the rug is getting loaded up right now. Literally my mom's friends were talking about how they want to sell their house to invest in Micron.

Micron went from 100 billion to 1.1 trillion MC in 8 months. That's regarded.

And now, you see Jason Huang making the rounds on CNBC (boomer tube) telling people that buying into Nivida and Micron is going to be like owning google at the ground floor.

LOL WHAT? Micron is worth like 10 billion and it's valued at 1.1 trillion. Is leather jacket man saying that Micron is going to hit 30 trillion MC within 10 years, following google's post IPO rise?

Seriously guys, watch out. People have gotten drunk off the recent AI rises but this is simply not going to continue. I genuinely believe this is the last rug pull to end all rug pulls. Once everyone sells their assets to buy Nividia and Micron stock, they will rug and release a Hentai virus 2.0 which will solve the issue of having to give UBI to all the regards who sold their homes to buy TSMC at $800/share","Counter({'THE': 3, 'YOU': 3, 'WILL': 2, 'AND': 2, 'TSMC': 2, 'MOST': 1, 'MUST': 1, 'LEFT': 1, 'INTO': 1, 'GOOD': 1, 'KIND': 1, 'ALL': 1, 'OTHER': 1, 'NOT': 1, 'NEED': 1, 'REAL': 1, 'GOLD': 1, 'LAND': 1, 'ELON': 1, 'WIFI': 1, 'ROBOT': 1, 'SEX': 1, 'TECH': 1, 'FYI': 1, 'WOULD': 1, 'LAKES': 1, 'CNBC': 1, 'WHAT': 1, 'UBI': 1})",36,0.9799,16.502104885912175
1tv3vac,top,Thank you Lisa Su! Arvind and spez please take it from here.,"Got lucky on some amd calls back in October predicting the open AI deal. Everything was jumping 30% in September and October 2025 (just as it is today) and AMD was one of the last semis without a big jump. I just knew something was about to happen. Kept playing amd calls and buying shares through last week and now I’m shifting into Reddit and IBM, and dabbling a bit in Oracle and Microsoft. 

After my big win, I booked my wife and I a flight, and we celebrated both me and Lisa’s bday in her home town of Taiwan at the original Din Tai Fung. My wife and I always wanted to go so we split the trip between Korea and Taiwan. (Photos of trip attached). We even ran into an AMD pop up store on our first day in Korea!

AMD will probably run to the 1000 but I sold covered calls after earnings and lost all of my shares last month so too salty to jump back in. Oh well, thank you Lisa, and onto the next play!",1249,155,2026-06-02 20:54:47+00:00,https://www.reddit.com/r/wallstreetbets/comments/1tv3vac/thank_you_lisa_su_arvind_and_spez_please_take_it/,https://www.reddit.com/gallery/1tv3vac,"Thank you Lisa Su! Arvind and spez please take it from here. Got lucky on some amd calls back in October predicting the open AI deal. Everything was jumping 30% in September and October 2025 (just as it is today) and AMD was one of the last semis without a big jump. I just knew something was about to happen. Kept playing amd calls and buying shares through last week and now I’m shifting into Reddit and IBM, and dabbling a bit in Oracle and Microsoft. 

After my big win, I booked my wife and I a flight, and we celebrated both me and Lisa’s bday in her home town of Taiwan at the original Din Tai Fung. My wife and I always wanted to go so we split the trip between Korea and Taiwan. (Photos of trip attached). We even ran into an AMD pop up store on our first day in Korea!

AMD will probably run to the 1000 but I sold covered calls after earnings and lost all of my shares last month so too salty to jump back in. Oh well, thank you Lisa, and onto the next play!","Counter({'AMD': 3, 'IBM': 1})",4,0.9608,12.180754837545884
1tv2g0s,top,Yall can cry if you want but see you in my mansion🚀🚀🚀🚀,Yall have the softest hands I have ever seen. I honestly don’t know why there aren’t more people in this IPO. Go Elon and Tesla ,4580,951,2026-06-02 20:03:03+00:00,https://www.reddit.com/r/wallstreetbets/comments/1tv2g0s/yall_can_cry_if_you_want_but_see_you_in_my_mansion/,https://i.redd.it/s1hh19x7ex4h1.jpeg,Yall can cry if you want but see you in my mansion🚀🚀🚀🚀 Yall have the softest hands I have ever seen. I honestly don’t know why there aren’t more people in this IPO. Go Elon and Tesla,Counter(),0,0.4767,15.288237628678107
1tv1gw5,top,Highest Average Challenge on $SPCE 8.59,Lets see if anyone has a higher average than me on SPCE 💰💰🔥,1924,465,2026-06-02 19:28:56+00:00,https://www.reddit.com/r/wallstreetbets/comments/1tv1gw5/highest_average_challenge_on_spce_859/,https://i.redd.it/6hs9j1gz7x4h1.jpeg,Highest Average Challenge on $SPCE 8.59 Lets see if anyone has a higher average than me on SPCE 💰💰🔥,Counter({'SPCE': 3}),3,0.0772,13.70686688084753
1tux8up,top,Fuck you WSB,"I should have taken 50% profit yesterday , got burned. Fuck SPCE. Exited with 60% loss instead.",9491,1553,2026-06-02 17:06:09+00:00,https://www.reddit.com/r/wallstreetbets/comments/1tux8up/fuck_you_wsb/,https://i.redd.it/zq44s0vniw4h1.jpeg,"Fuck you WSB I should have taken 50% profit yesterday , got burned. Fuck SPCE. Exited with 60% loss instead.",Counter({'SPCE': 1}),1,-0.7506,16.506792148483246
1tuvrhq,top,MU is not going to stop,,1308,179,2026-06-02 16:15:54+00:00,https://www.reddit.com/r/wallstreetbets/comments/1tuvrhq/mu_is_not_going_to_stop/,https://i.redd.it/ajyosp4p9w4h1.jpeg,MU is not going to stop,Counter(),0,0.2235,12.369975616800112
1tust3g,top,"We have hit the bottom, my fellow regards.","bought another $10k just now since my first post was deleted, $28k total boyos

  
edit: guys you don’t understand, I need another $50k so I can exercise like $400k of some options I have for liquidity, going to do whatever it takes. topped up another $2k @ $4.72",622,268,2026-06-02 14:34:34+00:00,https://www.reddit.com/r/wallstreetbets/comments/1tust3g/we_have_hit_the_bottom_my_fellow_regards/,https://i.redd.it/b2pd0zchrv4h1.png,"We have hit the bottom, my fellow regards. bought another $10k just now since my first post was deleted, $28k total boyos

  
edit: guys you don’t understand, I need another $50k so I can exercise like $400k of some options I have for liquidity, going to do whatever it takes. topped up another $2k @ $4.72",Counter(),0,0.4144,12.029257898389293
1turr0r,top,Spce sec filing dilution incoming you apes,,2681,711,2026-06-02 13:57:07+00:00,https://www.reddit.com/r/wallstreetbets/comments/1turr0r/spce_sec_filing_dilution_incoming_you_apes/,https://www.sec.gov/ix?doc=/Archives/edgar/data/0001706946/000119312526252565/d127675d8k.htm,Spce sec filing dilution incoming you apes,Counter(),0,0.0,14.4623959752536
