id,feed,title,body,score,num_comments,created_utc,permalink,url,text,ticker_counts,candidate_mentions,sentiment,engagement
1uza912,new,"I bought GOOGL calls expiring in 2028 after the earnings drop — am I early, or just wrong?","The stock still hasn’t recovered much, and I’m debating whether to keep holding or take the loss.

The business looks strong: Search remains dominant, YouTube is growing, and Google Cloud is becoming more important. Alphabet also has a huge investment in Anthropic, which could give it another way to benefit from AI through cloud usage, TPUs, and equity upside.

But Alphabet is also spending heavily on Gemini and AI infrastructure. If those investments don’t produce strong returns, the market may keep pressuring the stock.

**Would you keep the January 2028 calls, or take the loss and wait for a better setup? What would make you hold or exit?**

Not financial advice—just looking for different perspectives.",0,33,2026-07-17 19:51:46+00:00,https://www.reddit.com/r/wallstreetbets/comments/1uza912/i_bought_googl_calls_expiring_in_2028_after_the/,https://www.reddit.com/r/wallstreetbets/comments/1uza912/i_bought_googl_calls_expiring_in_2028_after_the/,"I bought GOOGL calls expiring in 2028 after the earnings drop — am I early, or just wrong? The stock still hasn’t recovered much, and I’m debating whether to keep holding or take the loss.

The business looks strong: Search remains dominant, YouTube is growing, and Google Cloud is becoming more important. Alphabet also has a huge investment in Anthropic, which could give it another way to benefit from AI through cloud usage, TPUs, and equity upside.

But Alphabet is also spending heavily on Gemini and AI infrastructure. If those investments don’t produce strong returns, the market may keep pressuring the stock.

**Would you keep the January 2028 calls, or take the loss and wait for a better setup? What would make you hold or exit?**

Not financial advice—just looking for different perspectives.",Counter({'GOOGL': 1}),1,0.7381,3.5263605246161616
1uza00l,hot,1DTE $21K SPY FD Yolo - 735P 7/20/26 220x @ .96 Each,"I bought these not too long ago.  
For the auto-mod that won't let me post, this is a $21K FD YOLO

https://preview.redd.it/8a88gwwfeudh1.png?width=861&format=png&auto=webp&s=5f63c3a5cce1f452b2a270320fcf9edc4f675d45

https://preview.redd.it/utj2l458ludh1.png?width=1042&format=png&auto=webp&s=7459df354dd3e36c286e2e5a7378d02b3272ee42

I got them at the very bottom of this chart.

https://preview.redd.it/cpoa926ieudh1.png?width=1423&format=png&auto=webp&s=793c4a78d42f68534a1374f1fd46ba4146156842

Well not much to say...  
I need SPY to tank Monday at open.

The bear has awoken from a long hibernation and is hungry for some bool meat.

This is a pure gamble based on how I perceive the market sentiment.

SPY has dropped below 744 and QQQ can't get back to 700.

That is all, gain/loss post to follow immediately upon closing my position.

**EDIT**  
Holy cow, I was down \~45% within minutes, but the last few minutes dump helped a lot.  
I'm only down 13.62% now going into the weekend.

https://preview.redd.it/vwodx4uwiudh1.png?width=867&format=png&auto=webp&s=6606af62d32c2e60d5bf717f8f68afc5ad51fa39

**TL**;**DR** *BOOLS R FUK*

https://preview.redd.it/rx5ego3gludh1.png?width=362&format=png&auto=webp&s=c14cad2729727c519c41c62d179f2ef04124d16e

",20,33,2026-07-17 19:42:23+00:00,https://www.reddit.com/r/wallstreetbets/comments/1uza00l/1dte_21k_spy_fd_yolo_735p_72026_220x_96_each/,https://www.reddit.com/r/wallstreetbets/comments/1uza00l/1dte_21k_spy_fd_yolo_735p_72026_220x_96_each/,"1DTE $21K SPY FD Yolo - 735P 7/20/26 220x @ .96 Each I bought these not too long ago.  
For the auto-mod that won't let me post, this is a $21K FD YOLO

https://preview.redd.it/8a88gwwfeudh1.png?width=861&format=png&auto=webp&s=5f63c3a5cce1f452b2a270320fcf9edc4f675d45

https://preview.redd.it/utj2l458ludh1.png?width=1042&format=png&auto=webp&s=7459df354dd3e36c286e2e5a7378d02b3272ee42

I got them at the very bottom of this chart.

https://preview.redd.it/cpoa926ieudh1.png?width=1423&format=png&auto=webp&s=793c4a78d42f68534a1374f1fd46ba4146156842

Well not much to say...  
I need SPY to tank Monday at open.

The bear has awoken from a long hibernation and is hungry for some bool meat.

This is a pure gamble based on how I perceive the market sentiment.

SPY has dropped below 744 and QQQ can't get back to 700.

That is all, gain/loss post to follow immediately upon closing my position.

**EDIT**  
Holy cow, I was down \~45% within minutes, but the last few minutes dump helped a lot.  
I'm only down 13.62% now going into the weekend.

https://preview.redd.it/vwodx4uwiudh1.png?width=867&format=png&auto=webp&s=6606af62d32c2e60d5bf717f8f68afc5ad51fa39

**TL**;**DR** *BOOLS R FUK*

https://preview.redd.it/rx5ego3gludh1.png?width=362&format=png&auto=webp&s=c14cad2729727c519c41c62d179f2ef04124d16e","Counter({'SPY': 3, 'QQQ': 1, 'BOOLS': 1, 'FUK': 1})",6,-0.3277,6.570882962339585
1uz9ba6,hot,"+230k SPY 0DTE, five out of five 🎯",,698,165,2026-07-17 19:17:05+00:00,https://www.reddit.com/r/wallstreetbets/comments/1uz9ba6/230k_spy_0dte_five_out_of_five/,https://i.redd.it/13igliawaudh1.png,"+230k SPY 0DTE, five out of five 🎯",Counter({'SPY': 1}),1,0.0,11.661638530590354
1uz9b32,hot,"Entire Country Shitting Explosively from Dirty Lettuce.  YOLO Clorox CLX calls $100 8/21 size $22,000","  
  
maybe we get a repricing of hygiene and sanitation securities now that we're all crapping our brains out from coast to coast ",212,81,2026-07-17 19:16:55+00:00,https://www.reddit.com/r/wallstreetbets/comments/1uz9b32/entire_country_shitting_explosively_from_dirty/,https://i.redd.it/wj9ykf3zaudh1.png,"Entire Country Shitting Explosively from Dirty Lettuce.  YOLO Clorox CLX calls $100 8/21 size $22,000   
  
maybe we get a repricing of hygiene and sanitation securities now that we're all crapping our brains out from coast to coast",Counter({'CLX': 1}),1,-0.1697,9.768011412973678
1uz8vnf,hot,"Borrowed $150K From My Wife to Buy TE LEAPS. If I'm Wrong, the Lamborghini Gets Sold.","https://preview.redd.it/3arf1w4u7udh1.png?width=1150&format=png&auto=webp&s=e1f539ca59276de5e7336d6c8cc57a58fc41c0a4

Just sharing an update for those keeping tabs on TE. **I borrowed $150,000 from my wife**. Our agreement was simple. If I'm wrong, I'll sell the Lamborghini and pay her back. 😂

I'm now sitting at roughly 118,000 common shares (low 9 average per share) and 866 long call contracts (I have some July 31st $7.50 and September 18 $12 which I bought when it was in the 9-10s), representing exposure to over 200,000 shares if the calls become deep in the money.

Lambo energy = bulls energy. I'm bullish asf.

Edit: The ""borrowing 150k"" was a joke as I said in the comments ""my money is her money and her money is her money"" so I'm borrowing my own money lmao. Your comments are funny asf keep the roast up plz. ",1195,427,2026-07-17 19:01:28+00:00,https://www.reddit.com/r/wallstreetbets/comments/1uz8vnf/borrowed_150k_from_my_wife_to_buy_te_leaps_if_im/,https://www.reddit.com/r/wallstreetbets/comments/1uz8vnf/borrowed_150k_from_my_wife_to_buy_te_leaps_if_im/,"Borrowed $150K From My Wife to Buy TE LEAPS. If I'm Wrong, the Lamborghini Gets Sold. https://preview.redd.it/3arf1w4u7udh1.png?width=1150&format=png&auto=webp&s=e1f539ca59276de5e7336d6c8cc57a58fc41c0a4

Just sharing an update for those keeping tabs on TE. **I borrowed $150,000 from my wife**. Our agreement was simple. If I'm wrong, I'll sell the Lamborghini and pay her back. 😂

I'm now sitting at roughly 118,000 common shares (low 9 average per share) and 866 long call contracts (I have some July 31st $7.50 and September 18 $12 which I bought when it was in the 9-10s), representing exposure to over 200,000 shares if the calls become deep in the money.

Lambo energy = bulls energy. I'm bullish asf.

Edit: The ""borrowing 150k"" was a joke as I said in the comments ""my money is her money and her money is her money"" so I'm borrowing my own money lmao. Your comments are funny asf keep the roast up plz.",Counter({'LEAPS': 1}),1,0.936,13.145861130092374
1uz7ixa,hot,bernstein bers,"i may be wrong most the time. but when i’m right, im right in a big way.",40,14,2026-07-17 18:12:44+00:00,https://www.reddit.com/r/wallstreetbets/comments/1uz7ixa/bernstein_bers/,https://i.redd.it/g0aonhyjztdh1.jpeg,"bernstein bers i may be wrong most the time. but when i’m right, im right in a big way.",Counter(),0,-0.2617,6.421622267806518
1uz73fi,hot,Weekly Earnings Thread 7/20 7/24,,179,375,2026-07-17 17:57:25+00:00,https://www.reddit.com/r/wallstreetbets/comments/1uz73fi/weekly_earnings_thread_720_724/,https://i.redd.it/clj4j9utwtdh1.jpeg,Weekly Earnings Thread 7/20 7/24,Counter(),0,0.0,11.122545994280106
1uz4ppy,hot,Meta in Talks to Lease Computing Power to Anthropic in Potential $10 Billion Deal,,1872,411,2026-07-17 16:32:03+00:00,https://www.reddit.com/r/wallstreetbets/comments/1uz4ppy/meta_in_talks_to_lease_computing_power_to/,https://www.nytimes.com/2026/07/17/technology/meta-anthropic-ai-computing-power.html?smtyp=cur&smid=tw-nytimes,Meta in Talks to Lease Computing Power to Anthropic in Potential $10 Billion Deal,Counter(),0,0.0,13.556320051793616
1uz4hzm,hot,VIX Can Be Profitable 🐻 💅,Bought UVXY earlier this week and increased my position on Wednesday. Sold for a nice profit. UVXY is a sure fire way to lose money unless you hit a nice step up in volatility just right.,21,12,2026-07-17 16:24:12+00:00,https://www.reddit.com/r/wallstreetbets/comments/1uz4hzm/vix_can_be_profitable/,https://i.redd.it/4ru78d77gtdh1.jpeg,VIX Can Be Profitable 🐻 💅 Bought UVXY earlier this week and increased my position on Wednesday. Sold for a nice profit. UVXY is a sure fire way to lose money unless you hit a nice step up in volatility just right.,"Counter({'UVXY': 2, 'VIX': 1})",3,0.8658,5.655991810819852
1uz415r,hot,140k MUU yolo,Can't wait to see the same 3 memes commented. Will buy more next week if we see the 700s.,106,46,2026-07-17 16:07:03+00:00,https://www.reddit.com/r/wallstreetbets/comments/1uz415r/140k_muu_yolo/,https://i.redd.it/17zw96voctdh1.png,140k MUU yolo Can't wait to see the same 3 memes commented. Will buy more next week if we see the 700s.,Counter({'MUU': 1}),1,0.2732,8.522976436171964
1uz0e8c,hot,$MRAM a cock up my ass,DD: none. Not financial advice,36,40,2026-07-17 13:52:34+00:00,https://www.reddit.com/r/wallstreetbets/comments/1uz0e8c/mram_a_cock_up_my_ass/,https://i.redd.it/1ii40o95psdh1.jpeg,$MRAM a cock up my ass DD: none. Not financial advice,Counter({'MRAM': 2}),2,-0.6249,7.324489979348533
1uz0bbq,hot,"Reformed degenerate, losing money safely","DCA'd from \~$15ea this morning, still like my odds of profiting off this trade by month's end if not sooner. 

But also ow",91,23,2026-07-17 13:49:36+00:00,https://www.reddit.com/r/wallstreetbets/comments/1uz0bbq/reformed_degenerate_losing_money_safely/,https://i.redd.it/3ukn0yxlosdh1.jpeg,"Reformed degenerate, losing money safely DCA'd from \~$15ea this morning, still like my odds of profiting off this trade by month's end if not sooner. 

But also ow",Counter({'DCA': 1}),1,0.431,7.699842407396986
1uz035k,hot,I Put all on black and it went red,Safe to say I’m no longer watching Bridgerton,234,62,2026-07-17 13:41:43+00:00,https://www.reddit.com/r/wallstreetbets/comments/1uz035k/i_put_all_on_black_and_it_went_red/,https://i.redd.it/2q5wt5l7nsdh1.jpeg,I Put all on black and it went red Safe to say I’m no longer watching Bridgerton,Counter(),0,0.1779,9.602720240535692
1uz032r,hot,Apple unseats Nvidia to become world's most valuable company as AI bets shift,,6732,532,2026-07-17 13:41:38+00:00,https://www.reddit.com/r/wallstreetbets/comments/1uz032r/apple_unseats_nvidia_to_become_worlds_most/,https://www.reuters.com/business/apple-closes-nvidia-race-worlds-most-valuable-company-2026-07-17/,Apple unseats Nvidia to become world's most valuable company as AI bets shift,Counter(),0,0.5256,15.093297512711125
1uyvnkf,hot,"AMZN just x10000000 their earnings, invest now",,2320,149,2026-07-17 10:17:29+00:00,https://www.reddit.com/r/wallstreetbets/comments/1uyvnkf/amzn_just_x10000000_their_earnings_invest_now/,https://i.redd.it/dah5n4srmrdh1.jpeg,"AMZN just x10000000 their earnings, invest now",Counter({'AMZN': 1}),1,0.0,12.760388700370694
1uyvcri,hot,"Daily Discussion Thread for July 17, 2026",This post contains content not supported on old Reddit. [Click here to view the full post](https://sh.reddit.com/r/wallstreetbets/comments/1uyvcri),246,13400,2026-07-17 10:00:37+00:00,https://www.reddit.com/r/wallstreetbets/comments/1uyvcri/daily_discussion_thread_for_july_17_2026/,https://www.reddit.com/r/wallstreetbets/comments/1uyvcri/daily_discussion_thread_for_july_17_2026/,"Daily Discussion Thread for July 17, 2026 This post contains content not supported on old Reddit. [Click here to view the full post](https://sh.reddit.com/r/wallstreetbets/comments/1uyvcri)",Counter(),0,-0.2411,15.012472946648206
1uyqwcl,hot,Regard play of the week: AAPL 7/16 Puts 0dte,"Might sound funny but hear me out for a moment:  
The rise in AAPL this week is exactly the same as someone selling computers and used furniture on craigslist to put the funds into their chequing account, only to buy more stuff a few days later.  
The only reason AAPL is up is because market players are parking their money there.

Today we will see a sharp decline across all markets at opening which will go towards a slight recovery at the end of the day. Bears and puts happy. MM job complete. Where is this ATM? AAPL. Liquidity will be pulled away from AAPL to feed the rest of the market. $10K position to start but adding another $5K (probably more) on opening bell. If you feel degen then this is the play for today.

I bought 20 SPY 7/16 750P just before market close yesterday so on market open i’m selling and loading up more AAPL puts. GLHF.

Disclaimer: DD is from my dreams and there absolutely no logical analysis here. The whole market feels irrational so what’s the point of DD for this play",33,28,2026-07-17 05:44:52+00:00,https://www.reddit.com/r/wallstreetbets/comments/1uyqwcl/regard_play_of_the_week_aapl_716_puts_0dte/,https://i.redd.it/do489nv4aqdh1.jpeg,"Regard play of the week: AAPL 7/16 Puts 0dte Might sound funny but hear me out for a moment:  
The rise in AAPL this week is exactly the same as someone selling computers and used furniture on craigslist to put the funds into their chequing account, only to buy more stuff a few days later.  
The only reason AAPL is up is because market players are parking their money there.

Today we will see a sharp decline across all markets at opening which will go towards a slight recovery at the end of the day. Bears and puts happy. MM job complete. Where is this ATM? AAPL. Liquidity will be pulled away from AAPL to feed the rest of the market. $10K position to start but adding another $5K (probably more) on opening bell. If you feel degen then this is the play for today.

I bought 20 SPY 7/16 750P just before market close yesterday so on market open i’m selling and loading up more AAPL puts. GLHF.

Disclaimer: DD is from my dreams and there absolutely no logical analysis here. The whole market feels irrational so what’s the point of DD for this play","Counter({'AAPL': 6, 'ATM': 1, 'SPY': 1, 'GLHF': 1})",9,0.9024,6.893656354602635
1uyqq4b,hot,Micron Rally?,"How low can these memory stocks drop. Seems like theres no true catalyst besides negative market sentiment, considering TSM’s strong earnings ( 10:52 edit, down another 2%)",163,157,2026-07-17 05:35:23+00:00,https://www.reddit.com/r/wallstreetbets/comments/1uyqq4b/micron_rally/,https://i.redd.it/58m4ghsf8qdh1.jpeg,"Micron Rally? How low can these memory stocks drop. Seems like theres no true catalyst besides negative market sentiment, considering TSM’s strong earnings ( 10:52 edit, down another 2%)",Counter({'TSM': 1}),1,-0.128,10.162461460851166
1uyp57r,hot,TSM Anyone?,,18,19,2026-07-17 04:12:24+00:00,https://www.reddit.com/r/wallstreetbets/comments/1uyp57r/tsm_anyone/,https://i.redd.it/g82yrjymtpdh1.jpeg,TSM Anyone?,Counter({'TSM': 1}),1,0.0,5.940171252720431
1uyoal3,hot,1 month vs 3 month,Basically did nothing for a whole month,87,34,2026-07-17 03:30:39+00:00,https://www.reddit.com/r/wallstreetbets/comments/1uyoal3/1_month_vs_3_month/,https://www.reddit.com/gallery/1uyoal3,1 month vs 3 month Basically did nothing for a whole month,Counter(),0,0.0,8.03268487596762
1uym8pk,hot,Is the software bottom in?,,2511,203,2026-07-17 01:54:43+00:00,https://www.reddit.com/r/wallstreetbets/comments/1uym8pk/is_the_software_bottom_in/,https://i.redd.it/ykivoxq15pdh1.png,Is the software bottom in?,Counter(),0,0.0,13.146954521432306
1uykc98,new,TSLQ>SPCG?,"I’ve been holding this bag too long and I see another opportunity to lose more money shorting Elon.

Should I finally dump this bag, loss harvest it, and buy SPCG with the proceeds? 

Give me your most regarded advice please. ",18,9,2026-07-17 00:27:47+00:00,https://www.reddit.com/r/wallstreetbets/comments/1uykc98/tslqspcg/,https://i.redd.it/eekpv5bkpodh1.jpeg,"TSLQ>SPCG? I’ve been holding this bag too long and I see another opportunity to lose more money shorting Elon.

Should I finally dump this bag, loss harvest it, and buy SPCG with the proceeds? 

Give me your most regarded advice please.","Counter({'SPCG': 2, 'TSLQ': 1})",3,-0.3811,5.247024072160486
1uyjsnp,hot,SpaceX Shares Fall After Company Aborts Starship Test Launch,,4264,434,2026-07-17 00:03:32+00:00,https://www.reddit.com/r/wallstreetbets/comments/1uyjsnp/spacex_shares_fall_after_company_aborts_starship/,https://www.wsj.com/livecoverage/stock-market-today-dow-sp-500-nasdaq-07-16-2026/card/spacex-shares-fall-after-company-aborts-starship-test-launch-7W9AZVBPXQO8SCw419cl,SpaceX Shares Fall After Company Aborts Starship Test Launch,Counter(),0,0.296,14.433543491014465
1uyjd2i,hot,Greed can cost dearly.,"I was doing ok this year and had some good money in AMD, Humana. I regretted not riding the sandisk train. I saw it was up and down 10% every other day. Bought PUTS at 2300 and covered when was 20k positive then wanted other way round too and bought short term calls. here we go. ",1012,226,2026-07-16 23:45:18+00:00,https://www.reddit.com/r/wallstreetbets/comments/1uyjd2i/greed_can_cost_dearly/,https://i.redd.it/e0cyswdzhodh1.jpeg,"Greed can cost dearly. I was doing ok this year and had some good money in AMD, Humana. I regretted not riding the sandisk train. I saw it was up and down 10% every other day. Bought PUTS at 2300 and covered when was 20k positive then wanted other way round too and bought short term calls. here we go.",Counter({'AMD': 1}),1,0.7351,12.345621521730086
1uyily5,hot,Chinese filing implies DeepSeek valuation of around $52 billion,,751,281,2026-07-16 23:13:02+00:00,https://www.reddit.com/r/wallstreetbets/comments/1uyily5/chinese_filing_implies_deepseek_valuation_of/,https://www.reuters.com/world/asia-pacific/chinese-filing-implies-deepseek-valuation-around-52-billion-2026-07-16/,Chinese filing implies DeepSeek valuation of around $52 billion,Counter(),0,0.0,12.264643394887955
1uyhxr4,hot,I present to you the best investment fund that has ever existed,"Medallion Fund, a private employee only hedge fund that employs a few hundred PhD researchers that create mathematical algorithms to beat the market. Since inception it has an average annual CAGR of 66.1% and to date has achieved about a **3billion** % return.

It has never had a year of negative returns.

It's wild. Take that Buffet! 

And yes I know this chart only goes back to 1988 when Medallion fund was created but even if you go all the way back to Berkshire inception, the results for Berkshire are barely a drop in the bucket compared to Medallion 😲",4120,386,2026-07-16 22:45:19+00:00,https://www.reddit.com/r/wallstreetbets/comments/1uyhxr4/i_present_to_you_the_best_investment_fund_that/,https://i.redd.it/ijmakrr65odh1.png,"I present to you the best investment fund that has ever existed Medallion Fund, a private employee only hedge fund that employs a few hundred PhD researchers that create mathematical algorithms to beat the market. Since inception it has an average annual CAGR of 66.1% and to date has achieved about a **3billion** % return.

It has never had a year of negative returns.

It's wild. Take that Buffet! 

And yes I know this chart only goes back to 1988 when Medallion fund was created but even if you go all the way back to Berkshire inception, the results for Berkshire are barely a drop in the bucket compared to Medallion 😲",Counter({'CAGR': 1}),1,0.303,14.282275824368599
1uyf968,hot,Why is their earnings call YOU FUCKING TUBE!?,"https://preview.redd.it/2a6qy7bvondh1.png?width=2880&format=png&auto=webp&s=cb804acc09985a478998f51a9a8b3c86452f8932

Title says it all... Going into a busted earnings call where one of the main concerns for stock dump is YouTube, who thought it'd be smart to run the earnings call on YouTube itself!?",388,64,2026-07-16 21:03:16+00:00,https://www.reddit.com/r/wallstreetbets/comments/1uyf968/why_is_their_earnings_call_you_fucking_tube/,https://www.reddit.com/r/wallstreetbets/comments/1uyf968/why_is_their_earnings_call_you_fucking_tube/,"Why is their earnings call YOU FUCKING TUBE!? https://preview.redd.it/2a6qy7bvondh1.png?width=2880&format=png&auto=webp&s=cb804acc09985a478998f51a9a8b3c86452f8932

Title says it all... Going into a busted earnings call where one of the main concerns for stock dump is YouTube, who thought it'd be smart to run the earnings call on YouTube itself!?","Counter({'YOU': 1, 'TUBE': 1})",2,0.3013,10.137966613514083
1uyf8uq,hot,People who cry of losing money… I am with you.,Started spy 0DTEs this year. I get big wins and lose even more. Overall 480K down YTD. But still i do hoping to recover by the end of the year. ,1169,340,2026-07-16 21:02:56+00:00,https://www.reddit.com/r/wallstreetbets/comments/1uyf8uq/people_who_cry_of_losing_money_i_am_with_you/,https://i.redd.it/35w8ayh0pndh1.jpeg,People who cry of losing money… I am with you. Started spy 0DTEs this year. I get big wins and lose even more. Overall 480K down YTD. But still i do hoping to recover by the end of the year.,Counter({'YTD': 1}),1,0.3291,12.89664150507532
1uyf5gk,hot,Netflix shares fell 8% after lukewarm earnings and  a shake-up in how it releases viewing data,,1420,180,2026-07-16 20:59:31+00:00,https://www.reddit.com/r/wallstreetbets/comments/1uyf5gk/netflix_shares_fell_8_after_lukewarm_earnings_and/,https://www.businessinsider.com/netflix-second-quarter-earnings-engagement-report-short-form-video-2026-7,Netflix shares fell 8% after lukewarm earnings and  a shake-up in how it releases viewing data,Counter(),0,0.296,12.457613159362927
1uyf2hb,hot,Momentum stocks seasonality chart,"In case you’re wondering why it feels like every higher beta growth stock you own is getting absolutely relentlessly annihilated.  -27.5% and probably higher after close today.  Higher than 2021 fed shutting the printer down.  July typically is a pullback but this is on the levels of dot com burst, with companies actually still making money.  TSM and ASML just had stellar quarters, mag 7 probably keeps spending.

Anyways, calls. Onward!",342,70,2026-07-16 20:56:20+00:00,https://www.reddit.com/r/wallstreetbets/comments/1uyf2hb/momentum_stocks_seasonality_chart/,https://i.redd.it/vlupvc6unndh1.jpeg,"Momentum stocks seasonality chart In case you’re wondering why it feels like every higher beta growth stock you own is getting absolutely relentlessly annihilated.  -27.5% and probably higher after close today.  Higher than 2021 fed shutting the printer down.  July typically is a pullback but this is on the levels of dot com burst, with companies actually still making money.  TSM and ASML just had stellar quarters, mag 7 probably keeps spending.

Anyways, calls. Onward!","Counter({'TSM': 1, 'ASML': 1})",2,0.4295,10.100410324207257
1uyezbt,hot,A few good trades greatly outnumbered by bad ones.,,175,48,2026-07-16 20:52:49+00:00,https://www.reddit.com/r/wallstreetbets/comments/1uyezbt/a_few_good_trades_greatly_outnumbered_by_bad_ones/,https://i.redd.it/6wdah9m7nndh1.jpeg,A few good trades greatly outnumbered by bad ones.,Counter(),0,-0.2177,9.062304293148777
1uydllp,hot,"What Are Your Moves Tomorrow, July 17, 2026",This post contains content not supported on old Reddit. [Click here to view the full post](https://sh.reddit.com/r/wallstreetbets/comments/1uydllp),210,13810,2026-07-16 20:00:37+00:00,https://www.reddit.com/r/wallstreetbets/comments/1uydllp/what_are_your_moves_tomorrow_july_17_2026/,https://www.reddit.com/r/wallstreetbets/comments/1uydllp/what_are_your_moves_tomorrow_july_17_2026/,"What Are Your Moves Tomorrow, July 17, 2026 This post contains content not supported on old Reddit. [Click here to view the full post](https://sh.reddit.com/r/wallstreetbets/comments/1uydllp)",Counter(),0,-0.2411,14.885078788553994
1uyd0rr,hot,"Thanks Elon for such great POS SPCX 😂😂,",SSPC is 2x Short SPCX etf ,812,176,2026-07-16 19:39:00+00:00,https://www.reddit.com/r/wallstreetbets/comments/1uyd0rr/thanks_elon_for_such_great_pos_spcx/,https://i.redd.it/1jiirmg1andh1.jpeg,"Thanks Elon for such great POS SPCX 😂😂, SSPC is 2x Short SPCX etf","Counter({'SPCX': 2, 'POS': 1, 'SSPC': 1})",4,0.7906,11.87688084212164
1uycjzg,new,Gains evaporated,Sheeeeeeeeeeesh lol,69,19,2026-07-16 19:21:44+00:00,https://www.reddit.com/r/wallstreetbets/comments/1uycjzg/gains_evaporated/,https://i.redd.it/vdqfq7ly6ndh1.jpeg,Gains evaporated Sheeeeeeeeeeesh lol,Counter(),0,0.6369,7.244227515603351
