id,feed,title,body,score,num_comments,created_utc,permalink,url,text,ticker_counts,candidate_mentions,sentiment,engagement
1u0j402,hot,"Fuck the AI buildout, I'm buying calls on cattle because of this little shit","https://preview.redd.it/8papaobe746h1.png?width=300&format=png&auto=webp&s=b6952be7845af117ff18716eccf974764d986a8f

This screwworm is going to do what oil couldn't - pop the AI bubble

Edit: [https://www.youtube.com/watch?v=t1\_MI\_5FHoc](https://www.youtube.com/watch?v=t1_MI_5FHoc) Trump wants to keep beef prices down. Hedge funds drive the futures prices down and the farmers get paid less. If the futures prices go up, the cost of paying the producers more gets passed on to the consumer. Costlier beef makes the price of chicken tendies go up, and causes the consumer price index to skyrocket. Warsh is forced to raise rates. The cheap debt for the AI buildout disappears, and the bubble pops.

Feeder cattle futures is the only way to do this wihout recieving 40000 lbs of live cattle at your doorstep.",5236,521,2026-06-08 20:03:50+00:00,https://www.reddit.com/r/wallstreetbets/comments/1u0j402/fuck_the_ai_buildout_im_buying_calls_on_cattle/,https://www.reddit.com/r/wallstreetbets/comments/1u0j402/fuck_the_ai_buildout_im_buying_calls_on_cattle/,"Fuck the AI buildout, I'm buying calls on cattle because of this little shit https://preview.redd.it/8papaobe746h1.png?width=300&format=png&auto=webp&s=b6952be7845af117ff18716eccf974764d986a8f

This screwworm is going to do what oil couldn't - pop the AI bubble

Edit: [https://www.youtube.com/watch?v=t1\_MI\_5FHoc](https://www.youtube.com/watch?v=t1_MI_5FHoc) Trump wants to keep beef prices down. Hedge funds drive the futures prices down and the farmers get paid less. If the futures prices go up, the cost of paying the producers more gets passed on to the consumer. Costlier beef makes the price of chicken tendies go up, and causes the consumer price index to skyrocket. Warsh is forced to raise rates. The cheap debt for the AI buildout disappears, and the bubble pops.

Feeder cattle futures is the only way to do this wihout recieving 40000 lbs of live cattle at your doorstep.",Counter(),0,-0.9398,14.821171682162127
1u0j0s9,hot,"What Are Your Moves Tomorrow, June 9, 2026",This post contains content not supported on old Reddit. [Click here to view the full post](https://sh.reddit.com/r/wallstreetbets/comments/1u0j0s9),477,6418,2026-06-08 20:00:37+00:00,https://www.reddit.com/r/wallstreetbets/comments/1u0j0s9/what_are_your_moves_tomorrow_june_9_2026/,https://www.reddit.com/r/wallstreetbets/comments/1u0j0s9/what_are_your_moves_tomorrow_june_9_2026/,"What Are Your Moves Tomorrow, June 9, 2026 This post contains content not supported on old Reddit. [Click here to view the full post](https://sh.reddit.com/r/wallstreetbets/comments/1u0j0s9)",Counter(),0,-0.2411,14.936628353803235
1u0ic8d,hot,150k FIG YOLO not going well. Already down,"Holding over 5,000 shares at a $30 avg across 3 accounts.  FML",203,111,2026-06-08 19:36:24+00:00,https://www.reddit.com/r/wallstreetbets/comments/1u0ic8d/150k_fig_yolo_not_going_well_already_down/,https://i.redd.it/5p8r5jnx246h1.jpeg,"150k FIG YOLO not going well. Already down Holding over 5,000 shares at a $30 avg across 3 accounts.  FML","Counter({'FIG': 1, 'FML': 1})",2,0.4971,10.03661886513931
1u0hjte,hot,9k IBM loss,,64,45,2026-06-08 19:08:52+00:00,https://www.reddit.com/r/wallstreetbets/comments/1u0hjte/9k_ibm_loss/,https://i.imgur.com/itA9HKX.jpeg,9k IBM loss,Counter({'IBM': 1}),1,-0.3182,8.003028666384733
1u0gf58,hot,Why wasn't I told that no oil tankers allowed to cross Hormuz or Bab el Mandab meant oil went down in price?,,594,105,2026-06-08 18:30:29+00:00,https://www.reddit.com/r/wallstreetbets/comments/1u0gf58/why_wasnt_i_told_that_no_oil_tankers_allowed_to/,https://i.redd.it/0lzuwg0rq36h1.png,Why wasn't I told that no oil tankers allowed to cross Hormuz or Bab el Mandab meant oil went down in price?,Counter(),0,0.2235,11.052000499657698
1u0fem9,hot,If your not 90% down what are you even doing,"Lost everything 80% in 2021 and the rest 10% on random shit but hey , at least now I learn to not buy meme stocks and trade on er. Btw I am up 600% ytd 281-2.1k . Who know I might end up even in 2 years.",651,115,2026-06-08 17:56:08+00:00,https://www.reddit.com/r/wallstreetbets/comments/1u0fem9/if_your_not_90_down_what_are_you_even_doing/,https://i.redd.it/8ib7y8r1l36h1.jpeg,"If your not 90% down what are you even doing Lost everything 80% in 2021 and the rest 10% on random shit but hey , at least now I learn to not buy meme stocks and trade on er. Btw I am up 600% ytd 281-2.1k . Who know I might end up even in 2 years.",Counter(),0,-0.4497,11.233634753033018
1u0fcmb,hot,"PDT Gone, trading good (QQQ calls)","After Friday’s put gains, I decided to trade the bounce on QQQ.  Might have been a little early on Friday but QQQ came through.  Just gonna ride off into the sunset for now, Godspeed regards  ",160,26,2026-06-08 17:54:31+00:00,https://www.reddit.com/r/wallstreetbets/comments/1u0fcmb/pdt_gone_trading_good_qqq_calls/,https://www.reddit.com/gallery/1u0fcmb,"PDT Gone, trading good (QQQ calls) After Friday’s put gains, I decided to trade the bounce on QQQ.  Might have been a little early on Friday but QQQ came through.  Just gonna ride off into the sunset for now, Godspeed regards",Counter({'QQQ': 3}),3,0.3919,8.377241230988792
1u0ekp2,hot,Bought SPY Puts at today's top🐻,Nice Lil 336% gains for the ber,261,35,2026-06-08 17:27:34+00:00,https://www.reddit.com/r/wallstreetbets/comments/1u0ekp2/bought_spy_puts_at_todays_top/,https://i.redd.it/qppyie4yf36h1.jpeg,Bought SPY Puts at today's top🐻 Nice Lil 336% gains for the ber,Counter({'SPY': 1}),1,0.6369,9.151863442217206
1u0e86f,hot,Im regarded,"well i picked the wrong stocks now my mental health is at the lowest point in my life. last time i do stock picking, clearly this game is designed as a scam to screw people over.

fuck the analysts too, 600 on MSFT, you make me laugh. downgrade that pos to 350",652,190,2026-06-08 17:15:37+00:00,https://www.reddit.com/r/wallstreetbets/comments/1u0e86f/im_regarded/,https://i.redd.it/w3gx16wid36h1.png,"Im regarded well i picked the wrong stocks now my mental health is at the lowest point in my life. last time i do stock picking, clearly this game is designed as a scam to screw people over.

fuck the analysts too, 600 on MSFT, you make me laugh. downgrade that pos to 350",Counter({'MSFT': 1}),1,-0.7096,11.733850557323061
1u0e59a,hot,"It's over, I thought I had a chance today but no","I checked my horoscope which confirmed I'll have some gains but ended up with a 70% loss trading 0 DTEs 3 minutes ago, I'm an international student and some of the money isn't even mine, it's my parents'. On facetime my mum looks at me with pride in her eyes. All I've done is fuck up over and over. I don't even feel alive right now. My master's program is coming to an end by the end of summer and all I have to show are fuck ups. 

I thought I learnt the lesson 3 months ago when the exact same thing happened. 

I hate myself over how much disappointment & suffering I've brought upon them, all they wanted was to feel pride in my achievements and here I am. 

I have a gambling problem. ",601,252,2026-06-08 17:12:54+00:00,https://www.reddit.com/r/wallstreetbets/comments/1u0e59a/its_over_i_thought_i_had_a_chance_today_but_no/,https://i.redd.it/e0t3k54cd36h1.jpeg,"It's over, I thought I had a chance today but no I checked my horoscope which confirmed I'll have some gains but ended up with a 70% loss trading 0 DTEs 3 minutes ago, I'm an international student and some of the money isn't even mine, it's my parents'. On facetime my mum looks at me with pride in her eyes. All I've done is fuck up over and over. I don't even feel alive right now. My master's program is coming to an end by the end of summer and all I have to show are fuck ups. 

I thought I learnt the lesson 3 months ago when the exact same thing happened. 

I hate myself over how much disappointment & suffering I've brought upon them, all they wanted was to feel pride in my achievements and here I am. 

I have a gambling problem.",Counter(),0,-0.9807,11.933646934036341
1u0d8be,hot,$GLXY YOLO,"(Not a space stock even though the ticker sounds like it)

$GLXY CEO was interviewed over the weekend (June 6) on a podcast and says that they have the largest data center in North America and that they are going to do a deal by July 4 (or end of summer at the latest). After that deal, they will have over 1.6 GW of capacity leased out.

Video below, segment starts at 16:10

https://youtu.be/8KgCb6RvxcI?si=E7o-K47SwjqqtLc8

Position:

6,686 shares @ $29.03",57,22,2026-06-08 16:40:36+00:00,https://www.reddit.com/r/wallstreetbets/comments/1u0d8be/glxy_yolo/,https://i.redd.it/0vmu59nk736h1.jpeg,"$GLXY YOLO (Not a space stock even though the ticker sounds like it)

$GLXY CEO was interviewed over the weekend (June 6) on a podcast and says that they have the largest data center in North America and that they are going to do a deal by July 4 (or end of summer at the latest). After that deal, they will have over 1.6 GW of capacity leased out.

Video below, segment starts at 16:10

https://youtu.be/8KgCb6RvxcI?si=E7o-K47SwjqqtLc8

Position:

6,686 shares @ $29.03",Counter({'GLXY': 4}),4,0.7603,7.195937226475569
1u0ce6x,hot,0DTE SPX is the only way? 374% Gain,"https://preview.redd.it/a933o4es136h1.png?width=508&format=png&auto=webp&s=40c0f9a5930659200aac12de7dbebeb7a8c21c36

Title sums it up, never tried this and saw a lot of posts losing their entire portfolios on these things. I got to thinking someone has to be on the other side of these making bank. Started 3 weeks ago resetting account to 50k after some Space gains. 

I obviously have gotten extremely lucky and am going to try and stay away for a little while. Rode out most of 2025 as a bear but recently just wanted to vibe day to day instead of watching it crumble slowly. 

https://preview.redd.it/ujgymr6n136h1.png?width=2126&format=png&auto=webp&s=693c2f986711fb226b97e5869fb26363044da280

  
Hopefully screenshots explain what goin on, theres a few hundred trades so cant tell you what days or contracts. This somewhat sums up what kind of stuff was going on. I would just DCA down and then hope it went up.

https://preview.redd.it/5f7t3yf1236h1.png?width=1386&format=png&auto=webp&s=a83edcc6fa7d409baabe66938932d94829e9b003

",667,187,2026-06-08 16:10:39+00:00,https://www.reddit.com/r/wallstreetbets/comments/1u0ce6x/0dte_spx_is_the_only_way_374_gain/,https://www.reddit.com/r/wallstreetbets/comments/1u0ce6x/0dte_spx_is_the_only_way_374_gain/,"0DTE SPX is the only way? 374% Gain https://preview.redd.it/a933o4es136h1.png?width=508&format=png&auto=webp&s=40c0f9a5930659200aac12de7dbebeb7a8c21c36

Title sums it up, never tried this and saw a lot of posts losing their entire portfolios on these things. I got to thinking someone has to be on the other side of these making bank. Started 3 weeks ago resetting account to 50k after some Space gains. 

I obviously have gotten extremely lucky and am going to try and stay away for a little while. Rode out most of 2025 as a bear but recently just wanted to vibe day to day instead of watching it crumble slowly. 

https://preview.redd.it/ujgymr6n136h1.png?width=2126&format=png&auto=webp&s=693c2f986711fb226b97e5869fb26363044da280

  
Hopefully screenshots explain what goin on, theres a few hundred trades so cant tell you what days or contracts. This somewhat sums up what kind of stuff was going on. I would just DCA down and then hope it went up.

https://preview.redd.it/5f7t3yf1236h1.png?width=1386&format=png&auto=webp&s=a83edcc6fa7d409baabe66938932d94829e9b003","Counter({'SPX': 1, 'DCA': 1})",2,0.9101,11.740730136366594
1u0bojo,hot,SpaceX is buying Tesla - Double Down,"**The Bet:**

Now 223 (up from 115) contracts of the Tesla December 18, 2026 $990 calls now at $3.61 — the single most profitable option out of roughly 8,000 different contracts on the entire Tesla chain in the event of a surprise purchase announcement.

**The Setup**:

Elon has repeatedly said he views advanced AI and humanoid robots like Optimus as a potential existential risk to humanity.

He tried to secure 25% voting control at Tesla to protect his ability to steer that future. When he couldn’t get it, he built absolute control in SpaceX instead. 

He can sign a definitive purchase agreement wherein Tesla shareholders receive SpaceX shares for their Tesla shares.

After the announcement the shares will trade in lock-step until the deal closes approximately six months later.

1 + 1 = 3

**The Payoff:**

Selling all options at extrinsic value + hyper IV on the day of the announcement.",1547,248,2026-06-08 15:45:58+00:00,https://www.reddit.com/r/wallstreetbets/comments/1u0bojo/spacex_is_buying_tesla_double_down/,https://i.redd.it/ljbhgkstx26h1.jpeg,"SpaceX is buying Tesla - Double Down **The Bet:**

Now 223 (up from 115) contracts of the Tesla December 18, 2026 $990 calls now at $3.61 — the single most profitable option out of roughly 8,000 different contracts on the entire Tesla chain in the event of a surprise purchase announcement.

**The Setup**:

Elon has repeatedly said he views advanced AI and humanoid robots like Optimus as a potential existential risk to humanity.

He tried to secure 25% voting control at Tesla to protect his ability to steer that future. When he couldn’t get it, he built absolute control in SpaceX instead. 

He can sign a definitive purchase agreement wherein Tesla shareholders receive SpaceX shares for their Tesla shares.

After the announcement the shares will trade in lock-step until the deal closes approximately six months later.

1 + 1 = 3

**The Payoff:**

Selling all options at extrinsic value + hyper IV on the day of the announcement.",Counter(),0,0.9726,12.86217195061438
1u0audl,hot,Thanks paper hand,Your contribution to my networth is recognized,20,1,2026-06-08 15:15:43+00:00,https://www.reddit.com/r/wallstreetbets/comments/1u0audl/thanks_paper_hand/,https://i.redd.it/n0vhjxhfs26h1.jpeg,Thanks paper hand Your contribution to my networth is recognized,Counter(),0,0.7269,3.7376696182833684
1u0aqq4,hot,All in on MSTR,Yolo on MSTR. Corn is going to bounce back and Saylor is taking me to the promise land. ,214,142,2026-06-08 15:11:57+00:00,https://www.reddit.com/r/wallstreetbets/comments/1u0aqq4/all_in_on_mstr/,https://i.redd.it/8ljyj3oor26h1.jpeg,All in on MSTR Yolo on MSTR. Corn is going to bounce back and Saylor is taking me to the promise land.,Counter({'MSTR': 2}),2,0.5267,10.33348265838757
1u0a7jw,hot,At least the adds at IBKR are honest.,,1602,70,2026-06-08 14:52:56+00:00,https://www.reddit.com/r/wallstreetbets/comments/1u0a7jw/at_least_the_adds_at_ibkr_are_honest/,https://i.redd.it/ghztu96do26h1.jpeg,At least the adds at IBKR are honest.,Counter({'IBKR': 1}),1,0.5106,11.642312029650867
1u09wg3,hot,Nebius Is Dropping £1.7B on UK NVIDIA AI Infrastructure While Everyone Keeps Calling AI a Bubble,Source - [https://nebius.com/newsroom/nebius-expands-in-uk-with-more-nvidia-powered-infrastructure-more-customers-and-more-cloud-capabilities-for-agentic-and-enterprise-ai](https://nebius.com/newsroom/nebius-expands-in-uk-with-more-nvidia-powered-infrastructure-more-customers-and-more-cloud-capabilities-for-agentic-and-enterprise-ai),84,50,2026-06-08 14:41:44+00:00,https://www.reddit.com/r/wallstreetbets/comments/1u09wg3/nebius_is_dropping_17b_on_uk_nvidia_ai/,https://i.redd.it/71vwdst8m26h1.png,Nebius Is Dropping £1.7B on UK NVIDIA AI Infrastructure While Everyone Keeps Calling AI a Bubble Source - [https://nebius.com/newsroom/nebius-expands-in-uk-with-more-nvidia-powered-infrastructure-more-customers-and-more-cloud-capabilities-for-agentic-and-enterprise-ai](https://nebius.com/newsroom/nebius-expands-in-uk-with-more-nvidia-powered-infrastructure-more-customers-and-more-cloud-capabilities-for-agentic-and-enterprise-ai),Counter(),0,0.0,8.374476889214643
1u0734k,hot,"Strategy resumes bitcoin buying spree, quelling market panic",,754,120,2026-06-08 12:55:25+00:00,https://www.reddit.com/r/wallstreetbets/comments/1u0734k/strategy_resumes_bitcoin_buying_spree_quelling/,https://www.investing.com/news/stock-market-news/strategy-resumes-bitcoin-buying-spree-quelling-market-panic-4730601,"Strategy resumes bitcoin buying spree, quelling market panic",Counter(),0,-0.5106,11.422508294845766
1u05rz2,hot,NVIDIA and SK hynix Announce Multiyear Technology Partnership to Advance Memory for AI Factories,"**News Summary:**

* NVIDIA and SK hynix announce multiyear technology partnership for next-generation memory aligned to NVIDIA’s AI infrastructure roadmap.
* The agreement supports supply for advanced memory, addressing the extended development cycles, advanced fabrication and capital investments to sustain the global buildout of AI factories.
* SK hynix will diversify into new markets NVIDIA is creating — across AI infrastructure, personal AI and physical AI — codeveloping memory for NVIDIA Vera Rubin AI supercomputers, Vera CPUs, RTX Spark-powered PCs and Jetson Thor robotic computing platforms.
* The two companies will apply AI to semiconductor chip design and manufacturing, using NVIDIA CUDA-X libraries and NVIDIA PhysicsNeMo to accelerate semiconductor simulations, TCAD workflows and in-house engineering codes.
* SK hynix will advance factory digital twins by combining NVIDIA Omniverse, OpenUSD scene optimization and NVIDIA cuOpt to drive fully autonomous fab operations.",427,21,2026-06-08 11:58:11+00:00,https://www.reddit.com/r/wallstreetbets/comments/1u05rz2/nvidia_and_sk_hynix_announce_multiyear_technology/,https://nvidianews.nvidia.com/news/sk-hynix-ai-factory,"NVIDIA and SK hynix Announce Multiyear Technology Partnership to Advance Memory for AI Factories **News Summary:**

* NVIDIA and SK hynix announce multiyear technology partnership for next-generation memory aligned to NVIDIA’s AI infrastructure roadmap.
* The agreement supports supply for advanced memory, addressing the extended development cycles, advanced fabrication and capital investments to sustain the global buildout of AI factories.
* SK hynix will diversify into new markets NVIDIA is creating — across AI infrastructure, personal AI and physical AI — codeveloping memory for NVIDIA Vera Rubin AI supercomputers, Vera CPUs, RTX Spark-powered PCs and Jetson Thor robotic computing platforms.
* The two companies will apply AI to semiconductor chip design and manufacturing, using NVIDIA CUDA-X libraries and NVIDIA PhysicsNeMo to accelerate semiconductor simulations, TCAD workflows and in-house engineering codes.
* SK hynix will advance factory digital twins by combining NVIDIA Omniverse, OpenUSD scene optimization and NVIDIA cuOpt to drive fully autonomous fab operations.","Counter({'RTX': 1, 'CUDA': 1, 'TCAD': 1})",3,0.9411,9.150165648940114
1u04xv0,hot,Anthropic and Google Are Paying SpaceX $2.17 Billion Every Month,,10768,1053,2026-06-08 11:17:28+00:00,https://www.reddit.com/r/wallstreetbets/comments/1u04xv0/anthropic_and_google_are_paying_spacex_217/,https://www.ibtimes.co.uk/spacex-google-data-centre-deal-1801386,Anthropic and Google Are Paying SpaceX $2.17 Billion Every Month,Counter(),0,0.0,16.244774644430187
1u04oxe,hot,SK Telecom and NVIDIA Build AI Infrastructure to Power Korea’s AI Innovation,,302,22,2026-06-08 11:04:58+00:00,https://www.reddit.com/r/wallstreetbets/comments/1u04oxe/sk_telecom_and_nvidia_build_ai_infrastructure_to/,https://nvidianews.nvidia.com/news/sk-telecom-ai-infrastructure,SK Telecom and NVIDIA Build AI Infrastructure to Power Korea’s AI Innovation,Counter(),0,0.3818,8.84922702143852
1u03hhc,hot,"Daily Discussion Thread for June 8, 2026",This post contains content not supported on old Reddit. [Click here to view the full post](https://sh.reddit.com/r/wallstreetbets/comments/1u03hhc),404,12049,2026-06-08 10:00:37+00:00,https://www.reddit.com/r/wallstreetbets/comments/1u03hhc/daily_discussion_thread_for_june_8_2026/,https://www.reddit.com/r/wallstreetbets/comments/1u03hhc/daily_discussion_thread_for_june_8_2026/,"Daily Discussion Thread for June 8, 2026 This post contains content not supported on old Reddit. [Click here to view the full post](https://sh.reddit.com/r/wallstreetbets/comments/1u03hhc)",Counter(),0,-0.2411,15.400707006025339
1u01srk,hot,Profit is profit (QQQ Puts),Unfortunately not degen enough to hold until end of day (these were worth $75k EOD btw),112,22,2026-06-08 08:20:51+00:00,https://www.reddit.com/r/wallstreetbets/comments/1u01srk/profit_is_profit_qqq_puts/,https://i.redd.it/ext61xveq06h1.jpeg,Profit is profit (QQQ Puts) Unfortunately not degen enough to hold until end of day (these were worth $75k EOD btw),"Counter({'QQQ': 1, 'EOD': 1})",2,0.6486,7.8628820346414905
1u00g3k,hot,NVIDIA CEO Has Good News for Micron and SanDisk Investors: “The Memory Shortage to Continue for Several Years”,"Good news for MU & SNDK. “If the multi-year shortage Huang outlined tonight holds, the recent pullback in MU and SNDK looks like a setup rather than a peak signal.”",2681,165,2026-06-08 07:02:06+00:00,https://www.reddit.com/r/wallstreetbets/comments/1u00g3k/nvidia_ceo_has_good_news_for_micron_and_sandisk/,https://finance.yahoo.com/markets/stocks/articles/nvidia-ceo-good-news-micron-042808161.html,"NVIDIA CEO Has Good News for Micron and SanDisk Investors: “The Memory Shortage to Continue for Several Years” Good news for MU & SNDK. “If the multi-year shortage Huang outlined tonight holds, the recent pullback in MU and SNDK looks like a setup rather than a peak signal.”",Counter({'SNDK': 2}),2,0.6486,13.006305852198167
1tzznm4,new,Market is dropping but my stock is green,her name is Li! buy the dip before we rip and short covering ,17,18,2026-06-08 06:16:07+00:00,https://www.reddit.com/r/wallstreetbets/comments/1tzznm4/market_is_dropping_but_my_stock_is_green/,https://i.redd.it/vsmgb4k4406h1.png,Market is dropping but my stock is green her name is Li! buy the dip before we rip and short covering,Counter(),0,0.0,5.834810737062605
1tzziaa,hot,It's Popcorn week guys!,,647,42,2026-06-08 06:07:49+00:00,https://www.reddit.com/r/wallstreetbets/comments/1tzziaa/its_popcorn_week_guys/,https://i.redd.it/825iq6rm206h1.png,It's Popcorn week guys!,Counter(),0,0.0,10.235090812045836
1tzx8m0,hot,Tech sell-off widens as South Korea index plunges,"South Korea’s Kospi, which is dominated by chipmakers Samsung and SK Hynix, is down almost 15% from last week’s record high. ",4764,256,2026-06-08 04:05:54+00:00,https://www.reddit.com/r/wallstreetbets/comments/1tzx8m0/tech_selloff_widens_as_south_korea_index_plunges/,https://www.ft.com/content/2f0f727b-5315-445c-b8f1-6aa65bd7474c,"Tech sell-off widens as South Korea index plunges South Korea’s Kospi, which is dominated by chipmakers Samsung and SK Hynix, is down almost 15% from last week’s record high.",Counter(),0,0.0,14.018128900983523
1tzwvdl,hot,Netflix yolo,"Poised for a breakout once the AI noise dies down. Every loser on here has Netflix (I only own stock, can’t afford the subscription). ",142,43,2026-06-08 03:47:57+00:00,https://www.reddit.com/r/wallstreetbets/comments/1tzwvdl/netflix_yolo/,https://i.redd.it/6ijsg73qdz5h1.jpeg,"Netflix yolo Poised for a breakout once the AI noise dies down. Every loser on here has Netflix (I only own stock, can’t afford the subscription).",Counter(),0,-0.0772,8.747034264178168
1tzugjh,hot,100k+ gain shorting Nebius and Marvell last Thursday,"Timed the absolute top somehow, must be the only smoothie who made money, soz too all those who got wrecked friday.

https://preview.redd.it/0n4u02sdsy5h1.png?width=1271&format=png&auto=webp&s=08788908667883fa2bbf54c33efa89ca96f9a113

",707,64,2026-06-08 01:49:10+00:00,https://www.reddit.com/r/wallstreetbets/comments/1tzugjh/100k_gain_shorting_nebius_and_marvell_last/,https://www.reddit.com/r/wallstreetbets/comments/1tzugjh/100k_gain_shorting_nebius_and_marvell_last/,"100k+ gain shorting Nebius and Marvell last Thursday Timed the absolute top somehow, must be the only smoothie who made money, soz too all those who got wrecked friday.

https://preview.redd.it/0n4u02sdsy5h1.png?width=1271&format=png&auto=webp&s=08788908667883fa2bbf54c33efa89ca96f9a113",Counter(),0,0.6369,10.736831363589356
1tzu9yg,hot,First and last time trading futures contracts.,"Shorted NASDAQ futures out of sheer stupidity after turning on margin last night then almost blew up my account doubling and tripling down. Somehow managed to hit the sell(buy)button exactly on that drop and it rebounded 10 seconds later.

Robinhood makes it very easy to turn on margin btw.",236,100,2026-06-08 01:40:25+00:00,https://www.reddit.com/r/wallstreetbets/comments/1tzu9yg/first_and_last_time_trading_futures_contracts/,https://www.reddit.com/gallery/1tzu9yg,"First and last time trading futures contracts. Shorted NASDAQ futures out of sheer stupidity after turning on margin last night then almost blew up my account doubling and tripling down. Somehow managed to hit the sell(buy)button exactly on that drop and it rebounded 10 seconds later.

Robinhood makes it very easy to turn on margin btw.",Counter(),0,-0.204,10.083180657976392
1tzt4zf,hot,Looks like meats back on the menu boys,Calls on SPCX. Puts on PSQ. Our lord and savior Leather jacket will carry us to Valhalla. ,699,151,2026-06-08 00:46:25+00:00,https://www.reddit.com/r/wallstreetbets/comments/1tzt4zf/looks_like_meats_back_on_the_menu_boys/,https://i.redd.it/h032t85chy5h1.jpeg,Looks like meats back on the menu boys Calls on SPCX. Puts on PSQ. Our lord and savior Leather jacket will carry us to Valhalla.,"Counter({'SPCX': 1, 'PSQ': 1})",2,0.3612,11.574960855889682
