id,feed,title,body,score,num_comments,created_utc,permalink,url,text,ticker_counts,candidate_mentions,sentiment,engagement
1tzsegn,hot,CELH is criminally undervalued. My biggest YOLO ever - $95k,"I’ll keep it simple. EBITDA growing massively and they’re continuing to take share. CELH trades for 9x EBITDA while Monster trades for 25x with slower growth. Alani NU integration remains on track. Stock should easily be $50 and it would still trade a significant multiple discount to Monster. Market always wakes up to strong results eventually. 

Also, doesn’t hurt to have a little AI insulation is the current environment.

Will roll the June calls out to July / September but think we’ll see a bounce over the next week or two. Stock held up great on Friday. Entered the position right before close on Friday so don’t say I didn’t warn you! ",207,233,2026-06-08 00:12:34+00:00,https://www.reddit.com/r/wallstreetbets/comments/1tzsegn/celh_is_criminally_undervalued_my_biggest_yolo/,https://i.redd.it/qf39hlraby5h1.jpeg,"CELH is criminally undervalued. My biggest YOLO ever - $95k I’ll keep it simple. EBITDA growing massively and they’re continuing to take share. CELH trades for 9x EBITDA while Monster trades for 25x with slower growth. Alani NU integration remains on track. Stock should easily be $50 and it would still trade a significant multiple discount to Monster. Market always wakes up to strong results eventually. 

Also, doesn’t hurt to have a little AI insulation is the current environment.

Will roll the June calls out to July / September but think we’ll see a bounce over the next week or two. Stock held up great on Friday. Entered the position right before close on Friday so don’t say I didn’t warn you!",Counter({'CELH': 2}),2,0.9013,10.79285919505902
1tzs3y2,hot,"Went from a +6,467.76% gain to a measly +4,735.41 gain on MU LEAPS. The one time I should've listened to you regards I didn't. FML","Hoping tomorrow will be green so I can just cash out, be done with it and relax. I promise I will sell this time!

Oh yeah, last time you guys were making fun of me for only having a $100 left in cash and hurted my feelings so I maxed margined and bought some 0DTE Puts on SPY last Friday and was able to close for a bit over 50k. Nice little cash pile there now, am I Warren Buffet yet?

Previous post - https://www.reddit.com/r/wallstreetbets/s/Z2Elf3fgeJ",107,61,2026-06-07 23:59:49+00:00,https://www.reddit.com/r/wallstreetbets/comments/1tzs3y2/went_from_a_646776_gain_to_a_measly_473541_gain/,https://i.redd.it/w8sn0xu09y5h1.jpeg,"Went from a +6,467.76% gain to a measly +4,735.41 gain on MU LEAPS. The one time I should've listened to you regards I didn't. FML Hoping tomorrow will be green so I can just cash out, be done with it and relax. I promise I will sell this time!

Oh yeah, last time you guys were making fun of me for only having a $100 left in cash and hurted my feelings so I maxed margined and bought some 0DTE Puts on SPY last Friday and was able to close for a bit over 50k. Nice little cash pile there now, am I Warren Buffet yet?

Previous post - https://www.reddit.com/r/wallstreetbets/s/Z2Elf3fgeJ","Counter({'LEAPS': 1, 'FML': 1, 'SPY': 1})",3,0.9536,8.809265612169312
1tzrxwl,new,-11k to +3k. Btc short 10x leverage,Everyone was shitting on me for shorting btc. Portfolio was at 33k - 38k for 3 months. I held through it. Now it's sitting at 50k. Thanks to wsb regards for demotivating me. ,47,18,2026-06-07 23:51:50+00:00,https://www.reddit.com/r/wallstreetbets/comments/1tzrxwl/11k_to_3k_btc_short_10x_leverage/,https://www.reddit.com/gallery/1tzrxwl,-11k to +3k. Btc short 10x leverage Everyone was shitting on me for shorting btc. Portfolio was at 33k - 38k for 3 months. I held through it. Now it's sitting at 50k. Thanks to wsb regards for demotivating me.,Counter(),0,0.0258,6.815639990074331
1tzrkfa,hot,$47 fee? No wonder crypto is fucking dead,,392,174,2026-06-07 23:34:42+00:00,https://www.reddit.com/r/wallstreetbets/comments/1tzrkfa/47_fee_no_wonder_crypto_is_fucking_dead/,https://i.redd.it/f1zi3sij4y5h1.jpeg,$47 fee? No wonder crypto is fucking dead,Counter(),0,-0.7778,11.138595585792775
1tzqy9p,new,"Nio ES9 to hit 10,000 deliveries this month as exec disputes Li Auto chassis test",,45,8,2026-06-07 23:07:15+00:00,https://www.reddit.com/r/wallstreetbets/comments/1tzqy9p/nio_es9_to_hit_10000_deliveries_this_month_as/,https://cnevpost.com/2026/06/05/nio-es9-hit-10000-deliveries-this-month/,"Nio ES9 to hit 10,000 deliveries this month as exec disputes Li Auto chassis test",Counter(),0,-0.2732,6.025865973825315
1tzp29r,hot,Elon Musk has spouted his fair share of bullshit—but his latest claims about the SpaceX IPO are on a whole new level.,,4728,433,2026-06-07 21:46:35+00:00,https://www.reddit.com/r/wallstreetbets/comments/1tzp29r/elon_musk_has_spouted_his_fair_share_of/,https://text.tchncs.de/chronik-des-laufenden-wahnsinns/h1elon-musk-has-spouted-his-fair-share-of-bullshit-but-his-latest-claims-about,Elon Musk has spouted his fair share of bullshit—but his latest claims about the SpaceX IPO are on a whole new level.,Counter(),0,0.5423,14.534513576744281
1tzoodm,hot,coca cola is up 3% while the market fucked me sideways without a condom or even a courtesy reach-around,"nasdaq dropped 4% and these cock-sucking chip stocks didn't even buy me dinner first. broadcom opened its fucking mouth, said absolutely nothing useful about AI, and the entire semiconductor sector collectively shit the bed and died. my calls are fucking worthless. i meanwhile coca-cola a company that sells fizzy brown piss water is up 3% handing out condoms like a smug bastard AFTER every bull got absolutely railed.

i hate this market, i hate these bears, and i hope every short seller steps on a shit, slips on a condom, and falls into a vat of flat coke. 🐻📉",721,126,2026-06-07 21:30:47+00:00,https://www.reddit.com/r/wallstreetbets/comments/1tzoodm/coca_cola_is_up_3_while_the_market_fucked_me/,https://www.reddit.com/r/wallstreetbets/comments/1tzoodm/coca_cola_is_up_3_while_the_market_fucked_me/,"coca cola is up 3% while the market fucked me sideways without a condom or even a courtesy reach-around nasdaq dropped 4% and these cock-sucking chip stocks didn't even buy me dinner first. broadcom opened its fucking mouth, said absolutely nothing useful about AI, and the entire semiconductor sector collectively shit the bed and died. my calls are fucking worthless. i meanwhile coca-cola a company that sells fizzy brown piss water is up 3% handing out condoms like a smug bastard AFTER every bull got absolutely railed.

i hate this market, i hate these bears, and i hope every short seller steps on a shit, slips on a condom, and falls into a vat of flat coke. 🐻📉",Counter({'AFTER': 1}),1,-0.9809,11.426212225351417
1tznvuv,hot,Lots of questions will be answered in about an hour.,,578,239,2026-06-07 20:58:56+00:00,https://www.reddit.com/r/wallstreetbets/comments/1tznvuv/lots_of_questions_will_be_answered_in_about_an/,https://i.redd.it/5vt0yt2rcx5h1.jpeg,Lots of questions will be answered in about an hour.,Counter(),0,0.0,11.841941400914987
1tzn8h9,hot,Tom Lee Was Called Out by Scott Wapner on CNBC Closing Bell Friday,"Understandably CNBC cut the calling-out bit out of the 2min video they posted of Tom Lee’s interview on Friday, but it was the most contentious I’ve seen Scott get with a bull like Tom in a long long while.

Essentially Scott asked Tom if this is the AI/chip correction Tom had predicted on cnbc recently, to which Tom gave a waffling “meh no but big sad,” after which Scott straight up called him out.

Scott specifically asked why that’s the case and why Tom is being overly bullish when the market is clearly spooked about something. Tom gave another non-answer. If you have a CNBC subscription, it’s a really interesting interview and I recommend checking it out.

Regular WSB autism and snark aside, this is why famous active CIO permabol lack credibility in my mind, because they don’t know how to talk about downturns in public. Of course the permaber are even worse because they are almost always wrong.

I feel like Tom Lee is one of the worst offenders, partly because he tries to come across so low key and unassuming, when really he’s very calculated and I would wager (my opinion) performative.

I can admit he’s been right more than he’s been wrong, but I also wouldn’t base positions on what he says when the vix starts to creep.

Calling him a fat cuck aside, what do you all think of Tom Lee? Is he legit, or is he more momma Cathie than maverick investment bro?",184,182,2026-06-07 20:33:30+00:00,https://www.reddit.com/r/wallstreetbets/comments/1tzn8h9/tom_lee_was_called_out_by_scott_wapner_on_cnbc/,https://i.redd.it/brm9s3p78x5h1.jpeg,"Tom Lee Was Called Out by Scott Wapner on CNBC Closing Bell Friday Understandably CNBC cut the calling-out bit out of the 2min video they posted of Tom Lee’s interview on Friday, but it was the most contentious I’ve seen Scott get with a bull like Tom in a long long while.

Essentially Scott asked Tom if this is the AI/chip correction Tom had predicted on cnbc recently, to which Tom gave a waffling “meh no but big sad,” after which Scott straight up called him out.

Scott specifically asked why that’s the case and why Tom is being overly bullish when the market is clearly spooked about something. Tom gave another non-answer. If you have a CNBC subscription, it’s a really interesting interview and I recommend checking it out.

Regular WSB autism and snark aside, this is why famous active CIO permabol lack credibility in my mind, because they don’t know how to talk about downturns in public. Of course the permaber are even worse because they are almost always wrong.

I feel like Tom Lee is one of the worst offenders, partly because he tries to come across so low key and unassuming, when really he’s very calculated and I would wager (my opinion) performative.

I can admit he’s been right more than he’s been wrong, but I also wouldn’t base positions on what he says when the vix starts to creep.

Calling him a fat cuck aside, what do you all think of Tom Lee? Is he legit, or is he more momma Cathie than maverick investment bro?","Counter({'CNBC': 3, 'CIO': 1})",4,-0.8919,10.429841977919747
1tzmzdo,hot,SpaceX Quietly Became an AI Cloud Company and Google Is Paying Almost $1B/Month for GPU Compute,,5482,599,2026-06-07 20:23:45+00:00,https://www.reddit.com/r/wallstreetbets/comments/1tzmzdo/spacex_quietly_became_an_ai_cloud_company_and/,https://i.redd.it/6v3gu4gg6x5h1.png,SpaceX Quietly Became an AI Cloud Company and Google Is Paying Almost $1B/Month for GPU Compute,Counter(),0,0.0,15.006337330620195
1tzmahm,hot,"What Are Your Moves Tomorrow, June 08, 2026",This post contains content not supported on old Reddit. [Click here to view the full post](https://sh.reddit.com/r/wallstreetbets/comments/1tzmahm),231,10766,2026-06-07 19:57:09+00:00,https://www.reddit.com/r/wallstreetbets/comments/1tzmahm/what_are_your_moves_tomorrow_june_08_2026/,https://www.reddit.com/r/wallstreetbets/comments/1tzmahm/what_are_your_moves_tomorrow_june_08_2026/,"What Are Your Moves Tomorrow, June 08, 2026 This post contains content not supported on old Reddit. [Click here to view the full post](https://sh.reddit.com/r/wallstreetbets/comments/1tzmahm)",Counter(),0,-0.2411,14.730978551482028
1tzllmw,hot,Iran Fires Missiles at Israel After Israeli Airstrike on Beirut,,3959,523,2026-06-07 19:30:34+00:00,https://www.reddit.com/r/wallstreetbets/comments/1tzllmw/iran_fires_missiles_at_israel_after_israeli/,https://www.wsj.com/world/middle-east/iran-fires-missiles-at-israel-after-israeli-airstrike-on-beirut-a93b4da7?mod=hp_lead_pos1,Iran Fires Missiles at Israel After Israeli Airstrike on Beirut,Counter(),0,0.0,14.545490988569568
1tzgton,hot,"Nvidia, SK to detail cooperation plan as Jensen Huang flags prolonged chip shortage",">Nvidia and South Korea's SK \[Hynix\] are expected to announce a plan for cooperation between the two companies on Monday (Jun 8), with the boss of the US chipmaker saying that the ongoing memory shortage would persist for ""quite a few years"".

Bullish for chip stocks on Monday. Am I right, you mother fellas?",682,76,2026-06-07 16:32:19+00:00,https://www.reddit.com/r/wallstreetbets/comments/1tzgton/nvidia_sk_to_detail_cooperation_plan_as_jensen/,https://www.channelnewsasia.com/business/nvidia-sk-chips-memory-shortage-jensen-huang-6167326,"Nvidia, SK to detail cooperation plan as Jensen Huang flags prolonged chip shortage >Nvidia and South Korea's SK \[Hynix\] are expected to announce a plan for cooperation between the two companies on Monday (Jun 8), with the boss of the US chipmaker saying that the ongoing memory shortage would persist for ""quite a few years"".

Bullish for chip stocks on Monday. Am I right, you mother fellas?",Counter(),0,-0.4588,10.870300281424473
1tzgqz0,hot,New pride month t-shirt just dropped,,1864,37,2026-06-07 16:29:27+00:00,https://www.reddit.com/r/wallstreetbets/comments/1tzgqz0/new_pride_month_tshirt_just_dropped/,https://i.redd.it/x7mxsf7o0w5h1.jpeg,New pride month t-shirt just dropped,Counter(),0,0.34,11.1686024918043
1tz89c4,top,Welp,,875,106,2026-06-07 10:12:52+00:00,https://www.reddit.com/r/wallstreetbets/comments/1tz89c4/welp/,https://i.redd.it/cw2gwseh5u5h1.jpeg,Welp,Counter(),0,0.0,11.448194925398298
1tz89aa,hot,Priorities,,14598,134,2026-06-07 10:12:47+00:00,https://www.reddit.com/r/wallstreetbets/comments/1tz89aa/priorities/,https://v.redd.it/9jqrc3hg5u5h1,Priorities,Counter(),0,0.0,14.493983090638409
1tyyxbo,top,Reddit is being overlooked,"Looking for someone to help me understand why one of the important companies to the AI ecosystem is sitting at $30b market cap. 

Right now Reddit is capturing .01% of the CapX spending this year even though they are the #1 most cited source in responses and are sitting on 20 years of some of the best training data there is.

10% of Reddit's revenue ($100m) is coming from deals they have with companies to access their API for training purposes. The majority of this $100m is from deals they signed with OpenAI and Google in 2024. They are due to expire in 2026-27, and I'd have to think the price is going to shoot way up. 

Honestly the only counter argument I see here is that models only need to be trained on data once, but there is, i dont even know how many, new posts on reddit every single day and having the live connection will always be needed for these models to stay up to date, especially on current events and time sensitive information. There's nothing even close to the type of data collection Reddit is gathering. 

Sold some of my AMD position to buy RDDT shares this week and im having a hard time  convincing myself to not go all in on RDDT. Help me see the light.  ",1273,545,2026-06-07 01:42:19+00:00,https://www.reddit.com/r/wallstreetbets/comments/1tyyxbo/reddit_is_being_overlooked/,https://www.reddit.com/r/wallstreetbets/comments/1tyyxbo/reddit_is_being_overlooked/,"Reddit is being overlooked Looking for someone to help me understand why one of the important companies to the AI ecosystem is sitting at $30b market cap. 

Right now Reddit is capturing .01% of the CapX spending this year even though they are the #1 most cited source in responses and are sitting on 20 years of some of the best training data there is.

10% of Reddit's revenue ($100m) is coming from deals they have with companies to access their API for training purposes. The majority of this $100m is from deals they signed with OpenAI and Google in 2024. They are due to expire in 2026-27, and I'd have to think the price is going to shoot way up. 

Honestly the only counter argument I see here is that models only need to be trained on data once, but there is, i dont even know how many, new posts on reddit every single day and having the live connection will always be needed for these models to stay up to date, especially on current events and time sensitive information. There's nothing even close to the type of data collection Reddit is gathering. 

Sold some of my AMD position to buy RDDT shares this week and im having a hard time  convincing myself to not go all in on RDDT. Help me see the light.","Counter({'RDDT': 2, 'API': 1, 'AMD': 1})",4,0.9127,13.452535811877013
1tyvyno,top,How can an exchange lose money? all they have to do is fill orders,,1864,256,2026-06-06 23:21:21+00:00,https://www.reddit.com/r/wallstreetbets/comments/1tyvyno/how_can_an_exchange_lose_money_all_they_have_to/,https://i.redd.it/1yn4dts8xq5h1.jpeg,How can an exchange lose money? all they have to do is fill orders,Counter(),0,-0.4019,13.080092416973136
1tyumtc,top,im starting to masturbate every morning before I open robinhood,"this is what ive been doing and Ive been making decent gains, I heard that the post nut clarity makes you think a lil better so I could make better decisions 

has anyone else tried it?",5356,371,2026-06-06 22:22:40+00:00,https://www.reddit.com/r/wallstreetbets/comments/1tyumtc/im_starting_to_masturbate_every_morning_before_i/,https://www.reddit.com/r/wallstreetbets/comments/1tyumtc/im_starting_to_masturbate_every_morning_before_i/,"im starting to masturbate every morning before I open robinhood this is what ive been doing and Ive been making decent gains, I heard that the post nut clarity makes you think a lil better so I could make better decisions 

has anyone else tried it?",Counter(),0,0.872,14.505053250154106
1tyk5v7,top,Trump admin proposes public stakes in AI companies,"we are going to gap up so hard on Monday

[https://www.reuters.com/business/trump-says-his-team-will-look-into-us-taking-stake-ai-companies-2026-06-05/?utm\_medium=Social&utm\_source=Facebook](https://www.reuters.com/business/trump-says-his-team-will-look-into-us-taking-stake-ai-companies-2026-06-05/?utm_medium=Social&utm_source=Facebook)",814,218,2026-06-06 15:24:44+00:00,https://www.reddit.com/r/wallstreetbets/comments/1tyk5v7/trump_admin_proposes_public_stakes_in_ai_companies/,https://www.reddit.com/r/wallstreetbets/comments/1tyk5v7/trump_admin_proposes_public_stakes_in_ai_companies/,"Trump admin proposes public stakes in AI companies we are going to gap up so hard on Monday

[https://www.reuters.com/business/trump-says-his-team-will-look-into-us-taking-stake-ai-companies-2026-06-05/?utm\_medium=Social&utm\_source=Facebook](https://www.reuters.com/business/trump-says-his-team-will-look-into-us-taking-stake-ai-companies-2026-06-05/?utm_medium=Social&utm_source=Facebook)",Counter(),0,-0.3018,12.092259843057363
1tyh2ya,top,Me coming downstairs after turning $10k Into $800,,15563,159,2026-06-06 13:18:37+00:00,https://www.reddit.com/r/wallstreetbets/comments/1tyh2ya/me_coming_downstairs_after_turning_10k_into_800/,https://i.redd.it/w3clq1kpxn5h1.jpeg,Me coming downstairs after turning $10k Into $800,Counter(),0,0.0,14.727889649338271
1tygq9n,top,The only TA you need,Maybe I've eaten too many 🖍s but it's starting to make sense. I'll tell my manager at Wendy's to buy puts.,814,41,2026-06-06 13:02:46+00:00,https://www.reddit.com/r/wallstreetbets/comments/1tygq9n/the_only_ta_you_need/,https://i.redd.it/07oty0xvun5h1.png,The only TA you need Maybe I've eaten too many 🖍s but it's starting to make sense. I'll tell my manager at Wendy's to buy puts.,Counter(),0,0.0,10.44085773152423
1tyeqgs,top,Valuation justified,,2069,151,2026-06-06 11:27:30+00:00,https://www.reddit.com/r/wallstreetbets/comments/1tyeqgs/valuation_justified/,https://i.redd.it/1irim1xvdn5h1.png,Valuation justified,Counter(),0,0.4019,12.659184407105691
1tydoii,top,Should I go in and ask for a refund? I wasn’t informed stocks could go down,,4238,135,2026-06-06 10:30:08+00:00,https://www.reddit.com/r/wallstreetbets/comments/1tydoii/should_i_go_in_and_ask_for_a_refund_i_wasnt/,https://i.redd.it/jrsydicn3n5h1.jpeg,Should I go in and ask for a refund? I wasn’t informed stocks could go down,Counter(),0,0.0,13.26473755708869
1tydllc,top,"SpaceX IPO running at two times oversubscribed, sources say",,1232,322,2026-06-06 10:25:13+00:00,https://www.reddit.com/r/wallstreetbets/comments/1tydllc/spacex_ipo_running_at_two_times_oversubscribed/,https://www.reuters.com/business/finance/spacex-ipo-running-two-times-oversubscribed-sources-say-2026-06-05/,"SpaceX IPO running at two times oversubscribed, sources say",Counter(),0,0.0,12.894857826387
1tyaufx,top,No crying in the casino,BTC is putting it up my ass at the moment,946,113,2026-06-06 07:41:42+00:00,https://www.reddit.com/r/wallstreetbets/comments/1tyaufx/no_crying_in_the_casino/,https://i.redd.it/y6gdkzql9m5h1.png,No crying in the casino BTC is putting it up my ass at the moment,Counter({'BTC': 1}),1,-0.8316,11.589497541580574
1ty9kq7,top,WSB traders after a record rally,"Problematic gamblers have my commiserations, but do US traders 'enjoy' losing?

Genuine question from a UK trader. I'm shocked how quickly the mood changes with US investors. Watched some Bloomberg/CNBC and the tone was dramatic and gloom. Like it triggered some fight or flight attitude.

Asia+EU will crash on Monday also, but people will be ""oh, ok, yes that's troublesome"". Not freaking out or start talking more loudly.

It's part of US trading culture to leverage more and take risk, but surely that makes you more stoic to mini crashes? 

Regards",1823,66,2026-06-06 06:29:23+00:00,https://www.reddit.com/r/wallstreetbets/comments/1ty9kq7/wsb_traders_after_a_record_rally/,https://i.redd.it/wektsluowl5h1.gif,"WSB traders after a record rally Problematic gamblers have my commiserations, but do US traders 'enjoy' losing?

Genuine question from a UK trader. I'm shocked how quickly the mood changes with US investors. Watched some Bloomberg/CNBC and the tone was dramatic and gloom. Like it triggered some fight or flight attitude.

Asia+EU will crash on Monday also, but people will be ""oh, ok, yes that's troublesome"". Not freaking out or start talking more loudly.

It's part of US trading culture to leverage more and take risk, but surely that makes you more stoic to mini crashes? 

Regards",Counter({'CNBC': 1}),1,-0.7968,11.713479790025243
1ty9jgz,top,Depressed trader drinks himself to a happy place after losing billions in a week on speculative tech calls.,I fe,12008,408,2026-06-06 06:27:19+00:00,https://www.reddit.com/r/wallstreetbets/comments/1ty9jgz/depressed_trader_drinks_himself_to_a_happy_place/,https://v.redd.it/317xl5a7wl5h1,Depressed trader drinks himself to a happy place after losing billions in a week on speculative tech calls. I fe,Counter(),0,-0.2023,15.407126803703484
1ty6pra,top,A lil rough out there today,,1544,50,2026-06-06 03:58:47+00:00,https://www.reddit.com/r/wallstreetbets/comments/1ty6pra/a_lil_rough_out_there_today/,https://v.redd.it/xszvr7qt5l5h1,A lil rough out there today,Counter(),0,0.0,11.27460482205617
1ty5m7q,top,Bear Day,Not made by AI. Made with MS paint.  ,1201,50,2026-06-06 03:04:14+00:00,https://www.reddit.com/r/wallstreetbets/comments/1ty5m7q/bear_day/,https://i.redd.it/e2697wn3wk5h1.png,Bear Day Not made by AI. Made with MS paint.,Counter(),0,0.0,11.02356774781948
1ty1cai,top,"My loss is your gain, or more like, my loss is your enjoyment...","Since the pandemic, I always thought ""This is way too high, it surely will go down"". And here are the results.

And yesterday, I thought on buying PUTs, and said to myself ""Bah, how many times do we have to teach you this lesson old man?""

They got me, got me good. Could have paid off the house, gotten a new car and a few travel expenses.

But hey, I wouldn't have been able to laugh at your comments in this post then 🤣",5803,720,2026-06-05 23:43:52+00:00,https://www.reddit.com/r/wallstreetbets/comments/1ty1cai/my_loss_is_your_gain_or_more_like_my_loss_is_your/,https://i.redd.it/mca9zmrcwj5h1.jpeg,"My loss is your gain, or more like, my loss is your enjoyment... Since the pandemic, I always thought ""This is way too high, it surely will go down"". And here are the results.

And yesterday, I thought on buying PUTs, and said to myself ""Bah, how many times do we have to teach you this lesson old man?""

They got me, got me good. Could have paid off the house, gotten a new car and a few travel expenses.

But hey, I wouldn't have been able to laugh at your comments in this post then 🤣",Counter(),0,0.8624,15.246941751289027
