created_utc,body,clean_body,body_sentiment,body_label
2026-07-08 10:55:50+00:00,"Source: [https://finance.yahoo.com/technology/article/apple-announces-chip-deal-with-broadcom-worth-more-than-30-billion-100000097.html](https://finance.yahoo.com/technology/article/apple-announces-chip-deal-with-broadcom-worth-more-than-30-billion-100000097.html)

Apple (AAPL) on Wednesday announced it has entered into a chip deal valued at more than $30 billion with Broadcom (AVGO). 

Under the terms of the deal, Broadcom will design and produce ""custom silicon components and cutting-edge wireless connectivity technologies"" for Apple products.

The news comes after Broadcom filed paperwork with the Securities and Exchange Commission on June 6, indicating it established a multiyear agreement to develop custom chips for Apple through 2031.

According to Apple, more than 15 billion chips will be built in the US via the deal as part of the company's American Manufacturing Program (AMP). The tie-up will also see Broadcom modernize its Fort Collins, Colo.-based manufacturing facilities via a $1.5 billion investment.

""Apple and Broadcom have a long history together, and this new phase of our partnership further accelerates our commitment to American manufacturing and innovation,"" Apple CEO Tim Cook said in a statement. 

""The cutting-edge components built in Fort Collins are essential to delivering the incredible performance and connectivity our customers expect, and we're proud to deepen our investments in US-based suppliers that share our commitment to excellence and innovation,"" he said.

Apple launched its AMP initiative in 2025 as part of the company's push to increase its manufacturing presence in the US, along with its partners. Other companies that participate in Apple's AMP effort include Corning (GLW), GlobalFoundries (GFS), and Texas Instruments (TXN).

The Trump administration made reshoring manufacturing and chip development a cornerstone of its industrial and technology policies. 

The White House has taken a 10% stake in Intel, and according to the Financial Times, OpenAI (OPAI.PVT) has proposed giving the administration a 5% position in the AI company.

Broadcom has been a major beneficiary of the AI trade, with the stock rising more than 35% thanks to its work developing chips for companies such as Google (GOOG, GOOGL).

Apple, meanwhile, has gone through a series of ups and downs related to its positioning in the AI market. More recently, the tech giant debuted an updated version of Siri during its WWDC event in June.

Importantly, the company's iPhone sales have continued to outperform, helping to lift its stock price 47% over the past year.",source apple aapl on wednesday announced it has entered into a chip deal valued at more than billion with broadcom avgo under the terms of the deal broadcom will design and produce custom silicon components and cutting edge wireless connectivity technologies for apple products the news comes after broadcom filed paperwork with the securities and exchange commission on june indicating it established a multiyear agreement to develop custom chips for apple through according to apple more than billion chips will be built in the us via the deal as part of the company s american manufacturing program amp the tie up will also see broadcom modernize its fort collins colo based manufacturing facilities via a billion investment apple and broadcom have a long history together and this new phase of our partnership further accelerates our commitment to american manufacturing and innovation apple ceo tim cook said in a statement the cutting edge components built in fort collins are essential to delivering the incredible performance and connectivity our customers expect and we re proud to deepen our investments in us based suppliers that share our commitment to excellence and innovation he said apple launched its amp initiative in as part of the company s push to increase its manufacturing presence in the us along with its partners other companies that participate in apple s amp effort include corning glw globalfoundries gfs and texas instruments txn the trump administration made reshoring manufacturing and chip development a cornerstone of its industrial and technology policies the white house has taken a stake in intel and according to the financial times openai opai pvt has proposed giving the administration a position in the ai company broadcom has been a major beneficiary of the ai trade with the stock rising more than thanks to its work developing chips for companies such as google goog googl apple meanwhile has gone through a series of ups and downs related to its positioning in the ai market more recently the tech giant debuted an updated version of siri during its wwdc event in june importantly the company s iphone sales have continued to outperform helping to lift its stock price over the past year,0.9899,positive
2026-07-08 10:00:37+00:00,This post contains content not supported on old Reddit. [Click here to view the full post](https://sh.reddit.com/r/wallstreetbets/comments/1uqo7wi),this post contains content not supported on old reddit click here to view the full post,-0.2411,negative
2026-07-08 09:24:55+00:00,What are we buying today?,what are we buying today,0.0,neutral
2026-07-08 02:59:38+00:00,"https://preview.redd.it/jmq3mxns7xbh1.png?width=1096&format=png&auto=webp&s=cbd3d24872749f1affc6b53d46e64d6637b7d7a5

I'm diamond handing all the way

Still believe we will see a big rebound",i m diamond handing all the way still believe we will see a big rebound,0.34,positive
2026-07-08 00:41:20+00:00,"Alright degenerates, let's talk about my favorite money incinerator, $NBIS.

The damage: 1,370 shares. Down $24K today alone. Down $143K since the June 22 top. Watched a third of my gains evaporate in two weeks because Zuck sneezed. Still up 387% on the position because I bought this thing in the $30s and apparently have a medical inability to take profit.

Why we're bleeding: Bloomberg dropped a report July 1 that Meta wants to sell its excess compute (""Meta Compute""). Market decided Nebius's biggest customer is now its biggest competitor and the whole neocloud sector got sent to the shadow realm. NBIS and CRWV both nuked.

Why I'm not selling and actually think this rips:

1. Meta literally signed a deal worth up to $27B with Nebius in MARCH. $12B dedicated capacity, $15B optional. You don't hand your ""competitor"" $27 billion. Meta reselling spare GPUs is not Meta becoming AWS.

2. The company is drowning in demand. Contracted power went from \~1GW last August to 3.5GW+ now, targeting 4GW. 1.2GW site locked in Pennsylvania. New data centers in the UK, Finland, and France. Daddy Jensen put $2B of Nvidia money in. The fundamentals did not change. A headline changed.

3. Here's the fun part: short interest is around 24% of float. Almost a quarter of this stock is sold short after a 35% drawdown. Q2 earnings land inside the next few weeks. You know what happens when a 24% shorted stock beats earnings. You've all seen this movie.

4. It joined the Nasdaq-100 in June, so index funds are forced buyers now. Aschenbrenner's AI fund owns 5.6% of the company.

And before you tell me $300 is copium: this exact ticker went $200 to $300 in five weeks in May and June. No squeeze fuel, no catalyst. It just did it. Now it's back at $195 with 24% SI and an earnings print loading.

My prediction: shorts press it to the $180s, shake out the paper hands, then it turns on a dime and we're back above $300 by end of August. If I'm wrong, screenshot this and roast me. If I'm right, I'm buying a spoiler for the 911 with the gains.

Positions: 1,370 shares NBIS, no options because I'm not THAT regarded.

Not financial advice. I eat crayons.",alright degenerates let s talk about my favorite money incinerator nbis the damage shares down k today alone down k since the june top watched a third of my gains evaporate in two weeks because zuck sneezed still up on the position because i bought this thing in the s and apparently have a medical inability to take profit why we re bleeding bloomberg dropped a report july that meta wants to sell its excess compute meta compute market decided nebius s biggest customer is now its biggest competitor and the whole neocloud sector got sent to the shadow realm nbis and crwv both nuked why i m not selling and actually think this rips meta literally signed a deal worth up to b with nebius in march b dedicated capacity b optional you don t hand your competitor billion meta reselling spare gpus is not meta becoming aws the company is drowning in demand contracted power went from gw last august to gw now targeting gw gw site locked in pennsylvania new data centers in the uk finland and france daddy jensen put b of nvidia money in the fundamentals did not change a headline changed here s the fun part short interest is around of float almost a quarter of this stock is sold short after a drawdown q earnings land inside the next few weeks you know what happens when a shorted stock beats earnings you ve all seen this movie it joined the nasdaq in june so index funds are forced buyers now aschenbrenner s ai fund owns of the company and before you tell me is copium this exact ticker went to in five weeks in may and june no squeeze fuel no catalyst it just did it now it s back at with si and an earnings print loading my prediction shorts press it to the s shake out the paper hands then it turns on a dime and we re back above by end of august if i m wrong screenshot this and roast me if i m right i m buying a spoiler for the with the gains positions shares nbis no options because i m not that regarded not financial advice i eat crayons,0.8591,positive
2026-07-07 23:39:24+00:00,"Chipotle's been in a genuinely rough stretch, ngl. Traffic declined for four straight quarters through the end of 2025, first annual same-store sales drop since 2016. Management's explanation was basically a broad consumer pullback hitting every income group, with lower-income diners cutting back hardest. Stock's down about 46% from its highs while the S&P was up double digits over that same stretch. Feels pretty on-theme for this sub honestly, another data point on how much pressure regular spending is under right now.

Q1 2026 was the first real sign of a turn though. Revenue grew \~7.4% to about $3.09B, beat estimates, and transaction counts went positive for the first time in a year. Digital sales are now close to 39% of total sales, helped along by new menu stuff like Chicken Al Pastor and higher-protein options aimed at winning back people who'd drifted off. Management's deliberately not discounting to chase traffic back either. They're protecting the brand's pricing position instead, even though that means margins stay squeezed while beef costs and tariffs work against them.

In June JPMorgan upgraded it to overweight, calling the \~43% decline since early 2025 a rare valuation opportunity. Their argument: the current multiple now reflects a realistic growth profile instead of the premium Chipotle used to command. Still trades at a forward P/E in the high 20s though, above the restaurant industry average. So not a screaming bargain by any classic value metric. More like a high-quality brand trading at a discount to its own history, not an obviously cheap stock.

They're still planning to open 350-370 new restaurants in 2026 too, expansion continuing even through the softer traffic environment. That alone drives some revenue growth whether or not comps fully recover.

Real risk here: 2026 guidance calls for flat same-store sales. Management itself isn't promising a fast turnaround. This is a bet that a strong brand recovers from a rough couple years, not a bet that it already has.

[Chipotle](https://www.stoxcraft.com/stocks/cmg) is one of those where the quality of the business was never really the question, just what price you're paying for the rough patch. Anyone here buying this pullback, or waiting to see if comps actually turn positive first?",chipotle s been in a genuinely rough stretch ngl traffic declined for four straight quarters through the end of first annual same store sales drop since management s explanation was basically a broad consumer pullback hitting every income group with lower income diners cutting back hardest stock s down about from its highs while the s p was up double digits over that same stretch feels pretty on theme for this sub honestly another data point on how much pressure regular spending is under right now q was the first real sign of a turn though revenue grew to about b beat estimates and transaction counts went positive for the first time in a year digital sales are now close to of total sales helped along by new menu stuff like chicken al pastor and higher protein options aimed at winning back people who d drifted off management s deliberately not discounting to chase traffic back either they re protecting the brand s pricing position instead even though that means margins stay squeezed while beef costs and tariffs work against them in june jpmorgan upgraded it to overweight calling the decline since early a rare valuation opportunity their argument the current multiple now reflects a realistic growth profile instead of the premium chipotle used to command still trades at a forward p e in the high s though above the restaurant industry average so not a screaming bargain by any classic value metric more like a high quality brand trading at a discount to its own history not an obviously cheap stock they re still planning to open new restaurants in too expansion continuing even through the softer traffic environment that alone drives some revenue growth whether or not comps fully recover real risk here guidance calls for flat same store sales management itself isn t promising a fast turnaround this is a bet that a strong brand recovers from a rough couple years not a bet that it already has chipotle is one of those where the quality of the business was never really the question just what price you re paying for the rough patch anyone here buying this pullback or waiting to see if comps actually turn positive first,0.976,positive
2026-07-07 22:21:10+00:00,,nan,0.0,neutral
2026-07-07 22:15:15+00:00,"first time poster here, I've been in the telecom industry a long time and am struggling to understand what folks are seeing in CCOI that is making them sell off (and personally have been buying more as it goes down) for the following reasons:

  
1) I think folks are confusing revenue for free cash flow, revenue has dropped as some inherently crappy (low/negative margin) customers are jettisoned from the sprint takeover.

2) wave revenue is up 90% year over year, this should be nearly all very high margin as it is on the owned network inherited from from sprint, the only costs are cards.

3) folks got spooked when the CEO lost most of his stake in the company by pledging his stock on margin debt to fund real-estate unrelated to the company.   I view this as a screw up but honestly something that just freaks folks out but is unrelated to the operations of cogent.

4) they just sold some datacenters for $225 million (cost basis essentially zero) that should go right to the debt line and cut \~10% of their debt, the deal is closed so i would expect this to be reflected in their next earnings cycle.    I suspect they have enough facilities to do something similar at least once or twice more given the number of sites they got from sprint.

  
As a side note, in my PE telecom experience we often would acquire companies and not worry about killing the crappy products that were loosing money (if we could kill their cogs too) as long as we were driving up EBITDA and it seems to me that the market is missing that this is what CCOI seems to be doing with the sprint acquisition.

  
Curious what folks think.   Am i crazy for thinking this is a good buy?",first time poster here i ve been in the telecom industry a long time and am struggling to understand what folks are seeing in ccoi that is making them sell off and personally have been buying more as it goes down for the following reasons i think folks are confusing revenue for free cash flow revenue has dropped as some inherently crappy low negative margin customers are jettisoned from the sprint takeover wave revenue is up year over year this should be nearly all very high margin as it is on the owned network inherited from from sprint the only costs are cards folks got spooked when the ceo lost most of his stake in the company by pledging his stock on margin debt to fund real estate unrelated to the company i view this as a screw up but honestly something that just freaks folks out but is unrelated to the operations of cogent they just sold some datacenters for million cost basis essentially zero that should go right to the debt line and cut of their debt the deal is closed so i would expect this to be reflected in their next earnings cycle i suspect they have enough facilities to do something similar at least once or twice more given the number of sites they got from sprint as a side note in my pe telecom experience we often would acquire companies and not worry about killing the crappy products that were loosing money if we could kill their cogs too as long as we were driving up ebitda and it seems to me that the market is missing that this is what ccoi seems to be doing with the sprint acquisition curious what folks think am i crazy for thinking this is a good buy,-0.9543,negative
2026-07-07 21:18:40+00:00,,nan,0.0,neutral
2026-07-07 21:08:33+00:00,,nan,0.0,neutral
2026-07-07 20:24:58+00:00,"No, seriously, stop buying options on SPY.

You should be using SPX. You can trade options overnight if that fancies you, it will cash settle at close without assignment risk, and you pay less in capital gains.

And you can do extra dumb degenerate stuff like buying 0DTEs 30 seconds before close to get assigned. Like I did today with SPX $7500 C’s @ 0.75 and they will settle at \~3.85.

EDIT: Looks like we got a case of the poors ",no seriously stop buying options on spy you should be using spx you can trade options overnight if that fancies you it will cash settle at close without assignment risk and you pay less in capital gains and you can do extra dumb degenerate stuff like buying dtes seconds before close to get assigned like i did today with spx c s and they will settle at edit looks like we got a case of the poors,0.1656,positive
2026-07-07 20:16:28+00:00,,nan,0.0,neutral
2026-07-07 20:00:37+00:00,This post contains content not supported on old Reddit. [Click here to view the full post](https://sh.reddit.com/r/wallstreetbets/comments/1uq6933),this post contains content not supported on old reddit click here to view the full post,-0.2411,negative
2026-07-07 19:05:21+00:00,Now let's hope it's got the same staying power as me 😤,now let s hope it s got the same staying power as me,0.4404,positive
2026-07-07 18:52:52+00:00,"GG all. especially bro who had HUM calls last week



https://preview.redd.it/8yr30rbgtubh1.jpg?width=1008&format=pjpg&auto=webp&s=9712f3bda3cc0037d919ae1fbfdde7d013b1ad1e

",gg all especially bro who had hum calls last week,0.296,positive
2026-07-07 18:04:49+00:00,"As you can see, I'm still buying. Here's my most recent purchase.

To those who, by now, have noticed that my dunce cap is actually a wizard cap: I forgive you for doubting me. And fear not, you have one last chance to board the SRRK train. Read the candles. Beautiful double bullish engulfing/hammer candle on the 2nd, just in time for the running of the bulls in Spain, no less. Nice follow up confirmation. $300k buy just now, high probability it was the first covering of much to inevitably come. If not, then it was some guy with cervical spine issues because his brain is so fucking big he walks around motor boating himself all day.  

Discussion:

On a scale of depressed to ecstatic, how happy are you on your decision to listen to or ignore Beef's last post?

And as before, feel free to roast the shit out of me. I could use some pre-vacation tan. 

Yours Truly,

Beef Stewart

 ",as you can see i m still buying here s my most recent purchase to those who by now have noticed that my dunce cap is actually a wizard cap i forgive you for doubting me and fear not you have one last chance to board the srrk train read the candles beautiful double bullish engulfing hammer candle on the nd just in time for the running of the bulls in spain no less nice follow up confirmation k buy just now high probability it was the first covering of much to inevitably come if not then it was some guy with cervical spine issues because his brain is so fucking big he walks around motor boating himself all day discussion on a scale of depressed to ecstatic how happy are you on your decision to listen to or ignore beef s last post and as before feel free to roast the shit out of me i could use some pre vacation tan yours truly beef stewart,0.9338,positive
2026-07-07 16:04:56+00:00,"Bought 600 contracts, avg at about 0.65 per contract. Sold for 1.16.",bought contracts avg at about per contract sold for,0.0,neutral
2026-07-07 15:43:38+00:00,"Full conviction.

For reference 1 USD = 0.81 Swiss Francs",full conviction for reference usd swiss francs,0.0,neutral
2026-07-07 15:20:02+00:00,"Spy Puts Open: [https://www.reddit.com/r/wallstreetbets/comments/1upduld/being\_a\_permabear\_is\_a\_bad\_habit/](https://www.reddit.com/r/wallstreetbets/comments/1upduld/being_a_permabear_is_a_bad_habit/)

NBIS Puts: [https://www.reddit.com/r/wallstreetbets/comments/1ulltx7/nbis\_puts\_38k/](https://www.reddit.com/r/wallstreetbets/comments/1ulltx7/nbis_puts_38k/)

Astrotech: [https://www.reddit.com/r/wallstreetbets/comments/1tpahu9/130\_on\_astrotech/](https://www.reddit.com/r/wallstreetbets/comments/1tpahu9/130_on_astrotech/) (May)

Blowing up 80k (Some time after) : [https://www.reddit.com/r/wallstreetbets/s/YHivcBpgZm](https://www.reddit.com/r/wallstreetbets/s/YHivcBpgZm)

Started the year winning big then blowing up an 80k account, came back with 40k and won big with astrotech, withdrew 40k then continued playing, now I'm withdrawing all of it and taking a break for a while, good bye, good night!",spy puts open nbis puts astrotech may blowing up k some time after started the year winning big then blowing up an k account came back with k and won big with astrotech withdrew k then continued playing now i m withdrawing all of it and taking a break for a while good bye good night,0.9287,positive
2026-07-07 14:33:29+00:00,,nan,0.0,neutral
