created_utc,body,clean_body,body_sentiment,body_label
2026-05-14 22:54:03+00:00,"I use head and shoulders daily. 

  Oh, and speaking of head and shoulders, you other humans, just like my self, just a ordinary human and definitely not an alien, think this will turn itself into a perfect example? 

  I know the heads pretty small, but it's not the size that matters, it's the motion. Besides, my retired super model wife with big breasts says the head is the perfect size for her. She's definitely not a crude face that I drew on my hand and used real lipstick. 

   The chart also shows a smaller head, but it just hit 1.54 due to the clarity act, but the clarity act hasn't even been signed into law yet. I don't know. Institutions have been loading up the past few weeks though...",i use head and shoulders daily oh and speaking of head and shoulders you other humans just like my self just a ordinary human and definitely not an alien think this will turn itself into a perfect example i know the heads pretty small but it s not the size that matters it s the motion besides my retired super model wife with big breasts says the head is the perfect size for her she s definitely not a crude face that i drew on my hand and used real lipstick the chart also shows a smaller head but it just hit due to the clarity act but the clarity act hasn t even been signed into law yet i don t know institutions have been loading up the past few weeks though,0.9895,positive
2026-05-14 22:51:34+00:00,,nan,0.0,neutral
2026-05-14 22:49:04+00:00,"Elites don’t even try and hide it anymore, we’re getting pumped and dumped in plain sight.",elites don t even try and hide it anymore we re getting pumped and dumped in plain sight,-0.5267,negative
2026-05-14 22:35:13+00:00,,nan,0.0,neutral
2026-05-14 22:22:55+00:00,"As someone who was trading the late 90's, it was commonplace for an IPO to open 100%+ over the IPO price. This is why everyone was scrambling to get their hands on hot IPO shares, which brokers did offer. Notice only one of these finished red after a year.

Fortunes are made and lost in markets like this, enjoy regards.

Position: long CBRS $305ish",as someone who was trading the late s it was commonplace for an ipo to open over the ipo price this is why everyone was scrambling to get their hands on hot ipo shares which brokers did offer notice only one of these finished red after a year fortunes are made and lost in markets like this enjoy regards position long cbrs ish,0.7311,positive
2026-05-14 22:21:14+00:00,,nan,0.0,neutral
2026-05-14 22:16:39+00:00,"The ominous W pattern has emerged. We all know what this means. Who’s on the wagon??

I always thought container batteries were hype. Imagine the cargo powering the vessel… by land, sea, or sky. This Ford Energy subsidiary is just what the company needed when you consider regulatory hurdles, tarriffs, aluminum shortage, and their overinvestment (?) in battery technology. Might as well be Ford Lemonade stand.

And damn this lemonade is good. 

Position: long \~3000 contracts 11-20$ range

Who’s with me this time? ",the ominous w pattern has emerged we all know what this means who s on the wagon i always thought container batteries were hype imagine the cargo powering the vessel by land sea or sky this ford energy subsidiary is just what the company needed when you consider regulatory hurdles tarriffs aluminum shortage and their overinvestment in battery technology might as well be ford lemonade stand and damn this lemonade is good position long contracts range who s with me this time,0.0,neutral
2026-05-14 22:14:01+00:00,,nan,0.0,neutral
2026-05-14 22:12:00+00:00,,nan,0.0,neutral
2026-05-14 21:10:24+00:00,"Investment firm Irth Capital is working with Papa John's International's [(PZZA.O), opens new tab](https://www.reuters.com/markets/companies/PZZA.O) largest U.S. franchisee, who controls ​around 10% of the pizza chain's domestic restaurants, to take the company private, three sources told Reuters.",investment firm irth capital is working with papa john s international s pzza o opens new tab largest u s franchisee who controls around of the pizza chain s domestic restaurants to take the company private three sources told reuters,0.0,neutral
2026-05-14 21:05:35+00:00,"I’m considering rolling them out to mid 2027, at least for GOOG and NVDA.",i m considering rolling them out to mid at least for goog and nvda,0.0,neutral
2026-05-14 20:52:06+00:00,"In Dec peak I was at 1.3 M , but after the stella Reddit Q4 earnings that tanked the stock 40% my port dipped hard to 440k

Made it all back 1.25 m today with 10k shares RkLB at $4.71 cost basis ( sold 25% today) and lots of 0DTE spx spread.

Don’t give up and keep on fighting. This is life changing money so going to scale back my trading .",in dec peak i was at m but after the stella reddit q earnings that tanked the stock my port dipped hard to k made it all back m today with k shares rklb at cost basis sold today and lots of dte spx spread don t give up and keep on fighting this is life changing money so going to scale back my trading,-0.2617,negative
2026-05-14 20:48:29+00:00,Who has a lower cost average? Am I the king?,who has a lower cost average am i the king,-0.296,negative
2026-05-14 20:48:08+00:00,I’m just not going to. ,i m just not going to,0.0,neutral
2026-05-14 20:29:42+00:00,Just trying momentum trade $25k to a mil,just trying momentum trade k to a mil,0.0,neutral
2026-05-14 20:29:31+00:00,"I'm about 80,000 EUR into this. Gambling on a positive supreme court verdict in June to put an end to the Monsanto bs. 

",i m about eur into this gambling on a positive supreme court verdict in june to put an end to the monsanto bs,0.8316,positive
2026-05-14 20:27:43+00:00,,nan,0.0,neutral
2026-05-14 20:25:01+00:00,Bought in yesterday at 1 pm seeing a massive jump decided I might partake in this gamble,bought in yesterday at pm seeing a massive jump decided i might partake in this gamble,0.0,neutral
2026-05-14 20:21:42+00:00,"Costco trades at \~42x forward earnings, priced for perfection in a softening macro environment. My bearish tilt into earnings rests on three quantitative flags:

First, gross margin compression. Despite net sales growth, core merchandise margins have contracted sequentially for three quarters. SG&A leverage has masked this, but inflationary stickiness in labor and logistics is real. The high margin ancillary revenue stream aka membership fees faces comp headwinds. With retail sales data showing durable goods deflation and big ticket pullback, average transaction value growth is stalling.

Second, membership income, the earnings backbone, is maturing. Executive penetration growth has decelerated. A fee increase remains speculative, yet already priced in. If guidance disappoints, the multiple contracts fast.

Third, options market dynamics. Implied volatility rank is elevated above 90th percentile, but realized moves have underperformed IV post-earnings in three of the last four prints. I'm buying outright puts for convexity, capturing skew and positioning for a sharp vol crush if they merely meet consensus.

Valuation is the killer. At this multiple, any earnings-per-share beat must come from buybacks or cost cutting, not top line strength. The risk/reward entering the print is asymmetric to the downside. Hard catalyst: membership income miss and tepid comp guidance.

Position: 29 May 26 COST $1000 Put x 20 contracts. Defined capital at risk, targeting IV crush and multiple compression. Earnings are May 28th after the bell.

Cheers, Regards! 🥂 ",costco trades at x forward earnings priced for perfection in a softening macro environment my bearish tilt into earnings rests on three quantitative flags first gross margin compression despite net sales growth core merchandise margins have contracted sequentially for three quarters sg a leverage has masked this but inflationary stickiness in labor and logistics is real the high margin ancillary revenue stream aka membership fees faces comp headwinds with retail sales data showing durable goods deflation and big ticket pullback average transaction value growth is stalling second membership income the earnings backbone is maturing executive penetration growth has decelerated a fee increase remains speculative yet already priced in if guidance disappoints the multiple contracts fast third options market dynamics implied volatility rank is elevated above th percentile but realized moves have underperformed iv post earnings in three of the last four prints i m buying outright puts for convexity capturing skew and positioning for a sharp vol crush if they merely meet consensus valuation is the killer at this multiple any earnings per share beat must come from buybacks or cost cutting not top line strength the risk reward entering the print is asymmetric to the downside hard catalyst membership income miss and tepid comp guidance position may cost put x contracts defined capital at risk targeting iv crush and multiple compression earnings are may th after the bell cheers regards,-0.9228,negative
2026-05-14 20:09:34+00:00,,nan,0.0,neutral
2026-05-14 20:07:19+00:00,"Anyone else getting involved in WOLF? Starting to look like extremely bullish set-up with 80% short float.  
Transitioning from EV to AI data centers. Their AI revenue is up 50% then 30% QoQ. Still small. But growing fast.  
They already have the infrastructure. Fab is built and mostly empty. At full utilization (1-2 yrs) management guides $3B rev, >40% EBITDA. Current market cap: $3B. Nothing is priced in.

Shorts paying $1.60/share/day to stay in. 933% APR to borrow. The short thesis gets more expensive every day AI bull run holds up.

risks: yield issues unresolved. revenue still declining. onsemi building a competing fab. $84M/qtr cash burn. up 210% YTD already.

Obviously, it’s popped quite a bit on the Citrini report. But it still looks like a 2-3x in the next year, and might have some short-term pop left to it as well.  
Thoughts?",anyone else getting involved in wolf starting to look like extremely bullish set up with short float transitioning from ev to ai data centers their ai revenue is up then qoq still small but growing fast they already have the infrastructure fab is built and mostly empty at full utilization yrs management guides b rev ebitda current market cap b nothing is priced in shorts paying share day to stay in apr to borrow the short thesis gets more expensive every day ai bull run holds up risks yield issues unresolved revenue still declining onsemi building a competing fab m qtr cash burn up ytd already obviously it s popped quite a bit on the citrini report but it still looks like a x in the next year and might have some short term pop left to it as well thoughts,0.9398,positive
2026-05-14 19:57:10+00:00,This post contains content not supported on old Reddit. [Click here to view the full post](https://sh.reddit.com/r/wallstreetbets/comments/1td9dup),this post contains content not supported on old reddit click here to view the full post,-0.2411,negative
2026-05-14 19:42:15+00:00,,nan,0.0,neutral
2026-05-14 19:25:43+00:00,"Been holding since $6. Thought I’d collect some premium, sold 2 calls at $95 strike last week for $388. Felt smart at the time and was happy to sell at $95. 

Then earnings dropped and this thing went on a run I was not expecting at all. 

200 shares getting called away at $95 Friday while the stock is around $130 trending up. Still walking away with really good profit on those so I guess I shouldn’t complain. But man it stings knowing the money I’m leaving on the table. Feels like someone is driving your car away

I still have more shares uncovered so at least those are along for the ride.

Should I roll out and up to September @ $115 for a small credit?",been holding since thought i d collect some premium sold calls at strike last week for felt smart at the time and was happy to sell at then earnings dropped and this thing went on a run i was not expecting at all shares getting called away at friday while the stock is around trending up still walking away with really good profit on those so i guess i shouldn t complain but man it stings knowing the money i m leaving on the table feels like someone is driving your car away i still have more shares uncovered so at least those are along for the ride should i roll out and up to september for a small credit,0.9361,positive
2026-05-14 19:15:20+00:00,,nan,0.0,neutral
2026-05-14 19:11:33+00:00,"I bought in to some of the top 2026 stock recs that was posted a few months ago / some of last year recs and here’s how they are doing. Just want to say thanks WSB 😉

Two others not shown is SMCI & NVDA. Both up as well

However, my positions for all of these are small and like everyone else.. wish i went all in. Debating if I should hold or sell since they are all popping off rn

My two new ones that I just got in to is NOK & AMPX.. small positions as well. Hope they do just as good",i bought in to some of the top stock recs that was posted a few months ago some of last year recs and here s how they are doing just want to say thanks wsb two others not shown is smci nvda both up as well however my positions for all of these are small and like everyone else wish i went all in debating if i should hold or sell since they are all popping off rn my two new ones that i just got in to is nok ampx small positions as well hope they do just as good,0.9531,positive
2026-05-14 18:57:21+00:00,oops 🤡🤡🤡,oops,0.0,neutral
2026-05-14 18:37:57+00:00,"Picked up around 57 shares of service now($5000). I’ll continue to buy like $200 weekly at these levels. This is a longterm investment I won’t be selling anytime soon. Curious what people think about service now and the future of the company. I’m pretty heavy into tech stocks but thought this fit in my portfolio quite well.

I now only have about $10,000 in cash. I’m going to get that to $20,000 by the end of the year.

What do you think about my portfolio? If you have an opinion please back it up with financials or facts Thankyou!",picked up around shares of service now i ll continue to buy like weekly at these levels this is a longterm investment i won t be selling anytime soon curious what people think about service now and the future of the company i m pretty heavy into tech stocks but thought this fit in my portfolio quite well i now only have about in cash i m going to get that to by the end of the year what do you think about my portfolio if you have an opinion please back it up with financials or facts thankyou,0.946,positive
2026-05-14 18:36:06+00:00,"Bought CVS calls before the earnings, rolled into these post earnings pop.

IV is super low and possibly can breakout above 100.

Ton of money still to be made from these low IV options! 

https://preview.redd.it/6zx6o5q1d51h1.png?width=2336&format=png&auto=webp&s=5fda244cbbc595291ff2a7ca4ed98ebfe2bef2b8

https://preview.redd.it/7bdw6rd2d51h1.png?width=2302&format=png&auto=webp&s=8925ed576db87c5bcb681fb8a0a3c45469c9368e

",bought cvs calls before the earnings rolled into these post earnings pop iv is super low and possibly can breakout above ton of money still to be made from these low iv options,0.1779,positive
2026-05-14 18:14:10+00:00,"Been looking at $LYFT and honestly can’t figure out why it’s this cheap. Market cap is around $5B, they did $6.3B in revenue last year, and pulled in over $1B in free cash flow. P/E is like 2 (yeah there’s a tax thing inflating it, forward is closer to 9, still cheap). About 16% of the float is short, institutions own basically all of it, so the actual float floating around is pretty thin.

The thing that got me interested is the FREENOW acquisition they closed last summer. They paid €175M to BMW/Mercedes for it and now they’re in 11 countries — basically doubled their addressable market overnight. Plus there’s the whole AI angle where agents will need real-world labor marketplaces to actually do stuff in the physical world, and Lyft already has the drivers and the infrastructure. Could be wrong, but at this price the downside seems pretty limited. Just buying shares, not getting fancy with options.​​​​​​​​​​​​​​​​",been looking at lyft and honestly can t figure out why it s this cheap market cap is around b they did b in revenue last year and pulled in over b in free cash flow p e is like yeah there s a tax thing inflating it forward is closer to still cheap about of the float is short institutions own basically all of it so the actual float floating around is pretty thin the thing that got me interested is the freenow acquisition they closed last summer they paid m to bmw mercedes for it and now they re in countries basically doubled their addressable market overnight plus there s the whole ai angle where agents will need real world labor marketplaces to actually do stuff in the physical world and lyft already has the drivers and the infrastructure could be wrong but at this price the downside seems pretty limited just buying shares not getting fancy with options,0.8641,positive
2026-05-14 17:55:59+00:00,"Everyone is looking for the next big downstream impact of AI after energy, memory, chips etc. I’m betting it will be batteries/electricity to handle ebbs and flows of demand. Wins over the last 3 months - Google leaps, NBIS stock, Apple leaps. Loss trade was only the one - Snapchat into earnings.

EDIT: Got into Ford yesterday at 13.5 - so I didn’t see it coming. Just believe in it for a quick jump at the very least and I don’t think it’s gone up enough yet.

EDIT 2: Yes, two different fidelity accounts, one is a Roth IRA and one is normal.",everyone is looking for the next big downstream impact of ai after energy memory chips etc i m betting it will be batteries electricity to handle ebbs and flows of demand wins over the last months google leaps nbis stock apple leaps loss trade was only the one snapchat into earnings edit got into ford yesterday at so i didn t see it coming just believe in it for a quick jump at the very least and i don t think it s gone up enough yet edit yes two different fidelity accounts one is a roth ira and one is normal,0.6908,positive
2026-05-14 17:33:39+00:00,,nan,0.0,neutral
2026-05-14 17:32:57+00:00,"Bought these as a levered directional play for the earnings run up, closed all today. May buy a few options to actually play earnings too. Probably my best trades return % wise ever ",bought these as a levered directional play for the earnings run up closed all today may buy a few options to actually play earnings too probably my best trades return wise ever,0.9022,positive
2026-05-14 17:23:17+00:00,,nan,0.0,neutral
2026-05-14 17:01:59+00:00,,nan,0.0,neutral
2026-05-14 16:30:43+00:00,"Ferrari vibes are oversold, volume from sellers is coming down. I'm buying shares with intentions on getting atm LEAPS as well. 

Once volume comes back I'll double the shares and pick up LEAPS. Expect it to come back in a couple weeks when the new electric vehicle is announced. ",ferrari vibes are oversold volume from sellers is coming down i m buying shares with intentions on getting atm leaps as well once volume comes back i ll double the shares and pick up leaps expect it to come back in a couple weeks when the new electric vehicle is announced,0.6705,positive
2026-05-14 16:21:24+00:00,"Upstart could 4x in a matter of weeks

If momentum gets going, UPST could be 100 within a week from the naked shorting crowdedness.

The intrinsic value of this company is around $50 yet trades at $28. Current and former ceo have bought over 10 million in shares altogether, despite their net worths being 100% upstart essentially already. The former ceo bought last week at 31, current ceo DOUBLED down and bought even more 1.5 million yesterday at $27.5 (bought 4m at 39.33 before). Thats 40x what Anthony noto is buying from SoFi in comparison.

Guidance is 35% CAGR for 3 years straight with 25% ebitda. The company will literally print money as an automated AI loan marketplace using other’s capital. They get all the reward with none of the risk from lending by routing loans to others balance sheets using AI. On top of that, they’ll be opening Upstart bank in a year to further reduce their operational costs. There’s only 1000 employees, mostly engineers, so they’ll be swimming in money. Forward agreements provide locked in capital and they’ve raised 4B and gotten renewed and raised partner capital agreements. Their guidance and bank operations makes this a $300 stock in a few years.

There’s only 100 million shares, and the stock appears to be a top 10 shorted stock with 75% utilization on IBKR and only 800k shares left to short. The stock appears to be one of the most naked shorted names in the entire market. In the past 2 years the stock has bounced up to $95 about 6 different times.

If momentum catches this stock, this could easily be gamma hedged over $100 in a few trading sessions.

TLDR: the stock has great fundamentals and projections, yet is getting crushed by short sellers atm. Stock could 10x in a few years from fundamentals alone, but shorts are beyond greedy.

Position: 4700 shares 10x 30 calls expiring next week. 3 30 C 2028 leaps

Update: What does upstart do? Upstart goes UP!",upstart could x in a matter of weeks if momentum gets going upst could be within a week from the naked shorting crowdedness the intrinsic value of this company is around yet trades at current and former ceo have bought over million in shares altogether despite their net worths being upstart essentially already the former ceo bought last week at current ceo doubled down and bought even more million yesterday at bought m at before thats x what anthony noto is buying from sofi in comparison guidance is cagr for years straight with ebitda the company will literally print money as an automated ai loan marketplace using other s capital they get all the reward with none of the risk from lending by routing loans to others balance sheets using ai on top of that they ll be opening upstart bank in a year to further reduce their operational costs there s only employees mostly engineers so they ll be swimming in money forward agreements provide locked in capital and they ve raised b and gotten renewed and raised partner capital agreements their guidance and bank operations makes this a stock in a few years there s only million shares and the stock appears to be a top shorted stock with utilization on ibkr and only k shares left to short the stock appears to be one of the most naked shorted names in the entire market in the past years the stock has bounced up to about different times if momentum catches this stock this could easily be gamma hedged over in a few trading sessions tldr the stock has great fundamentals and projections yet is getting crushed by short sellers atm stock could x in a few years from fundamentals alone but shorts are beyond greedy position shares x calls expiring next week c leaps update what does upstart do upstart goes up,0.8849,positive
2026-05-14 16:14:31+00:00,If I hit the jackpot I take profits If not I just hold long term That's why I use my long term account for trading 🤣🤣🤣,if i hit the jackpot i take profits if not i just hold long term that s why i use my long term account for trading,0.4404,positive
2026-05-14 16:11:44+00:00,"Bought into RKLB shares thanks to you guys and it went well, +$7k.

https://preview.redd.it/7q9xuii0n41h1.png?width=361&format=png&auto=webp&s=fc1117bd842ecc20f363d6152d76bbf7ea0e544e

Saw that options were printing way more though and decided to dip my toes in on the next high conviction regard play here.

  
Well then comes NBIS and there were some guy shorting and some guy posting call positions.  

I flipped a coin and went with the call guy.

https://preview.redd.it/msbou408n41h1.png?width=381&format=png&auto=webp&s=4564e2710c98c1121ced57e6c2503ce7c0a569b7

Still got a week left, wondering if I paperhands this and sell it now though.",bought into rklb shares thanks to you guys and it went well k saw that options were printing way more though and decided to dip my toes in on the next high conviction regard play here well then comes nbis and there were some guy shorting and some guy posting call positions i flipped a coin and went with the call guy still got a week left wondering if i paperhands this and sell it now though,0.8658,positive
2026-05-14 16:07:28+00:00,Riding to the 🌙 ,riding to the,0.0,neutral
2026-05-14 15:47:18+00:00,"**Because one can never go broke taking profits.**

https://preview.redd.it/7qyiy9xzi41h1.png?width=1080&format=png&auto=webp&s=0eb8d7bc2c5c05844cd6676c772d29db105f34ce

",because one can never go broke taking profits,0.6407,positive
