created_utc,body,clean_body,body_sentiment,body_label
2026-05-27 23:14:45+00:00,All tax-free. USD and GBP bases shown.,all tax free usd and gbp bases shown,0.5106,positive
2026-05-27 22:18:04+00:00,Yeah I don't care what anyone thinks I'm a gambler to the core and this is a bubble. I want to thank the VA for paying my mortgage payment for the rest of my life so I can take regarded positions like this. I just need to delete the app and come back in a few months . ,yeah i don t care what anyone thinks i m a gambler to the core and this is a bubble i want to thank the va for paying my mortgage payment for the rest of my life so i can take regarded positions like this i just need to delete the app and come back in a few months,0.8658,positive
2026-05-27 22:08:16+00:00,The amount of fomo we could start seeing in the next few weeks will be legendary. ,the amount of fomo we could start seeing in the next few weeks will be legendary,0.0,neutral
2026-05-27 21:52:23+00:00,I saw other guy posted MSFT won but news says DELL,i saw other guy posted msft won but news says dell,0.3291,positive
2026-05-27 21:42:51+00:00,"$MSFT still isn't moving up, even with this news... it seems like it's been cursed ever since the Gates Foundation sold all its shares a couple of weeks ago.",msft still isn t moving up even with this news it seems like it s been cursed ever since the gates foundation sold all its shares a couple of weeks ago,0.5719,positive
2026-05-27 21:32:14+00:00,"The movement seemed kinda weird today. I was like meh I am going for it

Thank you Leopold, love you buddy",the movement seemed kinda weird today i was like meh i am going for it thank you leopold love you buddy,0.8173,positive
2026-05-27 21:07:45+00:00,One of the worst days ever today thanks to one single stock. Fuck this shit,one of the worst days ever today thanks to one single stock fuck this shit,-0.8735,negative
2026-05-27 21:03:06+00:00,"Up around $200 and change on these so far. Spotify continues to grow and crush and I think it’s severely underbought by investors. 

They are finally figuring out how to get better guidance and add additional revenue streams. I think this stock can hit $1500-2000 within a year. ",up around and change on these so far spotify continues to grow and crush and i think it s severely underbought by investors they are finally figuring out how to get better guidance and add additional revenue streams i think this stock can hit within a year,-0.1779,negative
2026-05-27 20:55:23+00:00,That escalated quickly. I think this thing is just getting started. Going to keep holding indefinitely. ,that escalated quickly i think this thing is just getting started going to keep holding indefinitely,0.0,neutral
2026-05-27 20:47:24+00:00,,nan,0.0,neutral
2026-05-27 20:46:36+00:00,"Been swing trading ASTS for the last few years. Been saving for a house in the meantime and it finally brought me over the threshold. I still believe in the company and think it has a ton of room to grow but I doubt they can deliver on the number of satellites launched this year (45-60, now they are targeting 45) which will negatively impact the stock. The whole SpaceX IPO is also jarring. In no way do I think it will benefit the public or space sector but hoping I am wrong. Looking for a reentry into the $100 level but it don’t see this stopping if we can hold ATH prices. Just had to lock up in my profits but good luck and god speed to the rest of our GAYSTS lads out there. From another gay and well regarded fellow. Also fuck PayPal. Cheers!",been swing trading asts for the last few years been saving for a house in the meantime and it finally brought me over the threshold i still believe in the company and think it has a ton of room to grow but i doubt they can deliver on the number of satellites launched this year now they are targeting which will negatively impact the stock the whole spacex ipo is also jarring in no way do i think it will benefit the public or space sector but hoping i am wrong looking for a reentry into the level but it don t see this stopping if we can hold ath prices just had to lock up in my profits but good luck and god speed to the rest of our gaysts lads out there from another gay and well regarded fellow also fuck paypal cheers,0.9322,positive
2026-05-27 20:38:29+00:00,,nan,0.0,neutral
2026-05-27 20:31:16+00:00,"I hold NVDA and MSFT and I hate you all. I especially hate the retards riding MU and stupid space stocks and the new game stock that somehow became some kind of AI that went up a million percent today and the stupid optics stocks that went up.

I hope the market crashes we die together.

And fuck you META for betraying the rest of the Lag 7. Fuck Mark Zuckerberg for working out and getting in shape. I legitimately thought of buying a 2028 leaps today worth 9k, but didn’t pull the trigger cuz I wanted to have extra cash reserve. And that contract is now worth 11k. I hate all of you.

And I took profit on my SNOW call cuz it doubled and now the stock is up 30% after earnings. And the CRM call I decided to hold is down AH. I fucking hate all of you.",i hold nvda and msft and i hate you all i especially hate the retards riding mu and stupid space stocks and the new game stock that somehow became some kind of ai that went up a million percent today and the stupid optics stocks that went up i hope the market crashes we die together and fuck you meta for betraying the rest of the lag fuck mark zuckerberg for working out and getting in shape i legitimately thought of buying a leaps today worth k but didn t pull the trigger cuz i wanted to have extra cash reserve and that contract is now worth k i hate all of you and i took profit on my snow call cuz it doubled and now the stock is up after earnings and the crm call i decided to hold is down ah i fucking hate all of you,-0.9612,negative
2026-05-27 20:24:31+00:00," **| Salesforce Q1 2026 Earnings & Guidance**  
  
Q1 Results:  
  
 Adj. EPS: $3.88, beats $3.13 estimate (+23.96%)  
 Revenue: $11.13B, in-line with $11.05B estimate (+13.3% YoY)  
 ARR Highlights: Agentforce and Data 360 ARR nearly $3.4B, up 200% YoY, including $1.1B Informatica Cloud ARR and $1.2B Agentforce ARR (+205% YoY)  
 Remaining Performance Obligation (RPO): $33.6B, up 14% YoY  
  
Q2 Guidance:  
  
 EPS: $3.25-3.27, above $3.25 consensus  
 Revenue: $11.27-11.35B, slightly below $11.35B consensus  
  
FY27 Guidance:  
  
 EPS: $14.06-14.12, raised above $13.23 consensus  
 Revenue: $45.9-46.2B, in-line with $46.12B consensus  
  
Additional Highlights:  
  
Entered $25B accelerated share repurchase, upfront delivery of 103M shares (\~80% of total), final settlement expected Q3 FY27.",salesforce q earnings guidance q results adj eps beats estimate revenue b in line with b estimate yoy arr highlights agentforce and data arr nearly b up yoy including b informatica cloud arr and b agentforce arr yoy remaining performance obligation rpo b up yoy q guidance eps above consensus revenue b slightly below b consensus fy guidance eps raised above consensus revenue b in line with b consensus additional highlights entered b accelerated share repurchase upfront delivery of m shares of total final settlement expected q fy,0.5267,positive
2026-05-27 20:22:17+00:00,,nan,0.0,neutral
2026-05-27 20:14:44+00:00,,nan,0.0,neutral
2026-05-27 19:57:12+00:00,This post contains content not supported on old Reddit. [Click here to view the full post](https://sh.reddit.com/r/wallstreetbets/comments/1tpgqsw),this post contains content not supported on old reddit click here to view the full post,-0.2411,negative
2026-05-27 19:53:57+00:00,"I have compiled a list of certain stocks (yes retards it’s on paper deal with it) that I’ve been heavily monitoring over the past 3 months but most of the time never have the balls to go knee deep in. I’m pretty certain at least 5 stocks here will be up 300%+ in a few years. 

Do not take my advice ",i have compiled a list of certain stocks yes retards it s on paper deal with it that i ve been heavily monitoring over the past months but most of the time never have the balls to go knee deep in i m pretty certain at least stocks here will be up in a few years do not take my advice,0.8537,positive
2026-05-27 19:45:18+00:00,I'm also hoping that this option hits $100🤞,i m also hoping that this option hits,0.4215,positive
2026-05-27 19:36:23+00:00,"My thesis seemed like it ended up being on point back in July 2025. I'm so glad I didn't quit stocks during the tariff tantrum. Was so close to selling everything at $300k and going into real estate. 

My portfolio is now 30% $MU, 30% MRVL, 15% $ALAB, 15% $NVDA along with some $ALAB, $APH, and $GOOG in that order. I did did do some other trades and sold little by little. Most notable was buying $400k $MRVL at $74 then sold half and put in into OTM LEAPS and also rolling into shorter $SNDK and $MU calls in Nov 2025.

It had been a wild ride. I quit my job, bought my in-laws a house, and bought my family dream car Yukon Denali XL for my 3 kids still in car seats. So lots of withdraws. I feel so blessed this can be my life and get to spend it with my young family.

$800k in a margin account. $3.7m in me and wife's Roths. $1m in an IRA.

Original yolo and thesis back in July 2025:

[https://www.reddit.com/r/wallstreetbets/s/V1tXlrF522](https://www.reddit.com/r/wallstreetbets/s/V1tXlrF522)

ps mods let me know if I need to include anything else.",my thesis seemed like it ended up being on point back in july i m so glad i didn t quit stocks during the tariff tantrum was so close to selling everything at k and going into real estate my portfolio is now mu mrvl alab nvda along with some alab aph and goog in that order i did did do some other trades and sold little by little most notable was buying k mrvl at then sold half and put in into otm leaps and also rolling into shorter sndk and mu calls in nov it had been a wild ride i quit my job bought my in laws a house and bought my family dream car yukon denali xl for my kids still in car seats so lots of withdraws i feel so blessed this can be my life and get to spend it with my young family k in a margin account m in me and wife s roths m in an ira original yolo and thesis back in july ps mods let me know if i need to include anything else,0.932,positive
2026-05-27 19:33:17+00:00,"Here’s my thesis for the next few decades:

1. White collar wipeout: First, machines replaced hard labor and corporate profits went parabolic. Now, AI is replacing the workers which were believed to be irreplaceable (programmers, lawyers, support staff, drivers, …)  
2. Wealth transfer: Instead of paying employees (who buy consumer goods and keep the rest of the economy alive), companies are funneling that cash directly into AI infrastructure. Margins will skyrocket inbthis groth phase.  
3. Life of the hype ends: This digital revolution will mint massive winners over the next 10–20 years. But eventually, AI will just become a basic utility like electricity. Once it’s everywhere, today's AI giants will get disrupted and laughed at by the next big thing.

What's the play here? Are we looking at the biggest fundamental shift in corporate profitability ever, or am I just buying into a massive, overhyped AI bubble as many believe?",here s my thesis for the next few decades white collar wipeout first machines replaced hard labor and corporate profits went parabolic now ai is replacing the workers which were believed to be irreplaceable programmers lawyers support staff drivers wealth transfer instead of paying employees who buy consumer goods and keep the rest of the economy alive companies are funneling that cash directly into ai infrastructure margins will skyrocket inbthis groth phase life of the hype ends this digital revolution will mint massive winners over the next years but eventually ai will just become a basic utility like electricity once it s everywhere today s ai giants will get disrupted and laughed at by the next big thing what s the play here are we looking at the biggest fundamental shift in corporate profitability ever or am i just buying into a massive overhyped ai bubble as many believe,0.9612,positive
2026-05-27 18:39:39+00:00,"Yes I eat crayons, favorite color is seven.",yes i eat crayons favorite color is seven,0.6908,positive
2026-05-27 17:43:14+00:00,[ Removed by Reddit on account of violating the [content policy](/help/contentpolicy). ],removed by reddit on account of violating the content policy help contentpolicy,-0.2023,negative
2026-05-27 17:38:49+00:00,Not selling till $16 ,not selling till,0.0,neutral
2026-05-27 16:47:54+00:00,,nan,0.0,neutral
2026-05-27 16:23:44+00:00,"MU is getting all the heat! Is this the day we see it cross 1000 after hours? I do like the stock based on it's forward PE.

https://preview.redd.it/h6hq8swehp3h1.jpg?width=1320&format=pjpg&auto=webp&s=ba5b0987dc89e30b29778ffaa9ca195c7ca454bb

",mu is getting all the heat is this the day we see it cross after hours i do like the stock based on it s forward pe,0.3612,positive
2026-05-27 16:22:40+00:00,Lumen has been trading and valued as the POS telecom company it has been for years. But silently they have been pivoting to a growth company and are uniquely positioned to benefit greatly from the AI build out.   I believe the market is finally starting to appreciate the turnaround story and rerate this company as a growth stock now that the turnaround is basically complete.,lumen has been trading and valued as the pos telecom company it has been for years but silently they have been pivoting to a growth company and are uniquely positioned to benefit greatly from the ai build out i believe the market is finally starting to appreciate the turnaround story and rerate this company as a growth stock now that the turnaround is basically complete,0.946,positive
2026-05-27 16:21:30+00:00,"Jeez, my friend told me about it pre-market and I thought heck why not and bought in at $7, sold at $15.9 (2nd pic) for gains of 43.93k SGD (abt 34k USD)

Rest of the positions still holding, if it continues to rise, whatevs, I don't think I can be upset

Note: The ticker is banned due to too low cap, this post will prob get taken down 🫡 but I just had to share",jeez my friend told me about it pre market and i thought heck why not and bought in at sold at nd pic for gains of k sgd abt k usd rest of the positions still holding if it continues to rise whatevs i don t think i can be upset note the ticker is banned due to too low cap this post will prob get taken down but i just had to share,0.3071,positive
2026-05-27 15:44:21+00:00,"I'm 25 and also work as an aerospace engineer. But I'm too retarded to work for rklb, in fact I invested my first paychecks out of college into rklb stock a couple years ago cuz they were clearly smarter than me and kept rejecting my application lol. Long term very bullish on Space and EVTOL. Selling 70% of this profit because it's too good not to take and good timing w. upcoming spaceX IPO. ",i m and also work as an aerospace engineer but i m too retarded to work for rklb in fact i invested my first paychecks out of college into rklb stock a couple years ago cuz they were clearly smarter than me and kept rejecting my application lol long term very bullish on space and evtol selling of this profit because it s too good not to take and good timing w upcoming spacex ipo,0.9378,positive
2026-05-27 15:19:32+00:00,,nan,0.0,neutral
2026-05-27 15:14:55+00:00,Stocks only go up so bought some crypto puts for a quick flip ,stocks only go up so bought some crypto puts for a quick flip,0.0,neutral
2026-05-27 15:03:08+00:00,,nan,0.0,neutral
2026-05-27 14:47:33+00:00,"What a run! Bought it last week and was hoping MU would go up because it's the cheapest stock in the SP500 based on forward PE. Market finally realizing it now, MU to $1000!

https://preview.redd.it/oo8lmlze0p3h1.jpg?width=1320&format=pjpg&auto=webp&s=fb42ff5d5f66898d83b6c7ba5e05ba791619e705

  
",what a run bought it last week and was hoping mu would go up because it s the cheapest stock in the sp based on forward pe market finally realizing it now mu to,0.4215,positive
2026-05-27 14:26:25+00:00,"I ain’t leaving.

Roll groupon",i ain t leaving roll groupon,0.0,neutral
2026-05-27 14:23:16+00:00,,nan,0.0,neutral
2026-05-27 13:32:03+00:00,Is this sustainable?,is this sustainable,0.0,neutral
2026-05-27 12:56:45+00:00,"I am reading the jobs report and I came across this snipped below.  How is this possible if AI spending is increasing.  I guess the quetions that comes to mind is where is the money going and why is not showing up somewhere in Hiring or in the actual economy?



""Employment in information continued to trend down in April (-13,000). Telecommunications lost 3,000 jobs, while employment continued to trend down in motion picture and sound recording industries (-6,000) and in computing infrastructure providers, data processing, web hosting, and related services  (-4,000). Information employment is down by 342,000, or 11.0 percent, since its most recent peak in November 2022. """,i am reading the jobs report and i came across this snipped below how is this possible if ai spending is increasing i guess the quetions that comes to mind is where is the money going and why is not showing up somewhere in hiring or in the actual economy employment in information continued to trend down in april telecommunications lost jobs while employment continued to trend down in motion picture and sound recording industries and in computing infrastructure providers data processing web hosting and related services information employment is down by or percent since its most recent peak in november,-0.3182,negative
2026-05-27 12:50:48+00:00,"Big space bull here (also own 4000 RDW ($2.56 cost basis), 250 $SATS ($80/share avg), 200 $PL ($14/share), and another 300 shares of $RKLB in my Roth ($11/share)

Been also buying and selling LEAPS for $RKLB on every 20%+ drop and can’t wait for the next one to do the same again and again and again. Overall, up $75k + these options for free + these shares for free",big space bull here also own rdw cost basis sats share avg pl share and another shares of rklb in my roth share been also buying and selling leaps for rklb on every drop and can t wait for the next one to do the same again and again and again overall up k these options for free these shares for free,0.926,positive
2026-05-27 12:44:02+00:00,,nan,0.0,neutral
2026-05-27 11:37:51+00:00,When $1000?,when,0.0,neutral
2026-05-27 11:11:35+00:00,,nan,0.0,neutral
2026-05-27 11:00:43+00:00,This post contains content not supported on old Reddit. [Click here to view the full post](https://sh.reddit.com/r/wallstreetbets/comments/1tp25tq),this post contains content not supported on old reddit click here to view the full post,-0.2411,negative
2026-05-27 10:45:16+00:00,Crossed 108% up in 3 months — thanks NOK,crossed up in months thanks nok,0.4404,positive
2026-05-27 09:07:06+00:00,"Bought APLD at 5$, and NBIS at $84.

It's been a while ride, high risk high reward stocks, I've seen my portfolio lose half its value within a month. But after all, it was all worth it",bought apld at and nbis at it s been a while ride high risk high reward stocks i ve seen my portfolio lose half its value within a month but after all it was all worth it,0.4588,positive
2026-05-27 06:33:53+00:00,,nan,0.0,neutral
2026-05-27 06:28:29+00:00,"https://preview.redd.it/ubp7l1yfyl3h1.png?width=944&format=png&auto=webp&s=7c338b6edba598d898d6a22b97ae7ada0adec06b

https://preview.redd.it/2tqhkhogyl3h1.png?width=3624&format=png&auto=webp&s=c9d790d890d61750cf883577a64adce0e4ee58c2

Not only does the GOOGL daily chart looks like a ST reversal in trend is about to develop. Sequential counter at 1-0 Sell (a positive count).  The closing price of 388.88 has four eights.

8888 in Cantonese is **八八八八 where 八 is a homophone for the Chinese word 發 (faat) which means ""to strike it rich"".  To have 2 in a row is super lucky, 4 in a row is astronomical wealth.**

**The number 4 in Cantonese is** 四 where 四 is a homophone for the Chinese word 死 (***sei) which means ""death""***

***So 88.88 or 8888 in Cantonese*** **發發發發** ***reads like*** **發**死 in Cantonese and means ""Unstoppable Wealth""

In Hong Kong, people pay hundreds of thousands for Car License plates in public auctions.  In phone numbers and addresses.

Having 4 consecutive 8 is fortuitous indeed over there.

As for GOOG at 384.84

That's 2 strict **發**死 in a row.  A literal string of Die Rich.

The happy coincidence today is that both GOOGLE shares closed with similar auspicious numbers that compliments each other, affirming future direction for Google stock.



May 27 11AM update

GOOGL 390.84  range so far 385.90 to 392.85

I wrote 385 May 29 puts for 3.50 with delta < -0.21 and Vega 0.07 - excellent chance I keep the premium.",not only does the googl daily chart looks like a st reversal in trend is about to develop sequential counter at sell a positive count the closing price of has four eights in cantonese is where is a homophone for the chinese word faat which means to strike it rich to have in a row is super lucky in a row is astronomical wealth the number in cantonese is where is a homophone for the chinese word sei which means death so or in cantonese reads like in cantonese and means unstoppable wealth in hong kong people pay hundreds of thousands for car license plates in public auctions in phone numbers and addresses having consecutive is fortuitous indeed over there as for goog at that s strict in a row a literal string of die rich the happy coincidence today is that both google shares closed with similar auspicious numbers that compliments each other affirming future direction for google stock may am update googl range so far to i wrote may puts for with delta and vega excellent chance i keep the premium,0.9849,positive
2026-05-27 05:25:48+00:00,,nan,0.0,neutral
2026-05-27 04:47:22+00:00,"Not really that wealthy so I’m doing what I can but so far I’ve gotten lucky. I also have a Roth IRA entirely composed of mutual funds and ETFs that has performed worse in the same timespan. 

(Thank you to whoever in here told me to buy palantir at $23 a while ago.)",not really that wealthy so i m doing what i can but so far i ve gotten lucky i also have a roth ira entirely composed of mutual funds and etfs that has performed worse in the same timespan thank you to whoever in here told me to buy palantir at a while ago,0.2828,positive
2026-05-27 03:11:15+00:00,"I sold my 110 shares of Micron Technology at $64. Last September, I bought weekly MU call options, but they crashed and I sold them for an $8,000 loss. If I had bought yearly calls instead, I would’ve been a millionaire by now.",i sold my shares of micron technology at last september i bought weekly mu call options but they crashed and i sold them for an loss if i had bought yearly calls instead i would ve been a millionaire by now,-0.3291,negative
2026-05-27 03:02:32+00:00,"1. Memory is a Commodity, Not a Moat  
2. SK Hynix and Samsung, the hyperscalers will mercilessly pit the memory makers against each other to drive prices into the dirt.

Currently stuck with FKN Elon on $SPCX and $TSLA   
(Waiting on 350k$ margin bet to go tits up, hodling my last position as posted on r/wallstreetbets). 

Once TSLA goes UP, I will sell that and short $MU now that HOOD allows shorting stocks. 

What could go wrong!!??  
(I tried Michel Scott’s “I declare bankruptcy” meme but failed)",memory is a commodity not a moat sk hynix and samsung the hyperscalers will mercilessly pit the memory makers against each other to drive prices into the dirt currently stuck with fkn elon on spcx and tsla waiting on k margin bet to go tits up hodling my last position as posted on r wallstreetbets once tsla goes up i will sell that and short mu now that hood allows shorting stocks what could go wrong i tried michel scott s i declare bankruptcy meme but failed,-0.8462,negative
2026-05-27 02:47:36+00:00,760% return on Micron. $5k —> $43k. Kicking myself for not buying more 🫠,return on micron k k kicking myself for not buying more,0.0,neutral
2026-05-27 02:33:37+00:00,Getting a bit frosty up here but I’m holding until we hit $20+ ,getting a bit frosty up here but i m holding until we hit,0.0,neutral
