created_utc,body,clean_body,body_sentiment,body_label
2026-05-13 18:24:56+00:00,"PriceSmart is a Costco-style warehouse store chain that operates exclusively in Latin America and the Caribbean. The founder of PriceSmart, Robert Price, was actually a Costco executive in the early 90’s before his segment was spun off. He saw the potential of the Costco model, but recognized that Costco and Sam’s Club had saturated the US market. PriceSmart began to develop stores in Latin America and the Caribbean instead. The PriceSmart chain today is remarkably similar to Costco:

1. Yearly membership fees contribute a major share of total earnings
2. Both companies have relatively low debt. Long term debt/equity for COST is 0.18 and for PSMT it is 0.10
3. Same store revenue growth for both companies has been similar: in the most recent quarter COST was at 7.4%, while PSMT was at 7.8%.

The main difference for investors is that COST mostly operates in stable, developed markets, while PSMT does not. It’s important to note that PSMT is headquartered and listed in the US, on the NASDAQ. PSMT has additional currency and political risk, but not additional Governance risk. The market has priced in these risks with lower valuation ratios. COST currently has an EV/EBITDA of 33.0 and for PSMT, it is 13.7. 

Why am I bullish on PSMT right now? Because there’s an extremely consequential election this month in Colombia, which is the company’s most important market. And the election results have the potential to drive growth for years and election related downside is very limited.

Of PSMT’s total 7.8% same store revenue growth in the most recent quarter, Colombia contributed nearly half of this growth. And there appears to be the potential to rapidly increase store count in the country. Colombia has a population of 54 million and only 10 PriceSmart stores. In comparison, Costa Rica has a population of 5.2 million and it has 9 stores. Store growth in Colombia has been limited by permit restrictions and organized crime.

\*\*\*The next section is about the election and overall political situation in Colombia. I am not claiming one result or another is better for the people there. I am writing about it from an investor’s perspective because I believe the election results will significantly affect the company’s growth potential.\*\*\*

The current political party in power is the left wing “Historic Pact”. This party is generally popular with the working class and indigenous people. This party recently passed a massive, 24% increase in the minimum wage. Their main competition this cycle is the “National Salvation” party, with presidential candidate Abelardo de la Espriella. His plans to deal with crime have been compared to Nayib Bukele’s: militarization of the police and mass arrests. Espriella also wants corporate deregulation, free trade, and improved relations with the US.

PSMT will directly benefit if there is a change in power this election cycle:

1. A much lower corporate tax rate
2. Lower security and theft costs for transportation and warehousing 
3. The potential to expand to new parts of the country if the security situation improves
4. Decreased permitting restrictions could greatly increase store count.
5. Decreased risk of a trade conflict with the US

Investors are likely to price in these improved growth prospects soon after a favorable outcome occurs.  A nearly identical scenario already unfolded earlier this year in Costa Rica, the company’s second most important market. A right wing populist party won the final round of the election on February 1st of this year. PSMT stock price went up 9.5% in the 2 weeks after the election on no other news, while the S&P 500 was down.

If the same scenario occurs in Colombia, I expect the impact to be larger. It’s a more important market because it drives company wide growth. And there’s far more potential for store count growth. The store to population ratio in Colombia is ten times lower compared to Costa Rica. If the election results end up unfavorable, from an investor’s perspective, there’s not much downside. There’s no change of power and PSMT has already shown that it can grow in this market with the current government.

Betting markets currently have 62% odds that there will be a change in party this election. The first round is on May 31st.

I have 100% of my portfolio in PSMT. About $90K with an average cost of $157.5 per share.

https://preview.redd.it/jjqgfs7a5y0h1.png?width=1305&format=png&auto=webp&s=6a163f3e42dfa281d0fea87825ed10cdb74dd9ed

",pricesmart is a costco style warehouse store chain that operates exclusively in latin america and the caribbean the founder of pricesmart robert price was actually a costco executive in the early s before his segment was spun off he saw the potential of the costco model but recognized that costco and sam s club had saturated the us market pricesmart began to develop stores in latin america and the caribbean instead the pricesmart chain today is remarkably similar to costco yearly membership fees contribute a major share of total earnings both companies have relatively low debt long term debt equity for cost is and for psmt it is same store revenue growth for both companies has been similar in the most recent quarter cost was at while psmt was at the main difference for investors is that cost mostly operates in stable developed markets while psmt does not it s important to note that psmt is headquartered and listed in the us on the nasdaq psmt has additional currency and political risk but not additional governance risk the market has priced in these risks with lower valuation ratios cost currently has an ev ebitda of and for psmt it is why am i bullish on psmt right now because there s an extremely consequential election this month in colombia which is the company s most important market and the election results have the potential to drive growth for years and election related downside is very limited of psmt s total same store revenue growth in the most recent quarter colombia contributed nearly half of this growth and there appears to be the potential to rapidly increase store count in the country colombia has a population of million and only pricesmart stores in comparison costa rica has a population of million and it has stores store growth in colombia has been limited by permit restrictions and organized crime the next section is about the election and overall political situation in colombia i am not claiming one result or another is better for the people there i am writing about it from an investor s perspective because i believe the election results will significantly affect the company s growth potential the current political party in power is the left wing historic pact this party is generally popular with the working class and indigenous people this party recently passed a massive increase in the minimum wage their main competition this cycle is the national salvation party with presidential candidate abelardo de la espriella his plans to deal with crime have been compared to nayib bukele s militarization of the police and mass arrests espriella also wants corporate deregulation free trade and improved relations with the us psmt will directly benefit if there is a change in power this election cycle a much lower corporate tax rate lower security and theft costs for transportation and warehousing the potential to expand to new parts of the country if the security situation improves decreased permitting restrictions could greatly increase store count decreased risk of a trade conflict with the us investors are likely to price in these improved growth prospects soon after a favorable outcome occurs a nearly identical scenario already unfolded earlier this year in costa rica the company s second most important market a right wing populist party won the final round of the election on february st of this year psmt stock price went up in the weeks after the election on no other news while the s p was down if the same scenario occurs in colombia i expect the impact to be larger it s a more important market because it drives company wide growth and there s far more potential for store count growth the store to population ratio in colombia is ten times lower compared to costa rica if the election results end up unfavorable from an investor s perspective there s not much downside there s no change of power and psmt has already shown that it can grow in this market with the current government betting markets currently have odds that there will be a change in party this election the first round is on may st i have of my portfolio in psmt about k with an average cost of per share,0.9949,positive
2026-05-13 18:21:51+00:00,"The market has had an insane bull run since 2023, we literally threw a dart at the board and still hit each time. Yeah that's great, but in the long run its horrendous.

We've seen post like this, creating fear about our wars, elections, and fed rates. It doesn't really matter, each time the market has overreacted then corrected itself. It's been happening so much, it's causing high inflation on share prices. 

The low of the year 2023, will not be retouched unless we literally bombed our markets or companies. AI/Tech companies are 100%-1000% higher then it was 3 years ago. 

Micron, RKLB, PLTR, the list goes on and on. These companies stayed at their respected share price for years, then within a year rise 800%?  I understand especially the last few years our technology companies have made huge innovations. But are they really large enough to stabilize a share price above 800%? I mean maybe I'm wrong, but I've heard a lot of talk about “true evaluations”. It's almost like we can price the share at whatever we want, since we are the leaders in ai and technology.

SPY is nearly up 100% from 2023, which is actually insane. Considering majority of the baby boomers still own the market, we just doubled their entire savings. The rich just got even richer, and it's pushing younger generations into a corner. We won't be able to afford stocks, homes, living expenses and more. 

The market is high and theirs no doubt about it, we can keep pushing it higher. But at what point is this too high?",the market has had an insane bull run since we literally threw a dart at the board and still hit each time yeah that s great but in the long run its horrendous we ve seen post like this creating fear about our wars elections and fed rates it doesn t really matter each time the market has overreacted then corrected itself it s been happening so much it s causing high inflation on share prices the low of the year will not be retouched unless we literally bombed our markets or companies ai tech companies are higher then it was years ago micron rklb pltr the list goes on and on these companies stayed at their respected share price for years then within a year rise i understand especially the last few years our technology companies have made huge innovations but are they really large enough to stabilize a share price above i mean maybe i m wrong but i ve heard a lot of talk about true evaluations it s almost like we can price the share at whatever we want since we are the leaders in ai and technology spy is nearly up from which is actually insane considering majority of the baby boomers still own the market we just doubled their entire savings the rich just got even richer and it s pushing younger generations into a corner we won t be able to afford stocks homes living expenses and more the market is high and theirs no doubt about it we can keep pushing it higher but at what point is this too high,0.9359,positive
2026-05-13 18:05:47+00:00,entered call yesterday before market opened and still didnt exit yet,entered call yesterday before market opened and still didnt exit yet,0.0,neutral
2026-05-13 18:00:28+00:00,"Put like 1% of my portfolio into these after I read the earnings report and it dropped 30%. 

Lesson: read earnings sometimes! You might find a gem",put like of my portfolio into these after i read the earnings report and it dropped lesson read earnings sometimes you might find a gem,0.3612,positive
2026-05-13 17:55:54+00:00,"I don't expect these bets to actually end itm, but am using them as a leveraged way to ride the wave up to silver spot price of $100/oz. Rolling every time I get at least +100%. ",i don t expect these bets to actually end itm but am using them as a leveraged way to ride the wave up to silver spot price of oz rolling every time i get at least,0.0,neutral
2026-05-13 17:37:33+00:00,"Saw some chap put a million on it earlier today so like a lemming, decided to buy £9k in stocks and a few hundred in options. Beer tokens for the brewery.

Holding this one either up to the top or into the ground",saw some chap put a million on it earlier today so like a lemming decided to buy k in stocks and a few hundred in options beer tokens for the brewery holding this one either up to the top or into the ground,0.6176,positive
2026-05-13 17:36:28+00:00,"Mods bubble popped my first post so let me lay out the positions:

NVDA: 300-350k profit bought my first shares in 2016 been in and out since and usually would buy 100k leaps that expire years from the date bought would cash those at around 25k profit

MU, AMD, AMZN, AVGO, HCA, NBIS: Usually on big drops I bought tons of shares of these guys and usually around 10-20k far dated options would either ride them out to 0 or make bank.

QQQ 0DTE has been godly to me easily have made around 50-75k

My biggest gainer by far was Rocket Lab. Had 13,500 shares at like 22 avg during liberation day times but trimmed as it went up to 40 and 50 and completely cashed out right on tax day (I think it was around 70 at the time - feels bad). Have hit massive option plays from previous posts and the rest is history.

This year was so fucking stressful. Godspeed my friends see you all at Wendy’s when it’s back at 0.

Edit: wow this post blew up there’s no way I can reply to all the questions but I love you all and I definitely didn’t sell shit but will be full cash end of day. Think it’s time I wait for the crash and try and kick this nicotine addiction. 🤍🤍🤍🤍",mods bubble popped my first post so let me lay out the positions nvda k profit bought my first shares in been in and out since and usually would buy k leaps that expire years from the date bought would cash those at around k profit mu amd amzn avgo hca nbis usually on big drops i bought tons of shares of these guys and usually around k far dated options would either ride them out to or make bank qqq dte has been godly to me easily have made around k my biggest gainer by far was rocket lab had shares at like avg during liberation day times but trimmed as it went up to and and completely cashed out right on tax day i think it was around at the time feels bad have hit massive option plays from previous posts and the rest is history this year was so fucking stressful godspeed my friends see you all at wendy s when it s back at edit wow this post blew up there s no way i can reply to all the questions but i love you all and i definitely didn t sell shit but will be full cash end of day think it s time i wait for the crash and try and kick this nicotine addiction,0.7931,positive
2026-05-13 17:36:10+00:00,,nan,0.0,neutral
2026-05-13 17:29:34+00:00,"Sometimes I am happy, but than this hits my head and I am sad again.

  
Sold 1497 RTLB shares in July, 2024 for 4,78€.",sometimes i am happy but than this hits my head and i am sad again sold rtlb shares in july for,-0.0,neutral
2026-05-13 16:58:38+00:00,,nan,0.0,neutral
2026-05-13 16:53:37+00:00,"Stupid mistake in betting against the market. Still learning how to do this. But man, it sucka to see red lol",stupid mistake in betting against the market still learning how to do this but man it sucka to see red lol,0.2023,positive
2026-05-13 16:51:03+00:00,,nan,0.0,neutral
2026-05-13 16:17:20+00:00,"Ford is pivoting its battery plant to serve utilities, data centers and other businesses. IMO should be a good battery play.

Position: F JAN 15 '27 11.85 Call",ford is pivoting its battery plant to serve utilities data centers and other businesses imo should be a good battery play position f jan call,0.6486,positive
2026-05-13 16:01:41+00:00,"It's now over half my Roth portfolio.  PLTR and QQQ make up another 25%.  The other 25% is misc other stuff - RDDT, FLKR, etc.",it s now over half my roth portfolio pltr and qqq make up another the other is misc other stuff rddt flkr etc,0.0,neutral
2026-05-13 15:14:01+00:00,"Held through the hopeless lows of 260 in March, was down 70% at one point. Regret not adding more during the Jan-March period.",held through the hopeless lows of in march was down at one point regret not adding more during the jan march period,-0.765,negative
2026-05-13 12:35:43+00:00,,nan,0.0,neutral
2026-05-13 11:55:33+00:00,,nan,0.0,neutral
2026-05-13 11:29:20+00:00,"* Revenue is up 684% YoY $399M this quarter. They actually turned a profit on an EBITDA basis $129.5M, which is wild for how much they're spending.
* The Nvidia connection is huge. Nvidia just dropped $2B into them, and they're one of the first getting Blackwell/Rubin chips.
* 1.2 GW Megasite: They just got the green light for a massive ""AI factory"" in Pennsylvania. 
* Cash flow: They’re sitting on like $9B in cash now after some massive funding rounds.",revenue is up yoy m this quarter they actually turned a profit on an ebitda basis m which is wild for how much they re spending the nvidia connection is huge nvidia just dropped b into them and they re one of the first getting blackwell rubin chips gw megasite they just got the green light for a massive ai factory in pennsylvania cash flow they re sitting on like b in cash now after some massive funding rounds,0.7717,positive
2026-05-13 11:00:35+00:00,This post contains content not supported on old Reddit. [Click here to view the full post](https://sh.reddit.com/r/wallstreetbets/comments/1tbw89v),this post contains content not supported on old reddit click here to view the full post,-0.2411,negative
2026-05-13 09:56:04+00:00,,nan,0.0,neutral
2026-05-13 09:51:05+00:00,,nan,0.0,neutral
2026-05-13 09:35:53+00:00,,nan,0.0,neutral
2026-05-13 09:16:27+00:00,,nan,0.0,neutral
2026-05-13 02:51:12+00:00,"Description is in the title.

https://preview.redd.it/34h7h8gvjt0h1.jpg?width=1170&format=pjpg&auto=webp&s=0f2dd397b8de4914a3881a22267ea5615170de2b

",description is in the title,0.0,neutral
2026-05-13 02:32:02+00:00,,nan,0.0,neutral
2026-05-13 02:00:09+00:00,"Currently only 3 companies make HBM4, the biggest bottleneck of the entire AI build. Samsung, SK, and MU. Samsungs union walked away from talks last night, strike window is set for5/21 to 6/7, 18 days of the worlds biggest memory fab going dark. Once shutdown, tooling recalibration on these lines take WEEKS not days.

SK already sold out their DRAM, NAND, and HBM thru end of 2026 to NVDA. Locked in at contract prices. They get the headline of being #1 HBM but they have nothing left to put on the truck during a spot price spike. MU is in the same boat on HBM specifically, also sold out thru 2026, but the real prize is different. When Samsung goes dark for 18 days during a record memory upcycle, spot DRAM and NAND prices melt up, and MU’s 2027 contract negotiations happen with Samsung as the absent third bidder at the table. MU also has more standard DRAM and NAND flex than SK does right now.

Add to it MU has US based fabs, zero Korea labor exposure, and no Korean governance discount baked into the multiple. They have been shipping HBM3E to NVDA in volume since 2024 so the qualification work is long done. If your a hyperscaler scrambling for memory during the strike, you call the guys in Boise who can ship, not the guys in Pyeongtaek who cant.

Last thing, MU trades on US exchanges through any US discount broker, where as US retail still only has indirect SK exposure thru ETFs. That asymmetric access flows straight into MU’s multiple when the trade goes viral on here.

My thesis, MU is going to $1300. HBM is running approx 80% margins and mix keeps climbing every quarter. As HBM eats more of the revenue stack your blended earnings power gets to $80+ EPS run rate easy. $1300 is barely 16x at that point, and def reachable this year if the market feels AI super cycle holds thru 2027. Better hop on the ride while it is still under 800.

1200 shares at $464 and 100 shares at $381",currently only companies make hbm the biggest bottleneck of the entire ai build samsung sk and mu samsungs union walked away from talks last night strike window is set for to days of the worlds biggest memory fab going dark once shutdown tooling recalibration on these lines take weeks not days sk already sold out their dram nand and hbm thru end of to nvda locked in at contract prices they get the headline of being hbm but they have nothing left to put on the truck during a spot price spike mu is in the same boat on hbm specifically also sold out thru but the real prize is different when samsung goes dark for days during a record memory upcycle spot dram and nand prices melt up and mu s contract negotiations happen with samsung as the absent third bidder at the table mu also has more standard dram and nand flex than sk does right now add to it mu has us based fabs zero korea labor exposure and no korean governance discount baked into the multiple they have been shipping hbm e to nvda in volume since so the qualification work is long done if your a hyperscaler scrambling for memory during the strike you call the guys in boise who can ship not the guys in pyeongtaek who cant last thing mu trades on us exchanges through any us discount broker where as us retail still only has indirect sk exposure thru etfs that asymmetric access flows straight into mu s multiple when the trade goes viral on here my thesis mu is going to hbm is running approx margins and mix keeps climbing every quarter as hbm eats more of the revenue stack your blended earnings power gets to eps run rate easy is barely x at that point and def reachable this year if the market feels ai super cycle holds thru better hop on the ride while it is still under shares at and shares at,0.974,positive
2026-05-12 22:16:49+00:00,Was expecting to throw away a k LOL! Bought during lunch and held to expiry.,was expecting to throw away a k lol bought during lunch and held to expiry,0.4215,positive
