created_utc,body,clean_body,body_sentiment,body_label
2026-07-03 12:45:56+00:00,"Amazon says its Leo constellation has reached 396 satellites, enough to provide continuous service across its initial coverage latitudes and begin commercial operations. The milestone turns Leo from a long-delayed infrastructure project into a functioning competitor to SpaceX’s Starlink, although early users should expect limited coverage and occasional interruptions. Amazon ultimately plans to deploy 3,232 satellites, but it still has a massive gap to close against Starlink’s fleet of more than 10,000 operational satellites. The real battle may be less about matching Starlink immediately and more about Amazon bundling satellite connectivity into AWS, logistics, aviation, maritime, and enterprise contracts.

source - [https://www.theverge.com/science/960563/amazon-leo-service-tipping-point](https://www.theverge.com/science/960563/amazon-leo-service-tipping-point)",amazon says its leo constellation has reached satellites enough to provide continuous service across its initial coverage latitudes and begin commercial operations the milestone turns leo from a long delayed infrastructure project into a functioning competitor to spacex s starlink although early users should expect limited coverage and occasional interruptions amazon ultimately plans to deploy satellites but it still has a massive gap to close against starlink s fleet of more than operational satellites the real battle may be less about matching starlink immediately and more about amazon bundling satellite connectivity into aws logistics aviation maritime and enterprise contracts source,-0.4939,negative
2026-07-03 10:00:37+00:00,This post contains content not supported on old Reddit. [Click here to view the full post](https://sh.reddit.com/r/wallstreetbets/comments/1uma8p0),this post contains content not supported on old reddit click here to view the full post,-0.2411,negative
2026-07-03 08:53:29+00:00,Started with 30k a couple years ago turned on margin and made it to 1.4M. fell to 150k 5-6 times and now we're here. No longer in margin.,started with k a couple years ago turned on margin and made it to m fell to k times and now we re here no longer in margin,-0.296,negative
2026-07-03 08:45:57+00:00,"Meta is reportedly considering a collaboration with Samsung to produce custom artificial intelligence chips valued at 10 trillion Korean won ($7.7 billion). This potential partnership aims to enhance Meta's AI capabilities by leveraging Samsung's semiconductor manufacturing expertise. The move underscores Meta's commitment to advancing its AI infrastructure.

The chips would be built on Samsung’s 2nm process marking a shift from TSMC for Meta’s latest in house AI accelerator.

",meta is reportedly considering a collaboration with samsung to produce custom artificial intelligence chips valued at trillion korean won billion this potential partnership aims to enhance meta s ai capabilities by leveraging samsung s semiconductor manufacturing expertise the move underscores meta s commitment to advancing its ai infrastructure the chips would be built on samsung s nm process marking a shift from tsmc for meta s latest in house ai accelerator,0.9062,positive
2026-07-03 08:01:31+00:00,Maybe I should check out that sport,maybe i should check out that sport,0.0,neutral
2026-07-03 07:30:44+00:00,,nan,0.0,neutral
2026-07-03 05:48:14+00:00,"I bought the wrong dip this morning, can’t believe it was $487 just 2 days ago",i bought the wrong dip this morning can t believe it was just days ago,-0.4767,negative
2026-07-03 04:37:09+00:00,"In 2018 I traded my way from 0 to 150k CAD (using my student loans). Then lost all of it shorting TLRY. In 2025 I traded my way from 0 to \\\~$2 million CAD (using line of credits). Then I lost 95% of it trying to long MSTR. I’m currently on a recovery, this one being over the last 2 weeks. My post history has been made public so you can see all the YOLOs. Note: the screenshots only include my WealthSimple account. ",in i traded my way from to k cad using my student loans then lost all of it shorting tlry in i traded my way from to million cad using line of credits then i lost of it trying to long mstr i m currently on a recovery this one being over the last weeks my post history has been made public so you can see all the yolos note the screenshots only include my wealthsimple account,-0.2732,negative
2026-07-03 03:54:08+00:00,,nan,0.0,neutral
2026-07-03 02:01:59+00:00,"I recently made a post on how I lost in every AI stock

[https://www.reddit.com/r/wallstreetbets/s/MFObrubSnn](https://www.reddit.com/r/wallstreetbets/s/MFObrubSnn)

Folks there said I need to have more conviction and hold longer. I feel thats not true and whenever I buy something it goes to loss. I got some Micron based on the result bump and memory supercycle talk by Sanjay and POTUS tweet. From that day its been going down

https://preview.redd.it/agm2wtk88xah1.png?width=1921&format=png&auto=webp&s=5402e461292729bd84d210ceec1d7585ae5c120b

I also got a Sandisk stock as Bernstein increased target to 3000. I think Sandisk will now go to 300

https://preview.redd.it/pj1u1zbc8xah1.png?width=1927&format=png&auto=webp&s=599049ad07f22ebc698df6914bd92737537d98b5

I bought AVGO as its more diversified chip player that will survive even after AI fades. But its on its way to 0

https://preview.redd.it/g05vd6ui8xah1.png?width=1362&format=png&auto=webp&s=ed8ee8a506c63cc4663ccbbbdfa1f53a420ed7bc

The funny part is I have some SOXS and that is also at a loss! I thought I ll outsmart my luck by getting both bull and bear positions. But my luck is smarter and now both are in loss 

https://preview.redd.it/kjf89z1t8xah1.png?width=1435&format=png&auto=webp&s=37fee380939a169f694965eb5ee669e36f679ffb

You can ask why did I buy Micron and Sandisk at lifetime high. They were at lifetime high, RSI above 80, outside bollingers for months now. So technical exhaustion cant be the reason. Fundamentals have also not changed. Both are continuing sales. 

So the reason is clear.

I am not going to sell these though. Its ok if I lose the 10 K in Micron and Sandisk. Atleast I will stop others from making money :)",i recently made a post on how i lost in every ai stock folks there said i need to have more conviction and hold longer i feel thats not true and whenever i buy something it goes to loss i got some micron based on the result bump and memory supercycle talk by sanjay and potus tweet from that day its been going down i also got a sandisk stock as bernstein increased target to i think sandisk will now go to i bought avgo as its more diversified chip player that will survive even after ai fades but its on its way to the funny part is i have some soxs and that is also at a loss i thought i ll outsmart my luck by getting both bull and bear positions but my luck is smarter and now both are in loss you can ask why did i buy micron and sandisk at lifetime high they were at lifetime high rsi above outside bollingers for months now so technical exhaustion cant be the reason fundamentals have also not changed both are continuing sales so the reason is clear i am not going to sell these though its ok if i lose the k in micron and sandisk atleast i will stop others from making money,0.6924,positive
2026-07-03 00:12:20+00:00,"Yeah, I know about the debt

No AI slop or due diligence from me

Larry isn’t gonna lose and Larry has powerful friends

Oversold on debt, post earnings sell off, and Meta cloud fears",yeah i know about the debt no ai slop or due diligence from me larry isn t gonna lose and larry has powerful friends oversold on debt post earnings sell off and meta cloud fears,-0.5574,negative
2026-07-02 23:40:09+00:00,"Sotheby's is auctioning Jensen Huang's Tom Ford Leather Jacket. Proceeds going to a good cause: NVDA $220+ bagholders. Nah, not really, but I wouldn't hate it.

They should have auctioned this back in May when I had money. At least now I would at least have a leather jacket. Alas.

[https://www.sothebys.com/en/buy/auction/2026/the-ceos-uniform-jensen-huangs-tom-ford-leather-jacket/the-jensen-jacket-jensen-huangs-tom-ford-leather](https://www.sothebys.com/en/buy/auction/2026/the-ceos-uniform-jensen-huangs-tom-ford-leather-jacket/the-jensen-jacket-jensen-huangs-tom-ford-leather)

  
",sotheby s is auctioning jensen huang s tom ford leather jacket proceeds going to a good cause nvda bagholders nah not really but i wouldn t hate it they should have auctioned this back in may when i had money at least now i would at least have a leather jacket alas,-0.8098,negative
2026-07-02 23:28:26+00:00,"Insane buying opportunity today, the company is at a 9B marketcap while they are forecasted to make 471m/month (5.5B annualized) of revenue by this time next year just from selling their transceivers.

  
Data centre connectivity is the next bottleneck of AI and 800G and 1.6T optical transceivers are the future, and this is the best company to take advantage of it. 

Deleting my brokerage app and I'll see y'all in a year, go big or go broke frfr",insane buying opportunity today the company is at a b marketcap while they are forecasted to make m month b annualized of revenue by this time next year just from selling their transceivers data centre connectivity is the next bottleneck of ai and g and t optical transceivers are the future and this is the best company to take advantage of it deleting my brokerage app and i ll see y all in a year go big or go broke frfr,0.5423,positive
2026-07-02 22:30:33+00:00,"Aside from AVGU(bag holding for a week), I caught the falling knife trying to buy the dip on the rest today 😢 At least these are not call options, and I have some dry powder to average down if they dip again",aside from avgu bag holding for a week i caught the falling knife trying to buy the dip on the rest today at least these are not call options and i have some dry powder to average down if they dip again,-0.1531,negative
2026-07-02 21:25:20+00:00,,nan,0.0,neutral
2026-07-02 21:18:38+00:00,,nan,0.0,neutral
2026-07-02 20:01:32+00:00,"Bullish: https://www.wsj.com/finance/stocks/michael-burry-cites-beginning-of-the-end-with-new-ai-short-bets-50793c12

",bullish,0.0,neutral
2026-07-02 20:01:12+00:00,This post contains content not supported on old Reddit. [Click here to view the full post](https://sh.reddit.com/r/wallstreetbets/comments/1ulsves),this post contains content not supported on old reddit click here to view the full post,-0.2411,negative
2026-07-02 19:59:29+00:00,"*I'll try to keep this simple and brief.*   
  
**NYSE: ZIM** Integrated Shipping Services Ltd. Think boats, oceans, and moving goods. 

**ZIM** has a **signed merger agreement** from Hapag-Lloyd **for** **$35.00 per Share in Cash** and the stock is currently trading for around \~$25 per share. The deal is estimated to **close Q4 2026.**  
  
Which means a **40% upside if you buy shares** OR for the more risky WSB crowd nearly **300% gain for December $30 Strike Calls**.

The obvious question is why the 40% spread? Usually mergers hold closer to a 15% spread pre-closing of merger. The answer is perceived risk, which I believe to be overblown.

**The Main Risk**

The Israeli government owns a ""golden share"" in ZIM, for national security reasons. There is political risk that the government won't approve the deal, but I believe that is not the case here. 

Historically Israel precedent has not been outright veto of mergers under the Special State Share. Instead negotiation, restructuring, and modification until the government's security concerns are addressed is what they do. 

In this case, Hapag-Lloyd and ZIM structured the merger specifically to address their concerns from the onset. That doesn't mean there won't be additional asks from the Israeli gov that will need to be addressed, but I don't believe they will kill the deal.   
  
If anything it is possible the close date gets pushed out. The estimated close date is Q4 2026, but the actual language in the merger agreement gives them until Feb 2027, with one potential extension until June 2027 if special conditions are met. 

**Additional Positive Indicators**

* Mergers are common in the shipping industry and **Hapag-Lloyd has a long history of successful mergers.** In the last 20 years they've completed.
   * CP Ships (2005)
   * CSAV's container business (2014)
   * UASC (2017)
* ZIM recently received a **second higher cash bid** from a different company for $37.50/share. Now the Hapag-Lloyd merger agreement is already signed and there would be a penalty if ZIM switches to the new bidder, but multiple bids and competition is always a good thing for ZIM.

**This is a pure merger arbitrage play** **with serious upside and measured downside risk depending on positioning.**

If for some reason the deal falls apart a fair value for ZIM would be in the $19-$20 range representing an approximate \~25% downside risk for shareholders at the current \~$25/share price. 

My personal plan is to start building a sizable share position and continue adding to the position over the weeks. **I initialized my first position today with $100,000 to open.** I plan to continue to build up this share position to somewhere around $500,000 worth in shares over the upcoming weeks with the option to build up to 7 figures depending on how it develops.

https://preview.redd.it/5yv8kugwfvah1.png?width=1486&format=png&auto=webp&s=4b6a0272bc2364a49c25e4a65115e11eebada7c4

For those that want to learn more and dig into the details of the deal attached below are some useful links

Link to official ZIM merger announcement: [https://investors.zim.com/news/news-details/2026/ZIM-to-be-Acquired-by-Hapag-Lloyd-for-35-00-per-Share-in-Cash-at-Aggregate-Cash-Consideration-of-Approximately-4-2-Billion-New-Israeli-Company-New-ZIM-to-Acquire-Portion-of-ZIMs-Business/default.aspx](https://investors.zim.com/news/news-details/2026/ZIM-to-be-Acquired-by-Hapag-Lloyd-for-35-00-per-Share-in-Cash-at-Aggregate-Cash-Consideration-of-Approximately-4-2-Billion-New-Israeli-Company-New-ZIM-to-Acquire-Portion-of-ZIMs-Business/default.aspx)

Link to official SEC filing containing the merger agreement: [https://www.sec.gov/Archives/edgar/data/1654126/000117891326001558/exhibit\_99-1.htm?utm\_source=chatgpt.com](https://www.sec.gov/Archives/edgar/data/1654126/000117891326001558/exhibit_99-1.htm?utm_source=chatgpt.com)

**TLDR:** ZIM is getting bought out. Estimated close data Q4 2026 with 40% upside in share price and potential 300% upside with specific Call options. 

",i ll try to keep this simple and brief nyse zim integrated shipping services ltd think boats oceans and moving goods zim has a signed merger agreement from hapag lloyd for per share in cash and the stock is currently trading for around per share the deal is estimated to close q which means a upside if you buy shares or for the more risky wsb crowd nearly gain for december strike calls the obvious question is why the spread usually mergers hold closer to a spread pre closing of merger the answer is perceived risk which i believe to be overblown the main risk the israeli government owns a golden share in zim for national security reasons there is political risk that the government won t approve the deal but i believe that is not the case here historically israel precedent has not been outright veto of mergers under the special state share instead negotiation restructuring and modification until the government s security concerns are addressed is what they do in this case hapag lloyd and zim structured the merger specifically to address their concerns from the onset that doesn t mean there won t be additional asks from the israeli gov that will need to be addressed but i don t believe they will kill the deal if anything it is possible the close date gets pushed out the estimated close date is q but the actual language in the merger agreement gives them until feb with one potential extension until june if special conditions are met additional positive indicators mergers are common in the shipping industry and hapag lloyd has a long history of successful mergers in the last years they ve completed cp ships csav s container business uasc zim recently received a second higher cash bid from a different company for share now the hapag lloyd merger agreement is already signed and there would be a penalty if zim switches to the new bidder but multiple bids and competition is always a good thing for zim this is a pure merger arbitrage play with serious upside and measured downside risk depending on positioning if for some reason the deal falls apart a fair value for zim would be in the range representing an approximate downside risk for shareholders at the current share price my personal plan is to start building a sizable share position and continue adding to the position over the weeks i initialized my first position today with to open i plan to continue to build up this share position to somewhere around worth in shares over the upcoming weeks with the option to build up to figures depending on how it develops for those that want to learn more and dig into the details of the deal attached below are some useful links link to official zim merger announcement link to official sec filing containing the merger agreement tldr zim is getting bought out estimated close data q with upside in share price and potential upside with specific call options,0.9962,positive
2026-07-02 19:56:43+00:00,,nan,0.0,neutral
2026-07-02 19:24:39+00:00,,nan,0.0,neutral
2026-07-02 18:28:48+00:00,,nan,0.0,neutral
2026-07-02 17:29:41+00:00,"It shows negative money as I added another 1k it crashed so hard that I got liquited. I'm down 22k (including interest as I held for only a few days) still have some savings left but barely any. 

I mark my words literally and I was so close last time when I got fucked in msty but this time after losing over 75k in this shit over 6 years and with barely anything left and almost homeless. 

I can't do this ever again, it was stupid of me. 

I sometimes think the world is actually fully against me with this luck....I truly do this has always happened to me, I guess I never get lucky even once.",it shows negative money as i added another k it crashed so hard that i got liquited i m down k including interest as i held for only a few days still have some savings left but barely any i mark my words literally and i was so close last time when i got fucked in msty but this time after losing over k in this shit over years and with barely anything left and almost homeless i can t do this ever again it was stupid of me i sometimes think the world is actually fully against me with this luck i truly do this has always happened to me i guess i never get lucky even once,-0.9528,negative
2026-07-02 17:18:35+00:00,"I’ve noticed that every time a company announces a reverse split, people immediately act like it’s over.  
I get why. A lot of reverse splits happen because companies are struggling.  
But is a reverse split itself actually the problem, or is it just a symptom?  
There have to be some companies that used a reverse split, fixed their business, and ended up doing well afterward. I’m not talking about the usual dilution disasters—I’m talking about real turnaround stories.  
Curious to hear what examples you guys remember. Which reverse split stocks actually proved everyone wrong?",i ve noticed that every time a company announces a reverse split people immediately act like it s over i get why a lot of reverse splits happen because companies are struggling but is a reverse split itself actually the problem or is it just a symptom there have to be some companies that used a reverse split fixed their business and ended up doing well afterward i m not talking about the usual dilution disasters i m talking about real turnaround stories curious to hear what examples you guys remember which reverse split stocks actually proved everyone wrong,-0.8462,negative
2026-07-02 16:45:14+00:00,"These scumbags have taken $20/month from me for too many years, time to make some of it back. Or lose it all, idgaf either way.",these scumbags have taken month from me for too many years time to make some of it back or lose it all idgaf either way,-0.4019,negative
2026-07-02 16:34:08+00:00,,nan,0.0,neutral
