created_utc,body,clean_body,body_sentiment,body_label
2026-07-02 01:05:24+00:00,"I bought these at margin and the worst part as you can see I bought and sold them early last year as well a way smaller position. I've done shit like this multiple times before and decided to go fully into ETFs and then saw this went fomo was up overnight but then woke up to it being down held with only a few hundred dollars until margin called went all the way to 270 something and now it's here. 

I'm cooked and I might not get a chance to even get out at a low loss now. This is 50 percent of my whole account. 

At least I'll learn the lesson to stay in ETFs for good this happened to me right as I bought the blackberry stock next day banks closed buy button, happened to me with call options right before Intel tanked and went back up again, and many more times. 

I was waiting for this to go to 308 and just wanted a quick buck to make something back and it tanked the next day. Just how life is for a dumbass, lol. ",i bought these at margin and the worst part as you can see i bought and sold them early last year as well a way smaller position i ve done shit like this multiple times before and decided to go fully into etfs and then saw this went fomo was up overnight but then woke up to it being down held with only a few hundred dollars until margin called went all the way to something and now it s here i m cooked and i might not get a chance to even get out at a low loss now this is percent of my whole account at least i ll learn the lesson to stay in etfs for good this happened to me right as i bought the blackberry stock next day banks closed buy button happened to me with call options right before intel tanked and went back up again and many more times i was waiting for this to go to and just wanted a quick buck to make something back and it tanked the next day just how life is for a dumbass lol,-0.7657,negative
2026-07-02 00:41:00+00:00,,nan,0.0,neutral
2026-07-02 00:11:05+00:00,"If I’ve learned anything, never bet against Trump! Up $43k on shorting USO. Who else is in the free gas club?",if i ve learned anything never bet against trump up k on shorting uso who else is in the free gas club,0.5106,positive
2026-07-01 23:56:45+00:00,,nan,0.0,neutral
2026-07-01 23:49:41+00:00,,nan,0.0,neutral
2026-07-01 23:24:56+00:00,"I am reposting my original post that was removed because I did not post pictures to prove my bet. So here are screenshots of two of my purchases, you heathens.

Now here's my original post:

Allow me to place my dunce cap on the table for a second and talk about SRRK.

1. Apitegromab, through all phases of trials, has shown to be incredibly effective at reducing muscle loss resulting from drugs that cause weight loss. Phase 3 of the trial showed less than 2% of participants experiencing negative side effects. If approved to be prescribed alongside GLP-1s, this would address the largest drawback for GLP-1 patients. This makes them a prime acquisition candidate for Novo Nordisk, as there is an obvious symbiotic relationship between their products and the two companies have already partnered together on the Catalent Indiana manufacturing facility. 

2. SRRK resubmitted it's BLA to the FDA on March 31st for Apitegromab, updated and backed now by 3 very successful phases of trials.

3. This week Medicare approved of GLP-1 coverage for people 65+ for the associated health benefits. Elderly individuals are at a higher risk of significantly increased muscle loss from these drugs. I believe down the line this will expedite FDA approval of Apitegromab as a side-effect mitigator for GLP-1s. 

I think good news on any of these fronts would lead to explosive growth. Regardless, I feel the long-term potential is being greatly overlooked. 

This being said, the icing on the cake, is the lottery ticket that it comes with. And that is the possibility of (don't crucify me here) a short squeeze. There is currently a shorted position approximately 17.2% of the available public float with 16.2 days to cover. I'd never invest based on a squeeze prospect but it is an exciting little added bonus. To be clear and rule-abiding, you absolutely SHOULD NOT purchase shares with the expectation that there will be a short squeeze. The numbered reasons above are why I think this is a very strong buy (despite how much I hate the company's stupid name). The cake doesn't need icing, it's already great. 

Alright, there's my rant. I will now put my dunce cap back on. I won't brandish it again until it is gold-plated and encrusted with diamonds. In the meantime, feel free to roast me relentlessly. 

Yours Truly,

Beef Stewart",i am reposting my original post that was removed because i did not post pictures to prove my bet so here are screenshots of two of my purchases you heathens now here s my original post allow me to place my dunce cap on the table for a second and talk about srrk apitegromab through all phases of trials has shown to be incredibly effective at reducing muscle loss resulting from drugs that cause weight loss phase of the trial showed less than of participants experiencing negative side effects if approved to be prescribed alongside glp s this would address the largest drawback for glp patients this makes them a prime acquisition candidate for novo nordisk as there is an obvious symbiotic relationship between their products and the two companies have already partnered together on the catalent indiana manufacturing facility srrk resubmitted it s bla to the fda on march st for apitegromab updated and backed now by very successful phases of trials this week medicare approved of glp coverage for people for the associated health benefits elderly individuals are at a higher risk of significantly increased muscle loss from these drugs i believe down the line this will expedite fda approval of apitegromab as a side effect mitigator for glp s i think good news on any of these fronts would lead to explosive growth regardless i feel the long term potential is being greatly overlooked this being said the icing on the cake is the lottery ticket that it comes with and that is the possibility of don t crucify me here a short squeeze there is currently a shorted position approximately of the available public float with days to cover i d never invest based on a squeeze prospect but it is an exciting little added bonus to be clear and rule abiding you absolutely should not purchase shares with the expectation that there will be a short squeeze the numbered reasons above are why i think this is a very strong buy despite how much i hate the company s stupid name the cake doesn t need icing it s already great alright there s my rant i will now put my dunce cap back on i won t brandish it again until it is gold plated and encrusted with diamonds in the meantime feel free to roast me relentlessly yours truly beef stewart,0.9929,positive
2026-07-01 23:09:20+00:00,,nan,0.0,neutral
2026-07-01 22:01:00+00:00,"What does everyone think about this?  Literally at historic high.  Are we headed for a meltdown or is this because of the Iran war and possible consequences of that?

The **Cboe SKEW Index** is currently trading at **149.60**, while its sister index, the **VIX**, is hovering around **16.23**.\[[1](https://www.google.com/finance), [2](https://www.google.com/finance)\]

**What These Levels Mean Right Now**  
**Elevated SKEW (149.60):** A reading near 150 is historically high. This indicates that institutional investors are actively buying ""out-of-the-money"" put options to protect their portfolios against a sudden market crash or black swan event. \[[1](https://www.google.com/finance)\]  
**Moderate VIX (16.23):** Even though SKEW is elevated, the VIX remains in a moderate, relatively calm territory. This divergence suggests that while day-to-day market anxiety is low, big players are quietly paying a premium for systemic tail-risk insurance. \[[1](https://www.google.com/finance)\]",what does everyone think about this literally at historic high are we headed for a meltdown or is this because of the iran war and possible consequences of that the cboe skew index is currently trading at while its sister index the vix is hovering around what these levels mean right now elevated skew a reading near is historically high this indicates that institutional investors are actively buying out of the money put options to protect their portfolios against a sudden market crash or black swan event moderate vix even though skew is elevated the vix remains in a moderate relatively calm territory this divergence suggests that while day to day market anxiety is low big players are quietly paying a premium for systemic tail risk insurance,-0.6486,negative
2026-07-01 22:00:23+00:00,"Guys this drop looks really ugly...

Believe it or not, calls, I guess.

Source: [https://www.atlantafed.org/research-and-data/data/gdpnow](https://www.atlantafed.org/research-and-data/data/gdpnow)",guys this drop looks really ugly believe it or not calls i guess source,-0.6901,negative
2026-07-01 21:30:23+00:00,,nan,0.0,neutral
2026-07-01 21:02:48+00:00,,nan,0.0,neutral
2026-07-01 20:51:29+00:00,"Sold meta call debit spread 2 days before pump after holding it for two months. Could’ve been 10k gain instead of 27k loss now.

Whats the opposite of insider trading called? That’s what I’m doing essentially",sold meta call debit spread days before pump after holding it for two months could ve been k gain instead of k loss now whats the opposite of insider trading called that s what i m doing essentially,0.2732,positive
2026-07-01 20:38:29+00:00,"So let me get this straight.

Suckerberg spends tens of billions panic buying AI chips because he doesn't want to be the guy left behind.

Fast forward a few months and Meta suddenly has so much spare compute that they're talking about renting it out because they built more infrastructure than they currently need.

Wall Street's reaction?

*Punish the entire semiconductor and AI sector...* while pumping Meta like this was some kind of masterstroke on their part. There was no masterstroke or masterplan. The market is punishing the sector for one man's poor foresight and incompetence.

I expect a rapid correction when people realise this.

But then again, the market normally inverses logic. So, Meta calls? ",so let me get this straight suckerberg spends tens of billions panic buying ai chips because he doesn t want to be the guy left behind fast forward a few months and meta suddenly has so much spare compute that they re talking about renting it out because they built more infrastructure than they currently need wall street s reaction punish the entire semiconductor and ai sector while pumping meta like this was some kind of masterstroke on their part there was no masterstroke or masterplan the market is punishing the sector for one man s poor foresight and incompetence i expect a rapid correction when people realise this but then again the market normally inverses logic so meta calls,-0.7898,negative
2026-07-01 20:24:03+00:00,Went down 18% should go back up 18%. ,went down should go back up,0.0,neutral
2026-07-01 20:19:28+00:00,"Honestly safer play than any of the semiconductor stocks at this time. 

No AI slop. Mods please do not delete. ",honestly safer play than any of the semiconductor stocks at this time no ai slop mods please do not delete,0.8074,positive
2026-07-01 20:12:22+00:00,,nan,0.0,neutral
2026-07-01 20:09:05+00:00,"In at 2:54 out at 3:09, 2% of the time it works every time",in at out at of the time it works every time,0.0,neutral
2026-07-01 20:00:38+00:00,This post contains content not supported on old Reddit. [Click here to view the full post](https://sh.reddit.com/r/wallstreetbets/comments/1ukwbxe),this post contains content not supported on old reddit click here to view the full post,-0.2411,negative
2026-07-01 19:29:45+00:00,,nan,0.0,neutral
2026-07-01 19:22:39+00:00,"This is the gains I made this week from my degenerate gambling options. However, last week I actually made about twice this so this would be a moderate week.",this is the gains i made this week from my degenerate gambling options however last week i actually made about twice this so this would be a moderate week,0.34,positive
2026-07-01 18:43:26+00:00,Holding til 300/share ,holding til share,0.296,positive
2026-07-01 18:04:07+00:00,[https://www.bcg.com/publications/2026/global-wealth-growth-in-an-era-of-reordering](https://www.bcg.com/publications/2026/global-wealth-growth-in-an-era-of-reordering),,0.0,neutral
2026-07-01 17:47:29+00:00,"things are not looking great rn 

https://preview.redd.it/dr8hosgfonah1.png?width=791&format=png&auto=webp&s=093b0ad1d4dc351a19349b9b2892d29ec5a8f848

  


",things are not looking great rn,-0.5096,negative
2026-07-01 17:40:22+00:00,"what do you think chat, am i fucked? still holding",what do you think chat am i fucked still holding,-0.6597,negative
2026-07-01 17:35:32+00:00,,nan,0.0,neutral
2026-07-01 17:09:27+00:00,"(I didn’t sell, so these are all going to $0)",i didn t sell so these are all going to,0.0,neutral
2026-07-01 17:01:19+00:00,,nan,0.0,neutral
2026-07-01 16:18:55+00:00,,nan,0.0,neutral
2026-07-01 15:59:09+00:00,"Threw 100k on 7/2 575p yesterday cuz I thought it went up too much too fast

When I woke up this morning I was ready to close them for even or slight loss

But thanks to Zuck the cuck semis tanked, luck was on my side 🍀 

Also found out I could trade options in my 403b retirement plan and I’ve since almost tripled my account this year 😂 

Regards, 🫶🏽",threw k on p yesterday cuz i thought it went up too much too fast when i woke up this morning i was ready to close them for even or slight loss but thanks to zuck the cuck semis tanked luck was on my side also found out i could trade options in my b retirement plan and i ve since almost tripled my account this year regards,0.8381,positive
2026-07-01 14:17:05+00:00,,nan,0.0,neutral
2026-07-01 12:52:35+00:00,,nan,0.0,neutral
2026-07-01 12:23:53+00:00,"Consumer prices rose 2.8% from a year ago in June, **down from 3.2% the previous month**, Eurostat said Wednesday. That’s less than the 3% median estimate in a Bloomberg survey.

  
CPI is lower in EU in June. The EU is one of the place that got hit the hardest after the Strait of Hormuz closed. If EU's June CPI is now lower then  expected, then June CPI in USA will probably do the same. 

Inflation has peaked. Bullish for market. ",consumer prices rose from a year ago in june down from the previous month eurostat said wednesday that s less than the median estimate in a bloomberg survey cpi is lower in eu in june the eu is one of the place that got hit the hardest after the strait of hormuz closed if eu s june cpi is now lower then expected then june cpi in usa will probably do the same inflation has peaked bullish for market,-0.5267,negative
2026-07-01 10:00:37+00:00,This post contains content not supported on old Reddit. [Click here to view the full post](https://sh.reddit.com/r/wallstreetbets/comments/1ukhcuh),this post contains content not supported on old reddit click here to view the full post,-0.2411,negative
2026-07-01 04:27:43+00:00,Moderators - please delete if not appropriate.,moderators please delete if not appropriate,0.3182,positive
2026-07-01 01:43:07+00:00,,nan,0.0,neutral
2026-07-01 00:13:42+00:00,AI stocks continue to go brrr,ai stocks continue to go brrr,0.0,neutral
2026-06-30 23:14:05+00:00,,nan,0.0,neutral
2026-06-30 22:09:07+00:00,,nan,0.0,neutral
2026-06-30 21:00:45+00:00,,nan,0.0,neutral
2026-06-30 20:43:49+00:00,,nan,0.0,neutral
2026-06-30 20:43:06+00:00,RIP ur gainz tho,rip ur gainz tho,0.0,neutral
2026-06-30 20:34:45+00:00,,nan,0.0,neutral
2026-06-30 20:00:37+00:00,This post contains content not supported on old Reddit. [Click here to view the full post](https://sh.reddit.com/r/wallstreetbets/comments/1ujzv6s),this post contains content not supported on old reddit click here to view the full post,-0.2411,negative
2026-06-30 19:51:56+00:00," Japan will reportedly provide $926 million in subsidies to a Rakuten-led satellite network with AST SpaceMobile.

The funding would support equipment, ground facilities and systems needed to launch and control low-Earth-orbit satellites.

Japan sees the project as an economic security priority as it seeks to reduce reliance on foreign networks such as Starlink.",japan will reportedly provide million in subsidies to a rakuten led satellite network with ast spacemobile the funding would support equipment ground facilities and systems needed to launch and control low earth orbit satellites japan sees the project as an economic security priority as it seeks to reduce reliance on foreign networks such as starlink,0.4588,positive
2026-06-30 17:19:41+00:00,,nan,0.0,neutral
2026-06-30 16:53:04+00:00,"For the past 7 years I watched as you apes chased 0DTE quick dopamine hit gains. I swore to myself I’d never allow myself to ape as hard as the rest of you regards. Here is my proof of my 7 years diamond hand hold of the (formerly) Advanced Money Destroyer. 

Thank you for your attention to this matter and fuck you.",for the past years i watched as you apes chased dte quick dopamine hit gains i swore to myself i d never allow myself to ape as hard as the rest of you regards here is my proof of my years diamond hand hold of the formerly advanced money destroyer thank you for your attention to this matter and fuck you,0.4694,positive
2026-06-30 14:39:31+00:00,Just sold my options after holding for one year. 7K -> $94k in one year. Still holding my shares. ,just sold my options after holding for one year k k in one year still holding my shares,0.296,positive
2026-06-30 14:06:18+00:00,🫡,,0.0,neutral
2026-06-30 10:58:44+00:00,"The finance minister of Japan has issued a statement that they would shore up he yen since it's hit a 40 year low. That most likely means they're going to sell US treasuries which is a position of 1.21 trillion dollars. 

If they sell that what is your next move? I will be buying UVXY calls",the finance minister of japan has issued a statement that they would shore up he yen since it s hit a year low that most likely means they re going to sell us treasuries which is a position of trillion dollars if they sell that what is your next move i will be buying uvxy calls,-0.0516,negative
2026-06-30 10:00:37+00:00,This post contains content not supported on old Reddit. [Click here to view the full post](https://sh.reddit.com/r/wallstreetbets/comments/1ujkx0w),this post contains content not supported on old reddit click here to view the full post,-0.2411,negative
2026-06-30 09:49:58+00:00,It's honest work,it s honest work,0.5106,positive
2026-06-30 08:48:46+00:00,"I had a beef jerky business, it made like $11 an hour after costs so I shut it down.

But before I did, the bank saw my potential as a thriving small business and handed me a $20k overdraft. I did not buy beef jerky.

Michael Saylor wakes up every morning and buys Bitcoin with money he doesn’t have. I respect this man more than anyone alive. He is doing with billions what I do with a beef jerky overdraft. We are the same person.

I’m 20 years old and I now hold 350 shares of MSTR

I already had shares sitting at a bad average. Most people would’ve cut and moved on. I sold my entire stock portfolio, used the meat money to DCA, and went all in.

The thesis is simple. Bitcoin keeps absorbing capital. MSTR is the leveraged bet on that happening and all the current panic is overblown.

The bank thinks I’m buying inventory. The inventory is bitcoin. Technically I am in the beef jerky business, I’m just jerking a different kind of meat now.",i had a beef jerky business it made like an hour after costs so i shut it down but before i did the bank saw my potential as a thriving small business and handed me a k overdraft i did not buy beef jerky michael saylor wakes up every morning and buys bitcoin with money he doesn t have i respect this man more than anyone alive he is doing with billions what i do with a beef jerky overdraft we are the same person i m years old and i now hold shares of mstr i already had shares sitting at a bad average most people would ve cut and moved on i sold my entire stock portfolio used the meat money to dca and went all in the thesis is simple bitcoin keeps absorbing capital mstr is the leveraged bet on that happening and all the current panic is overblown the bank thinks i m buying inventory the inventory is bitcoin technically i am in the beef jerky business i m just jerking a different kind of meat now,0.3497,positive
2026-06-30 04:52:28+00:00,,nan,0.0,neutral
2026-06-30 02:26:41+00:00,,nan,0.0,neutral
2026-06-30 01:52:41+00:00,"The market seems to think it has Mattel figured out - (I miss you, em dash) a floundering toy maker that can only hope for a consumer discretionary recovery.

Softer than expected demand for its toys over the holiday season appeared to push Mattel stock off the cliff and after a dead cat bounce, a gradual downward incline with increasing shorts against the company. It's an attractive short against the consumer amidst inflation, eye watering national debt, geopolitical turmoil, and a challenging job market.

As regarded as I am, I have to disagree and point to a future that positions Mattel as an entertainment powerhouse across gaming, TV, and film.

Bears may point to the latest He-Man adaptation, Masters of the Universe, as a reason to be skeptical. Do a quick search though, and you'll find even the pundits aren't convinced they should be bearish. There's a lot of mixed sentiment, with some point to Amazon MGM happily holding the bag with around a \~$200M budget and a middling box office. Some point to streaming and toy sales as the panacea here.

That seems to be the implication behind an Amazon/MGM executive's statement published by Variety: ""\[Director\] Travis Knight and the entire cast and filmmaking team have delivered something truly special, and this opening is exactly the kind of critical first moment that validates our holistic distribution strategy—building awareness and engagement that will carry well beyond the theatrical window.”

There's streaming and there's the whole host of branded merch and toys that Amazon is selling.

And Mattel already has another film ready for later this year - Matchbox: The Movie, an adventure comedy film starring John Cena. Maybe the market can't see the potential here, but I think it's clear to see...

Between film, TV, and gaming (last quarter also came with a statement that Mattel is buying out NetEase's 50% stake in their joint venture, Mattel163), and given their CEO (who has a solid background in entertainment and kicked off his first year by alleviating production woes and pushing forward the popular Barbie movie) there's a powerful entertainment division in the making that can propel Mattel into growth.

tl;dr - toy company goes digital, regard approves",the market seems to think it has mattel figured out i miss you em dash a floundering toy maker that can only hope for a consumer discretionary recovery softer than expected demand for its toys over the holiday season appeared to push mattel stock off the cliff and after a dead cat bounce a gradual downward incline with increasing shorts against the company it s an attractive short against the consumer amidst inflation eye watering national debt geopolitical turmoil and a challenging job market as regarded as i am i have to disagree and point to a future that positions mattel as an entertainment powerhouse across gaming tv and film bears may point to the latest he man adaptation masters of the universe as a reason to be skeptical do a quick search though and you ll find even the pundits aren t convinced they should be bearish there s a lot of mixed sentiment with some point to amazon mgm happily holding the bag with around a m budget and a middling box office some point to streaming and toy sales as the panacea here that seems to be the implication behind an amazon mgm executive s statement published by variety director travis knight and the entire cast and filmmaking team have delivered something truly special and this opening is exactly the kind of critical first moment that validates our holistic distribution strategy building awareness and engagement that will carry well beyond the theatrical window there s streaming and there s the whole host of branded merch and toys that amazon is selling and mattel already has another film ready for later this year matchbox the movie an adventure comedy film starring john cena maybe the market can t see the potential here but i think it s clear to see between film tv and gaming last quarter also came with a statement that mattel is buying out netease s stake in their joint venture mattel and given their ceo who has a solid background in entertainment and kicked off his first year by alleviating production woes and pushing forward the popular barbie movie there s a powerful entertainment division in the making that can propel mattel into growth tl dr toy company goes digital regard approves,0.9868,positive
