created_utc,body,clean_body,body_sentiment,body_label
2026-07-06 23:21:20+00:00,"$AVEX 

Aevex Aerospace. Public since April. Batman.

They build autonomous military drones. The nav system, CompassX, runs without GPS or an operator link. Cameras plus AI match the ground to a terrain map and place the aircraft inside 5 meters. Nothing to jam because nothing’s transmitting. 

Every drone that relies on GPS or RF gets killed the second it meets real electronic warfare, which is now standard on any modern battlefield. 

Army picked their Atlas strike platform for fielding last October; Air Force has cut them multiple one-way-attack contracts.  
Numbers:  
	•	Q1 rev $216.7M, +307% YoY off $53.3M  
	•	Net income +$21M, from a -$27.3M loss  
	•	Adj EBITDA +$36.4M, from -$13.4M  
	•	FY guide $600–620M  
	•	Backlog $356.6M, \~93% converting this year, plus a recent $50M USAF contract

Earnings Aug 14, options implying \~12%.

Madison Dearborn owns most of it. Part of the slide from $42 was a June secondary, 8M shares at $27, plus a block sale. Other read: MDP’s a build-and-hold shop (TransUnion, Asurion) deliberately building a defense arm. They trimmed didnt exit. Not sure if there’s more scheduled blocks 

	•	9 analysts, unanimous strong buy, avg target $35.75 (\~75%), high $45  
	•	Not just drones, loitering munitions and unmanned surface vessels  
	•	\~2-3M daily volume. Thin float, low coverage. Tried to hedge today it wasn’t great. 

2000 shares, Aug and Oct $25 calls. Screenshot attached 

TLDR- ai drones and surface vessels. Just turned a profit just IPOd in April. Big year for drones. Vision nav is cool. Will probably roll August calls to something longer but for now we ball. ",avex aevex aerospace public since april batman they build autonomous military drones the nav system compassx runs without gps or an operator link cameras plus ai match the ground to a terrain map and place the aircraft inside meters nothing to jam because nothing s transmitting every drone that relies on gps or rf gets killed the second it meets real electronic warfare which is now standard on any modern battlefield army picked their atlas strike platform for fielding last october air force has cut them multiple one way attack contracts numbers q rev m yoy off m net income m from a m loss adj ebitda m from m fy guide m backlog m converting this year plus a recent m usaf contract earnings aug options implying madison dearborn owns most of it part of the slide from was a june secondary m shares at plus a block sale other read mdp s a build and hold shop transunion asurion deliberately building a defense arm they trimmed didnt exit not sure if there s more scheduled blocks analysts unanimous strong buy avg target high not just drones loitering munitions and unmanned surface vessels m daily volume thin float low coverage tried to hedge today it wasn t great shares aug and oct calls screenshot attached tldr ai drones and surface vessels just turned a profit just ipod in april big year for drones vision nav is cool will probably roll august calls to something longer but for now we ball,-0.2808,negative
2026-07-06 23:04:38+00:00,,nan,0.0,neutral
2026-07-06 22:37:12+00:00,,nan,0.0,neutral
2026-07-06 22:26:04+00:00,"Paypal is stupid undervalued.  They are facing competition, but at 8x pe they are 1/3rd the S&Ps average 24x pe ratio.

Any good news and that shit is going skyward

\+ 600 shares after hours and adding calls tomorrow morning",paypal is stupid undervalued they are facing competition but at x pe they are rd the s ps average x pe ratio any good news and that shit is going skyward shares after hours and adding calls tomorrow morning,-0.1154,negative
2026-07-06 21:33:22+00:00,"Thank you to the people who told me to sell at the pump today. I also tried out covered call contracts and wanted somebody to buy my shares at a less loss at 210 but then I quickly backed out and decided for my mind's sake to just sell. 

Good learning experience and never touching these investments again. 

Thanks Wallstreetbets and have a good one! 🙏❤️",thank you to the people who told me to sell at the pump today i also tried out covered call contracts and wanted somebody to buy my shares at a less loss at but then i quickly backed out and decided for my mind s sake to just sell good learning experience and never touching these investments again thanks wallstreetbets and have a good one,0.9266,positive
2026-07-06 21:01:52+00:00,"Kospi is up 170% this year. 170 FUCKING PERCENT. This seems like a ridiculous amount for a country’s ETF. Imagine if SPY had a 170 percent year, it would be absolutely absurd. I feel like this is bound to have a big pullback sometime soon. I’m curious to see how this could possibly continue pumping and how this 170% pump has affected the country of Korea.",kospi is up this year fucking percent this seems like a ridiculous amount for a country s etf imagine if spy had a percent year it would be absolutely absurd i feel like this is bound to have a big pullback sometime soon i m curious to see how this could possibly continue pumping and how this pump has affected the country of korea,0.4939,positive
2026-07-06 20:56:54+00:00,,nan,0.0,neutral
2026-07-06 20:00:37+00:00,This post contains content not supported on old Reddit. [Click here to view the full post](https://sh.reddit.com/r/wallstreetbets/comments/1up8fvp),this post contains content not supported on old reddit click here to view the full post,-0.2411,negative
2026-07-06 17:57:40+00:00,"Had to take profits this morning, bc I have bills to pay! ",had to take profits this morning bc i have bills to pay,0.3612,positive
2026-07-06 17:47:13+00:00,,nan,0.0,neutral
2026-07-06 17:07:40+00:00,,nan,0.0,neutral
2026-07-06 17:07:28+00:00,"I've been playing with $AMD since the run up. Saw it run up to $580 and crash, so thought I'd purchase some calls for the bounce back. AI had me worried that vega crush was going to kill my play. Woke up early to watch this play out. Bought these when $AMD crashed down to $511 and the $520C were $27. Sold this morning at an average of $55.",i ve been playing with amd since the run up saw it run up to and crash so thought i d purchase some calls for the bounce back ai had me worried that vega crush was going to kill my play woke up early to watch this play out bought these when amd crashed down to and the c were sold this morning at an average of,-0.6808,negative
2026-07-06 16:40:57+00:00,"reposting , I have a screenshot of the positions since first one got cancelled. YOLO? deep dive? how about both. mods reach out I’ll send the screenshot

listen up regards, while you are busy losing your wife boyfriend's money on 0dte, it seems you missed an IPO that makes no sense 

Introducing Bending Spoons ($BSP): ipo at 29, pumped to 40, now a sitting duck at 36

this thing is actually worth 18 billion, more then the AS Roma (which is just ridiculous)

have a look at every tech ipo in history. Any chance this thing stays up above IPO price when figma is bleeding cash? Bending spoons seem like an easy sell to me.

here is why this thing is going to zero (not financial advice, I am a regard)

1 It’s italian, based in Milan. As an italian myself, this thing cannot work by definition. we are good at pizza (even though the Japanese are getting better), pasta (even though this is Chinese according to my ex), overpriced sports cars, and tax evasion (this one we good at). 

we do not do tech. the servers probably go on strike every Friday, but this thing is a multi billion dollar Nasdaq empire

2. ⁠the business model is sketchy

they dont actually build anything. their whole strategy is buying tier F internet companies that are already dead. Do you remember evernote, meetup, wetransfer? Guess what, they even got AOL, yes that AOL.

their entire playbook is: buy something that is cheap, fire employees, pump a shitty, overpriced subscription model onto it, maybe use dark pattern, then profit. You tell me about it, I am not downloading any of that 

3.⁠ ⁠go look at the app store reviews for anything they own. I see two types: angry humans (1 star) trapped by dark patterns and getting charged money they didn't know about. Very eloquent 5 stars “wow i love using AOL in 2026 it helps my workflow!”.

my position: option chains are not out so instead I am shorting this thing borrowing at a crazy rate. If you are here for loss porn, get the lotion out. See you on the other side. I am 1400 positions short. my wife doesn’t know",reposting i have a screenshot of the positions since first one got cancelled yolo deep dive how about both mods reach out i ll send the screenshot listen up regards while you are busy losing your wife boyfriend s money on dte it seems you missed an ipo that makes no sense introducing bending spoons bsp ipo at pumped to now a sitting duck at this thing is actually worth billion more then the as roma which is just ridiculous have a look at every tech ipo in history any chance this thing stays up above ipo price when figma is bleeding cash bending spoons seem like an easy sell to me here is why this thing is going to zero not financial advice i am a regard it s italian based in milan as an italian myself this thing cannot work by definition we are good at pizza even though the japanese are getting better pasta even though this is chinese according to my ex overpriced sports cars and tax evasion this one we good at we do not do tech the servers probably go on strike every friday but this thing is a multi billion dollar nasdaq empire the business model is sketchy they dont actually build anything their whole strategy is buying tier f internet companies that are already dead do you remember evernote meetup wetransfer guess what they even got aol yes that aol their entire playbook is buy something that is cheap fire employees pump a shitty overpriced subscription model onto it maybe use dark pattern then profit you tell me about it i am not downloading any of that go look at the app store reviews for anything they own i see two types angry humans star trapped by dark patterns and getting charged money they didn t know about very eloquent stars wow i love using aol in it helps my workflow my position option chains are not out so instead i am shorting this thing borrowing at a crazy rate if you are here for loss porn get the lotion out see you on the other side i am positions short my wife doesn t know,-0.6656,negative
2026-07-06 16:22:48+00:00,,nan,0.0,neutral
2026-07-06 13:41:00+00:00,"Happy Monday WSB, let’s get this bread. I’m still yolo-ing WEN with an extra $10k Nov calls 🫪",happy monday wsb let s get this bread i m still yolo ing wen with an extra k nov calls,0.7003,positive
2026-07-06 12:11:23+00:00,[https://www.strategy.com/press/strategy-sells-3-588-btc-to-fund-digital-credit-dividends-now-holds-843-775-and-2-55b](https://www.strategy.com/press/strategy-sells-3-588-btc-to-fund-digital-credit-dividends-now-holds-843-775-and-2-55b),,0.0,neutral
2026-07-06 12:08:38+00:00,,nan,0.0,neutral
2026-07-06 10:00:37+00:00,This post contains content not supported on old Reddit. [Click here to view the full post](https://sh.reddit.com/r/wallstreetbets/comments/1uosy1d),this post contains content not supported on old reddit click here to view the full post,-0.2411,negative
2026-07-06 05:59:54+00:00,Someone's tanzaku (wish for Tanabata) in my building. (They are wishing for SPCX to go over $250 this year),someone s tanzaku wish for tanabata in my building they are wishing for spcx to go over this year,0.5574,positive
2026-07-06 03:53:04+00:00,,nan,0.0,neutral
2026-07-06 01:54:11+00:00,"I have XOM Calls at $170 and I have to keel rolling them.

How are Oil prices so low? Hormuz is closed agian, the tankers which are leaving the gulf are not returning to the gulf. Further more Ukraine has spent the last 2 months blowing up Russian oil infrastructure, 50% of Russian refineries are off line, and export terminals in St Petersburg area were hit. The damage Ukraine is doing to Russia is probably worse than the Hormuz situation.

Yet Oil is $70 per barrel and My XOM $170 calls wont print? I have to keep rolling them, and the roll is even cheap AF... what the is going on? 

The Situation in Russia should be bigger oil news than Hormuz ",i have xom calls at and i have to keel rolling them how are oil prices so low hormuz is closed agian the tankers which are leaving the gulf are not returning to the gulf further more ukraine has spent the last months blowing up russian oil infrastructure of russian refineries are off line and export terminals in st petersburg area were hit the damage ukraine is doing to russia is probably worse than the hormuz situation yet oil is per barrel and my xom calls wont print i have to keep rolling them and the roll is even cheap af what the is going on the situation in russia should be bigger oil news than hormuz,-0.8419,negative
2026-07-06 00:55:38+00:00,"I am not a financial advisor. I am a retard for a living with 32k in 2X leveraged AVAV this bull run still has legs.

AVAV just posted Q4 FY26 revenue of $641.6M, up 133% YoY, crushing the $556-559M consensus, with adjusted EPS of $1.84 vs. $1.47 expected. Stock ripped \~35% in three trading days on the print. Then, two days later, it landed a $500M firm fixed price Army contract for the Titan RF counter UAS system running through June 2029. Also Short term is massive insider buying with investors Day around the corner on July 8 hoping they clean guidance and this thing gaps up again. This is the exact setup 2x leverage was invented for.

Book-to-bill sits at 1.4x, meaning orders are outpacing revenue, backlog is building, not draining. BTIG flagged the Army IDIQ contract as a fresh catalyst, and Jefferies called the Titan award a strong signal for FY27 revenue visibility. Investor Day is July 8 in New York, where management is expected to lay out strategy post BlueHalo merger, which adds counter-UAS, SATCOM, and directed energy exposure areas the Pentagon is actively pouring money into.

Consensus sits around $258-259 (Buy rating, \~35% implied upside from \~$191). Range is wide — Street lows near $166-235, highs stretching to $361-450 depending on the shop. Piper Sandler’s at $248 Overweight; Jefferies just trimmed to $229 from $305 post-print (valuation catch-up, not a thesis change); Canaccord’s at $280.",i am not a financial advisor i am a retard for a living with k in x leveraged avav this bull run still has legs avav just posted q fy revenue of m up yoy crushing the m consensus with adjusted eps of vs expected stock ripped in three trading days on the print then two days later it landed a m firm fixed price army contract for the titan rf counter uas system running through june also short term is massive insider buying with investors day around the corner on july hoping they clean guidance and this thing gaps up again this is the exact setup x leverage was invented for book to bill sits at x meaning orders are outpacing revenue backlog is building not draining btig flagged the army idiq contract as a fresh catalyst and jefferies called the titan award a strong signal for fy revenue visibility investor day is july in new york where management is expected to lay out strategy post bluehalo merger which adds counter uas satcom and directed energy exposure areas the pentagon is actively pouring money into consensus sits around buy rating implied upside from range is wide street lows near highs stretching to depending on the shop piper sandler s at overweight jefferies just trimmed to from post print valuation catch up not a thesis change canaccord s at,0.8316,positive
2026-07-06 00:40:15+00:00,This is a pretty interesting take; it’s another reason I’ve been slowly selling off my Netflix holdings. It seems like the Warner Brothers merger talks are what opened the door to all the recent bad news. ,this is a pretty interesting take it s another reason i ve been slowly selling off my netflix holdings it seems like the warner brothers merger talks are what opened the door to all the recent bad news,0.5994,positive
2026-07-05 20:43:11+00:00,"I’ve been tracking a clear ""seesaw"" pattern over the last month between AI hardware/memory stocks and enterprise software.

It seems like every time big money panics and dumps chip makers on a Friday due to overcapacity fears, they immediately rotate that exact cash into software stocks to protect their positions over the weekend.

Last Friday was weird because Wall Street was closed for the US holiday. Asian and European buyers stepped in, pushing Micron up to hold around €897 (touching €902) and Nvidia to around €171. Volume was super low.

Now that US big money is coming back on Monday, do you think they will follow Asia’s lead and buy the dip, or will they trigger the 1-month rotation pattern again at the 15:30 CET opening bell and dump hardware for software?What are your moves for tomorrow? Are you watching key Euro floors like €165.96 on NVDA or €852.20 on MU?",i ve been tracking a clear seesaw pattern over the last month between ai hardware memory stocks and enterprise software it seems like every time big money panics and dumps chip makers on a friday due to overcapacity fears they immediately rotate that exact cash into software stocks to protect their positions over the weekend last friday was weird because wall street was closed for the us holiday asian and european buyers stepped in pushing micron up to hold around touching and nvidia to around volume was super low now that us big money is coming back on monday do you think they will follow asia s lead and buy the dip or will they trigger the month rotation pattern again at the cet opening bell and dump hardware for software what are your moves for tomorrow are you watching key euro floors like on nvda or on mu,0.4588,positive
2026-07-05 20:00:37+00:00,This post contains content not supported on old Reddit. [Click here to view the full post](https://sh.reddit.com/r/wallstreetbets/comments/1uobx5h),this post contains content not supported on old reddit click here to view the full post,-0.2411,negative
2026-07-05 18:57:03+00:00,What positions are you holding that you’re most excited about? Let’s get some ideas flowing (I need to diversify),what positions are you holding that you re most excited about let s get some ideas flowing i need to diversify,0.4005,positive
2026-07-05 18:22:18+00:00,"Playing weekly expiry on every dip. Seems like it’s trending up. Once all baggage holders are out, it’s gonna be 🚀",playing weekly expiry on every dip seems like it s trending up once all baggage holders are out it s gonna be,0.5106,positive
2026-07-05 15:36:40+00:00,,nan,0.0,neutral
2026-07-05 15:23:02+00:00,,nan,0.0,neutral
2026-07-05 14:45:20+00:00,"Been on WSB for a long time, but first YOLO post.

TLDR: GOOGL recent selloff seems like a good setup into pre-earnings. Higher low at $340, coiling under the $368–372 shelf. Break the shelf and there’s nothing but air to the $408.61 ATH — and roughly 58K contracts of open interest stacked at the 8/21 $415 strike says the crowd’s leaning the same way. Better than even odds it tags $400 before the July 29 print.

Position: 250 8/21 $400c, will sell some on any upward moves before earnings and let some ride (earnings are always a coin flip).

UPDATE: Still holding, nice move yesterday, but my TP hasn’t hit yet. I added some very cheap weekly puts as a hedge on the run up in light of semi / memory volatility.

UPDATE 7/8: I don’t plan to do daily updates, but figured I’d give a quick one in light of weird tape today. Really thin volume all day across the MAG7 excluding NVDA. I thought the support at 358 was encouraging, and the close was as bullish as it gets.  Still holding. ",been on wsb for a long time but first yolo post tldr googl recent selloff seems like a good setup into pre earnings higher low at coiling under the shelf break the shelf and there s nothing but air to the ath and roughly k contracts of open interest stacked at the strike says the crowd s leaning the same way better than even odds it tags before the july print position c will sell some on any upward moves before earnings and let some ride earnings are always a coin flip update still holding nice move yesterday but my tp hasn t hit yet i added some very cheap weekly puts as a hedge on the run up in light of semi memory volatility update i don t plan to do daily updates but figured i d give a quick one in light of weird tape today really thin volume all day across the mag excluding nvda i thought the support at was encouraging and the close was as bullish as it gets still holding,0.9776,positive
