created_utc,body,clean_body,body_sentiment,body_label
2026-07-23 23:09:31+00:00,,nan,0.0,neutral
2026-07-23 23:06:24+00:00,,nan,0.0,neutral
2026-07-23 21:53:50+00:00,Ouch.  Cash secured puts $TSLA.  ,ouch cash secured puts tsla,0.4019,positive
2026-07-23 21:45:26+00:00,"You can see where I started trading 0DTE puts and then where Robinhood got rid of pattern day trading.  

I break pretty much every rule as I have a day job. 

I only keep 300-500 in my account at a time.  

I don’t journal or back test.  

I rarely hold overnight since PDT is gone and I’m buying 0DTE.   1 out of 50 trades I’ll go out another day. .   

I use market orders only.   

Set ups I look for are all based on EW retracements and volume. 

I use a one day chart with 5 minute candles with 9d ema and 50 day ema and vwap

After the PDT rule is gone I believe I have an edge even with my sloppy trading off phone with marker orders.  

My goal is to make $300 a week.  

I have 25 years of investing experience.  Took 15 years off after the financial crisis.   

Am I lucky? 🍀 

The oxy call is just me piggybacking a friend because I liked the set up.  ",you can see where i started trading dte puts and then where robinhood got rid of pattern day trading i break pretty much every rule as i have a day job i only keep in my account at a time i don t journal or back test i rarely hold overnight since pdt is gone and i m buying dte out of trades i ll go out another day i use market orders only set ups i look for are all based on ew retracements and volume i use a one day chart with minute candles with d ema and day ema and vwap after the pdt rule is gone i believe i have an edge even with my sloppy trading off phone with marker orders my goal is to make a week i have years of investing experience took years off after the financial crisis am i lucky the oxy call is just me piggybacking a friend because i liked the set up,0.7845,positive
2026-07-23 21:39:36+00:00,,nan,0.0,neutral
2026-07-23 21:25:39+00:00,,nan,0.0,neutral
2026-07-23 21:12:33+00:00,"The U.S. Department of Energy (DOE) startup authorization allows Oklo to load nuclear fuel, conduct startup testing, and proceed toward first criticality.

In just over 10 months, Oklo progressed from groundbreaking to receiving DOE startup authorization for its first reactor at the Groves site.

During that period, Oklo built the reactor facility, established the operating organization, qualified personnel, implemented nuclear programs and procedures, procured fuel and major equipment from commercial suppliers, and completed the DOE authorization process.

The Groves low-power test reactor will demonstrate reactor operations that support Oklo’s plans for commercial-scale domestic isotope production.

Groves is a commercial-scale facility, meaning Oklo can repeat the experience with demonstrated experience in siting, building, commissioning, and operating its commercial reactors in the future with confidence in how long it takes and how much it costs to build its isotope production reactors.

LOCKHART, Texas--(BUSINESS WIRE)-- Oklo Inc. (NYSE: OKLO) (“Oklo”), an advanced nuclear technology company, today announced it received startup authorization for its Groves Isotope Test Reactor. This authorization, granted under the U.S. Department of Energy (DOE) Reactor Pilot Program, completes DOE’s authorization process and clears the way for fuel loading, startup testing, and reactor operations. Groves is a low-power test reactor designed to demonstrate reactor design, build, and operations, and to establish operating experience needed to support future isotope production facilities. The project advances Oklo’s plans to establish domestic production of critical isotopes for potential use in cancer care, manufacturing, scientific research, space exploration, and national security.

Groves, a privately financed facility, demonstrates nearly every element of a commercially oriented deployment model that Oklo can repeat and scale across future projects. The facility was built on private land, including full-scale civil excavation and construction, and assembled with all full-scale systems, components, and fuel either sourced commercially or manufactured by Oklo.

""This facility marks the fastest time that we are aware of to go from greenfield to substantial completion for a full-scale, privately funded and sited reactor in history,” said Oklo co-founder and CEO Jacob DeWitte. “By building on a greenfield site on private land, performing full-scale civil excavation and construction, and procuring fuel and all major components commercially, we demonstrated that the advanced nuclear industry can move at a pace that many did not believe possible. And this experience is fully translatable to future commercial deployments.”

“The U.S. Department of Energy is excited to see another Reactor Pilot Program participant receive authorization,” said Principal Deputy Assistant Secretary for Nuclear Energy Mike Goff. “With the right enabling environment, Oklo has been able to accelerate their progress and is now ready to take the next step with their technology.”

The startup authorization follows a rigorous readiness review, through which DOE confirmed that Oklo has achieved the engineering, organizational, and operational readiness needed to safely receive fuel and begin reactor operations. A readiness review is a critical final step in DOE’s startup authorization process: a multidisciplinary DOE team evaluates whether facility procedures and personnel training are adequate; the facility and equipment conform to the approved design, safety equipment functions properly; and required safety management programs have been implemented. Oklo fully developed these safety management programs in-house rather than relying on an established or pre-existing operating framework within an established facility such as a national laboratory.

""Executing on Groves has meant much more than just a construction project; it has been a valuable part of building and exercising key operational muscle across the Oklo enterprise,” said Oklo co-founder and COO Caroline DeWitte. “Startup of a private facility means honing and implementing operating procedures, training programs, security programs, environment, health and safety programs, quality assurance programs and procedures, and much more. Oklo's centers of excellence on all of these operational aspects now have this experience to bring to all our projects currently in progress and to build on for the future.”

Future Oklo projects will build on the established systems, qualified suppliers, and approved operating programs established through Groves. By establishing a repeatable approach to engineering, construction, commissioning, operations, and regulatory authorization, Groves helps reduce execution risk and accelerate future deployments across all of Oklo’s business units.

The Reactor Pilot Program created a rigorous pathway that enabled construction and organizational readiness activities to proceed while DOE conducted its reviews. Groves demonstrates how that approach can support advanced reactor deployment while maintaining a rigorous focus on safety.

https://oklo.com/newsroom/news-details/2026/Oklo-Receives-U-S--Department-of-Energy-Startup-Authorization-for-Groves-Reactor-Clearing-Way-for-Fuel-Loading-and-First-Criticality/default.aspx",the u s department of energy doe startup authorization allows oklo to load nuclear fuel conduct startup testing and proceed toward first criticality in just over months oklo progressed from groundbreaking to receiving doe startup authorization for its first reactor at the groves site during that period oklo built the reactor facility established the operating organization qualified personnel implemented nuclear programs and procedures procured fuel and major equipment from commercial suppliers and completed the doe authorization process the groves low power test reactor will demonstrate reactor operations that support oklo s plans for commercial scale domestic isotope production groves is a commercial scale facility meaning oklo can repeat the experience with demonstrated experience in siting building commissioning and operating its commercial reactors in the future with confidence in how long it takes and how much it costs to build its isotope production reactors lockhart texas business wire oklo inc nyse oklo oklo an advanced nuclear technology company today announced it received startup authorization for its groves isotope test reactor this authorization granted under the u s department of energy doe reactor pilot program completes doe s authorization process and clears the way for fuel loading startup testing and reactor operations groves is a low power test reactor designed to demonstrate reactor design build and operations and to establish operating experience needed to support future isotope production facilities the project advances oklo s plans to establish domestic production of critical isotopes for potential use in cancer care manufacturing scientific research space exploration and national security groves a privately financed facility demonstrates nearly every element of a commercially oriented deployment model that oklo can repeat and scale across future projects the facility was built on private land including full scale civil excavation and construction and assembled with all full scale systems components and fuel either sourced commercially or manufactured by oklo this facility marks the fastest time that we are aware of to go from greenfield to substantial completion for a full scale privately funded and sited reactor in history said oklo co founder and ceo jacob dewitte by building on a greenfield site on private land performing full scale civil excavation and construction and procuring fuel and all major components commercially we demonstrated that the advanced nuclear industry can move at a pace that many did not believe possible and this experience is fully translatable to future commercial deployments the u s department of energy is excited to see another reactor pilot program participant receive authorization said principal deputy assistant secretary for nuclear energy mike goff with the right enabling environment oklo has been able to accelerate their progress and is now ready to take the next step with their technology the startup authorization follows a rigorous readiness review through which doe confirmed that oklo has achieved the engineering organizational and operational readiness needed to safely receive fuel and begin reactor operations a readiness review is a critical final step in doe s startup authorization process a multidisciplinary doe team evaluates whether facility procedures and personnel training are adequate the facility and equipment conform to the approved design safety equipment functions properly and required safety management programs have been implemented oklo fully developed these safety management programs in house rather than relying on an established or pre existing operating framework within an established facility such as a national laboratory executing on groves has meant much more than just a construction project it has been a valuable part of building and exercising key operational muscle across the oklo enterprise said oklo co founder and coo caroline dewitte startup of a private facility means honing and implementing operating procedures training programs security programs environment health and safety programs quality assurance programs and procedures and much more oklo s centers of excellence on all of these operational aspects now have this experience to bring to all our projects currently in progress and to build on for the future future oklo projects will build on the established systems qualified suppliers and approved operating programs established through groves by establishing a repeatable approach to engineering construction commissioning operations and regulatory authorization groves helps reduce execution risk and accelerate future deployments across all of oklo s business units the reactor pilot program created a rigorous pathway that enabled construction and organizational readiness activities to proceed while doe conducted its reviews groves demonstrates how that approach can support advanced reactor deployment while maintaining a rigorous focus on safety,0.9964,positive
2026-07-23 20:58:03+00:00,"Comcast sucks as a company and is a long term dead end that will go bankrupt sometime around 2045, if not sooner. Their stock just crashed 7% today to 21.98 per share after their earnings report. This is a new 624-week low for the stock. If you ever invested in this company after Nov 1 2013, you got completely screwed and you should ask for a refund on your shares.

At $1.32 yearly dividend per share at 21.98 per share, this is a 6% dividend yield. Boomers are going to buy this and so will boomer adjacent ""income strategy"" funds. The bear case here is that with the way the federal reserve is going, this 6% dividend yield might not beat money market funds for long.

The stock is at the RSI oversold range on the monthly, the weekly, the daily, the 2h, the 1h, and the 1minute charts. This makes my entry at 21.96 per share definitely a falling knife catch, but at least it's a falling knife catch with decent short-term mean-reversion odds.

P/E is one of the dumbest measures of what a company is valued at but Comcast is currently 4.2 P/E. At least a few stupid youtubers and AI chatbots will talk about this incredibly low P/E and some gullible boomers might decide to buy some shares.

Their dividend payout ratio is 26% which isn't great, but its OK. I think this puts the odds that Comcast cuts or suspends their dividend before the next quarter at extremely low to impossible.

My position is 2000 shares at 21.965 per share. I'm targeting a 0.50 dollars move to the upside to make $1000. I think the odds of this occurring between now and the next earnings report are very likely.

This is the definition of picking up pennies in front of a steamroller (risk $44000 to make $1000) and nobody should do this. The copium case: the shares can depreciate by $1.72 from the current price and after 1 quarter I'll still have matched the performance of a money market fund with this position, even factoring in that dividends just subtract money from the stock price and pay it back to you.

NFA

https://preview.redd.it/m2xh4m5em1fh1.png?width=1330&format=png&auto=webp&s=cff26f4970d87b8e4a61f331126b3500e3a931fd",comcast sucks as a company and is a long term dead end that will go bankrupt sometime around if not sooner their stock just crashed today to per share after their earnings report this is a new week low for the stock if you ever invested in this company after nov you got completely screwed and you should ask for a refund on your shares at yearly dividend per share at per share this is a dividend yield boomers are going to buy this and so will boomer adjacent income strategy funds the bear case here is that with the way the federal reserve is going this dividend yield might not beat money market funds for long the stock is at the rsi oversold range on the monthly the weekly the daily the h the h and the minute charts this makes my entry at per share definitely a falling knife catch but at least it s a falling knife catch with decent short term mean reversion odds p e is one of the dumbest measures of what a company is valued at but comcast is currently p e at least a few stupid youtubers and ai chatbots will talk about this incredibly low p e and some gullible boomers might decide to buy some shares their dividend payout ratio is which isn t great but its ok i think this puts the odds that comcast cuts or suspends their dividend before the next quarter at extremely low to impossible my position is shares at per share i m targeting a dollars move to the upside to make i think the odds of this occurring between now and the next earnings report are very likely this is the definition of picking up pennies in front of a steamroller risk to make and nobody should do this the copium case the shares can depreciate by from the current price and after quarter i ll still have matched the performance of a money market fund with this position even factoring in that dividends just subtract money from the stock price and pay it back to you nfa,-0.6119,negative
2026-07-23 20:17:32+00:00,"Discovered stonks and trading last April, 2025.

Fast forward one year and nearly four months.

74k down in my account, and 63k in debt.

I remember the days when I was saving 2k/mo, paying all my bills on time, no worries in the world.

Now I have sleepless nights, wonder how much longer I will have a car, a house, a job, and can't go more than three days without fantasizing about leaving my brains and skull all over the ceiling.  

Not asking for help, not asking for advice, not asking for anything.  Just wanted to share with you gents.  This is pure addiction for me at this point and it is going to take absolutely everything I have and more until I am sleeping outside in the middle of winter.

I've accepted it and embraced my fate.

Never been remotely close to break even.  Time to pump the gas and see how deep I can take this dive.",discovered stonks and trading last april fast forward one year and nearly four months k down in my account and k in debt i remember the days when i was saving k mo paying all my bills on time no worries in the world now i have sleepless nights wonder how much longer i will have a car a house a job and can t go more than three days without fantasizing about leaving my brains and skull all over the ceiling not asking for help not asking for advice not asking for anything just wanted to share with you gents this is pure addiction for me at this point and it is going to take absolutely everything i have and more until i am sleeping outside in the middle of winter i ve accepted it and embraced my fate never been remotely close to break even time to pump the gas and see how deep i can take this dive,-0.666,negative
2026-07-23 20:14:03+00:00,,nan,0.0,neutral
2026-07-23 20:01:37+00:00,This post contains content not supported on old Reddit. [Click here to view the full post](https://sh.reddit.com/r/wallstreetbets/comments/1v4oyrv),this post contains content not supported on old reddit click here to view the full post,-0.2411,negative
2026-07-23 19:45:36+00:00,,nan,0.0,neutral
2026-07-23 19:40:01+00:00,"Always thought how people manage to lose this much and here i am...

The funny thing is, no matter how much you gain or lose, if you're not out of the game, it can still happen to you.

 Today you're laughing at my chart. Tomorrow your broker might be sending you the wellness check.

Let's be honest - most of us come here for two reasons:

1. To see if there's someone even more regarded than us.

2. To feel a little better about our own losses.

If my account makes one of you sleep better tonight, you're welcome.

As for me, it's back to the boring life: automating buys into low-cost index funds and not looking at them. Hopefully I don't end up trading again. (Oops... I mean gambling on stocks and options.)

Hopefully never see you regards!",always thought how people manage to lose this much and here i am the funny thing is no matter how much you gain or lose if you re not out of the game it can still happen to you today you re laughing at my chart tomorrow your broker might be sending you the wellness check let s be honest most of us come here for two reasons to see if there s someone even more regarded than us to feel a little better about our own losses if my account makes one of you sleep better tonight you re welcome as for me it s back to the boring life automating buys into low cost index funds and not looking at them hopefully i don t end up trading again oops i mean gambling on stocks and options hopefully never see you regards,0.9404,positive
2026-07-23 18:46:15+00:00,"100% MUD.

Kept some money for pasta dinners",mud kept some money for pasta dinners,0.0,neutral
2026-07-23 18:00:03+00:00,This post contains content not supported on old Reddit. [Click here to view the full post](https://sh.reddit.com/r/wallstreetbets/comments/1v4lh75),this post contains content not supported on old reddit click here to view the full post,-0.2411,negative
2026-07-23 17:47:16+00:00,I pray for peace ✨ 🌈 ,i pray for peace,0.7003,positive
2026-07-23 17:03:39+00:00,SKHY swings a ton with Korea pumping and dumping overnight. Was able to make some $$ and bought a brand new Rolex Datejust  ,skhy swings a ton with korea pumping and dumping overnight was able to make some and bought a brand new rolex datejust,-0.3182,negative
2026-07-23 16:23:14+00:00,"this shit will collapse, I am telling you I'm going to post my position every fucking day

yesterday you laughed at me for being Italian now I'm the one laughing at you

# IT'S TIME TO SINK THIS STUPID AND MANIPULATED MARKET",this shit will collapse i am telling you i m going to post my position every fucking day yesterday you laughed at me for being italian now i m the one laughing at you it s time to sink this stupid and manipulated market,-0.802,negative
2026-07-23 15:23:06+00:00,I trusted GOOGL. Thank you for the attention to this matter!,i trusted googl thank you for the attention to this matter,0.6932,positive
2026-07-23 14:53:47+00:00,Leveraged short positions on this dumpster fire of a company starting to pay off 🔥,leveraged short positions on this dumpster fire of a company starting to pay off,-0.5499,negative
2026-07-23 14:37:58+00:00,Could I have made more? Sure. But with my luck it would have Shrek-ed straight back up to my breakeven or worse in the first 30 minutes. ,could i have made more sure but with my luck it would have shrek ed straight back up to my breakeven or worse in the first minutes,0.4582,positive
2026-07-23 14:37:50+00:00,Finally closed SSPC ,finally closed sspc,0.0,neutral
2026-07-23 13:34:52+00:00,Doing great. Officially a regard!!!!,doing great officially a regard,0.6249,positive
2026-07-23 13:03:59+00:00,"My prior bullish post https://www.reddit.com/r/wallstreetbets/s/o0PxYmGV1n

He was supposed to take us to Mars and burn short sellers. 

Still holding 7300 shares. Please Elon fly again. ",my prior bullish post he was supposed to take us to mars and burn short sellers still holding shares please elon fly again,0.5423,positive
2026-07-23 10:57:07+00:00,,nan,0.0,neutral
2026-07-23 10:50:42+00:00,"OK so the most profitable companies in the world decided to GO ALL IN AI with humongous capex. They did it all at once apart from Apple who is not in the game. Google, Meta, Amazon , Oracle, Microsoft. All of them. The CEOs of these companies produced the most amount of wealth and propped up global gdp. Now they all agree on a thing.

Google yesterday blew up earnings from their cloud and said they will \*increase\* their humongous capex even more while reporting negative cash flow for the first time in their history.

A rational person would ask: are these amazing businessmen suddently all very wrong about the same thing at the same time OR

I am reading too much paid subs from burry and following the wrong people on twitter that have never produced anything?

Which is it? Are you smarter than a mag 7 CEO? Maybe ... hmm...",ok so the most profitable companies in the world decided to go all in ai with humongous capex they did it all at once apart from apple who is not in the game google meta amazon oracle microsoft all of them the ceos of these companies produced the most amount of wealth and propped up global gdp now they all agree on a thing google yesterday blew up earnings from their cloud and said they will increase their humongous capex even more while reporting negative cash flow for the first time in their history a rational person would ask are these amazing businessmen suddently all very wrong about the same thing at the same time or i am reading too much paid subs from burry and following the wrong people on twitter that have never produced anything which is it are you smarter than a mag ceo maybe hmm,0.8648,positive
2026-07-23 10:00:39+00:00,This post contains content not supported on old Reddit. [Click here to view the full post](https://sh.reddit.com/r/wallstreetbets/comments/1v49fts),this post contains content not supported on old reddit click here to view the full post,-0.2411,negative
2026-07-23 08:17:19+00:00,"**alphabet spent billions on AI just to make Google Finance objectively worse. As we can see, thats the only reason $GOOGL closed red yesterday and will open red today!**

**———-**  
**ps. but for real, UX so bad it makes you question whether anyone actually tested the app before forcing onto end user** 🦧** **",alphabet spent billions on ai just to make google finance objectively worse as we can see thats the only reason googl closed red yesterday and will open red today ps but for real ux so bad it makes you question whether anyone actually tested the app before forcing onto end user,-0.8514,negative
2026-07-23 06:28:36+00:00,"In my opinion great results.

Q2 2026 results speak for themselves:  
Revenue up 8%  
AI & Cloud sales up 105%  
Operating profit up 18%  
EPS up 75%  
€2.8 billion in AI & Cloud orders secured in a single quarter

Source:   
https://www.nokia.com/system/files/2026-07/nokia\_results\_2026\_q2.pdf",in my opinion great results q results speak for themselves revenue up ai cloud sales up operating profit up eps up billion in ai cloud orders secured in a single quarter source,0.8658,positive
