created_utc,body,clean_body,body_sentiment,body_label
2026-05-26 20:41:03+00:00,"Thought I was him, turns out I’m just like the rest of you regards",thought i was him turns out i m just like the rest of you regards,0.3612,positive
2026-05-26 20:30:06+00:00,Up on a few but down on most. Let’s see what tomorrow brings. Probably more insane buying now that I have a bunch of puts lol ,up on a few but down on most let s see what tomorrow brings probably more insane buying now that i have a bunch of puts lol,-0.0745,negative
2026-05-26 20:17:07+00:00,,nan,0.0,neutral
2026-05-26 20:06:34+00:00,Kicking myself for not buying MUU earlier,kicking myself for not buying muu earlier,0.0,neutral
2026-05-26 19:57:09+00:00,This post contains content not supported on old Reddit. [Click here to view the full post](https://sh.reddit.com/r/wallstreetbets/comments/1toia0i),this post contains content not supported on old reddit click here to view the full post,-0.2411,negative
2026-05-26 19:56:22+00:00,"Everyone thinks Pure Storage / Everpure is just a boring enterprise storage company.
That’s the opportunity.
This thing is not a commodity NAND trade. They are not just reselling SSDs and praying NAND prices go up. Pure sells a software-defined flash storage platform with proprietary DirectFlash modules and Purity software sitting on top.
That is why gross margins are around 70%+.
For a “hardware storage company,” that is insane. Those are much closer to software/platform margins than commodity component margins.
The market may be looking at this like “storage boxes.” But the business looks more like:
    •    Enterprise data platform
    •    Subscription storage model
    •    High-margin software/control layer
    •    Datacenter flash replacement cycle
    •    Lower power and footprint vs legacy disk systems
The key number: RPO.
Q3 FY26 RPO: $2.9B
 Q4 FY26 RPO: $3.7B
That is roughly $800M of contracted future revenue added in one quarter, or about 28% QoQ RPO growth.
Revenue was strong too, but RPO is the better tell. Customers are signing bigger future commitments before all of it shows up in revenue.
This is where the datacenter angle comes in.
Datacenters are running into power, space, cooling, and density constraints. HDD-heavy storage is cheap, but it is slower, bulkier, and power hungry. As workloads keep getting larger and data keeps piling up, high-capacity flash becomes more attractive.
Pure is trying to be the architecture layer for that shift, not just a NAND reseller.
That matters because NAND pricing cycles are brutal. Micron/SanDisk/Samsung are much more exposed to commodity pricing. Pure’s margin profile is different because the value is in the system, software, subscriptions, reliability, and efficiency.
Basically:
NAND companies sell the commodity ingredient.
 Pure sells the high-margin finished platform.
The hyperscaler piece is still early, which is also why the upside exists.
Meanwhile, Pure’s systems also tend to outperform legacy storage on the metrics hyperscalers actually care about: latency, uptime, density, and operational efficiency. Flash arrays can deliver dramatically faster read/write performance than HDD systems while using less rack space and less power. That means lower cooling costs, better utilization per square foot of datacenter space, and fewer operational headaches at scale.
The software layer matters too. Pure’s architecture is designed for non-disruptive upgrades, automation, and high reliability, which reduces downtime and lowers total cost of ownership over time. So even if the upfront hardware cost is higher than spinning disks, the long-term economics can still be better for large enterprise and hyperscale deployments.
Meta is the known major validation customer, but this is not yet fully rolled out across every hyperscaler. That means it is not de-risked. But if Meta scales and others follow, the market may stop valuing Pure like boring storage and start valuing it like a datacenter infrastructure platform.
That is the rerate case.
Base case: premium enterprise storage compounder.
 Bull case: high-margin datacenter flash platform.
 Full regard case: RPO keeps ripping, hyperscalers scale, gross margins stay near software-like levels, and the stock deserves a much higher forward P/E than old-school hardware names.
Here is where the math gets interesting.
If RPO grew from $2.9B to $3.7B in one quarter, that is a quarterly increase of about 28%. Obviously that pace will not continue forever, but even moderating to ~15–20% QoQ compounded over the next 2–3 years would push RPO toward the $10B–$15B range.
At that scale, Pure stops looking like a legacy storage vendor and starts looking more like a recurring infrastructure platform with hyperscaler exp t
Infrastructure/software hybrids with durable growth and sticky enterprise contracts can trade anywhere from 20–25x earnings in bullish cycles.
Put a ~$150B market cap on Pure in that scenario and divide by roughly 330M shares outstanding, and you get into the ~$500/share range.
That sounds insane if you think this is just “storage hardware.”
It sounds a lot less insane if RPO keeps compounding and hyperscalers increasingly adopt Pure as core datacenter infrastructure.
The important part is not “AI.” Everyone says AI.
The important part is:
    •    Data keeps growing
    •    Datacenters need denser storage
    •    Flash keeps replacing disk in high-performance environments
    •    Pure has 70%+ gross margins
    •    RPO just accelerated hard
    •    Hyperscaler adoption is still early
That is a much cleaner thesis than “AI storage go brrr.”
TL;DR: $P / Everpure looks like a boring storage company, but the economics are way better than boring hardware. 70%+ gross margins, strong RPO growth, subscription/platform characteristics, and early hyperscaler validation make this a sneaky datacenter infrastructure play. If RPO keeps compounding and the market rerates the business like a platform instead of a box seller, a long-term path toward a $500 stock is not impossible. Not financial advice, I just like high-margin “hardware” companies that do not actually trade like software yet.",everyone thinks pure storage everpure is just a boring enterprise storage company that s the opportunity this thing is not a commodity nand trade they are not just reselling ssds and praying nand prices go up pure sells a software defined flash storage platform with proprietary directflash modules and purity software sitting on top that is why gross margins are around for a hardware storage company that is insane those are much closer to software platform margins than commodity component margins the market may be looking at this like storage boxes but the business looks more like enterprise data platform subscription storage model high margin software control layer datacenter flash replacement cycle lower power and footprint vs legacy disk systems the key number rpo q fy rpo b q fy rpo b that is roughly m of contracted future revenue added in one quarter or about qoq rpo growth revenue was strong too but rpo is the better tell customers are signing bigger future commitments before all of it shows up in revenue this is where the datacenter angle comes in datacenters are running into power space cooling and density constraints hdd heavy storage is cheap but it is slower bulkier and power hungry as workloads keep getting larger and data keeps piling up high capacity flash becomes more attractive pure is trying to be the architecture layer for that shift not just a nand reseller that matters because nand pricing cycles are brutal micron sandisk samsung are much more exposed to commodity pricing pure s margin profile is different because the value is in the system software subscriptions reliability and efficiency basically nand companies sell the commodity ingredient pure sells the high margin finished platform the hyperscaler piece is still early which is also why the upside exists meanwhile pure s systems also tend to outperform legacy storage on the metrics hyperscalers actually care about latency uptime density and operational efficiency flash arrays can deliver dramatically faster read write performance than hdd systems while using less rack space and less power that means lower cooling costs better utilization per square foot of datacenter space and fewer operational headaches at scale the software layer matters too pure s architecture is designed for non disruptive upgrades automation and high reliability which reduces downtime and lowers total cost of ownership over time so even if the upfront hardware cost is higher than spinning disks the long term economics can still be better for large enterprise and hyperscale deployments meta is the known major validation customer but this is not yet fully rolled out across every hyperscaler that means it is not de risked but if meta scales and others follow the market may stop valuing pure like boring storage and start valuing it like a datacenter infrastructure platform that is the rerate case base case premium enterprise storage compounder bull case high margin datacenter flash platform full regard case rpo keeps ripping hyperscalers scale gross margins stay near software like levels and the stock deserves a much higher forward p e than old school hardware names here is where the math gets interesting if rpo grew from b to b in one quarter that is a quarterly increase of about obviously that pace will not continue forever but even moderating to qoq compounded over the next years would push rpo toward the b b range at that scale pure stops looking like a legacy storage vendor and starts looking more like a recurring infrastructure platform with hyperscaler exp t infrastructure software hybrids with durable growth and sticky enterprise contracts can trade anywhere from x earnings in bullish cycles put a b market cap on pure in that scenario and divide by roughly m shares outstanding and you get into the share range that sounds insane if you think this is just storage hardware it sounds a lot less insane if rpo keeps compounding and hyperscalers increasingly adopt pure as core datacenter infrastructure the important part is not ai everyone says ai the important part is data keeps growing datacenters need denser storage flash keeps replacing disk in high performance environments pure has gross margins rpo just accelerated hard hyperscaler adoption is still early that is a much cleaner thesis than ai storage go brrr tl dr p everpure looks like a boring storage company but the economics are way better than boring hardware gross margins strong rpo growth subscription platform characteristics and early hyperscaler validation make this a sneaky datacenter infrastructure play if rpo keeps compounding and the market rerates the business like a platform instead of a box seller a long term path toward a stock is not impossible not financial advice i just like high margin hardware companies that do not actually trade like software yet,0.9977,positive
2026-05-26 19:48:14+00:00,,nan,0.0,neutral
2026-05-26 19:48:13+00:00,"# The next Bottleneck in the AI Datacenter supercycle is Energy.

Have you read the paper Situational Awareness by Leopold Aschenbrenner? He is the 24 year old AI savant. Basically he wrote a paper about what is going to happen over the next 10 years and he has been correct, making buckets of money from the likes of $MU, $SNDK, $NVDA, and more along the way. He argued that the constraints on the path to AGI would shift from algorithms and chips to physical infrastructure, and above all, to electricity!

Memory, Storage, and Computer Hardware stocks have limited upside after their 1000-3000% gains in the last 12 months. However, the next bottleneck to rapid build out of AI datacenters... is Energy!

Berkeley National Laboratory estimates US datacenter electricity consumption will grow from 176 terwatthours in 2023 to between 325 - 580 terawatthours in 2028. A tripling of energy needs in just 5 years. Hyperscalers are on track to spend more than $650 Billion in 2026 alone, and have guided to be spending more in the future.

The IEA has idenitified natural gas turbines to be the most practical solution to datacenter power build out. Fermi specifically focuses on natural gas and eventually, nuclear. PJM (largest grid in the US) will be 6 Gigawatts short of its requirements by 2027. Fermi aims to solve this, Project Matador at full buildout will deliver 11 Gigawatts of private off-the-grid power with potential for up to 17 Gigawatts. 6 Gigawatts is roughly the consumption of NYC, and the hyperscalers need this type of power ASAP.

US residential energy bills have increased 36% since 2020, and will rise another 4% in 2026. Datacenters are increasingly unpopular as they make energy expensive for local residents. Lawmakers have introduced over 300 bills against Datacenter buildout just this year, some projects have been delayed or had to move because of this.

**But FERMI**, which has build out project **Matador**, will have up to 11 GW on 7500 acres in Texas. The site itself is a 99 year lease right next to DOE's nuclear weapons facility. There is a permitting pathway to civilian nuclear usage. Rick Perry, frmr Texas Governor and frmr Secretary of Energy, is cofounder and on the Board of Fermi. Let's just say he will know how to navigate energy deals and permitting in the state of Texas.

***Near Term Catalyst:***

On Fermi's Q1 '26 earnings call, management laid out a 90 day execution plan with 5 deliverables: 1. Secure a bind tenant agreement (news of this would make the stock skyrocket). 2. Maintaining capital discipline. 3. Hire a permanent CEO (this would abate worries about the management team). 4. Delivering power at the site (already being done tbh). 5. Exploring strategic partnerships for accelerating datacenter and power deployment.

The tenant is the biggest item, that would de-risk Fermi and cause a fundamental re-rating closer to its original IPO open price: **$25 a share**.

In my opinion, this a great opportunity and a potential 10x on the FRMI Aug 21 10C, as well as 300% gain on shares. My target price of $25 is reasonable, implying a \~$16B market cap. This is low for the sole company meeting the energy needs of nearly $1 Trillion addressable market.

TLDR: FRMI gonna go to $25 on AI Capex Energy build out. Buy August 21 10Call. Positions attached.",the next bottleneck in the ai datacenter supercycle is energy have you read the paper situational awareness by leopold aschenbrenner he is the year old ai savant basically he wrote a paper about what is going to happen over the next years and he has been correct making buckets of money from the likes of mu sndk nvda and more along the way he argued that the constraints on the path to agi would shift from algorithms and chips to physical infrastructure and above all to electricity memory storage and computer hardware stocks have limited upside after their gains in the last months however the next bottleneck to rapid build out of ai datacenters is energy berkeley national laboratory estimates us datacenter electricity consumption will grow from terwatthours in to between terawatthours in a tripling of energy needs in just years hyperscalers are on track to spend more than billion in alone and have guided to be spending more in the future the iea has idenitified natural gas turbines to be the most practical solution to datacenter power build out fermi specifically focuses on natural gas and eventually nuclear pjm largest grid in the us will be gigawatts short of its requirements by fermi aims to solve this project matador at full buildout will deliver gigawatts of private off the grid power with potential for up to gigawatts gigawatts is roughly the consumption of nyc and the hyperscalers need this type of power asap us residential energy bills have increased since and will rise another in datacenters are increasingly unpopular as they make energy expensive for local residents lawmakers have introduced over bills against datacenter buildout just this year some projects have been delayed or had to move because of this but fermi which has build out project matador will have up to gw on acres in texas the site itself is a year lease right next to doe s nuclear weapons facility there is a permitting pathway to civilian nuclear usage rick perry frmr texas governor and frmr secretary of energy is cofounder and on the board of fermi let s just say he will know how to navigate energy deals and permitting in the state of texas near term catalyst on fermi s q earnings call management laid out a day execution plan with deliverables secure a bind tenant agreement news of this would make the stock skyrocket maintaining capital discipline hire a permanent ceo this would abate worries about the management team delivering power at the site already being done tbh exploring strategic partnerships for accelerating datacenter and power deployment the tenant is the biggest item that would de risk fermi and cause a fundamental re rating closer to its original ipo open price a share in my opinion this a great opportunity and a potential x on the frmi aug c as well as gain on shares my target price of is reasonable implying a b market cap this is low for the sole company meeting the energy needs of nearly trillion addressable market tldr frmi gonna go to on ai capex energy build out buy august call positions attached,0.9905,positive
2026-05-26 19:43:33+00:00,"My 5/15 Call, I had 9k before CPI, and it went down to $2500 before I took the opportunity to roll the contract to 860C 6/5. My thesis, take an opportunity to profit from the dip and ride the forward momentum from the weekly chart. 

Today, market opens and I have until next Friday and MU is sitting at 830 so im like i’ll take the opportunity to get out of this position, because Ive been down and theres also a threat with extreme volatility of news. 

If I had held until at least the end of day today, I’d be up $6300 vs $1200 profit. Now normally I’d chalk it up to price of playing the game, but this is the 3rd time in 1 month where Ive missed out on at least 7k+ because Im not in a state of clear thinking and all 3 times, Ive been at work. 

On the bright side, I can at least say Im a legit cook in the kitchen. You’ll see me post about my AMD LEAP I sold too early last month, stay tuned lol. Factoring in news events has led me to ill advised decisions and I just need to 100% purely focus on the technicals.  Better days ahead 🚀 
",my call i had k before cpi and it went down to before i took the opportunity to roll the contract to c my thesis take an opportunity to profit from the dip and ride the forward momentum from the weekly chart today market opens and i have until next friday and mu is sitting at so im like i ll take the opportunity to get out of this position because ive been down and theres also a threat with extreme volatility of news if i had held until at least the end of day today i d be up vs profit now normally i d chalk it up to price of playing the game but this is the rd time in month where ive missed out on at least k because im not in a state of clear thinking and all times ive been at work on the bright side i can at least say im a legit cook in the kitchen you ll see me post about my amd leap i sold too early last month stay tuned lol factoring in news events has led me to ill advised decisions and i just need to purely focus on the technicals better days ahead,0.9431,positive
2026-05-26 19:41:40+00:00,,nan,0.0,neutral
2026-05-26 19:00:15+00:00,"During today’s NASA Moon Base briefing, it was announced that Blue Origin will deliver the first Lunar Terrain Vehicle (LTV) as part of the initial robotic missions supporting the lunar base. This comes as a surprise to many, since Intuitive Machines (LUNR) won the earlier LTV feasibility study with its Moon RACER team and had been seen as a strong contender for the next phase. LUNR shares dropped on the news as the long-pending LTV decision appears to have gone (at least partially) to Blue Origin.

[https://www.youtube.com/watch?v=Nyki6O1oxIg](https://www.youtube.com/watch?v=Nyki6O1oxIg)",during today s nasa moon base briefing it was announced that blue origin will deliver the first lunar terrain vehicle ltv as part of the initial robotic missions supporting the lunar base this comes as a surprise to many since intuitive machines lunr won the earlier ltv feasibility study with its moon racer team and had been seen as a strong contender for the next phase lunr shares dropped on the news as the long pending ltv decision appears to have gone at least partially to blue origin,0.9287,positive
2026-05-26 18:58:29+00:00,"It is pretty obvious that those 3310s and BlackBerries with the clit still have something to say to modern day iPhones and Androids with their crappy builds.

The ride so far was only the beginning. YOLO! 🚀🚀🚀

NOK Jan28 30C 72@3.30

BB Jan28 15C 103@2.32",it is pretty obvious that those s and blackberries with the clit still have something to say to modern day iphones and androids with their crappy builds the ride so far was only the beginning yolo nok jan c bb jan c,0.1779,positive
2026-05-26 18:53:27+00:00,,nan,0.0,neutral
2026-05-26 18:51:21+00:00,,nan,0.0,neutral
2026-05-26 18:47:55+00:00,,nan,0.0,neutral
2026-05-26 18:27:05+00:00,"Bought this last week. This gamble was half of my 401k which is almost doubled now.

May the AI hype party never die 🎉 ",bought this last week this gamble was half of my k which is almost doubled now may the ai hype party never die,0.7046,positive
2026-05-26 18:24:04+00:00,Never any pullback on this bulljizz market,never any pullback on this bulljizz market,0.0,neutral
2026-05-26 18:21:45+00:00,"I started at 2021, heard and knew about all the common sense and still deepdived into options and learned my lesson the hard way. I finally made some decent profit recently, but it doesn't really cheer me up as I calculated this will make my annualised return close to 10% over 5 years. However, if I did ABSOLUTELY nothing and just put the money in VOO, my annualised return would be 13%...

This kinda depresses me. I feel silly having spent all the nights restless thinking about my losses when I could've just let it ride and focused on something else that's more meaningful to me in life... That being said, thanks MU for making it hurt less.

Edit: just want to make some clarification. I wasn't trying to say 10% is shit. My point was to say that I felt silly making myself anxious and sleepless where I could've done nothing and made more. I like researching stocks and trading them (even options). It's just I also had other things that I was interested in but couldn't do because I was too invested in stock. So I guess if there's a lesson, it'd be that the index fund is truly a good choice of you don't want all the fuss.",i started at heard and knew about all the common sense and still deepdived into options and learned my lesson the hard way i finally made some decent profit recently but it doesn t really cheer me up as i calculated this will make my annualised return close to over years however if i did absolutely nothing and just put the money in voo my annualised return would be this kinda depresses me i feel silly having spent all the nights restless thinking about my losses when i could ve just let it ride and focused on something else that s more meaningful to me in life that being said thanks mu for making it hurt less edit just want to make some clarification i wasn t trying to say is shit my point was to say that i felt silly making myself anxious and sleepless where i could ve done nothing and made more i like researching stocks and trading them even options it s just i also had other things that i was interested in but couldn t do because i was too invested in stock so i guess if there s a lesson it d be that the index fund is truly a good choice of you don t want all the fuss,0.8902,positive
2026-05-26 18:13:22+00:00,"I went all in. Say whatever you want, I have faith.

Call me retard or whatever, let’s see when the marketing kicks in.

I promise I’ll update this post in 2 months time. Either AI completely destroyed this stock, or the hype has made it go moon. It can drop 40% I still won’t sell, fuck it.",i went all in say whatever you want i have faith call me retard or whatever let s see when the marketing kicks in i promise i ll update this post in months time either ai completely destroyed this stock or the hype has made it go moon it can drop i still won t sell fuck it,-0.5256,negative
2026-05-26 17:37:48+00:00,"My 1st ever 100K profit....

https://preview.redd.it/4ywmy8vspi3h1.jpg?width=1922&format=pjpg&auto=webp&s=1f92617bdb6e550df601af47f5f09e2eed4fc4ff

",my st ever k profit,0.4404,positive
2026-05-26 17:28:32+00:00,,nan,0.0,neutral
2026-05-26 17:19:25+00:00,On Friday CRSR announced a new portfolio of AI workstations and servers for AI applications. That’s all I need to know. Stock has been beaten down and this could be the spark that dramatically changes the story. Stock was up 10% Friday on the news. I think it could double. Options IV is relatively cheap so view this as a good risk / reward play. ,on friday crsr announced a new portfolio of ai workstations and servers for ai applications that s all i need to know stock has been beaten down and this could be the spark that dramatically changes the story stock was up friday on the news i think it could double options iv is relatively cheap so view this as a good risk reward play,0.7184,positive
