created_utc,body,clean_body,body_sentiment,body_label
2026-07-05 12:11:01+00:00,"[December 16, 1975 \(50 years old\) \\"" Kim Heeyoung \\""](https://preview.redd.it/b6utiineiebh1.jpg?width=600&format=pjpg&auto=webp&s=c7c7b93ffadd74917c149efc7d0912f1bb6930e9)

{It's a Korean stock meme.}  
  
Foreign investors probably see the ticker **SKHY** and think:

“Okay, SK hynix. Korean memory stock. HBM. AI. Nvidia supply chain. Got it.”

But Korean meme traders see something else.



Officially:

**SKHY = SK hynix**

Unofficially, in Korean meme language:

**S = Saranghae**  
That means **“I love you”** in Korean.

**KHY = Kim Hee-young**

So the meme version is:

**SKHY = Saranghae Kim Hee-young**  
**SKHY = I love you, Kim Hee-young**

Now why does this matter?

Because Kim Hee-young is not some random name.

Kim Hee-young is publicly known in Korea as the partner of **Chey Tae-won**, the chairman of SK Group. SK Group controls SK hynix, one of the most important companies in the AI memory and HBM supply chain.

So to foreigners, SKHY looks like a clean AI memory ADR ticker.

To Koreans, it also accidentally sounds like a billionaire chaebol romance meme.

Here is the lore.

Chey Tae-won was married to **Roh Soh-yeong**, the daughter of former South Korean president Roh Tae-woo. Their divorce became one of the biggest and most expensive chaebol divorce battles in Korean history.

This was not just a private love story.

This became a fight about money, shares, corporate control, and the SK empire.

The key issue was whether Chey’s stake in **SK Inc.**, the holding-company core of SK Group, should be treated as marital property. That matters because SK Inc. sits at the center of SK Group’s control structure, and SK Group includes SK hynix.

So the divorce was not just gossip.

[I am actually watching a Korean drama!](https://preview.redd.it/6bf72hhxjebh1.jpg?width=670&format=pjpg&auto=webp&s=35bdac77e1927ada2b062284f4fb09456db5dc13)

It touched:

AI memory  
HBM  
SK hynix  
SK Group control  
presidential-family marriage  
Kim Hee-young  
billion-dollar divorce math  
and now a Nasdaq ticker that accidentally reads like “I love you, Kim Hee-young.”

Korean meme traders jokingly call Chey Tae-won a **legendary chaebol romantic**.

Not because Nasdaq meant it that way.

Not because the company officially said anything like that.

But because **SKHY** accidentally reads like:

**Saranghae Kim Hee-young.**

That is the joke.

The official ticker is boring.

The meme ticker is elite.

Bull case:

1. SK hynix is one of the most important HBM suppliers in the AI cycle.
2. HBM demand is still tied directly to the Nvidia/AI infrastructure trade.
3. A Nasdaq ADR gives U.S. investors easier access.
4. The ticker is short, clean, and memeable.
5. SKHY has more lore than 99% of small-cap garbage on this sub.

Bear case:

1. Memory is cyclical.
2. HBM expectations are already very high.
3. ADR listings can create short-term supply and flow pressure.
4. Korean chaebol governance is not a beginner-friendly dungeon.
5. If you buy only because “Saranghae Kim Hee-young,” that is not investing. That is confession.

Conclusion:

Officially:

**SKHY = SK hynix**

Unofficially, for Korean internet degenerates:

**SKHY = Saranghae Kim Hee-young**  
**SKHY = I love you, Kim Hee-young**

This is not just a Korean AI memory stock coming to Nasdaq.

This is HBM, Nvidia supply chains, chaebol drama, a billion-dollar divorce saga, and one of the most accidentally romantic tickers in the market.",december years old kim heeyoung it s a korean stock meme foreign investors probably see the ticker skhy and think okay sk hynix korean memory stock hbm ai nvidia supply chain got it but korean meme traders see something else officially skhy sk hynix unofficially in korean meme language s saranghae that means i love you in korean khy kim hee young so the meme version is skhy saranghae kim hee young skhy i love you kim hee young now why does this matter because kim hee young is not some random name kim hee young is publicly known in korea as the partner of chey tae won the chairman of sk group sk group controls sk hynix one of the most important companies in the ai memory and hbm supply chain so to foreigners skhy looks like a clean ai memory adr ticker to koreans it also accidentally sounds like a billionaire chaebol romance meme here is the lore chey tae won was married to roh soh yeong the daughter of former south korean president roh tae woo their divorce became one of the biggest and most expensive chaebol divorce battles in korean history this was not just a private love story this became a fight about money shares corporate control and the sk empire the key issue was whether chey s stake in sk inc the holding company core of sk group should be treated as marital property that matters because sk inc sits at the center of sk group s control structure and sk group includes sk hynix so the divorce was not just gossip i am actually watching a korean drama it touched ai memory hbm sk hynix sk group control presidential family marriage kim hee young billion dollar divorce math and now a nasdaq ticker that accidentally reads like i love you kim hee young korean meme traders jokingly call chey tae won a legendary chaebol romantic not because nasdaq meant it that way not because the company officially said anything like that but because skhy accidentally reads like saranghae kim hee young that is the joke the official ticker is boring the meme ticker is elite bull case sk hynix is one of the most important hbm suppliers in the ai cycle hbm demand is still tied directly to the nvidia ai infrastructure trade a nasdaq adr gives u s investors easier access the ticker is short clean and memeable skhy has more lore than of small cap garbage on this sub bear case memory is cyclical hbm expectations are already very high adr listings can create short term supply and flow pressure korean chaebol governance is not a beginner friendly dungeon if you buy only because saranghae kim hee young that is not investing that is confession conclusion officially skhy sk hynix unofficially for korean internet degenerates skhy saranghae kim hee young skhy i love you kim hee young this is not just a korean ai memory stock coming to nasdaq this is hbm nvidia supply chains chaebol drama a billion dollar divorce saga and one of the most accidentally romantic tickers in the market,0.9977,positive
2026-07-05 08:49:34+00:00,"**Taiwan's Foxconn, the world's largest contract electronics maker, reported a 39.8% year-on-year ‌rise in second-quarter revenue that beat market forecasts ‌on strong demand for AI products**, though it cautioned about ""volatile"" global politics.

Revenue ​for Nvidia's biggest server maker and Apple's top iPhone assembler jumped to T$2.513 trillion ($78.71 billion) in the April-June quarter, Foxconn said in a statement on Sunday.

**June alone: T$821.8B, +52.1% YoY** — a record for the month.

Strong ⁠AI demand led to robust revenue growth for its cloud and networking products division, while smart consumer electronics, which ​includes iPhones, ​posted ""significant"" growth, the company said.

The driver is AI. **Foxconn** builds Nvidia's biggest AI servers, and its cloud/networking division posted robust growth. Smart consumer electronics — including iPhones, where Foxconn is Apple's top assembler — also saw ""significant"" growth.  
  
Q3 is expected to grow both quarter-on-quarter and year-on-year, with AI rack demand ""maintaining a growth trend."" 

",taiwan s foxconn the world s largest contract electronics maker reported a year on year rise in second quarter revenue that beat market forecasts on strong demand for ai products though it cautioned about volatile global politics revenue for nvidia s biggest server maker and apple s top iphone assembler jumped to t trillion billion in the april june quarter foxconn said in a statement on sunday june alone t b yoy a record for the month strong ai demand led to robust revenue growth for its cloud and networking products division while smart consumer electronics which includes iphones posted significant growth the company said the driver is ai foxconn builds nvidia s biggest ai servers and its cloud networking division posted robust growth smart consumer electronics including iphones where foxconn is apple s top assembler also saw significant growth q is expected to grow both quarter on quarter and year on year with ai rack demand maintaining a growth trend,0.9808,positive
2026-07-04 22:43:24+00:00,"Not sure why my last post was deleted, was hoping to go to the moon. ",not sure why my last post was deleted was hoping to go to the moon,0.2115,positive
2026-07-04 21:13:36+00:00,"Single-stock leveraged and inverse ETFs tracking SK Hynix now hold \~$19 billion in total assets, more than 4 times the stock's average daily trading volume this year of \~$4.5 billion.

At the same time, Samsung has \~$12.4 billion in leveraged ETF assets, +176% above its \~$4.5 billion in average daily turnover.

Furthermore, the Hong Kong-listed 2x leveraged long SK Hynix ETF, which holds \~$13 billion in assets, is worth about twice the value of SK Hynix shares traded on an average day, the widest gap of any major stock with a leveraged ETF tracking it.

By comparison, Micron, $MU, has \~$9.9 billion in leveraged ETF assets, well below its \~$27.5 billion in average daily trading volume.

All while Tesla, $TSLA, and Nvidia, $NVDA, have leveraged ETF assets of \~$6.0 billion and \~$5.6 billion, both far smaller than their daily trading volumes of \~$23.6 billion and \~$28.8 billion, respectively.

Leverage concentration in Korean chip stocks is through the roof.",single stock leveraged and inverse etfs tracking sk hynix now hold billion in total assets more than times the stock s average daily trading volume this year of billion at the same time samsung has billion in leveraged etf assets above its billion in average daily turnover furthermore the hong kong listed x leveraged long sk hynix etf which holds billion in assets is worth about twice the value of sk hynix shares traded on an average day the widest gap of any major stock with a leveraged etf tracking it by comparison micron mu has billion in leveraged etf assets well below its billion in average daily trading volume all while tesla tsla and nvidia nvda have leveraged etf assets of billion and billion both far smaller than their daily trading volumes of billion and billion respectively leverage concentration in korean chip stocks is through the roof,0.926,positive
2026-07-04 16:46:06+00:00,,nan,0.0,neutral
2026-07-04 15:18:09+00:00,"Full ported my retirement account into SNXX on Friday. 

Edit:Thursday afternoon not Friday",full ported my retirement account into snxx on friday edit thursday afternoon not friday,0.0,neutral
2026-07-04 14:09:06+00:00,"Sold my rddt and hims leaps for powder, recent sell off is overdone. Nebius will take care of you ",sold my rddt and hims leaps for powder recent sell off is overdone nebius will take care of you,0.4939,positive
2026-07-04 02:30:38+00:00,Usually the final phase of a bubble is a crazy real estate market. Paying for houses in pre-IPO stocks might be the new thing this round. ,usually the final phase of a bubble is a crazy real estate market paying for houses in pre ipo stocks might be the new thing this round,-0.34,negative
2026-07-04 00:24:41+00:00,"I have been holding 12/17/2027 $250Cs since the beginning of the year, averaging down as it tanks. 

Up to 13 contracts at $46.67, and picked up two $200Cs for $47.48 each after the ER meltdown. 

I also have some realized losses as I rolled down my strike, with a BEP at expiration around $300. 

I’ll make sure the fries are in the bag 🫡",i have been holding cs since the beginning of the year averaging down as it tanks up to contracts at and picked up two cs for each after the er meltdown i also have some realized losses as i rolled down my strike with a bep at expiration around i ll make sure the fries are in the bag,-0.2263,negative
2026-07-04 00:01:44+00:00,"Back when it was at 260 or so I was wondering what all these businesses and advertisers that use AI generated ad campaigns going to do when models start scraping other AI generated art and copyright laws get tighter and saw that Adobe's trying to use Adobe Stock only to train Firefly, and it's still priced like a media software company at 10x forward P/E.

Yeah artists don't like Adobe but that's probably priced in by now.

They currently don't have a CEO or CFO and investors don't like that because the CEO typically has the vision to sell as to what the company can be. Finding leadership is a matter of months.

I bought an ATM LEAP at 270 because I'm relatively new to options and don't quite want to bet on OTM, preferring something more like shares. It dropped to around 210 and I had the funds to buy another LEAP.

This is pretty much a bet people start thinking of Adobe as an AI stock soon.",back when it was at or so i was wondering what all these businesses and advertisers that use ai generated ad campaigns going to do when models start scraping other ai generated art and copyright laws get tighter and saw that adobe s trying to use adobe stock only to train firefly and it s still priced like a media software company at x forward p e yeah artists don t like adobe but that s probably priced in by now they currently don t have a ceo or cfo and investors don t like that because the ceo typically has the vision to sell as to what the company can be finding leadership is a matter of months i bought an atm leap at because i m relatively new to options and don t quite want to bet on otm preferring something more like shares it dropped to around and i had the funds to buy another leap this is pretty much a bet people start thinking of adobe as an ai stock soon,0.9668,positive
2026-07-03 23:22:35+00:00,,nan,0.0,neutral
2026-07-03 20:09:59+00:00,"Started rolling weekly CVNA puts this year and they have been bread and butter.  +30,598 realized.  Rolling weeklies until CVNA hits $20

WEN Calls.  Sold last weeks calls for +7k. Will add big time if price backs to the $7-$8

Thanks.  Here is to a good 2nd half 2026

BFLO-Retail",started rolling weekly cvna puts this year and they have been bread and butter realized rolling weeklies until cvna hits wen calls sold last weeks calls for k will add big time if price backs to the thanks here is to a good nd half bflo retail,0.6808,positive
2026-07-03 20:00:37+00:00,This post contains content not supported on old Reddit. [Click here to view the full post](https://sh.reddit.com/r/wallstreetbets/comments/1umoiql),this post contains content not supported on old reddit click here to view the full post,-0.2411,negative
2026-07-03 18:54:03+00:00,I’ve been following HOOD closely for the last few weeks and it seems like it’s time to onboard. ,i ve been following hood closely for the last few weeks and it seems like it s time to onboard,0.3612,positive
2026-07-03 18:30:07+00:00,"Added Apple options when it crashed \~6% after the price increase announcement. 

From a business perspective, every price increase is good for their earnings meaning they are managing the operating expense cost well. 

Few reasons that made me bought this position: 

\- Company like Apple was at very nice discounts.  
\- Price increase should have moved the stock up.  
\- Overall market sentiment was getting negative. Apple always support market when sentiment is negative. ",added apple options when it crashed after the price increase announcement from a business perspective every price increase is good for their earnings meaning they are managing the operating expense cost well few reasons that made me bought this position company like apple was at very nice discounts price increase should have moved the stock up overall market sentiment was getting negative apple always support market when sentiment is negative,0.8687,positive
2026-07-03 18:11:07+00:00,"Market is closed today, so I’ve been reading a lot of posts trying to explain what happened yesterday.  
MU reported a solid quarter, but memory stocks still got sold off hard.  
Maybe it was just profit-taking after a huge run.  
Maybe valuations got too stretched.  
Maybe people are calling it sector rotation.  
But that’s the part I’m not fully buying yet. If it was rotation, I didn’t really see another sector clearly absorbing all that money.  
Another thing in the back of my mind is SK Hynix becoming easier for U.S. investors to buy soon.  
For a long time, MU was the easiest way for many U.S. investors to play the AI memory story. That may start to change.  
I’m not saying yesterday’s sell-off was because of SK Hynix. I honestly don’t know.  
I’m just wondering if the market is starting to think differently about memory stocks now that investors may soon have another major name to compare against MU.  
Personally, I’m not chasing SK Hynix on day one. I’d rather wait for the first few trading sessions to settle.  
For MU, I’m watching whether yesterday’s low holds next week before thinking about adding.  
Maybe I’m overthinking it.  
But yesterday’s move felt like more than just a normal post-earnings reaction.  
Curious how others are reading it",market is closed today so i ve been reading a lot of posts trying to explain what happened yesterday mu reported a solid quarter but memory stocks still got sold off hard maybe it was just profit taking after a huge run maybe valuations got too stretched maybe people are calling it sector rotation but that s the part i m not fully buying yet if it was rotation i didn t really see another sector clearly absorbing all that money another thing in the back of my mind is sk hynix becoming easier for u s investors to buy soon for a long time mu was the easiest way for many u s investors to play the ai memory story that may start to change i m not saying yesterday s sell off was because of sk hynix i honestly don t know i m just wondering if the market is starting to think differently about memory stocks now that investors may soon have another major name to compare against mu personally i m not chasing sk hynix on day one i d rather wait for the first few trading sessions to settle for mu i m watching whether yesterday s low holds next week before thinking about adding maybe i m overthinking it but yesterday s move felt like more than just a normal post earnings reaction curious how others are reading it,0.9819,positive
2026-07-03 15:56:04+00:00,"The fucking comments to the posts are hilarious. 

And the funniest thing is, when there is a serious discussion it’s like the regard has been vaporized from the mind and everyone turned into a mini genius. 

HM to the Doakes behind the wheel meme where they turned him into a regard 😂 😂 ",the fucking comments to the posts are hilarious and the funniest thing is when there is a serious discussion it s like the regard has been vaporized from the mind and everyone turned into a mini genius hm to the doakes behind the wheel meme where they turned him into a regard,0.8176,positive
2026-07-03 15:43:19+00:00,,nan,0.0,neutral
2026-07-03 15:39:17+00:00,"https://preview.redd.it/scpajnvua1bh1.png?width=1320&format=png&auto=webp&s=00d8810e7da603856e99888a89ed538887506a81

This may be why the Nikkei 225 is performing so well. Even when the Nasdaq is selling off crazy, the Nikkei continues to rise.  


Korea has good stocks, but leveraged gambling is scaring away investors.",this may be why the nikkei is performing so well even when the nasdaq is selling off crazy the nikkei continues to rise korea has good stocks but leveraged gambling is scaring away investors,-0.4077,negative
2026-07-03 12:45:56+00:00,"Amazon says its Leo constellation has reached 396 satellites, enough to provide continuous service across its initial coverage latitudes and begin commercial operations. The milestone turns Leo from a long-delayed infrastructure project into a functioning competitor to SpaceX’s Starlink, although early users should expect limited coverage and occasional interruptions. Amazon ultimately plans to deploy 3,232 satellites, but it still has a massive gap to close against Starlink’s fleet of more than 10,000 operational satellites. The real battle may be less about matching Starlink immediately and more about Amazon bundling satellite connectivity into AWS, logistics, aviation, maritime, and enterprise contracts.

source - [https://www.theverge.com/science/960563/amazon-leo-service-tipping-point](https://www.theverge.com/science/960563/amazon-leo-service-tipping-point)",amazon says its leo constellation has reached satellites enough to provide continuous service across its initial coverage latitudes and begin commercial operations the milestone turns leo from a long delayed infrastructure project into a functioning competitor to spacex s starlink although early users should expect limited coverage and occasional interruptions amazon ultimately plans to deploy satellites but it still has a massive gap to close against starlink s fleet of more than operational satellites the real battle may be less about matching starlink immediately and more about amazon bundling satellite connectivity into aws logistics aviation maritime and enterprise contracts source,-0.4939,negative
2026-07-03 10:00:37+00:00,This post contains content not supported on old Reddit. [Click here to view the full post](https://sh.reddit.com/r/wallstreetbets/comments/1uma8p0),this post contains content not supported on old reddit click here to view the full post,-0.2411,negative
2026-07-03 08:53:29+00:00,Started with 30k a couple years ago turned on margin and made it to 1.4M. fell to 150k 5-6 times and now we're here. No longer in margin.,started with k a couple years ago turned on margin and made it to m fell to k times and now we re here no longer in margin,-0.296,negative
2026-07-03 08:45:57+00:00,"Meta is reportedly considering a collaboration with Samsung to produce custom artificial intelligence chips valued at 10 trillion Korean won ($7.7 billion). This potential partnership aims to enhance Meta's AI capabilities by leveraging Samsung's semiconductor manufacturing expertise. The move underscores Meta's commitment to advancing its AI infrastructure.

The chips would be built on Samsung’s 2nm process marking a shift from TSMC for Meta’s latest in house AI accelerator.

",meta is reportedly considering a collaboration with samsung to produce custom artificial intelligence chips valued at trillion korean won billion this potential partnership aims to enhance meta s ai capabilities by leveraging samsung s semiconductor manufacturing expertise the move underscores meta s commitment to advancing its ai infrastructure the chips would be built on samsung s nm process marking a shift from tsmc for meta s latest in house ai accelerator,0.9062,positive
2026-07-03 08:01:31+00:00,Maybe I should check out that sport,maybe i should check out that sport,0.0,neutral
2026-07-03 07:30:44+00:00,,nan,0.0,neutral
2026-07-03 05:48:14+00:00,"I bought the wrong dip this morning, can’t believe it was $487 just 2 days ago",i bought the wrong dip this morning can t believe it was just days ago,-0.4767,negative
2026-07-03 04:37:09+00:00,"In 2018 I traded my way from 0 to 150k CAD (using my student loans). Then lost all of it shorting TLRY. In 2025 I traded my way from 0 to \\\~$2 million CAD (using line of credits). Then I lost 95% of it trying to long MSTR. I’m currently on a recovery, this one being over the last 2 weeks. My post history has been made public so you can see all the YOLOs. Note: the screenshots only include my WealthSimple account. ",in i traded my way from to k cad using my student loans then lost all of it shorting tlry in i traded my way from to million cad using line of credits then i lost of it trying to long mstr i m currently on a recovery this one being over the last weeks my post history has been made public so you can see all the yolos note the screenshots only include my wealthsimple account,-0.2732,negative
2026-07-03 03:54:08+00:00,,nan,0.0,neutral
