created_utc,body,clean_body,body_sentiment,body_label
2026-05-16 11:44:52+00:00,,nan,0.0,neutral
2026-05-16 11:21:04+00:00,,nan,0.0,neutral
2026-05-16 08:10:47+00:00,,nan,0.0,neutral
2026-05-16 03:57:22+00:00,"https://preview.redd.it/gxqzkti3af1h1.png?width=806&format=png&auto=webp&s=73e8d88633b68b171fb8ac522417b134b823303c

I felt like a loser; I wasn’t even shorting the market.",i felt like a loser i wasn t even shorting the market,-0.2263,negative
2026-05-15 23:46:13+00:00,SpaceX said to plan public IPO filing as soon as Wednesday  $SPCX,spacex said to plan public ipo filing as soon as wednesday spcx,0.0,neutral
2026-05-15 23:10:06+00:00,"Interesting mix of stocks. No ASTS, NBIS, RKLB? What do you all think? ",interesting mix of stocks no asts nbis rklb what do you all think,0.128,positive
2026-05-15 21:01:44+00:00,Farewell to the Chair!,farewell to the chair,0.0,neutral
2026-05-15 20:33:16+00:00,,nan,0.0,neutral
2026-05-15 20:22:07+00:00,,nan,0.0,neutral
2026-05-15 20:08:25+00:00,,nan,0.0,neutral
2026-05-15 19:19:19+00:00,,nan,0.0,neutral
2026-05-15 17:50:48+00:00,"https://preview.redd.it/zo0x6qu69c1h1.jpg?width=938&format=pjpg&auto=webp&s=093e34ae7aa0c162cd235fbbadb53eedd26dbe24

started watching this stock on april 24th and bought 10 shares for a degenerate post on WSB - thanks to that guy, i should have YOLO'd a FULL PORT at the time but didnt have the balls like him. when i saw earnings report was yesterday i said fuck it and went all in for a quick gain. Happy Friday y'all. and the rich get richer.

for those of you about to say must be nice to have mom and dads money, see my previous [RYCEY YOLO GAINS](https://www.reddit.com/r/wallstreetbets/comments/1s2gfry/2019_to_2026_investing_196785827_in_realized/?utm_source=share&utm_medium=web3x&utm_name=web3xcss&utm_term=1&utm_content=share_button) from 2 months ago. ive been sitting on cash since then and got fomo from all the gains porn ive been seeing so went in for a quick flip.

those who will ask why i didnt do options - i have a gambling addiction so i cancelled my ability to do options or have margin in my brokerage account to prevent me from being a true regard.",started watching this stock on april th and bought shares for a degenerate post on wsb thanks to that guy i should have yolo d a full port at the time but didnt have the balls like him when i saw earnings report was yesterday i said fuck it and went all in for a quick gain happy friday y all and the rich get richer for those of you about to say must be nice to have mom and dads money see my previous rycey yolo gains from months ago ive been sitting on cash since then and got fomo from all the gains porn ive been seeing so went in for a quick flip those who will ask why i didnt do options i have a gambling addiction so i cancelled my ability to do options or have margin in my brokerage account to prevent me from being a true regard,0.9899,positive
2026-05-15 16:40:21+00:00,"https://preview.redd.it/g13a6vhdxb1h1.png?width=1434&format=png&auto=webp&s=30501d6d8ab21bb32b821aeeac59a623a535228e

Fuck this shit, its only going down from here.

Selling all my stocks and deleting the app.

See you next year boys.",fuck this shit its only going down from here selling all my stocks and deleting the app see you next year boys,-0.7964,negative
2026-05-15 16:19:44+00:00,,nan,0.0,neutral
2026-05-15 14:12:35+00:00,,nan,0.0,neutral
2026-05-15 13:44:31+00:00,,nan,0.0,neutral
2026-05-15 12:40:42+00:00,,nan,0.0,neutral
2026-05-15 12:27:21+00:00,Everytime i see you guys i think i can do the same. My heart sank trying out my 1st full port 0dte spy call. This was on may 1 and the markets were going up… how do i still lose money :(( i ended up losing a lot more that day but this trade was my all time worst,everytime i see you guys i think i can do the same my heart sank trying out my st full port dte spy call this was on may and the markets were going up how do i still lose money i ended up losing a lot more that day but this trade was my all time worst,-0.8519,negative
2026-05-15 09:14:49+00:00,Chinese Amazon just got a PUMP!,chinese amazon just got a pump,0.1779,positive
2026-05-15 07:10:37+00:00,,nan,0.0,neutral
2026-05-15 05:52:22+00:00,"Pray, had a dream of a plane crash landing safely in water, when POET was like $10 a few days back I saw a comment by a user called swimming plane that said POET to $20, took it as a sign, worked out well 

Comments and ban bet to prove it

Going to see if I can turn the initial $500 or so into $100,000 with this methodology 🙏",pray had a dream of a plane crash landing safely in water when poet was like a few days back i saw a comment by a user called swimming plane that said poet to took it as a sign worked out well comments and ban bet to prove it going to see if i can turn the initial or so into with this methodology,0.5859,positive
2026-05-14 23:59:51+00:00,"Figma reported today and beat eps by 66% (0.10 vs 0.06) beat revenue by 6% (333.5mil vs 315) 46% yoy growth. Increased revenue guidance 4% (projecting 35% yoy growth) and increased operating income guidance by 25%. They’re currently up 13% after hours after getting crushed -46% ytd with all the scare around claude design and google stitch. Are we seeing the first signs that the scare was overblown and it’s no so easy to just copy cat someone else’s product? 

Crowsdstrike is already back to ath after being down 37% a couple months ago. 

Salesforce reports later this month down 34% ytd, expectations are low, the opportunity seems primed for a good beat to change the narrative around software.

Semis are crowded, is software back on the menu?

Poor person positions: 

14 shares crwd, 21 shares crm, 1 crm $165C 1/21/28",figma reported today and beat eps by vs beat revenue by mil vs yoy growth increased revenue guidance projecting yoy growth and increased operating income guidance by they re currently up after hours after getting crushed ytd with all the scare around claude design and google stitch are we seeing the first signs that the scare was overblown and it s no so easy to just copy cat someone else s product crowsdstrike is already back to ath after being down a couple months ago salesforce reports later this month down ytd expectations are low the opportunity seems primed for a good beat to change the narrative around software semis are crowded is software back on the menu poor person positions shares crwd shares crm crm c,0.685,positive
2026-05-14 23:23:51+00:00,,nan,0.0,neutral
2026-05-14 22:21:14+00:00,,nan,0.0,neutral
2026-05-14 20:52:06+00:00,"In Dec peak I was at 1.3 M , but after the stella Reddit Q4 earnings that tanked the stock 40% my port dipped hard to 440k

Made it all back 1.25 m today with 10k shares RkLB at $4.71 cost basis ( sold 25% today) and lots of 0DTE spx spread.

Don’t give up and keep on fighting. This is life changing money so going to scale back my trading .",in dec peak i was at m but after the stella reddit q earnings that tanked the stock my port dipped hard to k made it all back m today with k shares rklb at cost basis sold today and lots of dte spx spread don t give up and keep on fighting this is life changing money so going to scale back my trading,-0.2617,negative
2026-05-14 20:27:43+00:00,,nan,0.0,neutral
2026-05-14 19:57:10+00:00,This post contains content not supported on old Reddit. [Click here to view the full post](https://sh.reddit.com/r/wallstreetbets/comments/1td9dup),this post contains content not supported on old reddit click here to view the full post,-0.2411,negative
2026-05-14 19:15:20+00:00,,nan,0.0,neutral
2026-05-14 17:55:59+00:00,"Everyone is looking for the next big downstream impact of AI after energy, memory, chips etc. I’m betting it will be batteries/electricity to handle ebbs and flows of demand. Wins over the last 3 months - Google leaps, NBIS stock, Apple leaps. Loss trade was only the one - Snapchat into earnings.

EDIT: Got into Ford yesterday at 13.5 - so I didn’t see it coming. Just believe in it for a quick jump at the very least and I don’t think it’s gone up enough yet.

EDIT 2: Yes, two different fidelity accounts, one is a Roth IRA and one is normal.",everyone is looking for the next big downstream impact of ai after energy memory chips etc i m betting it will be batteries electricity to handle ebbs and flows of demand wins over the last months google leaps nbis stock apple leaps loss trade was only the one snapchat into earnings edit got into ford yesterday at so i didn t see it coming just believe in it for a quick jump at the very least and i don t think it s gone up enough yet edit yes two different fidelity accounts one is a roth ira and one is normal,0.6908,positive
2026-05-14 17:33:39+00:00,,nan,0.0,neutral
2026-05-14 17:32:57+00:00,"Bought these as a levered directional play for the earnings run up, closed all today. May buy a few options to actually play earnings too. Probably my best trades return % wise ever ",bought these as a levered directional play for the earnings run up closed all today may buy a few options to actually play earnings too probably my best trades return wise ever,0.9022,positive
2026-05-14 16:21:24+00:00,"Upstart could 4x in a matter of weeks

If momentum gets going, UPST could be 100 within a week from the naked shorting crowdedness.

The intrinsic value of this company is around $50 yet trades at $28. Current and former ceo have bought over 10 million in shares altogether, despite their net worths being 100% upstart essentially already. The former ceo bought last week at 31, current ceo DOUBLED down and bought even more 1.5 million yesterday at $27.5 (bought 4m at 39.33 before). Thats 40x what Anthony noto is buying from SoFi in comparison.

Guidance is 35% CAGR for 3 years straight with 25% ebitda. The company will literally print money as an automated AI loan marketplace using other’s capital. They get all the reward with none of the risk from lending by routing loans to others balance sheets using AI. On top of that, they’ll be opening Upstart bank in a year to further reduce their operational costs. There’s only 1000 employees, mostly engineers, so they’ll be swimming in money. Forward agreements provide locked in capital and they’ve raised 4B and gotten renewed and raised partner capital agreements. Their guidance and bank operations makes this a $300 stock in a few years. At minimum I see this company at $10B next year as the first AI bank (SOFI is 20B).

There’s only 100 million shares, and the stock appears to be a top 10 shorted stock with 75% utilization on IBKR and only 420k shares left to short. The stock appears to be one of the most naked shorted names in the entire market. In the past 2 years the stock has bounced up to $95 about 6 different times.

If momentum catches this stock, this could easily be gamma hedged over $100 in a few trading sessions from low float, almost 0 shares to borrow, cheap share price and calls.

TLDR: the stock has great fundamentals and projections, yet is getting crushed by short sellers atm. Stock could 10x in a few years from fundamentals alone, but shorts are beyond greedy.

Position: 4700 shares 10x 30 calls expiring next week. 3 30 C 2028 leaps

Update: What does upstart do? Upstart goes UP! +10% day  
Day 2: From down 4% in morning to blasting +2% in afternoon!? Shorts doubled down with shares shortable from 800k to 400k. But 100+ is inevitable. Shorts are trapped. ",upstart could x in a matter of weeks if momentum gets going upst could be within a week from the naked shorting crowdedness the intrinsic value of this company is around yet trades at current and former ceo have bought over million in shares altogether despite their net worths being upstart essentially already the former ceo bought last week at current ceo doubled down and bought even more million yesterday at bought m at before thats x what anthony noto is buying from sofi in comparison guidance is cagr for years straight with ebitda the company will literally print money as an automated ai loan marketplace using other s capital they get all the reward with none of the risk from lending by routing loans to others balance sheets using ai on top of that they ll be opening upstart bank in a year to further reduce their operational costs there s only employees mostly engineers so they ll be swimming in money forward agreements provide locked in capital and they ve raised b and gotten renewed and raised partner capital agreements their guidance and bank operations makes this a stock in a few years at minimum i see this company at b next year as the first ai bank sofi is b there s only million shares and the stock appears to be a top shorted stock with utilization on ibkr and only k shares left to short the stock appears to be one of the most naked shorted names in the entire market in the past years the stock has bounced up to about different times if momentum catches this stock this could easily be gamma hedged over in a few trading sessions from low float almost shares to borrow cheap share price and calls tldr the stock has great fundamentals and projections yet is getting crushed by short sellers atm stock could x in a few years from fundamentals alone but shorts are beyond greedy position shares x calls expiring next week c leaps update what does upstart do upstart goes up day day from down in morning to blasting in afternoon shorts doubled down with shares shortable from k to k but is inevitable shorts are trapped,0.8484,positive
2026-05-14 13:47:09+00:00,"Thought this move was genius, but it was in fact retarded. ",thought this move was genius but it was in fact retarded,-0.7227,negative
