created_utc,body,clean_body,body_sentiment,body_label
2026-07-02 16:05:20+00:00,"Hey everyone,

Sitting here looking at Reddit’s current market cap (hovering around \*\*$37B–$38B\*\* at \~$196/share), and after that massive Q1 earnings report (revenue up 69% YoY), I started running some math on what it actually takes for RDDT to scale into a mega-cap tech giant. (Leveraging AI to pull some data)

Going from $38B to \*\*$300B\*\* sounds crazy—it’s roughly an 8x from here. For context, Meta is north of $1.2T, while Snap and Pinterest are sitting in the $20B–$40B dugout. But if you look under the hood, Reddit doesn't need to beat Facebook to become a $300B company; it just needs to actually monetize what it already has.

Here is the structural bull case for how RDDT gets there:

1. The Insane ARPU Gap (Our biggest flaw is the biggest upside)

Right now, Reddit’s Average Revenue Per User (ARPU) is criminally low—hovering around \*\*$5.23 globally\*\*. For comparison, Meta pulls in $45–$50 globally (and well over $200 in the US/Canada).  
We user-sort ourselves into hyper-specific, high-intent communities (think r/PersonalFinanceCanada, r/HomeImprovement, r/ElectricVehicles). Advertisers don't need invasive tracking cookies to find out what we want; we are literally shouting it out in the subreddits we join. If Reddit closes even half the ARPU gap with Meta through better ad tech, the core business scales to a $15B+ annual run rate easily.

 2. The AI Data-Licensing Moat

Unlike platforms dominated by 10-second video loops or private DMs, Reddit is a 20-year, structured, text-heavy archive of real human conversation. It turns out, this is the exact premium fuel Large Language Models need.  
With Google and OpenAI already paying for data licensing, analysts are projecting this could scale to \*\*$550M+ annually\*\*. Because data licensing has virtually zero incremental delivery cost, these revenues operate at \*\*90%+ gross margins\*\*. This means Reddit gets valued like a SaaS enterprise software company, not just a social media app.

3. Turning into a High-Intent Search Engine

We all know the meme: Google search is so broken by SEO spam that everyone just appends ""Reddit"" to their queries to find real human answers.

Reddit is actively building out its own native on-platform search and intent-matching. If they successfully intercept that traffic \*on the app\*, they transition from cheap ""feed ads"" to high-converting \*\*search intent ads\*\* (similar to Google or Amazon sponsored products), which command massive Cost Per Click (CPC) premiums.

4. Wild Operating Leverage

Reddit’s corporate structure is built to scale revenue way faster than expenses. Their content is completely user-generated and community-moderated. Last quarter, they showed \~70% YoY revenue growth with a \~40% Adjusted EBITDA margin. Once fixed overhead is covered, almost every single new dollar of revenue flows straight to the bottom line.

**The Math to $300B**

To command a $300B valuation at a mature tech multiple of \*\*25x–30x Free Cash Flow (FCF)\*\*, Reddit needs to net about \*\*$10B to $12B in annual free cash flow\*\*.

If they hit \*\*$15B in total revenue\*\* by the early 2030s—driven by a normalized $15–$20 global ARPU, scaled AI licensing data fees, and a real search ad product—the path to $300B is mathematically totally viable.

Obviously, the risks are real (user backlash to monetization, keeping mods happy, execution risk on their ad tech), but from a pure business architecture standpoint, the runway is massive.

What do you guys think? Is the market still underestimating the data moat, or is an 8x from here pure hopium?",hey everyone sitting here looking at reddit s current market cap hovering around b b at share and after that massive q earnings report revenue up yoy i started running some math on what it actually takes for rddt to scale into a mega cap tech giant leveraging ai to pull some data going from b to b sounds crazy it s roughly an x from here for context meta is north of t while snap and pinterest are sitting in the b b dugout but if you look under the hood reddit doesn t need to beat facebook to become a b company it just needs to actually monetize what it already has here is the structural bull case for how rddt gets there the insane arpu gap our biggest flaw is the biggest upside right now reddit s average revenue per user arpu is criminally low hovering around globally for comparison meta pulls in globally and well over in the us canada we user sort ourselves into hyper specific high intent communities think r personalfinancecanada r homeimprovement r electricvehicles advertisers don t need invasive tracking cookies to find out what we want we are literally shouting it out in the subreddits we join if reddit closes even half the arpu gap with meta through better ad tech the core business scales to a b annual run rate easily the ai data licensing moat unlike platforms dominated by second video loops or private dms reddit is a year structured text heavy archive of real human conversation it turns out this is the exact premium fuel large language models need with google and openai already paying for data licensing analysts are projecting this could scale to m annually because data licensing has virtually zero incremental delivery cost these revenues operate at gross margins this means reddit gets valued like a saas enterprise software company not just a social media app turning into a high intent search engine we all know the meme google search is so broken by seo spam that everyone just appends reddit to their queries to find real human answers reddit is actively building out its own native on platform search and intent matching if they successfully intercept that traffic on the app they transition from cheap feed ads to high converting search intent ads similar to google or amazon sponsored products which command massive cost per click cpc premiums wild operating leverage reddit s corporate structure is built to scale revenue way faster than expenses their content is completely user generated and community moderated last quarter they showed yoy revenue growth with a adjusted ebitda margin once fixed overhead is covered almost every single new dollar of revenue flows straight to the bottom line the math to b to command a b valuation at a mature tech multiple of x x free cash flow fcf reddit needs to net about b to b in annual free cash flow if they hit b in total revenue by the early s driven by a normalized global arpu scaled ai licensing data fees and a real search ad product the path to b is mathematically totally viable obviously the risks are real user backlash to monetization keeping mods happy execution risk on their ad tech but from a pure business architecture standpoint the runway is massive what do you guys think is the market still underestimating the data moat or is an x from here pure hopium,0.982,positive
2026-07-02 16:05:00+00:00,"Vertical Call for 10 contracts $65/$300 for $24k exp Jan 2027.

Go baby go! ",vertical call for contracts for k exp jan go baby go,0.0,neutral
2026-07-02 15:52:57+00:00,,nan,0.0,neutral
2026-07-02 15:43:34+00:00,They are $40 a piece now 🫠 (Would've been another 30k e.e),they are a piece now would ve been another k e e,0.0,neutral
2026-07-02 15:16:14+00:00,No DD just vibes,no dd just vibes,-0.296,negative
2026-07-02 14:34:07+00:00,"Still like the stock, but it stung that I didn't take enough profit last time. I have shares on my original shitty brokerage (Wealthfront) I got cheap and I'll never sell, but I plan on buying back in when I feel it's time. Take profits regards ",still like the stock but it stung that i didn t take enough profit last time i have shares on my original shitty brokerage wealthfront i got cheap and i ll never sell but i plan on buying back in when i feel it s time take profits regards,0.8519,positive
2026-07-02 13:29:31+00:00,,nan,0.0,neutral
2026-07-02 12:45:11+00:00,"The US economy added 57,000 jobs last month, **fewer than economists had anticipated**, government data shows. The unemployment rate dipped slightly to 4.2%.

Economists surveyed by Bloomberg had expected the Labor Department's employment situation report to post a gain of 113,000 jobs at the year's midway point, with the unemployment rate remaining flat at 4.3% for the fourth consecutive month, after a string of better-than-predicted data releases.",the us economy added jobs last month fewer than economists had anticipated government data shows the unemployment rate dipped slightly to economists surveyed by bloomberg had expected the labor department s employment situation report to post a gain of jobs at the year s midway point with the unemployment rate remaining flat at for the fourth consecutive month after a string of better than predicted data releases,0.128,positive
2026-07-02 12:19:08+00:00,had conviction yesterday cuz nobody buys teslas but now premarket my balls are shrinking and I’m scared someone meet me behind Wendy’s in case this doesn’t work out ,had conviction yesterday cuz nobody buys teslas but now premarket my balls are shrinking and i m scared someone meet me behind wendy s in case this doesn t work out,-0.5927,negative
2026-07-02 11:42:07+00:00,,nan,0.0,neutral
2026-07-02 10:00:37+00:00,This post contains content not supported on old Reddit. [Click here to view the full post](https://sh.reddit.com/r/wallstreetbets/comments/1uldy3c),this post contains content not supported on old reddit click here to view the full post,-0.2411,negative
2026-07-02 09:50:43+00:00,"**From Bloomberg:** [https://www.bloomberg.com/news/articles/2026-07-01/south-korean-banks-expand-trading-floors-for-24-hour-won-market](https://www.bloomberg.com/news/articles/2026-07-01/south-korean-banks-expand-trading-floors-for-24-hour-won-market)



South Korea’s biggest lenders are boosting trading desks in London and Seoul to prepare for the won’s round-the-clock trading starting next week.

Woori Bank dispatched eight staff to its London office, including five traders in its foreign-exchange, derivatives and bond desks ahead of securing UK regulatory approval in May, Kang Ju Hwan, manager at the bank’s public relations department said.

Hana Bank has added three dealers in Seoul and introduced a three-shift rotation to provide 24-hour market coverage, Jung Hyun-seok, senior manager of the bank’s public relations department said. Shinhan Bank and KB Kookmin Bank are also expanding headcount and upgrading systems, spokespeople for the two banks said.

**From July 6, the dollar-won spot market will trade continuously from 6 a.m. Monday to 6 a.m. Saturday during New York daylight savings time, from the current 9 a.m. to 2 a.m. schedule.** The move comes at a time when the won is hovering close to its lowest level since 2009. The slide this year prompted the government to take strong measures, including crack down on speculative foreign-exchange trading last month.

The overhaul is the centerpiece of Seoul’s years-long push to improve foreign investors’ access to local markets and bolster its case for an upgrade to MSCI Inc.’s developed-market index, where accessibility has long been a stumbling block.

The immediate challenge for the banks includes keeping desks staffed overnight when liquidity thins and major US data lands while Seoul is asleep. Their approaches diverge between building out London hubs and reinforcing Seoul.

Woori Bank’s license to conduct client derivatives business and securities investment operations will allow it to support won-related investments and hedging outside Korean market hours. Its new trading center in London, established through the expansion of its former branch office, also opened in June.

Shinhan Bank will add one more FX dealer in London from the current two in July as it plans to establish a London desk-centered response framework, Lee Ji Min, a manager at the bank’s public relations department, said. Kookmin Bank has recently completed internal IT upgrades to run 24 hours, and is also planning to expand headcount, Park Junhwan, head of the bank’s brand & PR department said.",from bloomberg south korea s biggest lenders are boosting trading desks in london and seoul to prepare for the won s round the clock trading starting next week woori bank dispatched eight staff to its london office including five traders in its foreign exchange derivatives and bond desks ahead of securing uk regulatory approval in may kang ju hwan manager at the bank s public relations department said hana bank has added three dealers in seoul and introduced a three shift rotation to provide hour market coverage jung hyun seok senior manager of the bank s public relations department said shinhan bank and kb kookmin bank are also expanding headcount and upgrading systems spokespeople for the two banks said from july the dollar won spot market will trade continuously from a m monday to a m saturday during new york daylight savings time from the current a m to a m schedule the move comes at a time when the won is hovering close to its lowest level since the slide this year prompted the government to take strong measures including crack down on speculative foreign exchange trading last month the overhaul is the centerpiece of seoul s years long push to improve foreign investors access to local markets and bolster its case for an upgrade to msci inc s developed market index where accessibility has long been a stumbling block the immediate challenge for the banks includes keeping desks staffed overnight when liquidity thins and major us data lands while seoul is asleep their approaches diverge between building out london hubs and reinforcing seoul woori bank s license to conduct client derivatives business and securities investment operations will allow it to support won related investments and hedging outside korean market hours its new trading center in london established through the expansion of its former branch office also opened in june shinhan bank will add one more fx dealer in london from the current two in july as it plans to establish a london desk centered response framework lee ji min a manager at the bank s public relations department said kookmin bank has recently completed internal it upgrades to run hours and is also planning to expand headcount park junhwan head of the bank s brand pr department said,0.985,positive
2026-07-02 09:48:43+00:00,,nan,0.0,neutral
2026-07-02 09:00:06+00:00,,nan,0.0,neutral
2026-07-02 08:00:01+00:00,"My thesis is very simple.

1. LLM models will become more and more efficient - needing less and less compute, memory and network requirements. 
2. LLM models will also become narrow and deep in their context - reinforcing the low need for hardware resources even further.
3. LLM models will start getting deployed locally with a small condensed data set - and would ping the external network less - only when the embedded local data happens to not have any information relevant to the question

Most of the above is happening already so may be i just woke up from a deep slumber.

This would mean the compute demand will actually fall - reducing the capex for all ai provider hyperscalers ie google/aws/azure and dropping the demand on nebius/coreweave/applied digital. 

This would cause hyperscaler stocks to go up and dc hardware/infra  provider stocks to go down.

Or i am totally wrong and LLM models will just expand infinitely to fill up as much compute as provided to them.   ",my thesis is very simple llm models will become more and more efficient needing less and less compute memory and network requirements llm models will also become narrow and deep in their context reinforcing the low need for hardware resources even further llm models will start getting deployed locally with a small condensed data set and would ping the external network less only when the embedded local data happens to not have any information relevant to the question most of the above is happening already so may be i just woke up from a deep slumber this would mean the compute demand will actually fall reducing the capex for all ai provider hyperscalers ie google aws azure and dropping the demand on nebius coreweave applied digital this would cause hyperscaler stocks to go up and dc hardware infra provider stocks to go down or i am totally wrong and llm models will just expand infinitely to fill up as much compute as provided to them,-0.2111,negative
2026-07-02 07:56:00+00:00,"MSFT earnings less than a month out. Prediction that it will run up to 462 just before earnings. Microsoft will post record earnings for another quarter. It will proceed to crash back down to 350 or lower.

Source: my ass. I’m holding 160 shares at 460 so it’s definitely gonna fuck me.",msft earnings less than a month out prediction that it will run up to just before earnings microsoft will post record earnings for another quarter it will proceed to crash back down to or lower source my ass i m holding shares at so it s definitely gonna fuck me,-0.7732,negative
2026-07-02 07:12:01+00:00,"If you dump in the middle of the day they circuit breaker you. 

If dump right up to close who cares if you get circuit broken if you’re already on your way to the company drinking place.",if you dump in the middle of the day they circuit breaker you if dump right up to close who cares if you get circuit broken if you re already on your way to the company drinking place,-0.6486,negative
2026-07-02 04:42:35+00:00,"Posted tonight - 7/1/2026

# NVIDIA Unlocks AI Compute at Scale, Inviting Partners to Power the AI Infrastructure Buildout

NVIDIA is partnering with AI clouds to deploy large‑scale, multi‑tenant AI factories, aligning economics through a revenue-sharing and credit-support model.

As AI moves from model development to production inference, compute demand is accelerating and shifting toward continuously operating AI factories that generate tokens at scale. This shift requires access to large‑scale, multi‑tenant accelerated computing that can come online quickly, stay highly utilized and support the economics of token‑scale AI services. 

Emerging AI companies historically have had limited access to capital-intensive infrastructure, with even long-term commitments insufficient to unlock financing for compute.

To address this, NVIDIA is introducing a new business model that opens up compute access to the fast‑growing AI ecosystem of startups, model builders, enterprises, research organizations and regional AI players. 

This new model enables AI clouds to procure NVIDIA infrastructure for AI-native, enterprise and ISV customers through economic alignment with a revenue-sharing and credit-support model. Through the partnership, AI clouds will sell NVIDIA-powered cloud services, with NVIDIA earning both standard product revenue and a share of the cloud revenue on the supported capacity. This structure accelerates adoption of NVIDIA platforms among the high-growth, high-conviction AI native sector, and provides NVIDIA with a recurring, usage-linked earnings stream.

For model builders, inference providers, agent platforms and enterprises scaling AI, it can mean faster access to full-stack accelerated computing without waiting through site selection, power procurement, construction and hardware bring-up.

# NVIDIA AI Factory Capacity Built Around Demand

The initiative is already taking shape, with AI cloud companies building D.S.X. AI factories designed to serve customers and workloads across regions. 

Sharon AI and Firmus are among the first companies to work with NVIDIA on this new business model. 

Sharon AI is deploying up to 40,000 NVIDIA Grace Blackwell GB300 GPUs.

“This strategic collaboration with NVIDIA marks a pivotal moment in Sharon AI’s mission to deliver sovereign, large-scale AI compute infrastructure,” said James Manning, cofounder and CEO of Sharon AI. 

Firmus is building a D.S.X. AI factory campus in Batam, Indonesia. The campus is expected to scale to 360 megawatts and up to 170,000 NVIDIA GPUs.

“AI-native companies need access to scalable, energy- and cost-efficient compute infrastructure to compete globally,” said Tim Rosenfield, co-CEO of Firmus Technologies. “Firmus AI cloud is building a NVIDIA D.S.X.-aligned AI factory, which will enable our cloud to help more customers access the compute they need to build and scale AI.”

AI natives such as Baseten, Fireworks AI and Together AI show where compute demand is headed: they need immediate access to AI cloud capacity to run model training, post-training, fine-tuning and high-volume agentic inference for developers, digital natives and enterprises building with AI.

Their customers need reliable access to large-scale NVIDIA accelerated computing as usage grows, but they also need commercial flexibility as products move from pilot to production. 

*To secure compute capacity and build and deploy AI models, contact Sharon AI and Firmus.* 

[https://blogs.nvidia.com/blog/nvidia-unlocks-ai-compute-at-scale-capital-partners-to-power-ai-infrastructure-buildout/](https://blogs.nvidia.com/blog/nvidia-unlocks-ai-compute-at-scale-capital-partners-to-power-ai-infrastructure-buildout/)",posted tonight nvidia unlocks ai compute at scale inviting partners to power the ai infrastructure buildout nvidia is partnering with ai clouds to deploy large scale multi tenant ai factories aligning economics through a revenue sharing and credit support model as ai moves from model development to production inference compute demand is accelerating and shifting toward continuously operating ai factories that generate tokens at scale this shift requires access to large scale multi tenant accelerated computing that can come online quickly stay highly utilized and support the economics of token scale ai services emerging ai companies historically have had limited access to capital intensive infrastructure with even long term commitments insufficient to unlock financing for compute to address this nvidia is introducing a new business model that opens up compute access to the fast growing ai ecosystem of startups model builders enterprises research organizations and regional ai players this new model enables ai clouds to procure nvidia infrastructure for ai native enterprise and isv customers through economic alignment with a revenue sharing and credit support model through the partnership ai clouds will sell nvidia powered cloud services with nvidia earning both standard product revenue and a share of the cloud revenue on the supported capacity this structure accelerates adoption of nvidia platforms among the high growth high conviction ai native sector and provides nvidia with a recurring usage linked earnings stream for model builders inference providers agent platforms and enterprises scaling ai it can mean faster access to full stack accelerated computing without waiting through site selection power procurement construction and hardware bring up nvidia ai factory capacity built around demand the initiative is already taking shape with ai cloud companies building d s x ai factories designed to serve customers and workloads across regions sharon ai and firmus are among the first companies to work with nvidia on this new business model sharon ai is deploying up to nvidia grace blackwell gb gpus this strategic collaboration with nvidia marks a pivotal moment in sharon ai s mission to deliver sovereign large scale ai compute infrastructure said james manning cofounder and ceo of sharon ai firmus is building a d s x ai factory campus in batam indonesia the campus is expected to scale to megawatts and up to nvidia gpus ai native companies need access to scalable energy and cost efficient compute infrastructure to compete globally said tim rosenfield co ceo of firmus technologies firmus ai cloud is building a nvidia d s x aligned ai factory which will enable our cloud to help more customers access the compute they need to build and scale ai ai natives such as baseten fireworks ai and together ai show where compute demand is headed they need immediate access to ai cloud capacity to run model training post training fine tuning and high volume agentic inference for developers digital natives and enterprises building with ai their customers need reliable access to large scale nvidia accelerated computing as usage grows but they also need commercial flexibility as products move from pilot to production to secure compute capacity and build and deploy ai models contact sharon ai and firmus,0.9714,positive
2026-07-02 04:36:30+00:00,I had 10 of these in 3 different accounts.  Sold half in all accounts at 520% and sold the remainder these yesterday at the spike up.  I can eat for another month.  Total gain of 120k. ,i had of these in different accounts sold half in all accounts at and sold the remainder these yesterday at the spike up i can eat for another month total gain of k,0.5267,positive
2026-07-02 01:26:23+00:00,Held from the top in July till now basically. Here's a stock I held for months just like BB and got messed up on.,held from the top in july till now basically here s a stock i held for months just like bb and got messed up on,0.2263,positive
2026-07-02 01:21:19+00:00,"Whoopsie doodle, I thought the lead up to SPCX IPO would help recover RKLB back to 150. Instead it just kept falling and I was too regarded to sell.

Am I a pro yet?",whoopsie doodle i thought the lead up to spcx ipo would help recover rklb back to instead it just kept falling and i was too regarded to sell am i a pro yet,0.2732,positive
