created_utc,body,clean_body,body_sentiment,body_label
2026-05-20 23:36:09+00:00,,nan,0.0,neutral
2026-05-20 23:30:07+00:00,"Anthropic is experiencing such explosive growth that it is expected to report its **first-ever operating profit in the second quarter of 2026**, according to internal financial projections reviewed by [The Wall Street Journal](https:).

Anthropic generated **$4.8 billion in revenue in Q1 2026**.

It expects revenue to jump to **$10.9 billion in Q2 2026**, a **130% increase in just one quarter**.

Anthropic is projected to earn **$559 million in operating profit** for the quarter.

This is significant milestones because most AI companies are still losing large amounts of money due to the enormous cost of computing infrastructure.

Much of this growth is being driven by strong enterprise adoption of Anthropic’s Claude AI models, particularly coding and agentic tools that help businesses automate software development and complex workflows.

At the same time, Anthropic’s operating efficiency is improving, with computing costs expected to decline from 71 cents to 56 cents for every dollar of revenue, showing that the company is scaling while becoming more cost-effective.

This performance marks a major turning point for the AI industry, demonstrating that generative AI companies can reach profitability much faster than many investors expected. It also strengthens Anthropic’s position as one of the most formidable competitors to OpenAI and has fueled speculation that the company could soon command a valuation approaching $900 billion, placing it among the most valuable private technology firms in the world.

[Mind-blowing growth is about to propel Anthropic into its first profitable quarter](https://www.msn.com/en-us/news/technology/mind-blowing-growth-is-about-to-propel-anthropic-into-its-first-profitable-quarter/ar-AA23FT6o?ocid=BingNewsSerp)",anthropic is experiencing such explosive growth that it is expected to report its first ever operating profit in the second quarter of according to internal financial projections reviewed by the wall street journal anthropic generated billion in revenue in q it expects revenue to jump to billion in q a increase in just one quarter anthropic is projected to earn million in operating profit for the quarter this is significant milestones because most ai companies are still losing large amounts of money due to the enormous cost of computing infrastructure much of this growth is being driven by strong enterprise adoption of anthropic s claude ai models particularly coding and agentic tools that help businesses automate software development and complex workflows at the same time anthropic s operating efficiency is improving with computing costs expected to decline from cents to cents for every dollar of revenue showing that the company is scaling while becoming more cost effective this performance marks a major turning point for the ai industry demonstrating that generative ai companies can reach profitability much faster than many investors expected it also strengthens anthropic s position as one of the most formidable competitors to openai and has fueled speculation that the company could soon command a valuation approaching billion placing it among the most valuable private technology firms in the world mind blowing growth is about to propel anthropic into its first profitable quarter,0.9893,positive
2026-05-20 23:00:59+00:00,"1,000 Barrels Brent for July (9 DTE) financially settled.

1,000 Barrels WTI for July (29 DTE) financially settled.

**The thesis is pretty simple:** The conflict is not over.

The market fell this morning after traders decided the conflict was over **for real** this time.

However, the last treaty we negotiated with Iran took 20 months to hash out, and I would be very surprised if we got this one done in 1/5th the time.

**Disclosure**:  I am a retail trader, not a financial advisor or oil professional.

BFLO-Retail",barrels brent for july dte financially settled barrels wti for july dte financially settled the thesis is pretty simple the conflict is not over the market fell this morning after traders decided the conflict was over for real this time however the last treaty we negotiated with iran took months to hash out and i would be very surprised if we got this one done in th the time disclosure i am a retail trader not a financial advisor or oil professional bflo retail,0.2006,positive
2026-05-20 22:41:53+00:00,,nan,0.0,neutral
2026-05-20 22:41:45+00:00,,nan,0.0,neutral
2026-05-20 22:32:52+00:00,https://www.sec.gov/Archives/edgar/data/1181412/000162828026036936/spaceexplorationtechnologi.htm page 258. ,page,0.0,neutral
2026-05-20 22:31:20+00:00,,nan,0.0,neutral
2026-05-20 22:24:12+00:00,Theta and IV a bitch,theta and iv a bitch,-0.5859,negative
2026-05-20 21:08:49+00:00,"Hi God, it’s me again…  
Bull has had major recent catalyst, from ending 1b dilution deal with Yorkshire (one of biggest things that has kept it suppressed), to instead doing a 100m buyback (both of these announced early April) as well as the PDT rule being removed in a few weeks. BULL’s earnings have continued to show major growth consistently, and with the yorkshire deal ended, as well as switching to a buyback, a lot of room to assume profit is swinging up hard, and with PDT it’ll be another huge jump in the future earnings.",hi god it s me again bull has had major recent catalyst from ending b dilution deal with yorkshire one of biggest things that has kept it suppressed to instead doing a m buyback both of these announced early april as well as the pdt rule being removed in a few weeks bull s earnings have continued to show major growth consistently and with the yorkshire deal ended as well as switching to a buyback a lot of room to assume profit is swinging up hard and with pdt it ll be another huge jump in the future earnings,0.8934,positive
2026-05-20 20:54:03+00:00,[https://www.sec.gov/Archives/edgar/data/1181412/000162828026036936/spaceexplorationtechnologi.htm#id286866c4c474ba490d6531a57db9e93\_57](https://www.sec.gov/Archives/edgar/data/1181412/000162828026036936/spaceexplorationtechnologi.htm#id286866c4c474ba490d6531a57db9e93_57),,0.0,neutral
2026-05-20 20:49:59+00:00,At least it's Canadian money so it's not real.,at least it s canadian money so it s not real,0.0,neutral
2026-05-20 20:26:42+00:00,,nan,0.0,neutral
2026-05-20 20:21:24+00:00,"Adjusted EPS $1.87

Revenue $81.62B, est. $79.19B (+20% QoQ,  +85% YoY)

Sees Q2 Revenue $91.0B ±2%, est. $87.36B

Adjusted Gross Margin 75.0%

Sees Q2 Adjusted Gross Margin 74.5%–75.5%

Sees Q2 Adjusted Operating Expenses ~$8.3B, est. $7.93B

Data Center Revenue $75.2B, est. $73.48B (+21% QoQ, +92% YoY)

Edge Computing revenue $6.4B (+10% QoQ, +29% YoY)

Hyperscale revenue ~50% of Data Center revenue

Hyperscale revenue increased sequentially in Q1

Boosts quarterly cash dividend to $0.25/share vs. $0.01/share prior

Reports additional $80B share buyback authorization

Moving to a new reporting framework with two platforms

Q2 revenue outlook topped estimates

No shipments of data center hopper products to China



Press release: https://nvidianews.nvidia.com/news/nvidia-announces-financial-results-for-first-quarter-fiscal-2027

Unrelated: Anthropic expects a 130% revenue surge to $10.9 billion in the June quarter and **its first operating profit** - WSJ.",adjusted eps revenue b est b qoq yoy sees q revenue b est b adjusted gross margin sees q adjusted gross margin sees q adjusted operating expenses b est b data center revenue b est b qoq yoy edge computing revenue b qoq yoy hyperscale revenue of data center revenue hyperscale revenue increased sequentially in q boosts quarterly cash dividend to share vs share prior reports additional b share buyback authorization moving to a new reporting framework with two platforms q revenue outlook topped estimates no shipments of data center hopper products to china press release unrelated anthropic expects a revenue surge to billion in the june quarter and its first operating profit wsj,0.5423,positive
2026-05-20 20:16:46+00:00,,nan,0.0,neutral
2026-05-20 20:09:54+00:00,"A few WSB classics and a few new ones for you regards.  Happy to share thoughts on any of these.  Mix of time in each (MU since Dec, LAM since 2022, RKLB since Oct, DFTX since 2024, etc) but have all performed well.",a few wsb classics and a few new ones for you regards happy to share thoughts on any of these mix of time in each mu since dec lam since rklb since oct dftx since etc but have all performed well,0.6808,positive
2026-05-20 20:03:11+00:00,"https://preview.redd.it/0b77c684mc2h1.jpg?width=1080&format=pjpg&auto=webp&s=bc9086a16bfc61bde27cf714c9e6ae91d6029dcc

Gains hit $21,000, then dropped to $0, then I hit $9,500 today. One big trade and I'll be back to $21,000 or $0.

there is a little voice in my head telling me DONT DO IT, but there is a chance and I know it! ",gains hit then dropped to then i hit today one big trade and i ll be back to or there is a little voice in my head telling me dont do it but there is a chance and i know it,0.4939,positive
2026-05-20 19:59:33+00:00,,nan,0.0,neutral
2026-05-20 19:57:11+00:00,This post contains content not supported on old Reddit. [Click here to view the full post](https://sh.reddit.com/r/wallstreetbets/comments/1tix0yi),this post contains content not supported on old reddit click here to view the full post,-0.2411,negative
2026-05-20 19:17:00+00:00,,nan,0.0,neutral
2026-05-20 18:47:13+00:00,"You may recall I had posted 5 days ago that I am selling all my INTC and getting out.

Well just as I pressed the post button I got a call from my boss about an urgent situation.

Spent the whole day trying to fix that and ended up forgetting about closing my INTC.

Just got a notification that my INTC position is up 5% today and I realized that I never closed my position.

Wow my boss saved me from making regarded moves!

Taking her to lunch at a nice place on Friday, but not going to tell her what happened.

https://preview.redd.it/ulmj2wdp8c2h1.png?width=1416&format=png&auto=webp&s=722f51dd2953c287e1ce98f19d364cbcb3a9a5a5

",you may recall i had posted days ago that i am selling all my intc and getting out well just as i pressed the post button i got a call from my boss about an urgent situation spent the whole day trying to fix that and ended up forgetting about closing my intc just got a notification that my intc position is up today and i realized that i never closed my position wow my boss saved me from making regarded moves taking her to lunch at a nice place on friday but not going to tell her what happened,0.7311,positive
2026-05-20 18:22:15+00:00,I said I would quit but ya know….. I’m full cash now good luck today friends :) ,i said i would quit but ya know i m full cash now good luck today friends,0.9186,positive
2026-05-20 18:09:45+00:00,"Had some cash I was sitting on in case the market went down. You know be smart and hold 30% cash at all times or whatever gay shit.

FIG is just going to keep smashing earnings, and eventually people will realize AI tokens are more expensive than their current software. Return of SaaS. My electrical engineer friend told me all about it, and he’s pretty smart",had some cash i was sitting on in case the market went down you know be smart and hold cash at all times or whatever gay shit fig is just going to keep smashing earnings and eventually people will realize ai tokens are more expensive than their current software return of saas my electrical engineer friend told me all about it and he s pretty smart,0.802,positive
2026-05-20 17:51:53+00:00,,nan,0.0,neutral
2026-05-20 17:27:15+00:00,Hold or buy more? ,hold or buy more,0.0,neutral
2026-05-20 16:27:18+00:00,,nan,0.0,neutral
2026-05-20 15:51:56+00:00,"**Position:** 1900 shares

Alright regards, gather round. While you apes are gambling on $BOT and buying $MU calls at ATHs, I've been quietly stacking META <$600. So listen up if you want to make some money.

**WHY HEDGE FUNDS WON'T BET ON ZUCK (AND WHY YOU SHOULD)**

Here's the part your financial advisor won't tell you because he's busy losing your IRA in covered calls: **Zuck has ABSOLUTE VOTING CONTROL.** He is the only Big Tech CEO who literally cannot be fired. Not Pichai. Not Cook. Not Nadella. Just Zuck and his dual-class share structure.

Hedge funds HATE this. They can't activist-investor him. They can't threaten the board. They can't cry on CNBC about ""shareholder value."" so they underweight the stock. That's why META traded at a huge discount when Zuck was burning cash on the metaverse, remember the stock at $90 and wished you got in?

I'll be real, the metaverse did fail and that's because Zuck is just an autistic lizard king, he's not a visionary that can build new products. 

**BUT he is the GOAT of corporate plagiarism.** This man saw Snapchat Stories in 2016 and cloned it into Instagram Stories so hard that Evan Spiegel is still crying to this day. Then TikTok showed up and started eating everyone's lunch, so Zuck whipped out Reels, jammed it into all his apps and now your aunt watches AI slop for 4 hours a day. Now apply this to AI. OpenAI and Anthropic are out there doing the HARD part: frontier research, RLHF, alignment, figuring out which architectures actually scale. **The race is not won by whoever has the best AI model first. It's won by whoever DISTRIBUTES it to the most humans.**

**THE AI CAPEX TRADE: HEADS I WIN, TAILS YOU REGARDS LOSE**

Capex now $125-145B for 2026. Market shat itself and dropped META 7% AH because big number bad and anyone CAN tweet ""OvErSpEnDiNg.""

**Scenario 1 Meta builds a SOTA model.** They jam it into the ad stack. Existing AI tools already boosted conversion rates 6%. Imagine what frontier-level intelligence does to ad targeting across 3.56B users. Revenue growth doesn't just continue, it ACCELERATES. Print machine goes brrr. it's a brand new business segment overnight.

**Scenario 2 The model is mid but AI Infra is valuable.** Cool. They have $145B of GPUs and data centers. You know what those are worth on the secondary market? Ask $IREN, $NBIS, $CRWV, the companies you regards are buying that are built on RENTING compute. Meta could pivot to being a neocloud and the assets still print. It's like buying Manhattan real estate and worst case you become a landlord. 

There is NO universe where BILLIONS of frontier compute is worthless. The bear case is ""Meta builds a multi-billion dollar infrastructure business on the side."" 

*Not financial advice.*",position shares alright regards gather round while you apes are gambling on bot and buying mu calls at aths i ve been quietly stacking meta so listen up if you want to make some money why hedge funds won t bet on zuck and why you should here s the part your financial advisor won t tell you because he s busy losing your ira in covered calls zuck has absolute voting control he is the only big tech ceo who literally cannot be fired not pichai not cook not nadella just zuck and his dual class share structure hedge funds hate this they can t activist investor him they can t threaten the board they can t cry on cnbc about shareholder value so they underweight the stock that s why meta traded at a huge discount when zuck was burning cash on the metaverse remember the stock at and wished you got in i ll be real the metaverse did fail and that s because zuck is just an autistic lizard king he s not a visionary that can build new products but he is the goat of corporate plagiarism this man saw snapchat stories in and cloned it into instagram stories so hard that evan spiegel is still crying to this day then tiktok showed up and started eating everyone s lunch so zuck whipped out reels jammed it into all his apps and now your aunt watches ai slop for hours a day now apply this to ai openai and anthropic are out there doing the hard part frontier research rlhf alignment figuring out which architectures actually scale the race is not won by whoever has the best ai model first it s won by whoever distributes it to the most humans the ai capex trade heads i win tails you regards lose capex now b for market shat itself and dropped meta ah because big number bad and anyone can tweet overspending scenario meta builds a sota model they jam it into the ad stack existing ai tools already boosted conversion rates imagine what frontier level intelligence does to ad targeting across b users revenue growth doesn t just continue it accelerates print machine goes brrr it s a brand new business segment overnight scenario the model is mid but ai infra is valuable cool they have b of gpus and data centers you know what those are worth on the secondary market ask iren nbis crwv the companies you regards are buying that are built on renting compute meta could pivot to being a neocloud and the assets still print it s like buying manhattan real estate and worst case you become a landlord there is no universe where billions of frontier compute is worthless the bear case is meta builds a multi billion dollar infrastructure business on the side not financial advice,0.966,positive
2026-05-20 15:48:02+00:00,"Calls on RKT is my play. Was down massively on higher yields yesterday, and it's already up 6% today.

  
What's your play, for when a final agreement between the US and Iran is announced?",calls on rkt is my play was down massively on higher yields yesterday and it s already up today what s your play for when a final agreement between the us and iran is announced,0.7906,positive
2026-05-20 15:14:47+00:00,"SLS has been ripping recently because of their REGAL trial ending soon. They got a drug called GPS meant to treat a type of Leukemia. Their trial is at 78 /80 events meaning we're waiting for the last two people to finish the trial. This is gonna be a huge binary event, they a previous Phase 2 CR2 AML trial which showed median overall survival of 16.3 months vs 5.4 months of the control arm. So I reckon the regal trial outta follow the same and perform very well.

  
Either way here are my positions and I'm full port on this. Used to have leaps but as you can see I started buying closer dated positions cuz I'm a greedy pig. Don't ask me about what any of the stats mean or what we're really looking for. Trial ending soon stock goes very up or very down. But probably very up me thinks. If this blows up in my face I'm gonna 9-5 and invest in google or something.

https://preview.redd.it/twkob5xs6b2h1.png?width=1080&format=png&auto=webp&s=ea334fe543a3d28ccc2b67d7fa3083cdf36e872d

",sls has been ripping recently because of their regal trial ending soon they got a drug called gps meant to treat a type of leukemia their trial is at events meaning we re waiting for the last two people to finish the trial this is gonna be a huge binary event they a previous phase cr aml trial which showed median overall survival of months vs months of the control arm so i reckon the regal trial outta follow the same and perform very well either way here are my positions and i m full port on this used to have leaps but as you can see i started buying closer dated positions cuz i m a greedy pig don t ask me about what any of the stats mean or what we re really looking for trial ending soon stock goes very up or very down but probably very up me thinks if this blows up in my face i m gonna and invest in google or something,0.4491,positive
2026-05-20 14:43:02+00:00,"Called this out about a month ago. 

TE was trending upward and trading at around $8-$9 before Trump’s March Madness War. 

At the same time, ya boy had to sell off and realize $10,000 worth of losses on ACHR at -30% or else I would’ve gotten margin called when ACHR dipped another 15% the following week. That shit sucked. 

Anyway, I’m lucky that TE dumped from $8 to $4 over a single weekend because that was a buying opportunity if I ever saw one. 

1) 2000 shares x $4.28    
2) 20 x $5 Call 4/24     
3) 15 x $5 Call 5/15    
4) 10 x $6 Call 6/18    
5) 36 x $5 Call 6/18 

Total Cost: $10,785

My graph has been swinging by 10-15% every other day. I wake up to RobinHood telling me that I blew past my margin maintenance requirement and now at risk of being margin called, just for my shit to recover by market close. 

If I were to put a number on it, I’d say I was at risk of being margin called for maybe 40% of the month? 

Feels good to finally get a conviction play right. Sold most of my position, and now I’m just riding 1000 shares and 20 option contracts with free house money. 

Turned my $10,000 loss into a $20,000+ swing. ",called this out about a month ago te was trending upward and trading at around before trump s march madness war at the same time ya boy had to sell off and realize worth of losses on achr at or else i would ve gotten margin called when achr dipped another the following week that shit sucked anyway i m lucky that te dumped from to over a single weekend because that was a buying opportunity if i ever saw one shares x x call x call x call x call total cost my graph has been swinging by every other day i wake up to robinhood telling me that i blew past my margin maintenance requirement and now at risk of being margin called just for my shit to recover by market close if i were to put a number on it i d say i was at risk of being margin called for maybe of the month feels good to finally get a conviction play right sold most of my position and now i m just riding shares and option contracts with free house money turned my loss into a swing,-0.8442,negative
2026-05-20 14:34:44+00:00,"Today is the classic bullish day that I have been waiting for 0DTE. Attached the proof of 0DTE, but total gains are more than $7500 (multiple 0DTEs trade).

  
Good Luck, Good day to you all !",today is the classic bullish day that i have been waiting for dte attached the proof of dte but total gains are more than multiple dtes trade good luck good day to you all,0.9413,positive
2026-05-20 14:17:05+00:00,,nan,0.0,neutral
2026-05-20 12:19:39+00:00,"Serious question.

Index keeps grinding up, AI narrative everywhere, but when you actually look under the surface, a few mega caps doing all the heavy lifting, everything else either chops or fades.

This doesn’t feel like past cycles where leadership rotated and you had multiple ways to win.

Right now it’s more like, AI runs = capital piles in = everything else lags = repeat Mid caps? inconsistent.

Small caps? mostly noise unless you catch a clean move early.

So yeah, market looks strong but it’s narrow.

I was messing around with GetAgent earlier just to break down sector contribution and scenario outcomes, and it basically reinforced the same thing, if the top names stall, the whole “strength” story starts looking fragile pretty fast.

Not calling a top or anything, just feels like we’re way more dependent on a few names than people want to admit.

So what’s the play here, ride the leaders and ignore everything else or start looking for rotation that hasn’t shown up yet?",serious question index keeps grinding up ai narrative everywhere but when you actually look under the surface a few mega caps doing all the heavy lifting everything else either chops or fades this doesn t feel like past cycles where leadership rotated and you had multiple ways to win right now it s more like ai runs capital piles in everything else lags repeat mid caps inconsistent small caps mostly noise unless you catch a clean move early so yeah market looks strong but it s narrow i was messing around with getagent earlier just to break down sector contribution and scenario outcomes and it basically reinforced the same thing if the top names stall the whole strength story starts looking fragile pretty fast not calling a top or anything just feels like we re way more dependent on a few names than people want to admit so what s the play here ride the leaders and ignore everything else or start looking for rotation that hasn t shown up yet,0.9899,positive
2026-05-20 11:00:38+00:00,This post contains content not supported on old Reddit. [Click here to view the full post](https://sh.reddit.com/r/wallstreetbets/comments/1tii82d),this post contains content not supported on old reddit click here to view the full post,-0.2411,negative
2026-05-20 09:54:35+00:00,All the gains were made by trading 0 dte on SPY and QQQ. Someone give me a play to 10x this in the next 5 years pls,all the gains were made by trading dte on spy and qqq someone give me a play to x this in the next years pls,0.6249,positive
2026-05-20 09:48:30+00:00,,nan,0.0,neutral
