created_utc,body,clean_body,body_sentiment,body_label
2026-05-14 11:00:49+00:00,This post contains content not supported on old Reddit. [Click here to view the full post](https://sh.reddit.com/r/wallstreetbets/comments/1tcupwr),this post contains content not supported on old reddit click here to view the full post,-0.2411,negative
2026-05-14 06:58:03+00:00,"Bought NBIS. Looking to hold for a few years. The bacon is cooking on everything! 

Looks like the green line is going up. Seems good to me. 

What do you guys think? Pump and dump scheme? 

What’s next? Got some nice calls out for ARISTA AND PLTR. ",bought nbis looking to hold for a few years the bacon is cooking on everything looks like the green line is going up seems good to me what do you guys think pump and dump scheme what s next got some nice calls out for arista and pltr,0.6808,positive
2026-05-14 06:12:49+00:00,"🚀🚀🚀

[https://www.reuters.com/business/retail-consumer/us-clears-h200-chip-sales-10-china-firms-nvidia-ceo-looks-breakthrough-2026-05-14/](https://www.reuters.com/business/retail-consumer/us-clears-h200-chip-sales-10-china-firms-nvidia-ceo-looks-breakthrough-2026-05-14/)",,0.0,neutral
2026-05-14 03:57:27+00:00,"From $115 a few days ago, up to $185/share now as of a few hours ago. 20x over-subscribed. 

You going in on the IPO? Thoughts generally?",from a few days ago up to share now as of a few hours ago x over subscribed you going in on the ipo thoughts generally,0.296,positive
2026-05-14 02:14:04+00:00,"I was cleaning out my apartment today and found an old notebook with a login for a fidelity account I made back years ago. Logged in not expecting anything and it made me do 2 factor authentication but couldnt find the app.

Spend over an hour on the phone with fidelity rep and they finally got me logged in. Turns out I bought some NVDA back in 2019 at a crazy low price and didn’t even know I had this. Sitting on massive gain.

Should I hodl or sell ? Don’t really need the money but it’s nice to have. ",i was cleaning out my apartment today and found an old notebook with a login for a fidelity account i made back years ago logged in not expecting anything and it made me do factor authentication but couldnt find the app spend over an hour on the phone with fidelity rep and they finally got me logged in turns out i bought some nvda back in at a crazy low price and didn t even know i had this sitting on massive gain should i hodl or sell don t really need the money but it s nice to have,0.5499,positive
2026-05-14 01:30:43+00:00,"I'm a regarded security guard who makes 18.50 an hour, so hear me out.

Trump is in China meeting Xi, and he brought a bunch of the boiz with him. Apple, Tesla, Nvidia, Boeing, BlackRock, etc.

But the one outlier??? Illumina. $ILMN.

A gene sequencing company with a market cap that looks hilariously tiny next to basically everyone else in that group. Unless I’m missing someone, ILMN looks like the smallest public-company name in the delegation by a mile.

So why the hell is Illumina’s CEO there?

China asked, begged, and pleaded. and Trump was forced to put very minor celebrity ""good guy lex luthor"" (their CEO Jacob Thaysen, who you can see below) on the plane.

[https://youtube.com/shorts/Vz96AX22Pt8](https://youtube.com/shorts/Vz96AX22Pt8)

My idea is basically: In 2025, Illumina got put on China’s Unreliable Entities List. China later eased the outright equipment ban, but ILMN is still stuck on the list, and sales there are still a major unresolved problem for the company.

Now suddenly the CEO is in the room during a Trump/Xi summit where U.S. companies are clearly trying to get China business wins.

Illumina’s official comment was basically corporate-speak about being “honored” to join and “shape the future of precision medicine,” but come on. They are the only life sciences/medtech CEO in the delegation while Big Pharma is nowhere to be found.

Could China have wanted Illumina at the table because removing them from the UEL, or giving them some kind of China relief, could be part of the summit/trade package.

If true $ILMN could absolutely fucking soar.

Why is the CEO of a relatively small gene sequencing company sitting with Trump’s CEO Avengers squad in China right now.

Because Illumina’s China issue is on the menu. They requested them.

Positions: ILMN 160 weeklies, gonna load up on June calls and 2027 leaps tomorrow (I only have $700 invested in this because I'm poor LOL)

  
please regards, don't bet what you can't lose. This is a moonshit.",i m a regarded security guard who makes an hour so hear me out trump is in china meeting xi and he brought a bunch of the boiz with him apple tesla nvidia boeing blackrock etc but the one outlier illumina ilmn a gene sequencing company with a market cap that looks hilariously tiny next to basically everyone else in that group unless i m missing someone ilmn looks like the smallest public company name in the delegation by a mile so why the hell is illumina s ceo there china asked begged and pleaded and trump was forced to put very minor celebrity good guy lex luthor their ceo jacob thaysen who you can see below on the plane my idea is basically in illumina got put on china s unreliable entities list china later eased the outright equipment ban but ilmn is still stuck on the list and sales there are still a major unresolved problem for the company now suddenly the ceo is in the room during a trump xi summit where u s companies are clearly trying to get china business wins illumina s official comment was basically corporate speak about being honored to join and shape the future of precision medicine but come on they are the only life sciences medtech ceo in the delegation while big pharma is nowhere to be found could china have wanted illumina at the table because removing them from the uel or giving them some kind of china relief could be part of the summit trade package if true ilmn could absolutely fucking soar why is the ceo of a relatively small gene sequencing company sitting with trump s ceo avengers squad in china right now because illumina s china issue is on the menu they requested them positions ilmn weeklies gonna load up on june calls and leaps tomorrow i only have invested in this because i m poor lol please regards don t bet what you can t lose this is a moonshit,0.9178,positive
2026-05-14 00:32:31+00:00,,nan,0.0,neutral
2026-05-13 23:43:53+00:00,"I liked my investment a lot when I bought, and it’s still pretty great, but Reddit has me shivering with its posts about the impending crash.

I just bought this for gaming and got super lucky

I could sell but then I owe tens of thousands in taxes ",i liked my investment a lot when i bought and it s still pretty great but reddit has me shivering with its posts about the impending crash i just bought this for gaming and got super lucky i could sell but then i owe tens of thousands in taxes,0.9011,positive
2026-05-13 23:19:56+00:00,"This position started at 290k CAD back in February. I’ve used leverage/margin, I’ve also bought more as the price climbed, increasing my average. I also rolled some options, so total percentage gains are not entirely accurate. 

Just a follow up from my DD. At the time, my position was roughly 650k USD or 890k CAD. 

Basing this off of CAD because I am Canadian. 

Today, my holdings broke passed 806k USD, or 1.1m CAD. 

Price target of $30, and will reassess my position then.",this position started at k cad back in february i ve used leverage margin i ve also bought more as the price climbed increasing my average i also rolled some options so total percentage gains are not entirely accurate just a follow up from my dd at the time my position was roughly k usd or k cad basing this off of cad because i am canadian today my holdings broke passed k usd or m cad price target of and will reassess my position then,-0.0352,neutral
2026-05-13 20:32:24+00:00,,nan,0.0,neutral
2026-05-13 20:03:11+00:00,This is how to go all in. Also processing an ACATS transfer rn to IBKR so I can’t sell or do anything until it’s done,this is how to go all in also processing an acats transfer rn to ibkr so i can t sell or do anything until it s done,0.0,neutral
2026-05-13 19:29:32+00:00,"I bought a ton of different leaps before and after 🥭's tariff adventure, totaling $33k cost basis, ending up worth 1.35M.

This is the best returning specific lot, on a Jan 2027 380C purchased on April 4 last year when GOOGL hit 145. 

Realized about 900k of the gains including the above position to derisk (hurt to do), but holding onto about 500k of the longest dated positions (Dec 2027 365C) as I still strongly believe in the company.

Also because it pisses off people here, putting some of the gains into more GLD LEAP puts because gold is more speculative than BTC at this point.",i bought a ton of different leaps before and after s tariff adventure totaling k cost basis ending up worth m this is the best returning specific lot on a jan c purchased on april last year when googl hit realized about k of the gains including the above position to derisk hurt to do but holding onto about k of the longest dated positions dec c as i still strongly believe in the company also because it pisses off people here putting some of the gains into more gld leap puts because gold is more speculative than btc at this point,0.7839,positive
2026-05-13 19:20:36+00:00,"Buying QQQ puts has been a never ending money pit, so I've decided to jump onboard the AI gravy train.

This can only mean one thing - the bubble will pop tonight and I'll be living in mummys basement forever 

Update: They crushed it! My recklessness might actually pay off for once. All hail our AI overlords 🫪 ",buying qqq puts has been a never ending money pit so i ve decided to jump onboard the ai gravy train this can only mean one thing the bubble will pop tonight and i ll be living in mummys basement forever update they crushed it my recklessness might actually pay off for once all hail our ai overlords,-0.4404,negative
2026-05-13 19:13:16+00:00,Less than 10 trades. Turned 3k to 140k in 3 years. ,less than trades turned k to k in years,0.0,neutral
2026-05-13 19:05:23+00:00,,nan,0.0,neutral
2026-05-13 18:05:47+00:00,entered call yesterday before market opened and still didnt exit yet,entered call yesterday before market opened and still didnt exit yet,0.0,neutral
2026-05-13 17:36:28+00:00,"Mods bubble popped my first post so let me lay out the positions:

NVDA: 300-350k profit bought my first shares in 2016 been in and out since and usually would buy 100k leaps that expire years from the date bought would cash those at around 25k profit

MU, AMD, AMZN, AVGO, HCA, NBIS: Usually on big drops I bought tons of shares of these guys and usually around 10-20k far dated options would either ride them out to 0 or make bank.

QQQ 0DTE has been godly to me easily have made around 50-75k

My biggest gainer by far was Rocket Lab. Had 13,500 shares at like 22 avg during liberation day times but trimmed as it went up to 40 and 50 and completely cashed out right on tax day (I think it was around 70 at the time - feels bad). Have hit massive option plays from previous posts and the rest is history.

This year was so fucking stressful. Godspeed my friends see you all at Wendy’s when it’s back at 0.

Edit: wow this post blew up there’s no way I can reply to all the questions but I love you all and I definitely didn’t sell shit but will be full cash end of day. Think it’s time I wait for the crash and try and kick this nicotine addiction. 🤍🤍🤍🤍",mods bubble popped my first post so let me lay out the positions nvda k profit bought my first shares in been in and out since and usually would buy k leaps that expire years from the date bought would cash those at around k profit mu amd amzn avgo hca nbis usually on big drops i bought tons of shares of these guys and usually around k far dated options would either ride them out to or make bank qqq dte has been godly to me easily have made around k my biggest gainer by far was rocket lab had shares at like avg during liberation day times but trimmed as it went up to and and completely cashed out right on tax day i think it was around at the time feels bad have hit massive option plays from previous posts and the rest is history this year was so fucking stressful godspeed my friends see you all at wendy s when it s back at edit wow this post blew up there s no way i can reply to all the questions but i love you all and i definitely didn t sell shit but will be full cash end of day think it s time i wait for the crash and try and kick this nicotine addiction,0.7931,positive
2026-05-13 16:17:20+00:00,"Ford is pivoting its battery plant to serve utilities, data centers and other businesses. IMO should be a good battery play.

Position: F JAN 15 '27 11.85 Call",ford is pivoting its battery plant to serve utilities data centers and other businesses imo should be a good battery play position f jan call,0.6486,positive
2026-05-13 11:55:33+00:00,,nan,0.0,neutral
2026-05-13 09:56:04+00:00,,nan,0.0,neutral
2026-05-13 09:51:05+00:00,,nan,0.0,neutral
2026-05-13 09:35:53+00:00,,nan,0.0,neutral
2026-05-13 09:16:27+00:00,,nan,0.0,neutral
2026-05-13 03:12:23+00:00,"My fellow Nebtards we meet again

NBIS is the future fourth hyperscaler in the making, execution is unmatched, the talent and track record of management is stellar

Their recent software acquisitions only further prove they are gunning to be the best bar none

Vertically integrated across the whole AI pipeline, they own the compute, they are building out their software stack, they hiring like crazy and they have a jewish israeli ceo

Literally the best investment in the market right now, if youre not buying NBIS you are allergic to making money

If this goes tits up im holding this mf for the long term idgaf, OpenAI and Anthropic IPO later this year will boost the stock price even more

Get in now or get in never",my fellow nebtards we meet again nbis is the future fourth hyperscaler in the making execution is unmatched the talent and track record of management is stellar their recent software acquisitions only further prove they are gunning to be the best bar none vertically integrated across the whole ai pipeline they own the compute they are building out their software stack they hiring like crazy and they have a jewish israeli ceo literally the best investment in the market right now if youre not buying nbis you are allergic to making money if this goes tits up im holding this mf for the long term idgaf openai and anthropic ipo later this year will boost the stock price even more get in now or get in never,0.891,positive
2026-05-13 02:51:12+00:00,"Description is in the title.

https://preview.redd.it/34h7h8gvjt0h1.jpg?width=1170&format=pjpg&auto=webp&s=0f2dd397b8de4914a3881a22267ea5615170de2b

",description is in the title,0.0,neutral
2026-05-13 02:32:02+00:00,,nan,0.0,neutral
2026-05-13 02:00:09+00:00,"Currently only 3 companies make HBM4, the biggest bottleneck of the entire AI build. Samsung, SK, and MU. Samsungs union walked away from talks last night, strike window is set for5/21 to 6/7, 18 days of the worlds biggest memory fab going dark. Once shutdown, tooling recalibration on these lines take WEEKS not days.

SK already sold out their DRAM, NAND, and HBM thru end of 2026 to NVDA. Locked in at contract prices. They get the headline of being #1 HBM but they have nothing left to put on the truck during a spot price spike. MU is in the same boat on HBM specifically, also sold out thru 2026, but the real prize is different. When Samsung goes dark for 18 days during a record memory upcycle, spot DRAM and NAND prices melt up, and MU’s 2027 contract negotiations happen with Samsung as the absent third bidder at the table. MU also has more standard DRAM and NAND flex than SK does right now.

Add to it MU has US based fabs, zero Korea labor exposure, and no Korean governance discount baked into the multiple. They have been shipping HBM3E to NVDA in volume since 2024 so the qualification work is long done. If your a hyperscaler scrambling for memory during the strike, you call the guys in Boise who can ship, not the guys in Pyeongtaek who cant.

Last thing, MU trades on US exchanges through any US discount broker, where as US retail still only has indirect SK exposure thru ETFs. That asymmetric access flows straight into MU’s multiple when the trade goes viral on here.

My thesis, MU is going to $1300. HBM is running approx 80% margins and mix keeps climbing every quarter. As HBM eats more of the revenue stack your blended earnings power gets to $80+ EPS run rate easy. $1300 is barely 16x at that point, and def reachable this year if the market feels AI super cycle holds thru 2027. Better hop on the ride while it is still under 800.

1200 shares at $464 and 100 shares at $381",currently only companies make hbm the biggest bottleneck of the entire ai build samsung sk and mu samsungs union walked away from talks last night strike window is set for to days of the worlds biggest memory fab going dark once shutdown tooling recalibration on these lines take weeks not days sk already sold out their dram nand and hbm thru end of to nvda locked in at contract prices they get the headline of being hbm but they have nothing left to put on the truck during a spot price spike mu is in the same boat on hbm specifically also sold out thru but the real prize is different when samsung goes dark for days during a record memory upcycle spot dram and nand prices melt up and mu s contract negotiations happen with samsung as the absent third bidder at the table mu also has more standard dram and nand flex than sk does right now add to it mu has us based fabs zero korea labor exposure and no korean governance discount baked into the multiple they have been shipping hbm e to nvda in volume since so the qualification work is long done if your a hyperscaler scrambling for memory during the strike you call the guys in boise who can ship not the guys in pyeongtaek who cant last thing mu trades on us exchanges through any us discount broker where as us retail still only has indirect sk exposure thru etfs that asymmetric access flows straight into mu s multiple when the trade goes viral on here my thesis mu is going to hbm is running approx margins and mix keeps climbing every quarter as hbm eats more of the revenue stack your blended earnings power gets to eps run rate easy is barely x at that point and def reachable this year if the market feels ai super cycle holds thru better hop on the ride while it is still under shares at and shares at,0.974,positive
2026-05-12 22:16:49+00:00,Was expecting to throw away a k LOL! Bought during lunch and held to expiry.,was expecting to throw away a k lol bought during lunch and held to expiry,0.4215,positive
2026-05-12 19:57:08+00:00,This post contains content not supported on old Reddit. [Click here to view the full post](https://sh.reddit.com/r/wallstreetbets/comments/1tbctyk),this post contains content not supported on old reddit click here to view the full post,-0.2411,negative
