created_utc,body,clean_body,body_sentiment,body_label
2026-06-30 08:48:46+00:00,"I had a beef jerky business, it made like $11 an hour after costs so I shut it down.

But before I did, the bank saw my potential as a thriving small business and handed me a $20k overdraft. I did not buy beef jerky.

Michael Saylor wakes up every morning and buys Bitcoin with money he doesn’t have. I respect this man more than anyone alive. He is doing with billions what I do with a beef jerky overdraft. We are the same person.

I’m 20 years old and I now hold 350 shares of MSTR

I already had shares sitting at a bad average. Most people would’ve cut and moved on. I sold my entire stock portfolio, used the meat money to DCA, and went all in.

The thesis is simple. Bitcoin keeps absorbing capital. MSTR is the leveraged bet on that happening and all the current panic is overblown.

The bank thinks I’m buying inventory. The inventory is bitcoin. Technically I am in the beef jerky business, I’m just jerking a different kind of meat now.",i had a beef jerky business it made like an hour after costs so i shut it down but before i did the bank saw my potential as a thriving small business and handed me a k overdraft i did not buy beef jerky michael saylor wakes up every morning and buys bitcoin with money he doesn t have i respect this man more than anyone alive he is doing with billions what i do with a beef jerky overdraft we are the same person i m years old and i now hold shares of mstr i already had shares sitting at a bad average most people would ve cut and moved on i sold my entire stock portfolio used the meat money to dca and went all in the thesis is simple bitcoin keeps absorbing capital mstr is the leveraged bet on that happening and all the current panic is overblown the bank thinks i m buying inventory the inventory is bitcoin technically i am in the beef jerky business i m just jerking a different kind of meat now,0.3497,positive
2026-06-30 04:52:28+00:00,,nan,0.0,neutral
2026-06-30 04:04:56+00:00,"I locked some profits in and bought some Visa And S&P500.

I am also still holding 31k AMD ",i locked some profits in and bought some visa and s p i am also still holding k amd,0.4404,positive
2026-06-30 02:26:41+00:00,,nan,0.0,neutral
2026-06-30 01:52:41+00:00,"The market seems to think it has Mattel figured out - (I miss you, em dash) a floundering toy maker that can only hope for a consumer discretionary recovery.

Softer than expected demand for its toys over the holiday season appeared to push Mattel stock off the cliff and after a dead cat bounce, a gradual downward incline with increasing shorts against the company. It's an attractive short against the consumer amidst inflation, eye watering national debt, geopolitical turmoil, and a challenging job market.

As regarded as I am, I have to disagree and point to a future that positions Mattel as an entertainment powerhouse across gaming, TV, and film.

Bears may point to the latest He-Man adaptation, Masters of the Universe, as a reason to be skeptical. Do a quick search though, and you'll find even the pundits aren't convinced they should be bearish. There's a lot of mixed sentiment, with some point to Amazon MGM happily holding the bag with around a \~$200M budget and a middling box office. Some point to streaming and toy sales as the panacea here.

That seems to be the implication behind an Amazon/MGM executive's statement published by Variety: ""\[Director\] Travis Knight and the entire cast and filmmaking team have delivered something truly special, and this opening is exactly the kind of critical first moment that validates our holistic distribution strategy—building awareness and engagement that will carry well beyond the theatrical window.”

There's streaming and there's the whole host of branded merch and toys that Amazon is selling.

And Mattel already has another film ready for later this year - Matchbox: The Movie, an adventure comedy film starring John Cena. Maybe the market can't see the potential here, but I think it's clear to see...

Between film, TV, and gaming (last quarter also came with a statement that Mattel is buying out NetEase's 50% stake in their joint venture, Mattel163), and given their CEO (who has a solid background in entertainment and kicked off his first year by alleviating production woes and pushing forward the popular Barbie movie) there's a powerful entertainment division in the making that can propel Mattel into growth.

tl;dr - toy company goes digital, regard approves",the market seems to think it has mattel figured out i miss you em dash a floundering toy maker that can only hope for a consumer discretionary recovery softer than expected demand for its toys over the holiday season appeared to push mattel stock off the cliff and after a dead cat bounce a gradual downward incline with increasing shorts against the company it s an attractive short against the consumer amidst inflation eye watering national debt geopolitical turmoil and a challenging job market as regarded as i am i have to disagree and point to a future that positions mattel as an entertainment powerhouse across gaming tv and film bears may point to the latest he man adaptation masters of the universe as a reason to be skeptical do a quick search though and you ll find even the pundits aren t convinced they should be bearish there s a lot of mixed sentiment with some point to amazon mgm happily holding the bag with around a m budget and a middling box office some point to streaming and toy sales as the panacea here that seems to be the implication behind an amazon mgm executive s statement published by variety director travis knight and the entire cast and filmmaking team have delivered something truly special and this opening is exactly the kind of critical first moment that validates our holistic distribution strategy building awareness and engagement that will carry well beyond the theatrical window there s streaming and there s the whole host of branded merch and toys that amazon is selling and mattel already has another film ready for later this year matchbox the movie an adventure comedy film starring john cena maybe the market can t see the potential here but i think it s clear to see between film tv and gaming last quarter also came with a statement that mattel is buying out netease s stake in their joint venture mattel and given their ceo who has a solid background in entertainment and kicked off his first year by alleviating production woes and pushing forward the popular barbie movie there s a powerful entertainment division in the making that can propel mattel into growth tl dr toy company goes digital regard approves,0.9868,positive
2026-06-29 23:47:39+00:00,"OK guys I just learned about simple moving averages and RSIntalking to Claude in depth and I feel like an absolute genius so I opened up a $3000  position on Oracle that expires in 60 days. Do you guys think this is regarded or am I low-key a genius?

The company keeps getting hammered by margins compressing and AI spending and blah blah blah blah blah but Oracle is really smart and has ties Israel I think and  a bunch of AI stuff I think I’m not sure so yeah time to buy calls

I really wish I learned about these indicators sooner so I didn’t make all these terrible plays…",ok guys i just learned about simple moving averages and rsintalking to claude in depth and i feel like an absolute genius so i opened up a position on oracle that expires in days do you guys think this is regarded or am i low key a genius the company keeps getting hammered by margins compressing and ai spending and blah blah blah blah blah but oracle is really smart and has ties israel i think and a bunch of ai stuff i think i m not sure so yeah time to buy calls i really wish i learned about these indicators sooner so i didn t make all these terrible plays,0.8169,positive
2026-06-29 20:09:48+00:00,"Source: [https://finance.yahoo.com/technology/ai/articles/super-micro-office-raided-taiwan-175946955.html](https://finance.yahoo.com/technology/ai/articles/super-micro-office-raided-taiwan-175946955.html)

Super Micro Computer Inc.'s offices in Taiwan were raided by government authorities on Monday, widening an investigation into the alleged smuggling of Nvidia Corp. chips into China using the company's servers, according to a person familiar with the situation.

Local investigators raided the residences of six individuals and the sites of three affiliated companies on Monday as part of the ongoing probe into allegedly illegal exports of Super Micro's servers, Taiwan's Keelung District Prosecutors Office said in a statement.

While prosecutors declined to provide names of those searched, Super Micro's Taiwan office was among them, a person familiar with the situation said, asking not to be identified because the information isn't public. Super Micro, which has previously said it is cooperating with Taiwanese authorities on the probe, didn't immediately respond to a request for comment.

The move marks an expansion of Taiwan's first public crackdown on AI chip diversion after years of pressure from Washington to take a more active role in curtailing China's tech access. The US has for years restricted exports of advanced AI chips to China over concerns that the hardware, the vast majority of which is produced in Taiwan, could benefit Beijing's military efforts.

Taiwan doesn't currently treat AI chip exports to China as a crime. While Taiwan authorities do warn potential sellers that they may be breaking US rules should they proceed, the only legal recourse through the island's courts is to charge suspected smugglers with violations of other, existing local laws. Taipei is now considering criminalizing exports themselves, which would give local prosecutors more tools to go after the illicit trade.

Authorities made their first known detentions of alleged chip smugglers in May, on charges of falsifying documents related to exports of Super Micro servers containing highly priced Nvidia AI chips. The three individuals were suspected of successfully sending at least one batch of Nvidia's AI chips to China via Japan, Bloomberg News has reported, and attempting to export around 50 servers that Taiwan authorities seized before they left the island.

Taiwanese data center operator Chief Telecom Inc. and Super Micro distributor Albatron Technology Co. were also raided on Monday, the person familiar with the investigation said. Taiwanese outlets including the Liberty Times newspaper reported on the names of the companies searched earlier on Monday.

Chief Telecom didn't have immediate comment. Albatron said in an exchange filing that it was searched by local investigators earlier on Monday, without providing details about why it was targeted. The company said there was no financial or operational impact.

Taiwan's Keelung District Prosecutors Office said in its statement that it has also summoned the individuals searched on Monday for interviews.

Taipei is considering fortifying its export controls on AI chips sales to China to better align with the US, Bloomberg has reported. That would give Taiwan prosecutors more tools to crack down on illicit trade of AI hardware, which is manufactured in bulk on the island. Both Nvidia and Advanced Micro Devices Inc. rely on Taiwan Semiconductor Manufacturing Co. to make their cutting-edge AI chips.

https://preview.redd.it/sx0zmp164aah1.png?width=1565&format=png&auto=webp&s=d54902f944e455ea35ce1bc9b7574a0e1acd9b04

  
",source super micro computer inc s offices in taiwan were raided by government authorities on monday widening an investigation into the alleged smuggling of nvidia corp chips into china using the company s servers according to a person familiar with the situation local investigators raided the residences of six individuals and the sites of three affiliated companies on monday as part of the ongoing probe into allegedly illegal exports of super micro s servers taiwan s keelung district prosecutors office said in a statement while prosecutors declined to provide names of those searched super micro s taiwan office was among them a person familiar with the situation said asking not to be identified because the information isn t public super micro which has previously said it is cooperating with taiwanese authorities on the probe didn t immediately respond to a request for comment the move marks an expansion of taiwan s first public crackdown on ai chip diversion after years of pressure from washington to take a more active role in curtailing china s tech access the us has for years restricted exports of advanced ai chips to china over concerns that the hardware the vast majority of which is produced in taiwan could benefit beijing s military efforts taiwan doesn t currently treat ai chip exports to china as a crime while taiwan authorities do warn potential sellers that they may be breaking us rules should they proceed the only legal recourse through the island s courts is to charge suspected smugglers with violations of other existing local laws taipei is now considering criminalizing exports themselves which would give local prosecutors more tools to go after the illicit trade authorities made their first known detentions of alleged chip smugglers in may on charges of falsifying documents related to exports of super micro servers containing highly priced nvidia ai chips the three individuals were suspected of successfully sending at least one batch of nvidia s ai chips to china via japan bloomberg news has reported and attempting to export around servers that taiwan authorities seized before they left the island taiwanese data center operator chief telecom inc and super micro distributor albatron technology co were also raided on monday the person familiar with the investigation said taiwanese outlets including the liberty times newspaper reported on the names of the companies searched earlier on monday chief telecom didn t have immediate comment albatron said in an exchange filing that it was searched by local investigators earlier on monday without providing details about why it was targeted the company said there was no financial or operational impact taiwan s keelung district prosecutors office said in its statement that it has also summoned the individuals searched on monday for interviews taipei is considering fortifying its export controls on ai chips sales to china to better align with the us bloomberg has reported that would give taiwan prosecutors more tools to crack down on illicit trade of ai hardware which is manufactured in bulk on the island both nvidia and advanced micro devices inc rely on taiwan semiconductor manufacturing co to make their cutting edge ai chips,0.9509,positive
2026-06-29 20:02:52+00:00,"QNX is in **275M+ vehicles worldwide**. With roughly **1.7B vehicles** on the road globally, that means QNX is in about **16% of the global vehicle fleet** — basically **1 in 6 vehicles**.  
That is a massive installed base for mission-critical embedded software.  
The growth is also finally showing up in the numbers. BB’s latest quarter had revenue up around **26% YoY**, and QNX also grew around **26% YoY** with very high software margins. This is starting to look less like a dead phone-company turnaround and more like a high-margin embedded software rerating.  
The comparison I like is: **BB could be the software-layer version of Qualcomm/Nokia.**  
Qualcomm is the auto chip/platform giant. Nokia became infrastructure after phones. BB could become the overlooked embedded software infrastructure play for vehicles, robotics, industrial systems, defense, aerospace, and edge AI.  
QNX is not a monopoly, but it looks like one of the leading safety-critical automotive OS platforms by disclosed vehicle count. That matters because automakers do not casually rip out validated software from vehicle platforms.  
The space angle is also interesting: QNX is now supported in NASA’s core Flight System ecosystem. That does not mean every spacecraft runs QNX, but it adds credibility to the mission-critical software story.  
Simple thesis: **BB is not a phone company anymore. It is a high-margin embedded software play hiding in plain sight.** 

**Made a more in-depth DD last week. Don’t sleep on this stock.**

**Not financial advice, just factual data** ",qnx is in m vehicles worldwide with roughly b vehicles on the road globally that means qnx is in about of the global vehicle fleet basically in vehicles that is a massive installed base for mission critical embedded software the growth is also finally showing up in the numbers bb s latest quarter had revenue up around yoy and qnx also grew around yoy with very high software margins this is starting to look less like a dead phone company turnaround and more like a high margin embedded software rerating the comparison i like is bb could be the software layer version of qualcomm nokia qualcomm is the auto chip platform giant nokia became infrastructure after phones bb could become the overlooked embedded software infrastructure play for vehicles robotics industrial systems defense aerospace and edge ai qnx is not a monopoly but it looks like one of the leading safety critical automotive os platforms by disclosed vehicle count that matters because automakers do not casually rip out validated software from vehicle platforms the space angle is also interesting qnx is now supported in nasa s core flight system ecosystem that does not mean every spacecraft runs qnx but it adds credibility to the mission critical software story simple thesis bb is not a phone company anymore it is a high margin embedded software play hiding in plain sight made a more in depth dd last week don t sleep on this stock not financial advice just factual data,0.8881,positive
2026-06-29 20:00:37+00:00,This post contains content not supported on old Reddit. [Click here to view the full post](https://sh.reddit.com/r/wallstreetbets/comments/1uj37dn),this post contains content not supported on old reddit click here to view the full post,-0.2411,negative
2026-06-29 18:37:45+00:00,,nan,0.0,neutral
2026-06-29 18:26:24+00:00,Scare money don’t make money fellas,scare money don t make money fellas,-0.4939,negative
2026-06-29 17:46:24+00:00,,nan,0.0,neutral
2026-06-29 17:37:17+00:00,is it wen?,is it wen,0.0,neutral
2026-06-29 17:11:13+00:00,"Solar sector is hot. GLW is going higher.  
  
Not selling yet. 🚀",solar sector is hot glw is going higher not selling yet,0.0,neutral
2026-06-29 17:10:28+00:00,"Last time when I posted my YOLO. almost 50% loss on ASTS. I received a lot of kind words and recommendations from WSB. I would like to post here again. I am still here, still loss, load more! I am more confident about ASTS. Rock to the Moon! ",last time when i posted my yolo almost loss on asts i received a lot of kind words and recommendations from wsb i would like to post here again i am still here still loss load more i am more confident about asts rock to the moon,0.8291,positive
2026-06-29 17:08:31+00:00,,nan,0.0,neutral
2026-06-29 16:57:45+00:00,,nan,0.0,neutral
