created_utc,body,clean_body,body_sentiment,body_label
2026-07-21 06:46:21+00:00,"Apologies for the stream of consciousness. It's almost 3AM and I've been benchmarking LLMs for the past 8 hours:  
  
Back when DeepSeek R1 came out, we saw the market react to the realization that a viable LLM doesn't need to be trained on the volume of cutting edge nVidia hardware you can only get on the white market. R1 was good. It wasn't the best, but it was a wake-up call for the west... that rhyme was not intentional...

Over the past few days, we saw 2 insane releases from Chinese labs.  
  
Kimi, which was trained on a mix of nVidia and Chinese chips, crept up to Opus 4.8 territory.  
  
And Qwen3.8, which came out Monday morning (Chinese time) and performs similarly to Kimi, and it was trained exclusively on domestic Chinese hardware -- proving nVidia's not even needed to train a SotA model.

Even domestically (in the US), Everyone and their mother has been working on training and inference ASICs and infra which will eventually displace nVidia hardware. Jensen's not dumb, so he's trying to keep nVidia in the conversation by continuing the trend of ""acquisitions"" (Groq), investments (Marvell), and partnerships (Intel), by now desperately squeezing itself onto the hype train of would-be competitors (d-Matrix). It's almost coming off desperate.

On top of the deterioration of nVidia's moat, add the fact that their stock price is based on the sales figures that came with reckless datacenter spending. Datacenter roll-outs are at a point, now, where we don't even need the hardware yet because we can't even power it for 5+ years! They've already saturated the grid where they *want* to build. We can't generate power fast enough, we can't run transmission lines fast enough, and residents are fed up with data center construction creeping up on their residential areas. There's just so much friction.

And my last point is, this shit isn't even profitable for the labs! The operational net losses of these labs is just... insane. They all hoarded nVidia's proverbial shovels and pickaxes early on as if they'd be the last one standing, but what happens when these labs begin to wind down? Are they going to be keeping up, buying overpriced nVidia chips at the current volume of their collective? Probably not. This is all just way too expensive to keep up. And increasingly, the public just ain't buying it.

</rant>

I can't fight the feeling that our favorite pickaxe salesman is losing his market, and I've been losing confidence that nVidia will have another Covid-era Crypto or AI moment to keep pace for the rest of the decade.

TL;DR: Chinese labs are now competitive using domestic hardware, and I think the practical market is much smaller and already saturated. Where are tomorrow's customers?

I *want* to be wrong, so by all means, tell me why I'm wrong lol",apologies for the stream of consciousness it s almost am and i ve been benchmarking llms for the past hours back when deepseek r came out we saw the market react to the realization that a viable llm doesn t need to be trained on the volume of cutting edge nvidia hardware you can only get on the white market r was good it wasn t the best but it was a wake up call for the west that rhyme was not intentional over the past few days we saw insane releases from chinese labs kimi which was trained on a mix of nvidia and chinese chips crept up to opus territory and qwen which came out monday morning chinese time and performs similarly to kimi and it was trained exclusively on domestic chinese hardware proving nvidia s not even needed to train a sota model even domestically in the us everyone and their mother has been working on training and inference asics and infra which will eventually displace nvidia hardware jensen s not dumb so he s trying to keep nvidia in the conversation by continuing the trend of acquisitions groq investments marvell and partnerships intel by now desperately squeezing itself onto the hype train of would be competitors d matrix it s almost coming off desperate on top of the deterioration of nvidia s moat add the fact that their stock price is based on the sales figures that came with reckless datacenter spending datacenter roll outs are at a point now where we don t even need the hardware yet because we can t even power it for years they ve already saturated the grid where they want to build we can t generate power fast enough we can t run transmission lines fast enough and residents are fed up with data center construction creeping up on their residential areas there s just so much friction and my last point is this shit isn t even profitable for the labs the operational net losses of these labs is just insane they all hoarded nvidia s proverbial shovels and pickaxes early on as if they d be the last one standing but what happens when these labs begin to wind down are they going to be keeping up buying overpriced nvidia chips at the current volume of their collective probably not this is all just way too expensive to keep up and increasingly the public just ain t buying it rant i can t fight the feeling that our favorite pickaxe salesman is losing his market and i ve been losing confidence that nvidia will have another covid era crypto or ai moment to keep pace for the rest of the decade tl dr chinese labs are now competitive using domestic hardware and i think the practical market is much smaller and already saturated where are tomorrow s customers i want to be wrong so by all means tell me why i m wrong lol,-0.9632,negative
2026-07-21 02:09:51+00:00,"Full port calls into earnings. Easy.

Every 500 likes, I will make HOOD go up by 1%",full port calls into earnings easy every likes i will make hood go up by,0.6908,positive
2026-07-21 00:41:45+00:00,"Meta always fucks up internal development (VR, Metaverse) but they've been successful with their big acquisitions (WhatsApp, Instagram). 

Why doesn't Meta just make a bid to OpenAI / Anthorpic instead of trying to develop things in house?",meta always fucks up internal development vr metaverse but they ve been successful with their big acquisitions whatsapp instagram why doesn t meta just make a bid to openai anthorpic instead of trying to develop things in house,0.631,positive
2026-07-20 23:45:55+00:00,"New to trading type behavior, haven’t been mentally",new to trading type behavior haven t been mentally,0.0,neutral
2026-07-20 22:16:57+00:00,,nan,0.0,neutral
2026-07-20 20:41:59+00:00,Bled to NVDA and MSFT. $10K loss from opening position. I miss the days when markets would go up or down. Everything trades like memecoins now…,bled to nvda and msft k loss from opening position i miss the days when markets would go up or down everything trades like memecoins now,-0.1027,negative
2026-07-20 20:22:50+00:00,"One of the shittiest trade ever.. Wondering if I'll get this shit assigned (it's deep in the money already)? Long call will be worth nothing in a few days once they start unlocking. 

Stock might go down even further to 75-80 range next month (today it closed at 119)... By the end of this year below 40.... Moral of the story - do not open IBKR app drunk. Do not mix trading and drinks 🤣",one of the shittiest trade ever wondering if i ll get this shit assigned it s deep in the money already long call will be worth nothing in a few days once they start unlocking stock might go down even further to range next month today it closed at by the end of this year below moral of the story do not open ibkr app drunk do not mix trading and drinks,-0.8793,negative
2026-07-20 20:01:31+00:00,This post contains content not supported on old Reddit. [Click here to view the full post](https://sh.reddit.com/r/wallstreetbets/comments/1v1wb98),this post contains content not supported on old reddit click here to view the full post,-0.2411,negative
2026-07-20 20:00:56+00:00,,nan,0.0,neutral
2026-07-20 18:44:21+00:00,"WOTC parent Hasbro (HAS) is going to report earnings pre-market 7/21/2026. I expect a beat above expectations as MTG's growth is likely outpacing the analyist consensus views.

For those unaware, Hasbro at this point is basically a mostly deadweight traditional toys/games business, and WOTC. WOTC and magic the gathering are powering almost all the earnings growth. All the toys business has to do, is recover from the tariff shock and analysts will largely ignore any negative sentiment attached to it.

2026 sets: Magic growth is huge. I've talked with plenty of LGSs over the past few months and the trend has been that Marvel Superheroes is selling much better than anticipated which makes sense as everyone was wary of SPM trends. But MSH is doing very well, and I would say there's the possibility it de-thrones LOTR as the 2nd best selling set of all time until The Hobbit releases. Reality Fracture looks to have good sentiment online currently. Star Trek is showing that WOTC is willing to take risks like autographed cards to pull in collectors from outside the direct MTG or TCG playerbase and reach for people into more traditional trading cards like Pokemon/Topps collectors. I expect Star Trek to outperform reddit sentiment.

2027 In-universe sets: All smash hits it looks like from the social media reaction. WOTC has really zero'd in on the blend of nostalia and novelty that they need. Expect CBBs to continue to sell out immediately and everyone being big-mad that they can't buy them at 'msrp'.

2027 Universe-beyond sets: Nintendo signing is a clear signal this could be the 'set that beats Final Fantasy' that Mark Rosewater has hinted at. But there's also the potential for massive properties like WoW, SW, or Elder Scrolls, etc... that would have broad massive audiences built in.

Distribution vs. Direct Selling on Amazon: WOTC looks to have been trying to capture more of the revenue chain by direct selling more products on Amazon. This means that instead of traditional TCG distribution capturing 25-35% of the margin on a product, Amazon is only capturing 10-15% and WOTC is getting that extra chunk.

Distribution model benefits from ancillary products: Because TCG printing is limited by production speeds and facilities (much like datacenters), for every 1000 play boosters you can make, you can either produce 33.33... (repeating of course) play booster boxes, or 4-5x as many bundles, gift bundles, singleton packs, scene boxes, warehouse boxes, and beginner boxes. Likely this is a way to incentivize stores to buy up as much of the ancillary products as they can from distribution to get access to higher CBB allocation. The net result is WOTC sells more broad SKUs and isn't relying on hardcore MTG people cracking play boxes or drafting.

Positions: CBBs in FF, BRO, MSH, SPM, LOTR, $HAS Aug 80Cs, Sept 110Cs, Jan 90Cs, Mar 110Cs, Jun 110Cs, Jan 120Cs. https://imgur.com/a/k3ywvBm

Previous thread(s):
 
https://www.reddit.com/r/wallstreetbets/comments/1srvqx8/magic_the_gathering_owner_hasbro_has_earnings/

https://www.reddit.com/r/mtgfinance/comments/1r0ertm/mtg_and_dd_parent_company_hasbro_has_reports/",wotc parent hasbro has is going to report earnings pre market i expect a beat above expectations as mtg s growth is likely outpacing the analyist consensus views for those unaware hasbro at this point is basically a mostly deadweight traditional toys games business and wotc wotc and magic the gathering are powering almost all the earnings growth all the toys business has to do is recover from the tariff shock and analysts will largely ignore any negative sentiment attached to it sets magic growth is huge i ve talked with plenty of lgss over the past few months and the trend has been that marvel superheroes is selling much better than anticipated which makes sense as everyone was wary of spm trends but msh is doing very well and i would say there s the possibility it de thrones lotr as the nd best selling set of all time until the hobbit releases reality fracture looks to have good sentiment online currently star trek is showing that wotc is willing to take risks like autographed cards to pull in collectors from outside the direct mtg or tcg playerbase and reach for people into more traditional trading cards like pokemon topps collectors i expect star trek to outperform reddit sentiment in universe sets all smash hits it looks like from the social media reaction wotc has really zero d in on the blend of nostalia and novelty that they need expect cbbs to continue to sell out immediately and everyone being big mad that they can t buy them at msrp universe beyond sets nintendo signing is a clear signal this could be the set that beats final fantasy that mark rosewater has hinted at but there s also the potential for massive properties like wow sw or elder scrolls etc that would have broad massive audiences built in distribution vs direct selling on amazon wotc looks to have been trying to capture more of the revenue chain by direct selling more products on amazon this means that instead of traditional tcg distribution capturing of the margin on a product amazon is only capturing and wotc is getting that extra chunk distribution model benefits from ancillary products because tcg printing is limited by production speeds and facilities much like datacenters for every play boosters you can make you can either produce repeating of course play booster boxes or x as many bundles gift bundles singleton packs scene boxes warehouse boxes and beginner boxes likely this is a way to incentivize stores to buy up as much of the ancillary products as they can from distribution to get access to higher cbb allocation the net result is wotc sells more broad skus and isn t relying on hardcore mtg people cracking play boxes or drafting positions cbbs in ff bro msh spm lotr has aug cs sept cs jan cs mar cs jun cs jan cs previous thread s,0.9954,positive
2026-07-20 18:39:05+00:00,Got this for insurance but have a hunch the hyperscalers are going to announce sustained or elevated capex. Do I just hold it though and basically pay the insurance or kick it and live or die by the next two weeks?,got this for insurance but have a hunch the hyperscalers are going to announce sustained or elevated capex do i just hold it though and basically pay the insurance or kick it and live or die by the next two weeks,-0.7876,negative
2026-07-20 17:43:17+00:00,4 year cycle. Tom Lee just started buying back shares again. Eth at ath = bmnr at $50+ minimum. This is the way,year cycle tom lee just started buying back shares again eth at ath bmnr at minimum this is the way,0.296,positive
2026-07-20 17:09:27+00:00,,nan,0.0,neutral
2026-07-20 16:15:28+00:00,"I've been getting my butt kicked by $BE and the $SPY.  
I am parking my port into $AMPG.

The stock seems solid, that's about all the DD I can provide.  
This is a $214K dollar Yolo (I have to put this to satisfy the auto-mod).

https://preview.redd.it/jdndws50teeh1.png?width=870&format=png&auto=webp&s=292b0d57681406ae84547c49566c6be4975d503e

  
It wicked off the 50sma on the 1d chart.

https://preview.redd.it/eehnc273teeh1.png?width=1232&format=png&auto=webp&s=d173f855fc848484bbd5f730b1948eac1e5cffe9

The plan right now is to sell => 9.00  
Or maybe sell before Google earnings... not sure yet.",i ve been getting my butt kicked by be and the spy i am parking my port into ampg the stock seems solid that s about all the dd i can provide this is a k dollar yolo i have to put this to satisfy the auto mod it wicked off the sma on the d chart the plan right now is to sell or maybe sell before google earnings not sure yet,0.0869,positive
2026-07-20 14:47:38+00:00,"**TL;DR:** GOOGL lost $200B in about 30 hours because a model is late and some engineers changed badges. This started the morning after Buffett told CNBC the $31B stake was his idea, including a $10B check written straight to Google funding the exact capex everyone is scared of. META meanwhile gained $125B this month on a leaked memo about maybe renting out spare GPUs someday. Google's actual cloud did $20B last quarter, up 63%, record margins, $462B backlog, and they're turning away customers because they can't build compute fast enough. Earnings Wednesday, 25x forward, expectations conveniently reset. Sold the machine, bought the memo.

July 15, Buffett goes on CNBC and says the thing nobody expected. The $31 billion Alphabet position everyone assumed was Greg Abel flexing his new job? ""I initiated it."" Said not buying sooner was a mistake, said Google is more likely to succeed than 90-95% of Wall Street's picks. Stock ran from the 358 area to close near 372 and kept climbing the next morning, touching 380.

Then Bloomberg landed midsession on the 16th. Gemini 3.5 Pro months behind schedule, coding benchmarks came in soft. The stock collapsed the same day, $200 billion gone, and kept bleeding through the 17th down to a 344 low. From 380 to 344 in roughly 30 hours of trading. Revenue estimates moved zero dollars.

The delay stacked on a month of exodus headlines. Shazeer back to OpenAI. John Jumper, the Nobel guy, off to Anthropic with two more researchers behind him. Except 3.5 Pro finished its training runs before any of them cleaned out their desks. Whatever those departures cost shows up in 2027's models. The market sold this quarter on next year's org chart.

Two weeks earlier Meta showed what headlines are worth when they point the other way. Stock jumps 9%, $125 billion in a session, on a report with unnamed sources and nothing announced that they might build a cloud business to sell excess compute. Zuck's own framing of the opportunity: we may have overbuilt. A hundred twenty five billion dollars for ""we bought too many GPUs and might rent out the extras.""

Google can't relate. Their cloud did $20 billion last quarter, up 63%, fastest of any major provider, operating margin at a record 32.9%, backlog nearly doubled to $462 billion with over half converting to revenue inside 24 months. And they're turning deals away. Not losing them, declining them, because they can't build capacity fast enough. Monday's bounce was a report that they're etching Gemini directly into next-gen silicon for 6-10x better power per token, built specifically to fix the shortage that's forcing them to say no to money. They're also selling TPUs to third parties now, with multiple gigawatts committed to Anthropic and Broadcom. Meta wants to enter the cloud business someday. Google is rationing theirs.

The delayed model canceled none of that backlog. Not one contract.

The leaderboard fear has the shelf life of milk anyway. Chinese labs keep compressing the frontier within weeks through distillation, Kimi and friends proved model rank doesn't hold. The durable war is cost per token and distribution, and Google owns every layer: silicon, data centers, models, three billion users. The AI subscription revenue people wring their hands over is a rounding error next to cloud and ads.

The capex is the real bear case and it deserves respect. $180-190 billion guided this year. Q1 free cash flow down 47%. Buybacks paused. Anthropic concentration in the backlog. If cloud growth prints below roughly 55% Wednesday the conversion story cracks and this whole thing gets rethought. Watch that one number.

That June tranche of Buffett's stake, though. It wasn't open market buying. It was a $10 billion private placement, shares purchased directly from Alphabet, cash going straight into the AI buildout. The spending that terrifies the market has Omaha's signature on the check. The man does not fund bonfires.

One more wrinkle in Wednesday's print. Alphabet marks its SpaceX and Anthropic stakes to market. SpaceX went public in June, repricing that stake off its old private mark. Anthropic closed a $65 billion round in late May at a $965 billion valuation, up from $380 billion in March. Both revaluations land inside Q2. Last quarter's paper gains already made the headline EPS look absurd. This quarter's paper is bigger, on both barrels, and the algos reading the wire at 4:01 don't read footnotes.

Stock's at 351 today, closer to last week's low than its high, coiled at the same level it sat before the Q1 print. That one went 350 to 408 on the report before round tripping the whole move. Same coil. Bigger catalyst.

Badge counts and memos got traded all month. Wednesday the machine reports.

At the end of the day: calls.

Not financial advice. The author is highly regarded and drives his own short bus.

Position: GOOGL 380C 7/24, many contracts.",tl dr googl lost b in about hours because a model is late and some engineers changed badges this started the morning after buffett told cnbc the b stake was his idea including a b check written straight to google funding the exact capex everyone is scared of meta meanwhile gained b this month on a leaked memo about maybe renting out spare gpus someday google s actual cloud did b last quarter up record margins b backlog and they re turning away customers because they can t build compute fast enough earnings wednesday x forward expectations conveniently reset sold the machine bought the memo july buffett goes on cnbc and says the thing nobody expected the billion alphabet position everyone assumed was greg abel flexing his new job i initiated it said not buying sooner was a mistake said google is more likely to succeed than of wall street s picks stock ran from the area to close near and kept climbing the next morning touching then bloomberg landed midsession on the th gemini pro months behind schedule coding benchmarks came in soft the stock collapsed the same day billion gone and kept bleeding through the th down to a low from to in roughly hours of trading revenue estimates moved zero dollars the delay stacked on a month of exodus headlines shazeer back to openai john jumper the nobel guy off to anthropic with two more researchers behind him except pro finished its training runs before any of them cleaned out their desks whatever those departures cost shows up in s models the market sold this quarter on next year s org chart two weeks earlier meta showed what headlines are worth when they point the other way stock jumps billion in a session on a report with unnamed sources and nothing announced that they might build a cloud business to sell excess compute zuck s own framing of the opportunity we may have overbuilt a hundred twenty five billion dollars for we bought too many gpus and might rent out the extras google can t relate their cloud did billion last quarter up fastest of any major provider operating margin at a record backlog nearly doubled to billion with over half converting to revenue inside months and they re turning deals away not losing them declining them because they can t build capacity fast enough monday s bounce was a report that they re etching gemini directly into next gen silicon for x better power per token built specifically to fix the shortage that s forcing them to say no to money they re also selling tpus to third parties now with multiple gigawatts committed to anthropic and broadcom meta wants to enter the cloud business someday google is rationing theirs the delayed model canceled none of that backlog not one contract the leaderboard fear has the shelf life of milk anyway chinese labs keep compressing the frontier within weeks through distillation kimi and friends proved model rank doesn t hold the durable war is cost per token and distribution and google owns every layer silicon data centers models three billion users the ai subscription revenue people wring their hands over is a rounding error next to cloud and ads the capex is the real bear case and it deserves respect billion guided this year q free cash flow down buybacks paused anthropic concentration in the backlog if cloud growth prints below roughly wednesday the conversion story cracks and this whole thing gets rethought watch that one number that june tranche of buffett s stake though it wasn t open market buying it was a billion private placement shares purchased directly from alphabet cash going straight into the ai buildout the spending that terrifies the market has omaha s signature on the check the man does not fund bonfires one more wrinkle in wednesday s print alphabet marks its spacex and anthropic stakes to market spacex went public in june repricing that stake off its old private mark anthropic closed a billion round in late may at a billion valuation up from billion in march both revaluations land inside q last quarter s paper gains already made the headline eps look absurd this quarter s paper is bigger on both barrels and the algos reading the wire at don t read footnotes stock s at today closer to last week s low than its high coiled at the same level it sat before the q print that one went to on the report before round tripping the whole move same coil bigger catalyst badge counts and memos got traded all month wednesday the machine reports at the end of the day calls not financial advice the author is highly regarded and drives his own short bus position googl c many contracts,0.5342,positive
2026-07-20 14:25:57+00:00,"220 contracts    IN @ .98  
220 contracts OUT @ .05

This is a 20K realized loss for 1DTE that I opened on Friday afternoon.

https://preview.redd.it/6t9phllp9eeh1.png?width=1353&format=png&auto=webp&s=9cb94ff742d1eb0fca25778e44f151645242f8d9

Bears always get killed...

Enjoy the loss pr0n you filthy disgusting animals.",contracts in contracts out this is a k realized loss for dte that i opened on friday afternoon bears always get killed enjoy the loss pr n you filthy disgusting animals,-0.8519,negative
2026-07-20 11:37:11+00:00,,nan,0.0,neutral
2026-07-20 10:58:54+00:00,,nan,0.0,neutral
