created_utc,body,clean_body,body_sentiment,body_label
2026-07-08 22:31:12+00:00,"The moderator removed my old post.

Here is my position on $BE so far, today's price movement put me on a maintenance call.

https://preview.redd.it/ozpfgh3l03ch1.png?width=692&format=png&auto=webp&s=a13ef49df4b6fbe5ad5e973b8e83ddeb63f2fb08

I've been selling naked ITM puts as well for big losses.  
Here is my margin call from just after today's market close.

https://preview.redd.it/0292iutq03ch1.png?width=1006&format=png&auto=webp&s=6e4767685e03839c4fb3f59328ba568a1d41fc5a

I am going to keep holding $BE through this if I can.  
I won't be able to fulfill another maintenance call after this one, so $BE has to hold.

I will sell covered calls up until earnings to try and reduce my exposure and mitigate any further margin calls.

I'm hoping 240 will act like a support and hold.

This is a lesson to those who think shares are not as dangerous as FD options.

I will post an update after $BE earnings end of this month.

Godspeed my fellow regards.",the moderator removed my old post here is my position on be so far today s price movement put me on a maintenance call i ve been selling naked itm puts as well for big losses here is my margin call from just after today s market close i am going to keep holding be through this if i can i won t be able to fulfill another maintenance call after this one so be has to hold i will sell covered calls up until earnings to try and reduce my exposure and mitigate any further margin calls i m hoping will act like a support and hold this is a lesson to those who think shares are not as dangerous as fd options i will post an update after be earnings end of this month godspeed my fellow regards,0.9498,positive
2026-07-08 21:21:48+00:00,,nan,0.0,neutral
2026-07-08 21:11:35+00:00,,nan,0.0,neutral
2026-07-08 20:48:21+00:00,,nan,0.0,neutral
2026-07-08 20:39:09+00:00,Think it takes a new level of stupid to do this. No words and this was all money I saved from 4 years of working part time jobs in college. You can see where i long term invested and where I started trading. Please don’t do it.,think it takes a new level of stupid to do this no words and this was all money i saved from years of working part time jobs in college you can see where i long term invested and where i started trading please don t do it,-0.2023,negative
2026-07-08 20:26:18+00:00,"MU = The Beatles

HBM = Twist and Shout

RMBS = The Top Notes",mu the beatles hbm twist and shout rmbs the top notes,0.2023,positive
2026-07-08 20:00:37+00:00,This post contains content not supported on old Reddit. [Click here to view the full post](https://sh.reddit.com/r/wallstreetbets/comments/1ur3tzh),this post contains content not supported on old reddit click here to view the full post,-0.2411,negative
2026-07-08 18:34:34+00:00,"could this possibly be a green flag for NFLX stock, as the Paramount Skydance / Warner Brothers Merger faces a new legislative hurdle - in addition to its UK opposition? ",could this possibly be a green flag for nflx stock as the paramount skydance warner brothers merger faces a new legislative hurdle in addition to its uk opposition,0.0,neutral
2026-07-08 18:15:05+00:00,A little surfing today 🏄,a little surfing today,0.0,neutral
2026-07-08 16:12:13+00:00,,nan,0.0,neutral
2026-07-08 16:10:03+00:00,"Alignment healthcare is a health insurance provider with a market cap of just under $5 billion. They primarily focus on offering Medicare Advantage plans to senior citizens.

Alignment generally takes on full downside risk, while large carriers often offload risk to physician groups. Higher than expected healthcare utilization/medical costs is bad for large carriers, but catastrophic for Alignment. The opposite is also true: if utilization softens it provides a massive earnings boost.

This next section is going to demonstrate how much of an effect utilization has on earnings for Alignment: 

First, here are their most current full year 2026 guidance midpoints:

Revenue: $5.183 billion

Medical Cost: $4.548 billion

Gross Profit: $635 million

EBITDA: $88.5 million



Now here is a hypothetical scenario with medical costs coming in 2% lower than expected: (Medical costs are volatile and a 2% swing is not at all unusual for health insurance providers) 

Revenue: $5.183 billion

Medical Cost: $4.457 billion

Gross Profit: $726 million

EBITDA: $179.5 million



A 2% surprise decrease in medical costs doubles EBITDA for the year.



Now back to the base guidance of $88.5 million EBITDA for 2026. Enterprise value is $4.52 billion, so forward EV/EBITDA is 51. That looks expensive but you also have to consider EBITDA and revenue growth. 2025 EBITDA was $46.1 million, so EBITDA growth guidance for 2026 is 92%. And revenue growth guidance (this is all organic revenue growth, not acquisitions) for 2026 is 32.5%. 

And if you believe medical costs are going to come down 2% like I do, then you are looking at a health insurance company with a forward EV/EBITDA of 25 and very high revenue and membership growth.

For years the health insurance industry was plagued by higher than expected medical costs. As individual investors, we don’t have access to recent hospital admissions or other hard data for the past couple of months. But now there is a ton of indirect evidence that utilization is coming in lower than expected:

1. The big investment banks are generally all raising their price targets on health insurers. And unlike us, they do have access to recent hospital data and are often citing utilization trends in their reports. Here’s an example: [Morgan Stanley Raises UNH price target on utilization](https://www.investing.com/news/analyst-ratings/morgan-stanley-raises-unitedhealth-stock-price-target-on-utilization-93CH-4767498) Alignment has 10 upward price target revisions and 0 down in the past 90 days.
2. Alignment presented at a Goldman Healthcare investor conference on June 9th and completely shifted their cautious tone from all previous conferences in at least the past 2 years. John Kao (Alignment CEO) “Yes, we feel very, very confident and comfortable with our Q2 guidance, very comfortable with it.” James Head (Alignment CFO) “And I would say that your description of benign utilization environment is, I think, is accurate.” The Goldman host even backs them up and says Goldman’s own internal data is showing the same. Scott Fidel (Goldman Sachs): “most of what we've seen through all of our sort of very robust checks are seems pretty benign for the industry”
3. One of Alignment’s peers: Oscar Health (OSCR) also presented at the same conference on June 8th 2026. OSCR said utilization trends look moderately favorable but they were still waiting on the “Wakely Report” to come out at the end of June and then they would know for sure. Again as retail investors we don’t have access to this report which shows recent utilization. But just look at OSCR stock price on the day the report was supposed to have come out: June 30th. The stock went up 12% in 1 day on no publicly available news.

Indirect evidence is pretty overwhelming at this point that utilization is coming in softer than expected. I think we are going to get the first confirmation of this when UNH reports earnings next week. And that’s going to have a huge effect on ALHC’s 2026 earnings.

  
Position: About $60K worth of ALHC shares",alignment healthcare is a health insurance provider with a market cap of just under billion they primarily focus on offering medicare advantage plans to senior citizens alignment generally takes on full downside risk while large carriers often offload risk to physician groups higher than expected healthcare utilization medical costs is bad for large carriers but catastrophic for alignment the opposite is also true if utilization softens it provides a massive earnings boost this next section is going to demonstrate how much of an effect utilization has on earnings for alignment first here are their most current full year guidance midpoints revenue billion medical cost billion gross profit million ebitda million now here is a hypothetical scenario with medical costs coming in lower than expected medical costs are volatile and a swing is not at all unusual for health insurance providers revenue billion medical cost billion gross profit million ebitda million a surprise decrease in medical costs doubles ebitda for the year now back to the base guidance of million ebitda for enterprise value is billion so forward ev ebitda is that looks expensive but you also have to consider ebitda and revenue growth ebitda was million so ebitda growth guidance for is and revenue growth guidance this is all organic revenue growth not acquisitions for is and if you believe medical costs are going to come down like i do then you are looking at a health insurance company with a forward ev ebitda of and very high revenue and membership growth for years the health insurance industry was plagued by higher than expected medical costs as individual investors we don t have access to recent hospital admissions or other hard data for the past couple of months but now there is a ton of indirect evidence that utilization is coming in lower than expected the big investment banks are generally all raising their price targets on health insurers and unlike us they do have access to recent hospital data and are often citing utilization trends in their reports here s an example morgan stanley raises unh price target on utilization alignment has upward price target revisions and down in the past days alignment presented at a goldman healthcare investor conference on june th and completely shifted their cautious tone from all previous conferences in at least the past years john kao alignment ceo yes we feel very very confident and comfortable with our q guidance very comfortable with it james head alignment cfo and i would say that your description of benign utilization environment is i think is accurate the goldman host even backs them up and says goldman s own internal data is showing the same scott fidel goldman sachs most of what we ve seen through all of our sort of very robust checks are seems pretty benign for the industry one of alignment s peers oscar health oscr also presented at the same conference on june th oscr said utilization trends look moderately favorable but they were still waiting on the wakely report to come out at the end of june and then they would know for sure again as retail investors we don t have access to this report which shows recent utilization but just look at oscr stock price on the day the report was supposed to have come out june th the stock went up in day on no publicly available news indirect evidence is pretty overwhelming at this point that utilization is coming in softer than expected i think we are going to get the first confirmation of this when unh reports earnings next week and that s going to have a huge effect on alhc s earnings position about k worth of alhc shares,0.9966,positive
2026-07-08 15:46:27+00:00,Finally learned how the sell button works and clawed back some losses.,finally learned how the sell button works and clawed back some losses,-0.4019,negative
2026-07-08 14:05:11+00:00,"looks distressed for no good reason today,  adding more if necessary

earnings in late July should beat/beat imo

https://preview.redd.it/on56p153j0ch1.png?width=793&format=png&auto=webp&s=41bef8c518554bd3ae48597ad1f98a629ac7fbb6

",looks distressed for no good reason today adding more if necessary earnings in late july should beat beat imo,-0.2732,negative
2026-07-08 12:50:13+00:00,,nan,0.0,neutral
2026-07-08 10:55:50+00:00,"Source: [https://finance.yahoo.com/technology/article/apple-announces-chip-deal-with-broadcom-worth-more-than-30-billion-100000097.html](https://finance.yahoo.com/technology/article/apple-announces-chip-deal-with-broadcom-worth-more-than-30-billion-100000097.html)

Apple (AAPL) on Wednesday announced it has entered into a chip deal valued at more than $30 billion with Broadcom (AVGO). 

Under the terms of the deal, Broadcom will design and produce ""custom silicon components and cutting-edge wireless connectivity technologies"" for Apple products.

The news comes after Broadcom filed paperwork with the Securities and Exchange Commission on June 6, indicating it established a multiyear agreement to develop custom chips for Apple through 2031.

According to Apple, more than 15 billion chips will be built in the US via the deal as part of the company's American Manufacturing Program (AMP). The tie-up will also see Broadcom modernize its Fort Collins, Colo.-based manufacturing facilities via a $1.5 billion investment.

""Apple and Broadcom have a long history together, and this new phase of our partnership further accelerates our commitment to American manufacturing and innovation,"" Apple CEO Tim Cook said in a statement. 

""The cutting-edge components built in Fort Collins are essential to delivering the incredible performance and connectivity our customers expect, and we're proud to deepen our investments in US-based suppliers that share our commitment to excellence and innovation,"" he said.

Apple launched its AMP initiative in 2025 as part of the company's push to increase its manufacturing presence in the US, along with its partners. Other companies that participate in Apple's AMP effort include Corning (GLW), GlobalFoundries (GFS), and Texas Instruments (TXN).

The Trump administration made reshoring manufacturing and chip development a cornerstone of its industrial and technology policies. 

The White House has taken a 10% stake in Intel, and according to the Financial Times, OpenAI (OPAI.PVT) has proposed giving the administration a 5% position in the AI company.

Broadcom has been a major beneficiary of the AI trade, with the stock rising more than 35% thanks to its work developing chips for companies such as Google (GOOG, GOOGL).

Apple, meanwhile, has gone through a series of ups and downs related to its positioning in the AI market. More recently, the tech giant debuted an updated version of Siri during its WWDC event in June.

Importantly, the company's iPhone sales have continued to outperform, helping to lift its stock price 47% over the past year.",source apple aapl on wednesday announced it has entered into a chip deal valued at more than billion with broadcom avgo under the terms of the deal broadcom will design and produce custom silicon components and cutting edge wireless connectivity technologies for apple products the news comes after broadcom filed paperwork with the securities and exchange commission on june indicating it established a multiyear agreement to develop custom chips for apple through according to apple more than billion chips will be built in the us via the deal as part of the company s american manufacturing program amp the tie up will also see broadcom modernize its fort collins colo based manufacturing facilities via a billion investment apple and broadcom have a long history together and this new phase of our partnership further accelerates our commitment to american manufacturing and innovation apple ceo tim cook said in a statement the cutting edge components built in fort collins are essential to delivering the incredible performance and connectivity our customers expect and we re proud to deepen our investments in us based suppliers that share our commitment to excellence and innovation he said apple launched its amp initiative in as part of the company s push to increase its manufacturing presence in the us along with its partners other companies that participate in apple s amp effort include corning glw globalfoundries gfs and texas instruments txn the trump administration made reshoring manufacturing and chip development a cornerstone of its industrial and technology policies the white house has taken a stake in intel and according to the financial times openai opai pvt has proposed giving the administration a position in the ai company broadcom has been a major beneficiary of the ai trade with the stock rising more than thanks to its work developing chips for companies such as google goog googl apple meanwhile has gone through a series of ups and downs related to its positioning in the ai market more recently the tech giant debuted an updated version of siri during its wwdc event in june importantly the company s iphone sales have continued to outperform helping to lift its stock price over the past year,0.9899,positive
2026-07-08 10:00:37+00:00,This post contains content not supported on old Reddit. [Click here to view the full post](https://sh.reddit.com/r/wallstreetbets/comments/1uqo7wi),this post contains content not supported on old reddit click here to view the full post,-0.2411,negative
2026-07-08 09:24:55+00:00,What are we buying today?,what are we buying today,0.0,neutral
2026-07-08 02:59:38+00:00,"https://preview.redd.it/jmq3mxns7xbh1.png?width=1096&format=png&auto=webp&s=cbd3d24872749f1affc6b53d46e64d6637b7d7a5

I'm diamond handing all the way

Still believe we will see a big rebound",i m diamond handing all the way still believe we will see a big rebound,0.34,positive
2026-07-08 00:41:20+00:00,"Alright degenerates, let's talk about my favorite money incinerator, $NBIS.

The damage: 1,370 shares. Down $24K today alone. Down $143K since the June 22 top. Watched a third of my gains evaporate in two weeks because Zuck sneezed. Still up 387% on the position because I bought this thing in the $30s and apparently have a medical inability to take profit.

Why we're bleeding: Bloomberg dropped a report July 1 that Meta wants to sell its excess compute (""Meta Compute""). Market decided Nebius's biggest customer is now its biggest competitor and the whole neocloud sector got sent to the shadow realm. NBIS and CRWV both nuked.

Why I'm not selling and actually think this rips:

1. Meta literally signed a deal worth up to $27B with Nebius in MARCH. $12B dedicated capacity, $15B optional. You don't hand your ""competitor"" $27 billion. Meta reselling spare GPUs is not Meta becoming AWS.

2. The company is drowning in demand. Contracted power went from \~1GW last August to 3.5GW+ now, targeting 4GW. 1.2GW site locked in Pennsylvania. New data centers in the UK, Finland, and France. Daddy Jensen put $2B of Nvidia money in. The fundamentals did not change. A headline changed.

3. Here's the fun part: short interest is around 24% of float. Almost a quarter of this stock is sold short after a 35% drawdown. Q2 earnings land inside the next few weeks. You know what happens when a 24% shorted stock beats earnings. You've all seen this movie.

4. It joined the Nasdaq-100 in June, so index funds are forced buyers now. Aschenbrenner's AI fund owns 5.6% of the company.

And before you tell me $300 is copium: this exact ticker went $200 to $300 in five weeks in May and June. No squeeze fuel, no catalyst. It just did it. Now it's back at $195 with 24% SI and an earnings print loading.

My prediction: shorts press it to the $180s, shake out the paper hands, then it turns on a dime and we're back above $300 by end of August. If I'm wrong, screenshot this and roast me. If I'm right, I'm buying a spoiler for the 911 with the gains.

Positions: 1,370 shares NBIS, no options because I'm not THAT regarded.

Not financial advice. I eat crayons.",alright degenerates let s talk about my favorite money incinerator nbis the damage shares down k today alone down k since the june top watched a third of my gains evaporate in two weeks because zuck sneezed still up on the position because i bought this thing in the s and apparently have a medical inability to take profit why we re bleeding bloomberg dropped a report july that meta wants to sell its excess compute meta compute market decided nebius s biggest customer is now its biggest competitor and the whole neocloud sector got sent to the shadow realm nbis and crwv both nuked why i m not selling and actually think this rips meta literally signed a deal worth up to b with nebius in march b dedicated capacity b optional you don t hand your competitor billion meta reselling spare gpus is not meta becoming aws the company is drowning in demand contracted power went from gw last august to gw now targeting gw gw site locked in pennsylvania new data centers in the uk finland and france daddy jensen put b of nvidia money in the fundamentals did not change a headline changed here s the fun part short interest is around of float almost a quarter of this stock is sold short after a drawdown q earnings land inside the next few weeks you know what happens when a shorted stock beats earnings you ve all seen this movie it joined the nasdaq in june so index funds are forced buyers now aschenbrenner s ai fund owns of the company and before you tell me is copium this exact ticker went to in five weeks in may and june no squeeze fuel no catalyst it just did it now it s back at with si and an earnings print loading my prediction shorts press it to the s shake out the paper hands then it turns on a dime and we re back above by end of august if i m wrong screenshot this and roast me if i m right i m buying a spoiler for the with the gains positions shares nbis no options because i m not that regarded not financial advice i eat crayons,0.8591,positive
2026-07-07 23:39:24+00:00,"Chipotle's been in a genuinely rough stretch, ngl. Traffic declined for four straight quarters through the end of 2025, first annual same-store sales drop since 2016. Management's explanation was basically a broad consumer pullback hitting every income group, with lower-income diners cutting back hardest. Stock's down about 46% from its highs while the S&P was up double digits over that same stretch. Feels pretty on-theme for this sub honestly, another data point on how much pressure regular spending is under right now.

Q1 2026 was the first real sign of a turn though. Revenue grew \~7.4% to about $3.09B, beat estimates, and transaction counts went positive for the first time in a year. Digital sales are now close to 39% of total sales, helped along by new menu stuff like Chicken Al Pastor and higher-protein options aimed at winning back people who'd drifted off. Management's deliberately not discounting to chase traffic back either. They're protecting the brand's pricing position instead, even though that means margins stay squeezed while beef costs and tariffs work against them.

In June JPMorgan upgraded it to overweight, calling the \~43% decline since early 2025 a rare valuation opportunity. Their argument: the current multiple now reflects a realistic growth profile instead of the premium Chipotle used to command. Still trades at a forward P/E in the high 20s though, above the restaurant industry average. So not a screaming bargain by any classic value metric. More like a high-quality brand trading at a discount to its own history, not an obviously cheap stock.

They're still planning to open 350-370 new restaurants in 2026 too, expansion continuing even through the softer traffic environment. That alone drives some revenue growth whether or not comps fully recover.

Real risk here: 2026 guidance calls for flat same-store sales. Management itself isn't promising a fast turnaround. This is a bet that a strong brand recovers from a rough couple years, not a bet that it already has.

[Chipotle](https://www.stoxcraft.com/stocks/cmg) is one of those where the quality of the business was never really the question, just what price you're paying for the rough patch. Anyone here buying this pullback, or waiting to see if comps actually turn positive first?",chipotle s been in a genuinely rough stretch ngl traffic declined for four straight quarters through the end of first annual same store sales drop since management s explanation was basically a broad consumer pullback hitting every income group with lower income diners cutting back hardest stock s down about from its highs while the s p was up double digits over that same stretch feels pretty on theme for this sub honestly another data point on how much pressure regular spending is under right now q was the first real sign of a turn though revenue grew to about b beat estimates and transaction counts went positive for the first time in a year digital sales are now close to of total sales helped along by new menu stuff like chicken al pastor and higher protein options aimed at winning back people who d drifted off management s deliberately not discounting to chase traffic back either they re protecting the brand s pricing position instead even though that means margins stay squeezed while beef costs and tariffs work against them in june jpmorgan upgraded it to overweight calling the decline since early a rare valuation opportunity their argument the current multiple now reflects a realistic growth profile instead of the premium chipotle used to command still trades at a forward p e in the high s though above the restaurant industry average so not a screaming bargain by any classic value metric more like a high quality brand trading at a discount to its own history not an obviously cheap stock they re still planning to open new restaurants in too expansion continuing even through the softer traffic environment that alone drives some revenue growth whether or not comps fully recover real risk here guidance calls for flat same store sales management itself isn t promising a fast turnaround this is a bet that a strong brand recovers from a rough couple years not a bet that it already has chipotle is one of those where the quality of the business was never really the question just what price you re paying for the rough patch anyone here buying this pullback or waiting to see if comps actually turn positive first,0.976,positive
2026-07-07 22:21:10+00:00,,nan,0.0,neutral
