created_utc,body,clean_body,body_sentiment,body_label
2026-07-01 23:43:54+00:00,"The thing people underrate about AI is how much of the work is data preparation. Before a model can learn anything useful, someone has to collect, clean, label, and structure enormous amounts of training data. Then someone has to evaluate the model's outputs for accuracy and safety. That unglamorous middle layer is what Innodata does, and it does it for some of the biggest AI labs and tech companies in the world.

The Q1 numbers were genuinely strong. Revenue grew 54% year over year to a record $90.1 million, which the CEO pointed out was more than the company's entire annual revenue just three years ago. Adjusted EBITDA nearly doubled. They raised full-year 2026 guidance to 40% or more growth, up from 35%. The balance sheet is debt-free with $117 million in cash.

The detail that caught my eye was customer diversification. Revenue from ""other Big Tech"" customers, meaning everyone outside their single largest client, grew 453% year over year. A Big Tech customer that generated nothing for them a year ago is now on track to become their second-largest client, worth about $51 million in 2026. For a company that used to lean heavily on one customer, that broadening is exactly what you want to see.

Now the honest risks, and they matter. Customer concentration is still real even after the diversification. A handful of hyperscale relationships drive a big share of revenue, and losing one would hurt fast. The valuation is rich, trading at a forward P/E in the high 60s, so a lot of growth is already priced in. There's also been notable insider selling into the strength, which is worth knowing even if it isn't conclusive.

The bull case for [Innodata](https://www.stoxcraft.com/stocks/inod) is that as AI moves from simple text models to multistep reasoning, agents, and robotics, the data preparation and evaluation work gets harder and more valuable, not less. The bear case is that you're paying a premium multiple for a business with concentration risk and a possibility that automation eventually eats some of the labor-intensive work it sells. Where do people land on the data-services layer of AI?",the thing people underrate about ai is how much of the work is data preparation before a model can learn anything useful someone has to collect clean label and structure enormous amounts of training data then someone has to evaluate the model s outputs for accuracy and safety that unglamorous middle layer is what innodata does and it does it for some of the biggest ai labs and tech companies in the world the q numbers were genuinely strong revenue grew year over year to a record million which the ceo pointed out was more than the company s entire annual revenue just three years ago adjusted ebitda nearly doubled they raised full year guidance to or more growth up from the balance sheet is debt free with million in cash the detail that caught my eye was customer diversification revenue from other big tech customers meaning everyone outside their single largest client grew year over year a big tech customer that generated nothing for them a year ago is now on track to become their second largest client worth about million in for a company that used to lean heavily on one customer that broadening is exactly what you want to see now the honest risks and they matter customer concentration is still real even after the diversification a handful of hyperscale relationships drive a big share of revenue and losing one would hurt fast the valuation is rich trading at a forward p e in the high s so a lot of growth is already priced in there s also been notable insider selling into the strength which is worth knowing even if it isn t conclusive the bull case for innodata is that as ai moves from simple text models to multistep reasoning agents and robotics the data preparation and evaluation work gets harder and more valuable not less the bear case is that you re paying a premium multiple for a business with concentration risk and a possibility that automation eventually eats some of the labor intensive work it sells where do people land on the data services layer of ai,0.9798,positive
2026-07-01 23:33:20+00:00,🌈🧸,,0.0,neutral
2026-07-01 23:30:15+00:00,"**THIS UPDATE IS DEDICATED TO:** the absolute regards who shat all over my [original YOLO post](https://www.reddit.com/r/wallstreetbets/s/Bu5Wb41z0d).

In 8 days, I have printed $550,000 CAD ($380K USD). It peaked up to over $660,000 CAD ($464K USD) today. It's genuinely comical how many of you bozos doubted this play. I fr think WSB has gone soft. All the hate and yapping about risk in the comments of the OG post was pathetic. After I saw all the negative comments I actually rolled the Oct calls I had with TD into Sept ones just to get some more short term leverage. Sometimes I think you regards forget what this community was made for.

Around $250K CAD ($175K USD) in profits have been secured (see the last slide), but the rest is still riding. My net worth just officially crossed $4 Million today and I’m only 21. In the OG post, I made a bet that if I got wiped out, I'd sell my McLaren and go full degen on 0DTE lottos... Thankfully I won’t have to do this, instead I think I’m actually going to buy another supercar to join the collection (lmk your thoughts on what I should get). 

Anyway I'm officially retiring from Coinbase support and draining 🍔’s. I already have a couple mil stashed away  
in Monero, but I've always had a hard time pulling out the XMR into clean fiat currency. This new fiat print is very nice cuz I can actually spend it without feds or ZachXBT up my ass. Y’all can catch me in Thailand with some femboys. Happy Canada Day, God bless America, and Godspeed 🫡",this update is dedicated to the absolute regards who shat all over my original yolo post in days i have printed cad k usd it peaked up to over cad k usd today it s genuinely comical how many of you bozos doubted this play i fr think wsb has gone soft all the hate and yapping about risk in the comments of the og post was pathetic after i saw all the negative comments i actually rolled the oct calls i had with td into sept ones just to get some more short term leverage sometimes i think you regards forget what this community was made for around k cad k usd in profits have been secured see the last slide but the rest is still riding my net worth just officially crossed million today and i m only in the og post i made a bet that if i got wiped out i d sell my mclaren and go full degen on dte lottos thankfully i won t have to do this instead i think i m actually going to buy another supercar to join the collection lmk your thoughts on what i should get anyway i m officially retiring from coinbase support and draining s i already have a couple mil stashed away in monero but i ve always had a hard time pulling out the xmr into clean fiat currency this new fiat print is very nice cuz i can actually spend it without feds or zachxbt up my ass y all can catch me in thailand with some femboys happy canada day god bless america and godspeed,0.9841,positive
2026-07-01 23:24:56+00:00,"I am reposting my original post that was removed because I did not post pictures to prove my bet. So here are screenshots of two of my purchases, you heathens.

Now here's my original post:

Allow me to place my dunce cap on the table for a second and talk about SRRK.

1. Apitegromab, through all phases of trials, has shown to be incredibly effective at reducing muscle loss resulting from drugs that cause weight loss. Phase 3 of the trial showed less than 2% of participants experiencing negative side effects. If approved to be prescribed alongside GLP-1s, this would address the largest drawback for GLP-1 patients. This makes them a prime acquisition candidate for Novo Nordisk, as there is an obvious symbiotic relationship between their products and the two companies have already partnered together on the Catalent Indiana manufacturing facility. 

2. SRRK resubmitted it's BLA to the FDA on March 31st for Apitegromab, updated and backed now by 3 very successful phases of trials.

3. This week Medicare approved of GLP-1 coverage for people 65+ for the associated health benefits. Elderly individuals are at a higher risk of significantly increased muscle loss from these drugs. I believe down the line this will expedite FDA approval of Apitegromab as a side-effect mitigator for GLP-1s. 

I think good news on any of these fronts would lead to explosive growth. Regardless, I feel the long-term potential is being greatly overlooked. 

This being said, the icing on the cake, is the lottery ticket that it comes with. And that is the possibility of (don't crucify me here) a short squeeze. There is currently a shorted position approximately 17.2% of the available public float with 16.2 days to cover. I'd never invest based on a squeeze prospect but it is an exciting little added bonus. To be clear and rule-abiding, you absolutely SHOULD NOT purchase shares with the expectation that there will be a short squeeze. The numbered reasons above are why I think this is a very strong buy (despite how much I hate the company's stupid name). The cake doesn't need icing, it's already great. 

Alright, there's my rant. I will now put my dunce cap back on. I won't brandish it again until it is gold-plated and encrusted with diamonds. In the meantime, feel free to roast me relentlessly. 

Yours Truly,

Beef Stewart",i am reposting my original post that was removed because i did not post pictures to prove my bet so here are screenshots of two of my purchases you heathens now here s my original post allow me to place my dunce cap on the table for a second and talk about srrk apitegromab through all phases of trials has shown to be incredibly effective at reducing muscle loss resulting from drugs that cause weight loss phase of the trial showed less than of participants experiencing negative side effects if approved to be prescribed alongside glp s this would address the largest drawback for glp patients this makes them a prime acquisition candidate for novo nordisk as there is an obvious symbiotic relationship between their products and the two companies have already partnered together on the catalent indiana manufacturing facility srrk resubmitted it s bla to the fda on march st for apitegromab updated and backed now by very successful phases of trials this week medicare approved of glp coverage for people for the associated health benefits elderly individuals are at a higher risk of significantly increased muscle loss from these drugs i believe down the line this will expedite fda approval of apitegromab as a side effect mitigator for glp s i think good news on any of these fronts would lead to explosive growth regardless i feel the long term potential is being greatly overlooked this being said the icing on the cake is the lottery ticket that it comes with and that is the possibility of don t crucify me here a short squeeze there is currently a shorted position approximately of the available public float with days to cover i d never invest based on a squeeze prospect but it is an exciting little added bonus to be clear and rule abiding you absolutely should not purchase shares with the expectation that there will be a short squeeze the numbered reasons above are why i think this is a very strong buy despite how much i hate the company s stupid name the cake doesn t need icing it s already great alright there s my rant i will now put my dunce cap back on i won t brandish it again until it is gold plated and encrusted with diamonds in the meantime feel free to roast me relentlessly yours truly beef stewart,0.9929,positive
2026-07-01 23:14:45+00:00,"Jack in the box JACK has less shares and more days to cover than Wendy's and has been green af lately

Who will win the fast food war?",jack in the box jack has less shares and more days to cover than wendy s and has been green af lately who will win the fast food war,0.204,positive
2026-07-01 23:09:20+00:00,,nan,0.0,neutral
2026-07-01 22:01:00+00:00,"What does everyone think about this?  Literally at historic high.  Are we headed for a meltdown or is this because of the Iran war and possible consequences of that?

The **Cboe SKEW Index** is currently trading at **149.60**, while its sister index, the **VIX**, is hovering around **16.23**.\[[1](https://www.google.com/finance), [2](https://www.google.com/finance)\]

**What These Levels Mean Right Now**  
**Elevated SKEW (149.60):** A reading near 150 is historically high. This indicates that institutional investors are actively buying ""out-of-the-money"" put options to protect their portfolios against a sudden market crash or black swan event. \[[1](https://www.google.com/finance)\]  
**Moderate VIX (16.23):** Even though SKEW is elevated, the VIX remains in a moderate, relatively calm territory. This divergence suggests that while day-to-day market anxiety is low, big players are quietly paying a premium for systemic tail-risk insurance. \[[1](https://www.google.com/finance)\]",what does everyone think about this literally at historic high are we headed for a meltdown or is this because of the iran war and possible consequences of that the cboe skew index is currently trading at while its sister index the vix is hovering around what these levels mean right now elevated skew a reading near is historically high this indicates that institutional investors are actively buying out of the money put options to protect their portfolios against a sudden market crash or black swan event moderate vix even though skew is elevated the vix remains in a moderate relatively calm territory this divergence suggests that while day to day market anxiety is low big players are quietly paying a premium for systemic tail risk insurance,-0.6486,negative
2026-07-01 22:00:23+00:00,"Guys this drop looks really ugly...

Believe it or not, calls, I guess.

Source: [https://www.atlantafed.org/research-and-data/data/gdpnow](https://www.atlantafed.org/research-and-data/data/gdpnow)",guys this drop looks really ugly believe it or not calls i guess source,-0.6901,negative
2026-07-01 21:30:23+00:00,,nan,0.0,neutral
2026-07-01 21:02:48+00:00,,nan,0.0,neutral
2026-07-01 20:51:29+00:00,"Sold meta call debit spread 2 days before pump after holding it for two months. Could’ve been 10k gain instead of 27k loss now.

Whats the opposite of insider trading called? That’s what I’m doing essentially",sold meta call debit spread days before pump after holding it for two months could ve been k gain instead of k loss now whats the opposite of insider trading called that s what i m doing essentially,0.2732,positive
2026-07-01 20:38:29+00:00,"So let me get this straight.

Suckerberg spends tens of billions panic buying AI chips because he doesn't want to be the guy left behind.

Fast forward a few months and Meta suddenly has so much spare compute that they're talking about renting it out because they built more infrastructure than they currently need.

Wall Street's reaction?

*Punish the entire semiconductor and AI sector...* while pumping Meta like this was some kind of masterstroke on their part. There was no masterstroke or masterplan. The market is punishing the sector for one man's poor foresight and incompetence.

I expect a rapid correction when people realise this.

But then again, the market normally inverses logic. So, Meta calls? ",so let me get this straight suckerberg spends tens of billions panic buying ai chips because he doesn t want to be the guy left behind fast forward a few months and meta suddenly has so much spare compute that they re talking about renting it out because they built more infrastructure than they currently need wall street s reaction punish the entire semiconductor and ai sector while pumping meta like this was some kind of masterstroke on their part there was no masterstroke or masterplan the market is punishing the sector for one man s poor foresight and incompetence i expect a rapid correction when people realise this but then again the market normally inverses logic so meta calls,-0.7898,negative
2026-07-01 20:24:03+00:00,Went down 18% should go back up 18%. ,went down should go back up,0.0,neutral
2026-07-01 20:19:28+00:00,"Honestly safer play than any of the semiconductor stocks at this time. 

No AI slop. Mods please do not delete. ",honestly safer play than any of the semiconductor stocks at this time no ai slop mods please do not delete,0.8074,positive
2026-07-01 20:12:49+00:00,Lots of sale volume on Apple but stock price stayed elevated.  I’ve never seen more sales than buys and the stock keeps ticking up.   Thoughts?,lots of sale volume on apple but stock price stayed elevated i ve never seen more sales than buys and the stock keeps ticking up thoughts,0.0,neutral
2026-07-01 20:12:22+00:00,,nan,0.0,neutral
2026-07-01 20:09:05+00:00,"In at 2:54 out at 3:09, 2% of the time it works every time",in at out at of the time it works every time,0.0,neutral
2026-07-01 20:00:38+00:00,This post contains content not supported on old Reddit. [Click here to view the full post](https://sh.reddit.com/r/wallstreetbets/comments/1ukwbxe),this post contains content not supported on old reddit click here to view the full post,-0.2411,negative
2026-07-01 19:29:45+00:00,,nan,0.0,neutral
2026-07-01 19:22:39+00:00,"This is the gains I made this week from my degenerate gambling options. However, last week I actually made about twice this so this would be a moderate week.",this is the gains i made this week from my degenerate gambling options however last week i actually made about twice this so this would be a moderate week,0.34,positive
2026-07-01 18:43:26+00:00,Holding til 300/share ,holding til share,0.296,positive
2026-07-01 18:04:07+00:00,[https://www.bcg.com/publications/2026/global-wealth-growth-in-an-era-of-reordering](https://www.bcg.com/publications/2026/global-wealth-growth-in-an-era-of-reordering),,0.0,neutral
2026-07-01 17:47:29+00:00,"things are not looking great rn 

https://preview.redd.it/dr8hosgfonah1.png?width=791&format=png&auto=webp&s=093b0ad1d4dc351a19349b9b2892d29ec5a8f848

  


",things are not looking great rn,-0.5096,negative
2026-07-01 17:40:22+00:00,"what do you think chat, am i fucked? still holding",what do you think chat am i fucked still holding,-0.6597,negative
2026-07-01 17:35:32+00:00,,nan,0.0,neutral
2026-07-01 17:26:30+00:00,What mean? Why is my selling to close price theoretical and 0,what mean why is my selling to close price theoretical and,0.0,neutral
2026-07-01 17:09:27+00:00,"(I didn’t sell, so these are all going to $0)",i didn t sell so these are all going to,0.0,neutral
2026-07-01 17:01:19+00:00,,nan,0.0,neutral
2026-07-01 16:18:55+00:00,,nan,0.0,neutral
2026-07-01 16:16:22+00:00,"Could Masayoshi Son slowly destroy Arm by taking it public? Even if that's the case, it would take years and years. Arm has a solid moat, and even the RISC-V architecture will find it very hard to disrupt.",could masayoshi son slowly destroy arm by taking it public even if that s the case it would take years and years arm has a solid moat and even the risc v architecture will find it very hard to disrupt,-0.5563,negative
2026-07-01 15:59:09+00:00,"Threw 100k on 7/2 575p yesterday cuz I thought it went up too much too fast

When I woke up this morning I was ready to close them for even or slight loss

But thanks to Zuck the cuck semis tanked, luck was on my side 🍀 

Also found out I could trade options in my 403b retirement plan and I’ve since almost tripled my account this year 😂 

Regards, 🫶🏽",threw k on p yesterday cuz i thought it went up too much too fast when i woke up this morning i was ready to close them for even or slight loss but thanks to zuck the cuck semis tanked luck was on my side also found out i could trade options in my b retirement plan and i ve since almost tripled my account this year regards,0.8381,positive
2026-07-01 15:43:32+00:00,Bought these January IGV calls Friday. Not mad at a quick $20k.,bought these january igv calls friday not mad at a quick k,0.3875,positive
2026-07-01 15:21:30+00:00,"Not selling until we hit $22 after earnings

3000 $20 strike calls, 40,000 shares 

I live in Korea - the sell-off was caused by the data breach, but the public sentiment has returned to positive and most people have renewed their subscriptions. It is very likely CPNG gets a large government grant for Coupang Intelligence and they have been extremely resilient through economic pressures

I think this is a stock people have forgotten about, but it's cheap compared to competitors due to an issue that is now behind us. Their immediate investment (quite large) into data security has calmed both the government and larger players down imo",not selling until we hit after earnings strike calls shares i live in korea the sell off was caused by the data breach but the public sentiment has returned to positive and most people have renewed their subscriptions it is very likely cpng gets a large government grant for coupang intelligence and they have been extremely resilient through economic pressures i think this is a stock people have forgotten about but it s cheap compared to competitors due to an issue that is now behind us their immediate investment quite large into data security has calmed both the government and larger players down imo,0.9418,positive
