created_utc,body,clean_body,body_sentiment,body_label
2026-07-23 03:39:25+00:00,"From $37k > $591k > $130k > $571k > $76k 

I kept buying call options as my margin limit continued to increase. And then the margin calls started, options expired and my stocks were sold for me. Had 98% of my portfolio in one space stock.",from k k k k k i kept buying call options as my margin limit continued to increase and then the margin calls started options expired and my stocks were sold for me had of my portfolio in one space stock,0.3182,positive
2026-07-23 03:05:53+00:00,Bought some puts. AMD should fly. You’re welcome everyone,bought some puts amd should fly you re welcome everyone,0.4588,positive
2026-07-23 00:25:25+00:00,Sorry not sorry,sorry not sorry,-0.1531,negative
2026-07-23 00:04:20+00:00,"I shared this as a verified trade and it was deleted, so here's an unverified screenshot instead. ",i shared this as a verified trade and it was deleted so here s an unverified screenshot instead,0.34,positive
2026-07-22 23:36:16+00:00,"I had so much money, but the casino took it back.",i had so much money but the casino took it back,0.0,neutral
2026-07-22 21:44:33+00:00,,nan,0.0,neutral
2026-07-22 20:50:38+00:00,,nan,0.0,neutral
2026-07-22 20:43:23+00:00,,nan,0.0,neutral
2026-07-22 20:21:25+00:00,,nan,0.0,neutral
2026-07-22 20:00:37+00:00,This post contains content not supported on old Reddit. [Click here to view the full post](https://sh.reddit.com/r/wallstreetbets/comments/1v3raow),this post contains content not supported on old reddit click here to view the full post,-0.2411,negative
2026-07-22 19:05:48+00:00,"*$SPCX is going one way: down.*

We all know Musk loves pumping his stocks through hype, FOMO, and soft market manipulation (taking Tesla private?). This could not be truer than for SpaceX, which is like if you took every buzzword in business today, put it in a blender, and then IPO'd the resulting scrambled eggs of a business plan. Rockets building AI datacenters to power social media chatbots? Are we insane? 

Here is my DD:

1. SpaceX is the most successful rocket company ever. It is contracted by NASA to build a moon lander. SpaceX -> moon. But today is opposite day.

2. If the AI bubble pops, it's going to start with SpaceXAI (fire the intern that suggested that). Does a sun synchronous orbit get 24/7 sun to power satellites? Yes. Does it make sense to incinerate your AI datacenters every 3 years in the upper atmosphere when South Korea is doubling their GDP selling HBM? No.

3. Twitter- I mean, X (didn't mean to dead name) is not an advertising powerhouse. It makes about the same amount of money as this platform, Reddit, worth only $32B

4. I am a greedy bastard. Money, money now, money please, me money me now money

5. Rockets will eventually be a >$1T business on fundamentals alone. But this isn't 2040 yet, it's 2026

6. If I lose my money it's fake and not real and made up, if I double my money it's real. 

7. See #4 again 

Last note: the premiums on this are insane, so I'm going with a vertical put strategy to minimize up front premium while mitigating theta decay. I also want an expiration after all the tranches of insider lockup periods are released to maximize selling pressure",spcx is going one way down we all know musk loves pumping his stocks through hype fomo and soft market manipulation taking tesla private this could not be truer than for spacex which is like if you took every buzzword in business today put it in a blender and then ipo d the resulting scrambled eggs of a business plan rockets building ai datacenters to power social media chatbots are we insane here is my dd spacex is the most successful rocket company ever it is contracted by nasa to build a moon lander spacex moon but today is opposite day if the ai bubble pops it s going to start with spacexai fire the intern that suggested that does a sun synchronous orbit get sun to power satellites yes does it make sense to incinerate your ai datacenters every years in the upper atmosphere when south korea is doubling their gdp selling hbm no twitter i mean x didn t mean to dead name is not an advertising powerhouse it makes about the same amount of money as this platform reddit worth only b i am a greedy bastard money money now money please me money me now money rockets will eventually be a t business on fundamentals alone but this isn t yet it s if i lose my money it s fake and not real and made up if i double my money it s real see again last note the premiums on this are insane so i m going with a vertical put strategy to minimize up front premium while mitigating theta decay i also want an expiration after all the tranches of insider lockup periods are released to maximize selling pressure,-0.983,negative
2026-07-22 18:50:38+00:00,,nan,0.0,neutral
2026-07-22 18:30:12+00:00,This post contains content not supported on old Reddit. [Click here to view the full post](https://sh.reddit.com/r/wallstreetbets/comments/1v3opkw),this post contains content not supported on old reddit click here to view the full post,-0.2411,negative
2026-07-22 18:26:37+00:00,,nan,0.0,neutral
2026-07-22 18:19:58+00:00,"https://preview.redd.it/nv8r7nd8pteh1.png?width=2286&format=png&auto=webp&s=5f1f26a905304a94f2d0a716ff0dd8b01f020d8a

Idk if im supposed to put this as a yolo or a loss but I am in NOW so much. as you can see, I bought the high at 130 (oops) but today, I opened up some positions right before earnings.

Did some research on the CEO and dude is a stellar guy. Not only a predator (positive connotation, not diddler connotation), but also a kind guy.

Obviously, the CEO can not control then entire company, but he has an outsized effect on it's structure and direction.

""dude

this guy is a super hero

missing one eye

no wonder he just wears glasses all the time  
[https://en.wikipedia.org/wiki/Bill\_McDermott](https://en.wikipedia.org/wiki/Bill_McDermott)

[https://www.cnbc.com/2017/06/08/sap-ceo-bill-mcdermott-on-losing-an-eye-my-accident-changed-my-life-for-the-better.html](https://www.cnbc.com/2017/06/08/sap-ceo-bill-mcdermott-on-losing-an-eye-my-accident-changed-my-life-for-the-better.html)""

# 

And yes, insider buys are bullish, ceo bought back into his stock 3M, around 104 a share, and service now is not easily replaced by AI, and actually benefits from AI research, and govt buys as well

",idk if im supposed to put this as a yolo or a loss but i am in now so much as you can see i bought the high at oops but today i opened up some positions right before earnings did some research on the ceo and dude is a stellar guy not only a predator positive connotation not diddler connotation but also a kind guy obviously the ceo can not control then entire company but he has an outsized effect on it s structure and direction dude this guy is a super hero missing one eye no wonder he just wears glasses all the time and yes insider buys are bullish ceo bought back into his stock m around a share and service now is not easily replaced by ai and actually benefits from ai research and govt buys as well,0.951,positive
2026-07-22 18:00:12+00:00,This post contains content not supported on old Reddit. [Click here to view the full post](https://sh.reddit.com/r/wallstreetbets/comments/1v3ntyr),this post contains content not supported on old reddit click here to view the full post,-0.2411,negative
2026-07-22 18:00:12+00:00,This post contains content not supported on old Reddit. [Click here to view the full post](https://sh.reddit.com/r/wallstreetbets/comments/1v3ntyw),this post contains content not supported on old reddit click here to view the full post,-0.2411,negative
2026-07-22 17:30:44+00:00,This post contains content not supported on old Reddit. [Click here to view the full post](https://sh.reddit.com/r/wallstreetbets/comments/1v3mz0l),this post contains content not supported on old reddit click here to view the full post,-0.2411,negative
2026-07-22 17:20:40+00:00,"bought some random stocks just to watch them but never made a serious play. basically I'm sitting on ""cash"" (SGOV) waiting for ""something to happen"". collecting \~3.56% so like $3,500 a month right now. which at this point i feel is safer than whatever the hell is about to happen.

Flair is DD because based on my ignorant research i say short term this bitch going down.  
EDIT: 7/23/26 didnt realize i was just like [Buffett hoarding cash](https://www.ibtimes.co.uk/stock-market-too-expensive-warren-buffett-cash-pile-1810174) haha 😁😏",bought some random stocks just to watch them but never made a serious play basically i m sitting on cash sgov waiting for something to happen collecting so like a month right now which at this point i feel is safer than whatever the hell is about to happen flair is dd because based on my ignorant research i say short term this bitch going down edit didnt realize i was just like buffett hoarding cash haha,-0.2726,negative
2026-07-22 17:18:39+00:00,"Alright degenerates, gather round.

Korea just showed us what the endgame looks like and it ain't pretty. 1.2 million accounts margin called in a week. 350K liquidated to zero. 62% of those were millennials and zoomers. Their market dropped 10% in ONE DAY because someone said ""hey maybe AI spending slows down."" 50% of their entire market was just Samsung and SK Hynix. Two stocks. That's it.

Now look at us. 34% of the S&P is in 10 companies and they're all making the exact same bet that AI capex goes up forever. NVDA, MSFT, GOOG, META, AMZN - basically running the same play Korea just fumbled. Half this sub is gonna say ""bro it's different here, the Fed prints, 401Ks buy every dip, we're the reserve currency, AI actually works.""

The other half is gonna say leverage at ATH + concentration at ATH = we're about to get our cheeks clapped harder than '08. I genuinely don't know who's right. What I do know is some Korean Warren Buffett was probably sitting there with 600% margin on 3x leveraged ETFs telling himself ""this time it's different"" right before his account got sent to the shadow realm.

So real talk - if NVDA or GOOG miss guidance by like 2% next earnings, do we get the same cascade? Or do institutions just vacuum up every share before we can even panic sell at the bottom like we always do?

Position: Sitting on cash like a coward.

What's everyone's play here? Buying the dip or hedging?",alright degenerates gather round korea just showed us what the endgame looks like and it ain t pretty million accounts margin called in a week k liquidated to zero of those were millennials and zoomers their market dropped in one day because someone said hey maybe ai spending slows down of their entire market was just samsung and sk hynix two stocks that s it now look at us of the s p is in companies and they re all making the exact same bet that ai capex goes up forever nvda msft goog meta amzn basically running the same play korea just fumbled half this sub is gonna say bro it s different here the fed prints ks buy every dip we re the reserve currency ai actually works the other half is gonna say leverage at ath concentration at ath we re about to get our cheeks clapped harder than i genuinely don t know who s right what i do know is some korean warren buffett was probably sitting there with margin on x leveraged etfs telling himself this time it s different right before his account got sent to the shadow realm so real talk if nvda or goog miss guidance by like next earnings do we get the same cascade or do institutions just vacuum up every share before we can even panic sell at the bottom like we always do position sitting on cash like a coward what s everyone s play here buying the dip or hedging,0.9062,positive
2026-07-22 12:53:08+00:00,,nan,0.0,neutral
2026-07-22 12:25:32+00:00,Everything will collapse like a fucking house of cards don't be the exit liquidity of banks and institutions,everything will collapse like a fucking house of cards don t be the exit liquidity of banks and institutions,-0.1779,negative
2026-07-22 11:47:54+00:00,"Margins - doubled to 15%

Shorts - 18% of float

Backlogged revenues: 3 years worth of 2025 booked in a single quarter (60b)

Risks:

\- scandals as usual, but with all this data center business flowing to them, CEO has his eyes on bigger pastures

\- dilution to realize the gains

At forward PE of 12, and with the latest press release, I imagine shorts will unwind.

Position: 4200 shares, sell limit 124. ",margins doubled to shorts of float backlogged revenues years worth of booked in a single quarter b risks scandals as usual but with all this data center business flowing to them ceo has his eyes on bigger pastures dilution to realize the gains at forward pe of and with the latest press release i imagine shorts will unwind position shares sell limit,0.5719,positive
2026-07-22 10:00:37+00:00,This post contains content not supported on old Reddit. [Click here to view the full post](https://sh.reddit.com/r/wallstreetbets/comments/1v3bneo),this post contains content not supported on old reddit click here to view the full post,-0.2411,negative
2026-07-22 04:32:49+00:00,"I plan to hold the following for the next 5 years at least (no day trading).  These positions will determine whether I get to retire early or not.  Obviously a gamble on semis for the foreseeable future, but I struggle on whether this is absolutely stupid or if it may pay off in the long run.  Welcome to any and all feedback, whatever it may be.

EDIT:  I really appreciate everyone’s input so far, the consensus seems to be that I’ve smoked myself stupid and the 2x letf’s are unwise, at best.",i plan to hold the following for the next years at least no day trading these positions will determine whether i get to retire early or not obviously a gamble on semis for the foreseeable future but i struggle on whether this is absolutely stupid or if it may pay off in the long run welcome to any and all feedback whatever it may be edit i really appreciate everyone s input so far the consensus seems to be that i ve smoked myself stupid and the x letf s are unwise at best,-0.1128,negative
2026-07-22 01:44:11+00:00,This game feels rigged.... i dont like it.,this game feels rigged i dont like it,-0.5588,negative
2026-07-22 01:44:01+00:00,"
As I mentioned last week, I believe the SPCX event that was scheduled right before Opex and then canceled at the last second was by design. Until I see a full transparent audit of what happened, I'll keep my conspiracy hat on. If you follow the options flow like I do, it doesn't seem that far-fetched. There was heavy put positioning at the 135 and 125 strikes, and price conveniently flushed below both. 

SPCX has over 7 billion outstanding shares, but the tradable float is very small because so many shares are locked up. Despite that, options trade with huge volume. Between the low float and heavy algo activity, the stock is much easier to push around.

Canceling the launch last Thursday flushed the stock below the 135 IPO price and encouraged more bears and shorts to pile in. Earnings are on Aug. 6, and two days later the first batch of locked-up shares becomes eligible for selling. My guess is they'll successfully launch before that Aug. 6 to Aug. 8 window. A successful launch, combined with the news, could drive a sharp rally and squeeze shorts. Elon can easily add more fuel during the earnings call by talking about SpaceX's future, creating another frenzy.

If that happens, we'll sell covered calls on our shares and collect the inflated premiums. I will likely use little bit of those premiums to buy puts because next selling wave can take the price below 100. As I said when we bought the dip, I'm not bullish or bearish on SPCX. I simply think it's a stock where we can eventually own shares at a zero cost basis and continue to generate income later.

I was tempted to buy calls this morning when SPCX opened around 120, but I held off. The next Space X launch window is schedule for July 23. With the FOMC, BOJ, and the key dates I discussed in my Q3 correction articles, stock market is going to be very volatile. There's a chance they cancel launch again and push it closer to earnings week--this could trap even more shorts. By the time I finished writing this, the stock had already rallied into the upper 120s and call premiums had jumped. 

If they cancel again this week, I'll probably buy some out of the money calls in addition to the shares we already own. If it keeps running instead, we'll wait for the excitement to peak and sell covered calls. I could be completely wrong, but I traded Tesla in its early days and I've seen how Elon has used bears and shorts to his advantage.

source: trademetry 
",as i mentioned last week i believe the spcx event that was scheduled right before opex and then canceled at the last second was by design until i see a full transparent audit of what happened i ll keep my conspiracy hat on if you follow the options flow like i do it doesn t seem that far fetched there was heavy put positioning at the and strikes and price conveniently flushed below both spcx has over billion outstanding shares but the tradable float is very small because so many shares are locked up despite that options trade with huge volume between the low float and heavy algo activity the stock is much easier to push around canceling the launch last thursday flushed the stock below the ipo price and encouraged more bears and shorts to pile in earnings are on aug and two days later the first batch of locked up shares becomes eligible for selling my guess is they ll successfully launch before that aug to aug window a successful launch combined with the news could drive a sharp rally and squeeze shorts elon can easily add more fuel during the earnings call by talking about spacex s future creating another frenzy if that happens we ll sell covered calls on our shares and collect the inflated premiums i will likely use little bit of those premiums to buy puts because next selling wave can take the price below as i said when we bought the dip i m not bullish or bearish on spcx i simply think it s a stock where we can eventually own shares at a zero cost basis and continue to generate income later i was tempted to buy calls this morning when spcx opened around but i held off the next space x launch window is schedule for july with the fomc boj and the key dates i discussed in my q correction articles stock market is going to be very volatile there s a chance they cancel launch again and push it closer to earnings week this could trap even more shorts by the time i finished writing this the stock had already rallied into the upper s and call premiums had jumped if they cancel again this week i ll probably buy some out of the money calls in addition to the shares we already own if it keeps running instead we ll wait for the excitement to peak and sell covered calls i could be completely wrong but i traded tesla in its early days and i ve seen how elon has used bears and shorts to his advantage source trademetry,0.9858,positive
2026-07-21 23:21:07+00:00,,nan,0.0,neutral
2026-07-21 21:23:54+00:00,,nan,0.0,neutral
2026-07-21 20:42:35+00:00,,nan,0.0,neutral
2026-07-21 20:38:07+00:00,"https://www.cnbc.com/2026/07/21/goldman-sachs-private-markets-platform.html

Ladder is getting pulled up boys. No more worrying about the next TSLA, AMD, etc. It will be found for you (and bought before you too). 

If you haven't made it yet...well...I hope you like the taste of the subscription-based insect food product you'll soon be living off of.",ladder is getting pulled up boys no more worrying about the next tsla amd etc it will be found for you and bought before you too if you haven t made it yet well i hope you like the taste of the subscription based insect food product you ll soon be living off of,0.3832,positive
2026-07-21 20:31:07+00:00,,nan,0.0,neutral
2026-07-21 20:26:54+00:00,"I’ve lost over **$5,800** trading options, and it’s clear what I’m doing isn’t working.

For those of you who are consistently profitable, what strategy or setup do you recommend? Any tips, rules, or habits that made a big difference for you?  
I’m looking for something simple and repeatable, not a get-rich-quick strategy. If you’ve been in my position before, what helped you turn things around?

Any advice is appreciated. Thanks",i ve lost over trading options and it s clear what i m doing isn t working for those of you who are consistently profitable what strategy or setup do you recommend any tips rules or habits that made a big difference for you i m looking for something simple and repeatable not a get rich quick strategy if you ve been in my position before what helped you turn things around any advice is appreciated thanks,0.8392,positive
2026-07-21 20:25:12+00:00,Bought 25C expires in July 2027 a few days ago.. full porting yolo,bought c expires in july a few days ago full porting yolo,0.2732,positive
2026-07-21 20:23:13+00:00,,nan,0.0,neutral
2026-07-21 20:21:02+00:00,Flip flopped this morning between calls and puts. Thank Wendy’s for the tendies ,flip flopped this morning between calls and puts thank wendy s for the tendies,0.3612,positive
2026-07-21 20:18:17+00:00,Seriously WTF,seriously wtf,-0.6705,negative
2026-07-21 20:00:53+00:00,This post contains content not supported on old Reddit. [Click here to view the full post](https://sh.reddit.com/r/wallstreetbets/comments/1v2thsx),this post contains content not supported on old reddit click here to view the full post,-0.2411,negative
2026-07-21 18:58:46+00:00,"Snack maker Utz Brands — which [owns Zapp's](https://www.utzsnacks.com/pages/ourbrands?srsltid=AfmBOooB-cWZFFt_pzSfdgKtB20Jb8HpIncRjlEhI3ZBxYkzR_XR6gc8) and several other brands, including its eponymous chip line — [has agreed](https://www.wsj.com/business/deals/utz-brands-to-be-taken-private-for-about-2-9billion-b6e8df8d) to be taken private by Germany's Intersnack Group in a deal worth about $2.9 billion. 

Intersnack will pay $14.25 a share in cash, a premium of more than 90% to Utz's last closing price of $7.45. 

Shares of the chip maker surged early Tuesday, jumping as much as 89% at one point. 

The deal will leave the founding Rice and Lissette family with ownership of half of Utz.",snack maker utz brands which owns zapp s and several other brands including its eponymous chip line has agreed to be taken private by germany s intersnack group in a deal worth about billion intersnack will pay a share in cash a premium of more than to utz s last closing price of shares of the chip maker surged early tuesday jumping as much as at one point the deal will leave the founding rice and lissette family with ownership of half of utz,0.7003,positive
2026-07-21 15:54:12+00:00,"52 MRVL $210 calls.

Bought at $6.12, now $8.65.

P&L +$13,156 (+41.33%).

3 days left.

Target $220.

Moon or dirt.

No plan B",mrvl calls bought at now p l days left target moon or dirt no plan b,-0.5574,negative
2026-07-21 13:34:34+00:00,Gona ride the lightning on this one for a bit ,gona ride the lightning on this one for a bit,0.0,neutral
2026-07-21 13:12:44+00:00,,nan,0.0,neutral
2026-07-21 12:27:12+00:00,,nan,0.0,neutral
2026-07-21 11:21:15+00:00,,nan,0.0,neutral
2026-07-21 10:01:34+00:00,This post contains content not supported on old Reddit. [Click here to view the full post](https://sh.reddit.com/r/wallstreetbets/comments/1v2e15m),this post contains content not supported on old reddit click here to view the full post,-0.2411,negative
2026-07-21 07:29:54+00:00,,nan,0.0,neutral
