created_utc,body,clean_body,body_sentiment,body_label
2026-05-15 23:10:06+00:00,"Interesting mix of stocks. No ASTS, NBIS, RKLB? What do you all think? ",interesting mix of stocks no asts nbis rklb what do you all think,0.128,positive
2026-05-15 22:33:26+00:00,Overnight calls didn’t go well; most of my set-ups failed after today’s session. Ended up going to the whore house (SPX) to sell myself cheap and recoup some of my losses. ,overnight calls didn t go well most of my set ups failed after today s session ended up going to the whore house spx to sell myself cheap and recoup some of my losses,-0.8481,negative
2026-05-15 21:40:32+00:00,"Bought 10 puts for $3.10.

Sold for $3.20. (profit of like $88 bc of option fees)

If I waited just 3-4 minutes longer, I could have sold for $14.80 (over $11,000 profit in a 5 min trade)

Bought and Sold 10 puts in the final minutes of trading as SPX was going down and when I bought them, there were 2 green candles so I was ready to cut the loss, then a red candle came in and brought me to a quick profit of $100 so I sold. Then that red candle kept going, and was followed by more... and what was $100, could have been over $13,000 in less than 5 minutes.

I have seen people say this type of stuff stings more than losses, but let me tell you first hand, it does not. I have had some losses that I held way too long and should've sold and that leaves a scar far worse than something like this.

TL:DR profit is profit, be happy, and try not to think of *what could have been*.",bought puts for sold for profit of like bc of option fees if i waited just minutes longer i could have sold for over profit in a min trade bought and sold puts in the final minutes of trading as spx was going down and when i bought them there were green candles so i was ready to cut the loss then a red candle came in and brought me to a quick profit of so i sold then that red candle kept going and was followed by more and what was could have been over in less than minutes i have seen people say this type of stuff stings more than losses but let me tell you first hand it does not i have had some losses that i held way too long and should ve sold and that leaves a scar far worse than something like this tl dr profit is profit be happy and try not to think of what could have been,0.9476,positive
2026-05-15 21:01:44+00:00,Farewell to the Chair!,farewell to the chair,0.0,neutral
2026-05-15 20:53:31+00:00,I'm a value investor now. ,i m a value investor now,0.34,positive
2026-05-15 20:47:32+00:00,"How has Wendy’s not been a bigger meme stock? It’s got the perfect ticker ($WEN) and everyone’s always talking about eating behind the Wendy’s dumpster.

You’re supposed to buy low and sell high right? Wendy’s is barely above the COVID crash lows of 2020. 13F’s today show 114% of shares outstanding owned by institutions - so that’s 27M shares MM’s, PB’s, Brokers collectively don’t have. And 46M shares in SI.

Borrow costs are already ripping (over 10% this week and closed over 8% today) as shares are becoming scarce even on the lending market.

And there’s rumblings that the largest individual holder, Nelson Peltz from Trian AM is courting overseas money to take it private. What happens when there’s a tender offer for well above current prices and no one’s selling? And there’s 73M shares that need to be bought by institutions / SI?

MOON

Modest YOLO attached ",how has wendy s not been a bigger meme stock it s got the perfect ticker wen and everyone s always talking about eating behind the wendy s dumpster you re supposed to buy low and sell high right wendy s is barely above the covid crash lows of f s today show of shares outstanding owned by institutions so that s m shares mm s pb s brokers collectively don t have and m shares in si borrow costs are already ripping over this week and closed over today as shares are becoming scarce even on the lending market and there s rumblings that the largest individual holder nelson peltz from trian am is courting overseas money to take it private what happens when there s a tender offer for well above current prices and no one s selling and there s m shares that need to be bought by institutions si moon modest yolo attached,0.91,positive
2026-05-15 20:33:16+00:00,,nan,0.0,neutral
2026-05-15 20:22:07+00:00,,nan,0.0,neutral
2026-05-15 20:08:25+00:00,,nan,0.0,neutral
2026-05-15 19:57:16+00:00,This post contains content not supported on old Reddit. [Click here to view the full post](https://sh.reddit.com/r/wallstreetbets/comments/1te7bmz),this post contains content not supported on old reddit click here to view the full post,-0.2411,negative
2026-05-15 19:48:28+00:00,Traded both puts and calls. Mostly call gains all 0dte,traded both puts and calls mostly call gains all dte,0.34,positive
2026-05-15 19:34:33+00:00,"I’ve held this position for a while, one of the first ones I’d taken getting into investing. Turns out I sold it at a terrible time 😍",i ve held this position for a while one of the first ones i d taken getting into investing turns out i sold it at a terrible time,-0.4767,negative
2026-05-15 19:19:19+00:00,,nan,0.0,neutral
2026-05-15 19:17:36+00:00,"**(Put my thoughts in AI to write with clarity)**

**1) What is Doximity:** Known as ""Linkedin for Doctors"", leading digital professional network for U.S. physicians, with 85%+ of U.S. doctors as verified members. Offers workflow tools, telehealth, on-call scheduling, and recently AI-powered clinical search and scribe products.

**2) Revenue concentration in ads + very expensive:** Roughly 85-90% of revenue comes from pharmaceutical advertising sold to drug manufacturers targeting U.S. physicians. Soft pharma ad market hits the top line directly with no diversified cushion.  Doximity commands CPMs of $80-150+ for physician-targeted ads vs. \~$7-15 for Meta and \~$3-8 for Google — a 30-50x premium pharma will increasingly question as AI-driven targeting on mass platforms improves.

**3) Earnings destruction** Stock fell \~24% on May 14 after management guided FY27 revenue growth to just 3-5%, down from 13% in FY26. Now down \~60% YTD and \~77% from the 52-week high.

**4) Still expensive despite the crash** Even post-crash, DOCS trades at 5.3x P/S and \~12.9x fwd P/E on just 5% growth — the highest P/S-to-growth ratio in the peer group, with Pinterest at 3.36x P/S on 13-16% growth and SNAP at 1.50x P/S on 10-12% growth offering cleaner setups.

**5) Margin compression from AI investments without monetization** EBITDA margins guided down from 55% to 49% as AI compute costs ramp, while management admits ""minimal AI revenue this fiscal year."" Engagement is up (+30% workflow users), but this will not translate in monetization. They pretty much have their entire doctor base on platform already

**6) AI is bifurcating the ad market** Meta and Google are pulling away through AI-driven ad optimization (Advantage+, Performance Max) that mid-tier platforms can't match. Pinterest, Snap, and a sub-scale Doximity are structurally disadvantaged as pharma budgets consolidate.

**7) No international path** \~100% U.S. business with no meaningful international revenue; verified-physician moat doesn't transfer across geographies. Sub-$700M revenue base is too small to fund the multi-year compliance build-out per market.

**8) Multiple compression has further to run** At a peer-comparable 3.5x P/S on FY27 $670M revenue, market cap would be \~$2.35B vs. current \~$3.42B — implying \~20% further downside to \~$15. IPO-era premium multiples aren't returning without growth reacceleration.

My position: $5000 in puts over 3, 6 month horizon

https://preview.redd.it/0gri9icknc1h1.png?width=947&format=png&auto=webp&s=e8187b9b5af340fbac1b5cb26a250f58dd68abad",put my thoughts in ai to write with clarity what is doximity known as linkedin for doctors leading digital professional network for u s physicians with of u s doctors as verified members offers workflow tools telehealth on call scheduling and recently ai powered clinical search and scribe products revenue concentration in ads very expensive roughly of revenue comes from pharmaceutical advertising sold to drug manufacturers targeting u s physicians soft pharma ad market hits the top line directly with no diversified cushion doximity commands cpms of for physician targeted ads vs for meta and for google a x premium pharma will increasingly question as ai driven targeting on mass platforms improves earnings destruction stock fell on may after management guided fy revenue growth to just down from in fy now down ytd and from the week high still expensive despite the crash even post crash docs trades at x p s and x fwd p e on just growth the highest p s to growth ratio in the peer group with pinterest at x p s on growth and snap at x p s on growth offering cleaner setups margin compression from ai investments without monetization ebitda margins guided down from to as ai compute costs ramp while management admits minimal ai revenue this fiscal year engagement is up workflow users but this will not translate in monetization they pretty much have their entire doctor base on platform already ai is bifurcating the ad market meta and google are pulling away through ai driven ad optimization advantage performance max that mid tier platforms can t match pinterest snap and a sub scale doximity are structurally disadvantaged as pharma budgets consolidate no international path u s business with no meaningful international revenue verified physician moat doesn t transfer across geographies sub m revenue base is too small to fund the multi year compliance build out per market multiple compression has further to run at a peer comparable x p s on fy m revenue market cap would be b vs current b implying further downside to ipo era premium multiples aren t returning without growth reacceleration my position in puts over month horizon,0.946,positive
2026-05-15 19:03:37+00:00,So far so good - except for that covered call…,so far so good except for that covered call,0.6213,positive
2026-05-15 19:00:57+00:00,"I can't believe this is how I get introduced to this community. 

MSFT bag holder here. Couple of days ago I got tired of the stock just standing still while everything else was going through the roof, I thought I'd make use of my brand new margin account and capitalize on microSOFT by selling some calls at a seemingly unreachable strike price. Well, turns out I was the one standing in the way of everyone's gains. You're welcome.",i can t believe this is how i get introduced to this community msft bag holder here couple of days ago i got tired of the stock just standing still while everything else was going through the roof i thought i d make use of my brand new margin account and capitalize on microsoft by selling some calls at a seemingly unreachable strike price well turns out i was the one standing in the way of everyone s gains you re welcome,0.4767,positive
2026-05-15 17:50:48+00:00,"https://preview.redd.it/zo0x6qu69c1h1.jpg?width=938&format=pjpg&auto=webp&s=093e34ae7aa0c162cd235fbbadb53eedd26dbe24

started watching this stock on april 24th and bought 10 shares for a degenerate post on WSB - thanks to that guu, i should have YOLO'd a FULL PORT at the time but didnt have the balls like him. when i saw earnings report was yesterday i said fuck it and went all in for a quick gain. Happy Friday y'all. and the rich get richer.

for those of you about to say must nice to have mom and dads money, see my previous [RYCEY YOLO GAINS](https://www.reddit.com/r/wallstreetbets/comments/1s2gfry/2019_to_2026_investing_196785827_in_realized/?utm_source=share&utm_medium=web3x&utm_name=web3xcss&utm_term=1&utm_content=share_button) from 2 months ago. ive been sitting on cash since then and got fomo from all the gains porn ive been seeing so went in for a quick flip.

those who will ask why i didnt do options - i have a gambling addiction so i cancelled my ability to do options or have margin in my brokerage account to prevent me from being a true regard.",started watching this stock on april th and bought shares for a degenerate post on wsb thanks to that guu i should have yolo d a full port at the time but didnt have the balls like him when i saw earnings report was yesterday i said fuck it and went all in for a quick gain happy friday y all and the rich get richer for those of you about to say must nice to have mom and dads money see my previous rycey yolo gains from months ago ive been sitting on cash since then and got fomo from all the gains porn ive been seeing so went in for a quick flip those who will ask why i didnt do options i have a gambling addiction so i cancelled my ability to do options or have margin in my brokerage account to prevent me from being a true regard,0.9899,positive
2026-05-15 17:19:16+00:00,,nan,0.0,neutral
2026-05-15 16:40:21+00:00,"https://preview.redd.it/g13a6vhdxb1h1.png?width=1434&format=png&auto=webp&s=30501d6d8ab21bb32b821aeeac59a623a535228e

Fuck this shit, its only going down from here.

Selling all my stocks and deleting the app.

See you next year boys.",fuck this shit its only going down from here selling all my stocks and deleting the app see you next year boys,-0.7964,negative
2026-05-15 16:20:56+00:00,,nan,0.0,neutral
2026-05-15 16:19:44+00:00,,nan,0.0,neutral
2026-05-15 15:33:56+00:00,"Have been watching MSFT slowly chop itself down for the last few weeks to almost $400/share; last night it just hit too low for me not to buy, especially after the bounce at open yesterday right above $400.

\~$20,000 in buying power used across two sets of trades at $20k a piece, one held overnight, one held for about 30 minutes.  In an out, just like Nick Cannon and Tyreek Hill.

Had about $10k in August calls that I bought months back, sold today for a loss of $500 or so.  MSFT's calls seemed way too cheap for the intra day moves that it's shown to make.  Interesting that it popped almost $20 points today when the wider market was quite down, and over the last week several European countries have announced their pulling away from US tech.",have been watching msft slowly chop itself down for the last few weeks to almost share last night it just hit too low for me not to buy especially after the bounce at open yesterday right above in buying power used across two sets of trades at k a piece one held overnight one held for about minutes in an out just like nick cannon and tyreek hill had about k in august calls that i bought months back sold today for a loss of or so msft s calls seemed way too cheap for the intra day moves that it s shown to make interesting that it popped almost points today when the wider market was quite down and over the last week several european countries have announced their pulling away from us tech,0.4033,positive
2026-05-15 15:32:55+00:00,"""El Niño is coming faster than expected and chances are rising that it will be historically strong"" -CNN

Per Gemini / Claude cooling, water, and agriculture are most likely to gain stock value over the next 6 months. specifically they came out for Traine (TT), Invesco DB Agriculture Fund (DBA), Bunge (BA, an AG / food co), Xylem (XYL, water technology), and Watts Water Technologies (WTS).

It seems like a good time to get in since headlines about El Niño are hitting today.

Positions: TT 11 shares, DBA 36, BG 8, XYL 27, WTS 4",el ni o is coming faster than expected and chances are rising that it will be historically strong cnn per gemini claude cooling water and agriculture are most likely to gain stock value over the next months specifically they came out for traine tt invesco db agriculture fund dba bunge ba an ag food co xylem xyl water technology and watts water technologies wts it seems like a good time to get in since headlines about el ni o are hitting today positions tt shares dba bg xyl wts,0.9498,positive
2026-05-15 15:13:24+00:00,"Bought them on a pullback and sold near the top, got lucky 🍀 ",bought them on a pullback and sold near the top got lucky,0.5574,positive
2026-05-15 15:12:08+00:00,"AMD and chip stock holders, this is worse than the dotcom crash imo.

I've been buying puts and it printed. Rolling them out to June. These analysts are the same ones you listened to when they said hold. Now they say panic and sell last minute so they can save face.after the crash. Will you be smart enough to listen? Or will you let them crash the market overnight while you're asleep and most of you can't even trade during extended hours.

I am personally going to keep buying puts til it hits 350 and then I'll hold cash for a while.

Source: https://www.barrons.com/articles/ai-bubble-take-down-stock-market-hammer-economy-a53324e7",amd and chip stock holders this is worse than the dotcom crash imo i ve been buying puts and it printed rolling them out to june these analysts are the same ones you listened to when they said hold now they say panic and sell last minute so they can save face after the crash will you be smart enough to listen or will you let them crash the market overnight while you re asleep and most of you can t even trade during extended hours i am personally going to keep buying puts til it hits and then i ll hold cash for a while source,-0.8093,negative
