created_utc,body,clean_body,body_sentiment,body_label
2026-05-18 17:25:54+00:00,"New rules from Nasdaq remove the 10% minimum requirement. 

Under the old rules, a new stock had to season for at least 3 months before it could join the index, and it had to have at least 10% of its shares traded publicly. Both of those requirements are now gone. Now, a stock is eligible for fast-track inclusion after just 15 trading days, with almost no float if its market capitalization places it among the top 40 holdings of the Nasdaq-100.

There are reports that Musk is asking underwriters to waive the typical 180-day lock-up period that prevents company insiders and some other shareholders from selling their shares after an IPO. 

According to [Semafor](https://www.semafor.com/article/04/09/2026/spacex-bankers-game-plan-to-blunt-post-ipo-selling-tsunami), Musk is pushing for a much shorter lock-up, or even none at all, with insiders able to sell in gradual tranches tied to price and trading-volume thresholds. 

That would do away with rules designed to prevent insiders from cashing out at peak hype, which are standard protections for new public shareholders.  
In practice, this means insiders get to cash out at what will probably be a record valuation for the company right when retail investors get their first opportunity to buy in. 

Musk is also apparently negotiating an above-average level of retail participation in the offering, directing [20% to 30% of the IPO to individual investors](https://marketwise.com/investing/spacex-ipo-3-unusual-things-musk-plan/), compared to the more typical 5% to 10%. Allowing insiders to exit quickly to retail buyers raises eyebrows about who benefits from these underwriting changes.

Source: https://www.forbes.com/sites/garthfriesen/2026/04/25/spacex-ipo-is-forcing-changes-to-index-and-underwriting-rules/",new rules from nasdaq remove the minimum requirement under the old rules a new stock had to season for at least months before it could join the index and it had to have at least of its shares traded publicly both of those requirements are now gone now a stock is eligible for fast track inclusion after just trading days with almost no float if its market capitalization places it among the top holdings of the nasdaq there are reports that musk is asking underwriters to waive the typical day lock up period that prevents company insiders and some other shareholders from selling their shares after an ipo according to semafor musk is pushing for a much shorter lock up or even none at all with insiders able to sell in gradual tranches tied to price and trading volume thresholds that would do away with rules designed to prevent insiders from cashing out at peak hype which are standard protections for new public shareholders in practice this means insiders get to cash out at what will probably be a record valuation for the company right when retail investors get their first opportunity to buy in musk is also apparently negotiating an above average level of retail participation in the offering directing to of the ipo to individual investors compared to the more typical to allowing insiders to exit quickly to retail buyers raises eyebrows about who benefits from these underwriting changes source,0.8832,positive
2026-05-18 17:24:59+00:00,"A little under a year ago I posted some DD on Redwire as it sat at $8.88 after a poor earnings call. I had 2800 shares at the time (\~25k), with intention to add to the position. 

Today it sits at $14, and is still undervalued.

I currently hold 6000 shares (\~84k), with intention to add more as long as space continues to gain interest, specifically orbital datacenters. With SpaceX IPO on the horizon, I think this is currently the best company to benefit from the sector growth, without needing to worry about IPO valuation skews.

In my last post I talked about how they had a backlog of contracts, and their losses were mainly due to their aggressive acquisitions rather than poor execution.

Well, looks like I was right. Revenue is up 57.9% YoY and the backlog book-to-bill ratio grew even MORE to 1.92 from 1.57, which was already high. They literally have tons of work coming in and even have Alphabet and SpaceX agreements in the pipeline for SPACE DATACENTERS.

Yes, they are currently still losing money, but only because they keep making profitable acquisitions to fulfil their backlog. They are in a rare scenario where they can go look for talent already knowing the job they will be doing next year. Most companies have to make acquisitions, then go find work.

This is the picks and shovels play for space infrastructure (starting with datacenters), which doesn't sound real, but will be very soon. Everything is pointing to it, and it's real. This is going to be a massive player in any space infrastructure play. It's not a matter of if, but when (which is why I have shares and not options). We WILL be building shit in space, and when we do, this is the best positioned company to benefit from it.

This is still accumulation phase for me, so I will be buying more over the next months. I look forward to another update if anything materially changes with the company

(Previous post: [https://www.reddit.com/r/wallstreetbets/comments/1mr0app/redwire\_rdw\_the\_oversold\_space\_winner/](https://www.reddit.com/r/wallstreetbets/comments/1mr0app/redwire_rdw_the_oversold_space_winner/) )

  
",a little under a year ago i posted some dd on redwire as it sat at after a poor earnings call i had shares at the time k with intention to add to the position today it sits at and is still undervalued i currently hold shares k with intention to add more as long as space continues to gain interest specifically orbital datacenters with spacex ipo on the horizon i think this is currently the best company to benefit from the sector growth without needing to worry about ipo valuation skews in my last post i talked about how they had a backlog of contracts and their losses were mainly due to their aggressive acquisitions rather than poor execution well looks like i was right revenue is up yoy and the backlog book to bill ratio grew even more to from which was already high they literally have tons of work coming in and even have alphabet and spacex agreements in the pipeline for space datacenters yes they are currently still losing money but only because they keep making profitable acquisitions to fulfil their backlog they are in a rare scenario where they can go look for talent already knowing the job they will be doing next year most companies have to make acquisitions then go find work this is the picks and shovels play for space infrastructure starting with datacenters which doesn t sound real but will be very soon everything is pointing to it and it s real this is going to be a massive player in any space infrastructure play it s not a matter of if but when which is why i have shares and not options we will be building shit in space and when we do this is the best positioned company to benefit from it this is still accumulation phase for me so i will be buying more over the next months i look forward to another update if anything materially changes with the company previous post,0.9841,positive
2026-05-18 17:02:37+00:00,"Sweetgreen SG has finally broken out of a long term chop, put in a strong bottom, and is poised for a strong rebound driven by fundamentals including revenue and margin expansion from wraps addition, same store sales return to positivity, Spyce divestiture, and a marketing strategy pivot that is yielding positive social media results.

Wraps are an easy win for SG in targeting cost-sensitive demos, priced from $10.95, and are showing success in expanding the base beyond salads. In April 2026, SG demonstrated a 4.8% same-store sales growth increase in wrap test markets. SG now competes with Chipotle and other fast-casual wrap and burrito offerings, which are highly popular. Wraps are substantially positive for margins and require little capex investment as it builds almost entirely from existing ingredients. Restaurant-level profit margins are currently around 10%, but tortillas are higher margin and store longer than salads. If the wrap-to-salad product mix reaches only 20% of sales, this alone could yield a restaurant profit margin increase to 15%. As a result of the wraps roll-out and operational stabilization, Sweetgreen updated its full-year 2026 guidance, projecting positive Adjusted EBITDA of $1-$6.0M.

Sweetgreen has pivoted their marketing strategy to a more personality and influencer based model including both pop culture and health influencers. This appeals to younger demographics and has resulted in a notable 27% increase in social media traffic year over year. Sweetgreen wraps searches notably have been doubling on a weekly basis since launch.

Sweetgreen has been a target of short sellers for several years, and this rebound is a catalyst to push short sellers to other opportunities. SG currently sits at 22% short, (22.8M shares), 4.8 days to cover, and 44.4% off-exchange short volume ratio in dark pools. Shorts have done well for several years here but I believe the easy money has been made here.

Strong insider buys signal the future, with the last year 1.276M net insider buys. Hedge funds also increased ownership by 400k shares last quarter.

By December 2026, these positive trends could easily drive Sweetgreen's price to sales ratio up from 1.2 to 2, which would increase the price to $12.60/share (+150% from today). A more optimistic case would be a P/S back at the historical 4 level, which would correspond to a share price of $25.20 (+300% from today). I'm optimistic in our chances of being in this range by then and have taken significant stock and options positions accordingly",sweetgreen sg has finally broken out of a long term chop put in a strong bottom and is poised for a strong rebound driven by fundamentals including revenue and margin expansion from wraps addition same store sales return to positivity spyce divestiture and a marketing strategy pivot that is yielding positive social media results wraps are an easy win for sg in targeting cost sensitive demos priced from and are showing success in expanding the base beyond salads in april sg demonstrated a same store sales growth increase in wrap test markets sg now competes with chipotle and other fast casual wrap and burrito offerings which are highly popular wraps are substantially positive for margins and require little capex investment as it builds almost entirely from existing ingredients restaurant level profit margins are currently around but tortillas are higher margin and store longer than salads if the wrap to salad product mix reaches only of sales this alone could yield a restaurant profit margin increase to as a result of the wraps roll out and operational stabilization sweetgreen updated its full year guidance projecting positive adjusted ebitda of m sweetgreen has pivoted their marketing strategy to a more personality and influencer based model including both pop culture and health influencers this appeals to younger demographics and has resulted in a notable increase in social media traffic year over year sweetgreen wraps searches notably have been doubling on a weekly basis since launch sweetgreen has been a target of short sellers for several years and this rebound is a catalyst to push short sellers to other opportunities sg currently sits at short m shares days to cover and off exchange short volume ratio in dark pools shorts have done well for several years here but i believe the easy money has been made here strong insider buys signal the future with the last year m net insider buys hedge funds also increased ownership by k shares last quarter by december these positive trends could easily drive sweetgreen s price to sales ratio up from to which would increase the price to share from today a more optimistic case would be a p s back at the historical level which would correspond to a share price of from today i m optimistic in our chances of being in this range by then and have taken significant stock and options positions accordingly,0.9977,positive
2026-05-18 16:44:06+00:00,I was hoping for something sweet today to get extra out of these calls but took the w. +$40k,i was hoping for something sweet today to get extra out of these calls but took the w k,0.4404,positive
2026-05-18 16:14:07+00:00,"Fuck the SaaSpocalypse, enterprise software is alive (except for workday, that shit is ass)

Tbh this is all inspired by a picture of Bull McDermott - dude looks like he’s straight out of the matrix",fuck the saaspocalypse enterprise software is alive except for workday that shit is ass tbh this is all inspired by a picture of bull mcdermott dude looks like he s straight out of the matrix,-0.34,negative
2026-05-18 16:05:11+00:00,"This isn’t financial advice, simply my own opinion, so do your own DD. I own a long position in OMER ($12.47 average).

**TLDR:** OMER is trading around $870 million market cap. Their drug Yartemlea alone could give the company over a $5 billion market cap. Considering their $2.1 billion deal with NOVO for another drug in their pipeline, Zaltenibart, I think OMER is currently undervalued. I think OMER will be trading around $30 per share by the end of summer 2026. My bullish estimate is $40+ (with EMA approval, EU partnership, and stronger than anticipated Yartemlea sales in 2026)

OMER is one of my favorite biotech plays at the moment. They had their 1q 2026 earnings report on May 13th, and there is a lot to be excited about in regard to the future of OMER. Here are some highlights why I think this stock will be trading at a $2 billion market cap or more by the end of summer.

**1. Yartemlea FDA & EMA Approval:** OMER received FDA approval for their drug Yartemlea in December 2025, and was giving a broad label (can be used on patients as young as 2), with no warning label, They commercially launched the drug in late January 2026. The drug treats transplant-associated thrombotic microangiopathy (TA-TMA), and it is the only FDA drug approved to treat TA-TMA. On the recent earnings call, mgmt said that this drug has already achieved self-sustainability (sales revenue exceeds production, distribution, and sales team/marketing costs).

This drug alone will help the company become cash flow positive by 2027, using 2025 expenses (so the numbers could be different based on expenses in 2026), that means mgmt thinks Yartemlea will reach at least \~$123 million in annual revenue by 2027. That is only considering the US market. In it’s commercial launch quarter (1q 2026), Yartemlea achieved $9.9 million net sales, which beat analysts expectations of $4.19 million. By the end of March, Yartemlea had orders from 30 unique accounts; 60% of the top ten transplant centers in the US have given Yartemlea P&T committee approval. The U.S. Centers for Medicare and Medicaid Services (CMS) assigned a permanent health care common procedure coding system, J-code, which will go into effect on July 1st, 2026. The J-code designation will be a huge boost to reimbursement and help drive increased sale of Yartemlea from Medicare/Medicaid patients.

OMER is awaiting EU approval for Yartemlea, which will be decided in summer 2026. If Yartemlea gets EU approval, that will increase the patient population for Yartemlea by over 100%. On their earnings call in March, mgmt confirmed they are working on a partnership deal for the EU market. Based on mgmts estimate that Yartemlea could achieve over $120 million in revenue in the US alone by 2027, if they get EU approval, that could substantially increase their current estimate (and I personally think they are intentionally being conservative with their estimated sales). So Yartemlea alone could be reaching $250 million in annual revenue by 2027.

**2. Yartemlea Sales Potential:** As far as the sales potential for Yartemlea, data I’ve read says there about 2000-3000 new cases of TA-TMA each year in the US alone. There are some higher estimates all the way up to 10,000 a year, but I’ll stick with the 2000-3000 a year estimate. Yartemlea costs $36,000 per vial, and most patients need 8-10 doses for the treatment. So that would be $288,000 to $360,000 per patient. Let’s say there’s some discounts or rebates with clinics and/or health insurance companies, I’d conservatively say it’s about $250,000 per patient. If 100% of patients that develop TA-TMA were to get this drug, that would put the ceiling at $500 million to $750 million in sales per year, in the USA alone (using 2,000-3,000 patient estimate)

The EU market would be a big deal, and it would roughly double the patient population (4,000-6,000) annually. It would bring the potential ceiling to $1.0-$1.5 billion peak annual revenue for Yartemlea. If the number of patients each year is closer to the 10,000 estimate, then that would be $2.5 billion in peak annual revenue for Yartemlea.

I realize that 100% of patients getting Yartemlea isn’t realistic, but there is currently no other drug that has been approved to treat TA-TMA. There are some off-label drugs that have been used to treat TA-TMA but they have side effects (some have serious side effects). Yartemlea does not have any directly attributed side effects from OMERs research studies (infections have been seen, but that is extremely common with TA-TMA in general so no definitive relation to the drug itself). I think the low risk of side effects from Yartemlea and the ability to be used in children as young as 2, will make Yartemlea a heavily used drug in this population.

**3. OMER Deal with NOVO:** OMER secured a deal with NOVO Nordisk in November 2025 for another drug in their pipeline, Zaltenibart, which treats rare blood and kidney disorders. This deal is worth up to a potential $2.1 billion dollars. OMER received $240 million upfront in late 2025, which they used a portion of to pay off debt. They now only have $70.8 million in debt remaining in 2029 convertibles. OMER has $171.8 million in cash and investments on hand. They have an upcoming $100 million milestone payment from the NOVO deal that mgmt feels confident they will achieve (per the deal, no specifics given on what the milestone is), and I assume “upcoming” means it will happen at some point this year.

On the recent earnings call, the CFO highlighted that OMER had repurchased 360,000 shares for $4.2 million. They indicated they may repurchase more (no specifics given) shares depending on the market conditions. All in all I think OMER will be trading over $30 a share by late summer if it gets EU approval and sales of Yartemlea are looking strong. However, if OMER announces an EU partnership deal for Yartemlea in the summer and gets EMA approval, then I think OMER will be trading over $40 per share by the end of summer.",this isn t financial advice simply my own opinion so do your own dd i own a long position in omer average tldr omer is trading around million market cap their drug yartemlea alone could give the company over a billion market cap considering their billion deal with novo for another drug in their pipeline zaltenibart i think omer is currently undervalued i think omer will be trading around per share by the end of summer my bullish estimate is with ema approval eu partnership and stronger than anticipated yartemlea sales in omer is one of my favorite biotech plays at the moment they had their q earnings report on may th and there is a lot to be excited about in regard to the future of omer here are some highlights why i think this stock will be trading at a billion market cap or more by the end of summer yartemlea fda ema approval omer received fda approval for their drug yartemlea in december and was giving a broad label can be used on patients as young as with no warning label they commercially launched the drug in late january the drug treats transplant associated thrombotic microangiopathy ta tma and it is the only fda drug approved to treat ta tma on the recent earnings call mgmt said that this drug has already achieved self sustainability sales revenue exceeds production distribution and sales team marketing costs this drug alone will help the company become cash flow positive by using expenses so the numbers could be different based on expenses in that means mgmt thinks yartemlea will reach at least million in annual revenue by that is only considering the us market in it s commercial launch quarter q yartemlea achieved million net sales which beat analysts expectations of million by the end of march yartemlea had orders from unique accounts of the top ten transplant centers in the us have given yartemlea p t committee approval the u s centers for medicare and medicaid services cms assigned a permanent health care common procedure coding system j code which will go into effect on july st the j code designation will be a huge boost to reimbursement and help drive increased sale of yartemlea from medicare medicaid patients omer is awaiting eu approval for yartemlea which will be decided in summer if yartemlea gets eu approval that will increase the patient population for yartemlea by over on their earnings call in march mgmt confirmed they are working on a partnership deal for the eu market based on mgmts estimate that yartemlea could achieve over million in revenue in the us alone by if they get eu approval that could substantially increase their current estimate and i personally think they are intentionally being conservative with their estimated sales so yartemlea alone could be reaching million in annual revenue by yartemlea sales potential as far as the sales potential for yartemlea data i ve read says there about new cases of ta tma each year in the us alone there are some higher estimates all the way up to a year but i ll stick with the a year estimate yartemlea costs per vial and most patients need doses for the treatment so that would be to per patient let s say there s some discounts or rebates with clinics and or health insurance companies i d conservatively say it s about per patient if of patients that develop ta tma were to get this drug that would put the ceiling at million to million in sales per year in the usa alone using patient estimate the eu market would be a big deal and it would roughly double the patient population annually it would bring the potential ceiling to billion peak annual revenue for yartemlea if the number of patients each year is closer to the estimate then that would be billion in peak annual revenue for yartemlea i realize that of patients getting yartemlea isn t realistic but there is currently no other drug that has been approved to treat ta tma there are some off label drugs that have been used to treat ta tma but they have side effects some have serious side effects yartemlea does not have any directly attributed side effects from omers research studies infections have been seen but that is extremely common with ta tma in general so no definitive relation to the drug itself i think the low risk of side effects from yartemlea and the ability to be used in children as young as will make yartemlea a heavily used drug in this population omer deal with novo omer secured a deal with novo nordisk in november for another drug in their pipeline zaltenibart which treats rare blood and kidney disorders this deal is worth up to a potential billion dollars omer received million upfront in late which they used a portion of to pay off debt they now only have million in debt remaining in convertibles omer has million in cash and investments on hand they have an upcoming million milestone payment from the novo deal that mgmt feels confident they will achieve per the deal no specifics given on what the milestone is and i assume upcoming means it will happen at some point this year on the recent earnings call the cfo highlighted that omer had repurchased shares for million they indicated they may repurchase more no specifics given shares depending on the market conditions all in all i think omer will be trading over a share by late summer if it gets eu approval and sales of yartemlea are looking strong however if omer announces an eu partnership deal for yartemlea in the summer and gets ema approval then i think omer will be trading over per share by the end of summer,0.9949,positive
2026-05-18 15:42:55+00:00,"Went to bank today, teller was really hot

Position: $24k of $WFC calls, various expiry’s",went to bank today teller was really hot position k of wfc calls various expiry s,0.0,neutral
