created_utc,body,clean_body,body_sentiment,body_label
2026-07-19 08:14:29+00:00,"**20k >130k > 16k > 150K > 16k on IREN and IRE, 2k left over after 14k tax penalties (Canada is a scam).** Made some then roundtripped again, then made some back then roundtripped again with IRE 2x ETF losses and WTI oil 2x ETF losses. Lost 90% on IREN TWICE. TWICE was at 130k+ (Dec 2024 and Nov 6, 2025) and back to less than 20k by July 2025 and 2026. Both times IREN peaked in November 2025 and December 2024 and it crashed in April. I made some back trading oil 2x ETF last few months April to June and then YOLOd on a 2x oil ETF in June and got crushed 50% holding leveraged long oil last few weeks and sold the exact bottom at 69 oil in July (first lost on a short as oil spiked then lost on a long as oil crashed). Then bought the top again in memory stocks DRAM two weeks ago. Should have put it all 150k (peak account value in November) on Sandisk or Micron or MUU...had I rotated back in November would be a millionaire now. Instead have to tell my wife I blew all the house downpayment money. No lambo for me. Not even a used Porsche!

I initially started with 20k on CORZQ at 1 in 2023 which I traded to 60k by the time CORZZ (warrants) went from 1 to around 3 in April 2024. I sold the bottom on CORZZ in April 2024 in the 2s before CORZZ became CORZ and went to 20+ later in 2024. I lost half with AMC and switched to IREN in fall 2024 with 30k left, reaching 120-130k by December 2024 day trading IREN.

As I lost more I revenge traded back adding more cash at bottoms like IREN, AMC, HODL, IRE 2x ETF, HOU oil 2x ETF etc, contributing about 75k total and having 15k left after 3 years of stressful trading. My hair is all white now. My wife now gives me a small allowance of play money and all I have left is the 15k now (2k after tax penalties).

I wake up every day embarrassed with how much I lost and what could have been. I just hold DRAM now at a loss from two weeks ago but if anyone has any ideas for a 10x comeback trade let me know. I may switch to LEAPS if DRAM drops more or get IREN call LEAPS again if it goes under 30 by August like last year. Or try to short oil again if it spikes near 100 (this was the correct trade just didn't hold long enough). Or maybe wait for that new capacitor ETF (Roundhill MLCC & PCB ETF — CIRQ) and get LEAPS there.

**Some lessons learned:** Always rotate after something does a 5x or 10x etc. Look for momentum themes like memory hardware shortage versus seasonal AI BTC miner stocks that hype cycle (It seems April is always the lows on tech). BTC miners peak in November to December. Use a stop loss like let's say 20 or 30% loss, that was the mistake I made with IRE. I could have exited at 60k left in January bought back the lows in April on IREN call options (which was the original plan to buy the lows in April) and then did a 5x on 60k on call options to make it all back by June (IREN cycled from 70 to 30 several times). In 2025 I sold in January recovered 60k but instead of getting IREN back at the April lows when it was 5 with call options for a literal 100x by year end I bought AMC and some crypto Solana treasury company HODL and was down another 90% by summer down to 16k. Then made it back with IREN call options by November back to 130k on that move on IREN from 25 to 80. IREN peaked November 6 after hours at 80. I sold all my call options then and got the IRE 2x ETF at the peak which crashed 90% since by the time I sold in April. The reason I got the ETF was because all the social media analysts and Youtubers were saying there would be a parabolic Santa rally into December and IREN would be 120-150. IREN cratered to 30 by December from the November 80 high.  I sold IRE in April. For oil was doing well April to June getting back to over 30k but then went all in long 2x right before the MOU announcement and oil crashed from 100 to 60s leading to another 50% loss. I actually hard a big short on oil that I closed at a loss when oil was low mid 90s right before the MOU announcement and then went all in long with everything before that weekend, then the MOU rugpull happened and in a few weeks oil was in the 60s. Now it is back up to near 90 apparently so might have been close to back to even but I had already sold the bottom in oil at 69 (the literal bottom) so now down another 50% and bought the top in DRAM ETF in June. Probably would had 30k left if I had done nothing with oil since oil pumped back up. And a lot more had I kept my original short from 90+.

**If I can say one takeaway: Don't touch 2x ETFs. Just don't do it. 2x and 3x ETFs are the devil's juice. Just ask the MSTR 2x, or SPCX 2x, or Silver 2x bros how that worked out. Even if it bounces back the volatility decay means you will still be down 90%. IREN went from 80 to 30, to 60 to 30, to 70 and the ETF went from basically 120 to 30 in 6 months while IREN was only slightly lower. Always use a stop loss like 20-30%. You can make back a 30% drop once you realize the mistake but once you're down 50-90% it's going to be impossible to make it back without a 10x. I went on vacation in November shopping for Porsches, and when I came back a month later IREN went from 80 to 30 and I was looking for a discount coupon for an oil change on a used car at a second hand shop because I couldn't even afford Mr. Lube. I was waiting for a parabolic top on IREN to 120+ by December and 150+ by January. All the Youtube and Twitter analysts were saying it would be 200+ by spring. It was 30 within weeks of 80 and the IRE ETF collapsed 90%. I was too late and too slow to rotate to silver and memory stocks. My plan was to diversity and cash out in December during the blow off top to 100+ IREN. It was 30 by then and I was down 90%.**

**The Regret: Every morning I think of this, technically the absolute peak was 150k in November 2025 since I had two accounts. The peak in December 2024 was around 130k. I withdrew maybe 20k of that and yes 15k is left. The all time peak was in November 6 2025 around 150k over 2 accounts. Had I rotated to anything else memory like Sandisk or Micron MUU back in November or Silver 2x ETF it would have been 2 million by now. Imagine that 150k in Sandisk at 80 instead of IREN at 80. IREN is now 30 and Sandisk reached 2000+. Now imagine that 150k peak in Sandisk call options LEAPS on that run from 80 to 2000+. This is what I think about every morning when I wake up and every night when I go to bed. I was preparing for an ALL IN blowoff top by spring which happened except it wasn't IREN. I picked the wrong horse due to watching some Youtubers and social media Twitter ""analysts"" who kept talking about a pending hyperscaler deal and drawing imaginary charts to 100+ IREN. It did happen for others like HUT, Micron, Sandisk, Nebius etc. IREN was a dog and others like Nebius went to the moon since. Even HUT, and all memory stocks went to the moon. Now I go to the bookstore to look at magazines and picture books on Porsches, Lambos and Ferraris, but don't even buy the books. Sometimes I buy books from Amazon and return them.**

**I updated more details to my post. I feel like a defeated down dog on the balcony of the rental condo that I can barely afford watching the Porsches, Lambos, and Ferraris go by and thinking that could have been me if only I hadn't picked the wrong ETF, IRE versus MUU or just gotten any of the memory stocks like Sandisk for that 10-20x moonshot. Literally everything else went up EXCEPT IREN. I should have rotated or diversified as soon as IREN hit my 70+ target.**

**Taxes:** Forgot the best part, ended up paying like 14k in taxes for so called higher income (double taxed on RRSP withdrawal on 30k), RRSP over contributions and retroactive interest penalties for 2 years with no tax benefit whatsoever even though I lost a ton so if you subtract that it's more like 1-2k left over. The losses are all in a TFSA now so no tax break there either. Don't invest folks, only insiders and hedge funds win and the government takes most of it in the end. And if you're in Canada don't take part in the RRSP scam because the government will take most of it in the end.

**Next steps:** Having said that if IREN drops back under 30 will probably spend that last 15k or so in LEAPS options for another run to 70 by year end. My original plan was to sell IREN in December and buy back at the April lows but it cratered too fast before I could exit. The same 30 to 80 trade with LEAPS can still be done which is how I turned 20k into 130k last year on a move from 25 to 70+. My other plan is to wait for the Roundhill MLCC & PCB ETF — CIRQ and get LEAPS on that as I think that will be the next AI bottleneck after memory. Right now just holding the DRAM memory ETF as of two weeks ago and will try to at least not lose any more money.

**IREN Analysis:** The trade was IREN 25 to 70 which is a 5-6x on LEAPS. That's how I did it last year 20k to 130k. That was my plan for April which already happened 30 to 70 AGAIN but I was too slow to exit last year so didn't do it in April. Same mistake as 2025 didn't buy the low in April at 5. The oil surge and memory surge situation threw me off this year so didn't follow my own plan. I could have easily turned that 30k into 150k from April to June if only I had bought back the April bottom in IREN. The same bottom happening again like last year and like April except this time lost capital on the oil trade. A 5x on 15k is entirely realistic by December if IREN drops enough under 30. To get to 100k would require either a bigger short term drop on IREN or more capital. Or a higher surge into year end to 100 from 25. That would make the LEAPS do an 8x on 15k. I had a good plan but did not follow it. In 2025 I cashed out 60k in January 50% down from 120k then IREN went from 15 to 5 in April, and to 80 by November. I held 120k worth of LEAPS 15 strike for Jan 2026. I could have cashed out 60k this January as well and done a 5x on the LEAPS from April to June as IREN went from 30 to 70 which was my plan but did not execute and waited too long to exit. Exited in April and did not get back into IREN instead trading oil until June. The IREN plan was solid just didn't exit on time and failed to re-enter as planned. A re-entry in the 2025 April low would have resulted in a 100x gain by November on 60k on the call options as IREN went from 3 to 80. This year I partially waited to see if IREN would get back to those 20s range like in 2025 as I would trade LEAPS at a big discount with crushed IV. There's a good chance IREN falls to 20s in August. That would be a 5-10x LEAPS trade on a return to 70+ IREN from the 20 level. In April 2025 it was 5 and then went to 80 in November and I had 120k worth of call options from 10 so you can imagine the gains had I held or better yet had I bought back at 3-5 with the 60k. IREN swings now from 30 to 70 every few months but the IV is much higher.

**LOSER: The reason I failed was lack of discipline in following the trading plan and lack of a stop loss when the crash happened last November prematurely. My plan to short oil also failed because I didn't hold the position I had and didn't follow the plan. Always follow your trading plan! Oh and back in 2024 I had 60k worth of CORZZ at 2 in April and I said I would hold until December aiming for 10 but didn't...CORZ went to 10+ by summer, then 20+ later that year, and instead I was down 50% on an AMC trade by the summer. But that's a story for another day! I revenge traded both CORZ and IREN with call options to 130k that fall of 2024 by December. Then in 2025 the same mistake, got some pump and dump HODL Solana treasury company and by summer was down back to 16k and the cycle repeated once again with IREN to 150k by November...and then with IRE and oil right back down to 16k by July AGAIN! And here we are...now got hit with 15k in tax penalties on top so only 1-2 k left. Oh and lost some money on treasury companies like BNMR, SBET, Sol Strategies HODL and some others which destroyed my capital back in early to mid 2025 so remember crypto treasury companies and BTC miners always dilute and pump and dump on hype so stay away except for a quick trade of a few months at most if you get lucky and are able to time it perfectly (MSTR and IREN being the best examples).**",k k k k k on iren and ire k left over after k tax penalties canada is a scam made some then roundtripped again then made some back then roundtripped again with ire x etf losses and wti oil x etf losses lost on iren twice twice was at k dec and nov and back to less than k by july and both times iren peaked in november and december and it crashed in april i made some back trading oil x etf last few months april to june and then yolod on a x oil etf in june and got crushed holding leveraged long oil last few weeks and sold the exact bottom at oil in july first lost on a short as oil spiked then lost on a long as oil crashed then bought the top again in memory stocks dram two weeks ago should have put it all k peak account value in november on sandisk or micron or muu had i rotated back in november would be a millionaire now instead have to tell my wife i blew all the house downpayment money no lambo for me not even a used porsche i initially started with k on corzq at in which i traded to k by the time corzz warrants went from to around in april i sold the bottom on corzz in april in the s before corzz became corz and went to later in i lost half with amc and switched to iren in fall with k left reaching k by december day trading iren as i lost more i revenge traded back adding more cash at bottoms like iren amc hodl ire x etf hou oil x etf etc contributing about k total and having k left after years of stressful trading my hair is all white now my wife now gives me a small allowance of play money and all i have left is the k now k after tax penalties i wake up every day embarrassed with how much i lost and what could have been i just hold dram now at a loss from two weeks ago but if anyone has any ideas for a x comeback trade let me know i may switch to leaps if dram drops more or get iren call leaps again if it goes under by august like last year or try to short oil again if it spikes near this was the correct trade just didn t hold long enough or maybe wait for that new capacitor etf roundhill mlcc pcb etf cirq and get leaps there some lessons learned always rotate after something does a x or x etc look for momentum themes like memory hardware shortage versus seasonal ai btc miner stocks that hype cycle it seems april is always the lows on tech btc miners peak in november to december use a stop loss like let s say or loss that was the mistake i made with ire i could have exited at k left in january bought back the lows in april on iren call options which was the original plan to buy the lows in april and then did a x on k on call options to make it all back by june iren cycled from to several times in i sold in january recovered k but instead of getting iren back at the april lows when it was with call options for a literal x by year end i bought amc and some crypto solana treasury company hodl and was down another by summer down to k then made it back with iren call options by november back to k on that move on iren from to iren peaked november after hours at i sold all my call options then and got the ire x etf at the peak which crashed since by the time i sold in april the reason i got the etf was because all the social media analysts and youtubers were saying there would be a parabolic santa rally into december and iren would be iren cratered to by december from the november high i sold ire in april for oil was doing well april to june getting back to over k but then went all in long x right before the mou announcement and oil crashed from to s leading to another loss i actually hard a big short on oil that i closed at a loss when oil was low mid s right before the mou announcement and then went all in long with everything before that weekend then the mou rugpull happened and in a few weeks oil was in the s now it is back up to near apparently so might have been close to back to even but i had already sold the bottom in oil at the literal bottom so now down another and bought the top in dram etf in june probably would had k left if i had done nothing with oil since oil pumped back up and a lot more had i kept my original short from if i can say one takeaway don t touch x etfs just don t do it x and x etfs are the devil s juice just ask the mstr x or spcx x or silver x bros how that worked out even if it bounces back the volatility decay means you will still be down iren went from to to to to and the etf went from basically to in months while iren was only slightly lower always use a stop loss like you can make back a drop once you realize the mistake but once you re down it s going to be impossible to make it back without a x i went on vacation in november shopping for porsches and when i came back a month later iren went from to and i was looking for a discount coupon for an oil change on a used car at a second hand shop because i couldn t even afford mr lube i was waiting for a parabolic top on iren to by december and by january all the youtube and twitter analysts were saying it would be by spring it was within weeks of and the ire etf collapsed i was too late and too slow to rotate to silver and memory stocks my plan was to diversity and cash out in december during the blow off top to iren it was by then and i was down the regret every morning i think of this technically the absolute peak was k in november since i had two accounts the peak in december was around k i withdrew maybe k of that and yes k is left the all time peak was in november around k over accounts had i rotated to anything else memory like sandisk or micron muu back in november or silver x etf it would have been million by now imagine that k in sandisk at instead of iren at iren is now and sandisk reached now imagine that k peak in sandisk call options leaps on that run from to this is what i think about every morning when i wake up and every night when i go to bed i was preparing for an all in blowoff top by spring which happened except it wasn t iren i picked the wrong horse due to watching some youtubers and social media twitter analysts who kept talking about a pending hyperscaler deal and drawing imaginary charts to iren it did happen for others like hut micron sandisk nebius etc iren was a dog and others like nebius went to the moon since even hut and all memory stocks went to the moon now i go to the bookstore to look at magazines and picture books on porsches lambos and ferraris but don t even buy the books sometimes i buy books from amazon and return them i updated more details to my post i feel like a defeated down dog on the balcony of the rental condo that i can barely afford watching the porsches lambos and ferraris go by and thinking that could have been me if only i hadn t picked the wrong etf ire versus muu or just gotten any of the memory stocks like sandisk for that x moonshot literally everything else went up except iren i should have rotated or diversified as soon as iren hit my target taxes forgot the best part ended up paying like k in taxes for so called higher income double taxed on rrsp withdrawal on k rrsp over contributions and retroactive interest penalties for years with no tax benefit whatsoever even though i lost a ton so if you subtract that it s more like k left over the losses are all in a tfsa now so no tax break there either don t invest folks only insiders and hedge funds win and the government takes most of it in the end and if you re in canada don t take part in the rrsp scam because the government will take most of it in the end next steps having said that if iren drops back under will probably spend that last k or so in leaps options for another run to by year end my original plan was to sell iren in december and buy back at the april lows but it cratered too fast before i could exit the same to trade with leaps can still be done which is how i turned k into k last year on a move from to my other plan is to wait for the roundhill mlcc pcb etf cirq and get leaps on that as i think that will be the next ai bottleneck after memory right now just holding the dram memory etf as of two weeks ago and will try to at least not lose any more money iren analysis the trade was iren to which is a x on leaps that s how i did it last year k to k that was my plan for april which already happened to again but i was too slow to exit last year so didn t do it in april same mistake as didn t buy the low in april at the oil surge and memory surge situation threw me off this year so didn t follow my own plan i could have easily turned that k into k from april to june if only i had bought back the april bottom in iren the same bottom happening again like last year and like april except this time lost capital on the oil trade a x on k is entirely realistic by december if iren drops enough under to get to k would require either a bigger short term drop on iren or more capital or a higher surge into year end to from that would make the leaps do an x on k i had a good plan but did not follow it in i cashed out k in january down from k then iren went from to in april and to by november i held k worth of leaps strike for jan i could have cashed out k this january as well and done a x on the leaps from april to june as iren went from to which was my plan but did not execute and waited too long to exit exited in april and did not get back into iren instead trading oil until june the iren plan was solid just didn t exit on time and failed to re enter as planned a re entry in the april low would have resulted in a x gain by november on k on the call options as iren went from to this year i partially waited to see if iren would get back to those s range like in as i would trade leaps at a big discount with crushed iv there s a good chance iren falls to s in august that would be a x leaps trade on a return to iren from the level in april it was and then went to in november and i had k worth of call options from so you can imagine the gains had i held or better yet had i bought back at with the k iren swings now from to every few months but the iv is much higher loser the reason i failed was lack of discipline in following the trading plan and lack of a stop loss when the crash happened last november prematurely my plan to short oil also failed because i didn t hold the position i had and didn t follow the plan always follow your trading plan oh and back in i had k worth of corzz at in april and i said i would hold until december aiming for but didn t corz went to by summer then later that year and instead i was down on an amc trade by the summer but that s a story for another day i revenge traded both corz and iren with call options to k that fall of by december then in the same mistake got some pump and dump hodl solana treasury company and by summer was down back to k and the cycle repeated once again with iren to k by november and then with ire and oil right back down to k by july again and here we are now got hit with k in tax penalties on top so only k left oh and lost some money on treasury companies like bnmr sbet sol strategies hodl and some others which destroyed my capital back in early to mid so remember crypto treasury companies and btc miners always dilute and pump and dump on hype so stay away except for a quick trade of a few months at most if you get lucky and are able to time it perfectly mstr and iren being the best examples,-0.9569,negative
2026-07-19 07:55:40+00:00,"I found the secret to the infinite money glitch. Finally back to trading after a 1 year hiatus. Threw half my paycheck ($750) at the start of the month into SPX 0DTE’s doing absolute degenerate intraday trades. I flip a coin, heads i buy calls and tails i buy puts. 

Positions: Scalping SPX 0DTE Calls/Puts",i found the secret to the infinite money glitch finally back to trading after a year hiatus threw half my paycheck at the start of the month into spx dte s doing absolute degenerate intraday trades i flip a coin heads i buy calls and tails i buy puts positions scalping spx dte calls puts,0.0,neutral
2026-07-19 05:17:46+00:00,RED LIGHT!,red light,0.0,neutral
2026-07-19 01:21:07+00:00,The AI era is basically following the Internet era. What we're seeing today is very similar to late 1998. And then the NASDAQ rocketed higher.,the ai era is basically following the internet era what we re seeing today is very similar to late and then the nasdaq rocketed higher,0.0,neutral
2026-07-18 21:37:23+00:00,"Funded my Roth IRA for the first time and full ported it by buying LEAPS on Mag 7 names instead of trying to day trade.  
Buy the dip. Buy plenty of time. Close the app. **Go live life.**

Buy and sell when gains hit 30-50%. No tax worries, no wash sale worries.  
So much less stressful than trying to time every intraday move!",funded my roth ira for the first time and full ported it by buying leaps on mag names instead of trying to day trade buy the dip buy plenty of time close the app go live life buy and sell when gains hit no tax worries no wash sale worries so much less stressful than trying to time every intraday move,-0.8711,negative
