created_utc,body,clean_body,body_sentiment,body_label
2026-07-11 23:03:55+00:00,Until further notice ,until further notice,0.0,neutral
2026-07-11 22:44:12+00:00,they been beefing on X (Twitter),they been beefing on x twitter,0.0,neutral
2026-07-11 21:54:44+00:00,"Maybe I’m overthinking this, so poke holes in it.  
The thinking seems to be that CPI should be okay because gas came down during June from the highs we saw in May.

I get that.  
But isn’t everyone focusing on one piece of the puzzle?  
Gas did fall month-over-month, but compared to last june, people were still paying a lot more at the pump for most of the month.

Then I started thinking about everything else that happened in June.

\-World Cup started June 11 (hotels, Airbnbs, restaurants, rideshares, flights, fan events, etc.)  
\-Summer travel season kicked off.  
\-Airlines seem more willing to cut capacity than cut prices.  
\-Beef still feels pricey.  
\-Coffee hasn’t exactly gotten cheaper.  
My grocery bill definitely doesn’t feel like inflation is over.  
It felt like half the country had their AC running nonstop.  
Netflix, AT&T, and it seems like every subscription finds another excuse to tack on a few bucks.

None of those things individually are enough to move CPI.  
But what if they don’t have to?  
What if everyone is looking at gasoline while all these smaller categories quietly add up?

I’m not saying the headline CPI comes in way above expectations. Gas falling from May could still help that.  
I’m wondering more about core CPI  
What if everyone expects around .3%, but it sneaks in at .4 because a bunch of these “little” things all hit at once?

If that happens, wouldn’t the bigger move be in the bond market?  
A hotter core number would probably push treasury yields higher as traders start pricing out rate cuts (or pricing in a greater chance the Fed stays higher for longer).   
In a way, the bond market would be tightening financial conditions before the Fed even has  
 to do anything.  
So here’s the real question…  
If your thesis is “hotter CPI #**,”** what’s the cleaner trade?  
SPY puts?  
QQQ puts?  
A Treasury trade?  
Or is this whole idea already priced in and I’m just trying to justify why my grocery bill hurts my feelings?  
Curious what everyone thinks. My kids could use a new pair of shoes for school.😁.  Thanks in advance of my loss or win🤣",maybe i m overthinking this so poke holes in it the thinking seems to be that cpi should be okay because gas came down during june from the highs we saw in may i get that but isn t everyone focusing on one piece of the puzzle gas did fall month over month but compared to last june people were still paying a lot more at the pump for most of the month then i started thinking about everything else that happened in june world cup started june hotels airbnbs restaurants rideshares flights fan events etc summer travel season kicked off airlines seem more willing to cut capacity than cut prices beef still feels pricey coffee hasn t exactly gotten cheaper my grocery bill definitely doesn t feel like inflation is over it felt like half the country had their ac running nonstop netflix at t and it seems like every subscription finds another excuse to tack on a few bucks none of those things individually are enough to move cpi but what if they don t have to what if everyone is looking at gasoline while all these smaller categories quietly add up i m not saying the headline cpi comes in way above expectations gas falling from may could still help that i m wondering more about core cpi what if everyone expects around but it sneaks in at because a bunch of these little things all hit at once if that happens wouldn t the bigger move be in the bond market a hotter core number would probably push treasury yields higher as traders start pricing out rate cuts or pricing in a greater chance the fed stays higher for longer in a way the bond market would be tightening financial conditions before the fed even has to do anything so here s the real question if your thesis is hotter cpi what s the cleaner trade spy puts qqq puts a treasury trade or is this whole idea already priced in and i m just trying to justify why my grocery bill hurts my feelings curious what everyone thinks my kids could use a new pair of shoes for school thanks in advance of my loss or win,0.9808,positive
2026-07-11 20:31:35+00:00,,nan,0.0,neutral
2026-07-11 19:26:51+00:00,"BlackBerry BB should be a long-term bet in my opinion becaue of it QNX operating system in robotics: 

BlackBerry QNX, a division of BlackBerry Limited, develops and licenses a Unix-like, microkernel-based real-time operating system (RTOS) primarily for safety-critical embedded applications. QNX software powers more than 275 million vehicles worldwide as of late 2025, with market leadership in automotive operating systems estimated at around 35-38% share in recent analyses.

It holds strong positions in infotainment, advanced driver-assistance systems (ADAS), digital cockpits, and is expanding into robotics, industrial automation, medical devices, and physical AI. In fiscal 2026, the QNX segment achieved record revenues, with Q4 revenue of $78.7 million (up 20% year-over-year) and a royalty backlog reaching approximately $950 million. BlackBerry raised its fiscal 2027 QNX revenue guidance to $295-312 million following strong first-quarter performance of about $72 million (up 26%). The platform emphasizes functional safety certifications such as ISO 26262 ASIL D and IEC 61508 SIL 3.

Soucre: [BlackBerry QNX: Real-Time Operating System for Mission-Critical Embedded Systems](https://leprivatebanker.com/2026/07/11/blackberry-qnx-real-time-operating-system-for-mission-critical-embedded-systems/)

",blackberry bb should be a long term bet in my opinion becaue of it qnx operating system in robotics blackberry qnx a division of blackberry limited develops and licenses a unix like microkernel based real time operating system rtos primarily for safety critical embedded applications qnx software powers more than million vehicles worldwide as of late with market leadership in automotive operating systems estimated at around share in recent analyses it holds strong positions in infotainment advanced driver assistance systems adas digital cockpits and is expanding into robotics industrial automation medical devices and physical ai in fiscal the qnx segment achieved record revenues with q revenue of million up year over year and a royalty backlog reaching approximately million blackberry raised its fiscal qnx revenue guidance to million following strong first quarter performance of about million up the platform emphasizes functional safety certifications such as iso asil d and iec sil soucre blackberry qnx real time operating system for mission critical embedded systems,0.9217,positive
2026-07-11 18:31:38+00:00,Seen today.,seen today,0.0,neutral
2026-07-11 14:41:45+00:00,"Always see the same tickers on wsbs nowadays. I am wondering who is looking at csquare ipo since they are a data center play. I've put in for shares and will see how it plays out this week. I also bought Cbrs recently and think they will rocket soon. Yet nobody talks about them. Just seems everyone pushes same old shit like meta and mag 7 dead stocks. Memory takes allot of space too.

Spcx still is a big talking point and of course Sk hynix. Yes I bought Spcx ipo then sold it before it dumped. I also bought 100 shares of Sk because I don't agree with the negativity surrounding it right now. If it drops more I will definitely buy more. With earnings season coming up we have allot of  catalyst that can make or break us. The new comers may soar after other earnings. With Be, Cls, Lrcx, Goog reporting end of the month I think we will get a good look at how money is being spent. All leading up to bigger gains in memory stocks. 

Just wondering where everyone else is that holds a big ai portfolio. I think csquare could be a great add but haven't really researched them. Cbrs will definitely be a bigger player  eventually. ",always see the same tickers on wsbs nowadays i am wondering who is looking at csquare ipo since they are a data center play i ve put in for shares and will see how it plays out this week i also bought cbrs recently and think they will rocket soon yet nobody talks about them just seems everyone pushes same old shit like meta and mag dead stocks memory takes allot of space too spcx still is a big talking point and of course sk hynix yes i bought spcx ipo then sold it before it dumped i also bought shares of sk because i don t agree with the negativity surrounding it right now if it drops more i will definitely buy more with earnings season coming up we have allot of catalyst that can make or break us the new comers may soar after other earnings with be cls lrcx goog reporting end of the month i think we will get a good look at how money is being spent all leading up to bigger gains in memory stocks just wondering where everyone else is that holds a big ai portfolio i think csquare could be a great add but haven t really researched them cbrs will definitely be a bigger player eventually,0.8737,positive
2026-07-11 07:32:29+00:00,"&#x200B;

Weekend Yolo.

Going back in for another round.",x b weekend yolo going back in for another round,0.2732,positive
2026-07-11 04:38:31+00:00,"I was trying to understand why SPCX is struggling to hold a bid after the Nasdaq100 inclusion, and the lock-up math is probably part of the answer.

The IPO issued 638.9M Class A shares at $135, including the full greenshoe. The first major post-IPO unlock is 911.5M shares after Q2 results + 2 trading days. That alone is 142% of the IPO-issued shares. If the extra Q2 price trigger is met, another 456M shares can unlock, taking that first window to more than 2x the IPO-issued share count.

Lock up dates matter, but the real risk is scale: how many shares become eligible for sale versus the IPO float. I find this useful when accumulating newly listed companies, so this calendar may help someone else.

Data fed into chatgpt: SEC 8-K for IPO shares/pricing and the SEC 424(b)(4) lock-up schedule. Tables generated by chatgpt.",i was trying to understand why spcx is struggling to hold a bid after the nasdaq inclusion and the lock up math is probably part of the answer the ipo issued m class a shares at including the full greenshoe the first major post ipo unlock is m shares after q results trading days that alone is of the ipo issued shares if the extra q price trigger is met another m shares can unlock taking that first window to more than x the ipo issued share count lock up dates matter but the real risk is scale how many shares become eligible for sale versus the ipo float i find this useful when accumulating newly listed companies so this calendar may help someone else data fed into chatgpt sec k for ipo shares pricing and the sec b lock up schedule tables generated by chatgpt,0.9289,positive
2026-07-11 03:23:32+00:00,No thoughts just vibes ,no thoughts just vibes,-0.296,negative
2026-07-11 02:39:00+00:00,"Reddit took my META retirement post down but you can still view the comments [here](https://www.reddit.com/r/wallstreetbets/s/OlNGBmSVPM) and also the original yolo post [here](https://www.reddit.com/r/wallstreetbets/s/c54tAW2L4S) … mods won’t reinstate the gain post because at the time I had only realized 50% of the positions gains and its a rule that gain posts have to be 100% realized… Only today did I finally finish selling off the last of that META position. Officially profited nearly $600K USD off it. I love Zuck so much.

Anyway lots of you on my retirement post raised a valid argument… it’s not possible to retire from being a degenerate, especially not at the age of 21.

I’m currently in Thailand, and the other day I was gifted a 150mcg tab of LSD from a beautiful femboy… During the comedown of my trip I noticed the emotion of fear no longer existed within my consciousness, hence why I took these positions. Worst case scenario is I blow all the fiat, stay in Thailand permanently, and live out the rest of my days surviving off my Monero stash… not bad.

Since a decent portion of this sub has already reported me to the FBI, RCMP, SEC, and Interpol for being a crypto scammer, cyber criminal, international money launderer, and of course an insider trader (how else did I time the META play so well with no DD? 😹), I figured I might as well continue ~~insider tradi~~ng gambling until the feds get me. I plan to fully exit these positions before August (hopefully I don’t get extradited before then 💔) Afterwards I'Il consider putting whatever fiat currency I have in the recos of [r/bogleheads](r/bogleheads) like a good little boomer. WAGMI my fellow regards. Godspeed.

**Positions:**  
45x - MSFT Sept 18th $400c  
50x - MSFT Oct 16th $420c  
35x - MSFT Nov 20th $400c

300x - NFLX Sept 18th $80c  
100x - NFLX Nov 20th $80c

**Disclaimer:** Lots of the text content in this post is pure bait and satire for my own entertainment. I have taken these positions based on an actual thesis and standard sizing. I do not recommend tailing this play unless you actually do your own DD, share conviction, and can also afford the risk. Both companies have been absolute dogs lately and have piss poor sentiment… then again this is WSB, so ik you degens will just blindly gamble your Wendy's paychecks however you see fit. If you want to protect your $500 accounts, your best bet is prob to just to inverse me tbh. Thanks for reading my essay 🫡",reddit took my meta retirement post down but you can still view the comments here and also the original yolo post here mods won t reinstate the gain post because at the time i had only realized of the positions gains and its a rule that gain posts have to be realized only today did i finally finish selling off the last of that meta position officially profited nearly k usd off it i love zuck so much anyway lots of you on my retirement post raised a valid argument it s not possible to retire from being a degenerate especially not at the age of i m currently in thailand and the other day i was gifted a mcg tab of lsd from a beautiful femboy during the comedown of my trip i noticed the emotion of fear no longer existed within my consciousness hence why i took these positions worst case scenario is i blow all the fiat stay in thailand permanently and live out the rest of my days surviving off my monero stash not bad since a decent portion of this sub has already reported me to the fbi rcmp sec and interpol for being a crypto scammer cyber criminal international money launderer and of course an insider trader how else did i time the meta play so well with no dd i figured i might as well continue insider tradi ng gambling until the feds get me i plan to fully exit these positions before august hopefully i don t get extradited before then afterwards i il consider putting whatever fiat currency i have in the recos of r bogleheads r bogleheads like a good little boomer wagmi my fellow regards godspeed positions x msft sept th c x msft oct th c x msft nov th c x nflx sept th c x nflx nov th c disclaimer lots of the text content in this post is pure bait and satire for my own entertainment i have taken these positions based on an actual thesis and standard sizing i do not recommend tailing this play unless you actually do your own dd share conviction and can also afford the risk both companies have been absolute dogs lately and have piss poor sentiment then again this is wsb so ik you degens will just blindly gamble your wendy s paychecks however you see fit if you want to protect your accounts your best bet is prob to just to inverse me tbh thanks for reading my essay,0.9952,positive
2026-07-11 01:51:38+00:00,After the market close of course ,after the market close of course,0.0,neutral
2026-07-10 22:06:15+00:00,"Praying we’ve reached the RKLB bottom, $71K in calls for August 21st. ",praying we ve reached the rklb bottom k in calls for august st,0.4404,positive
2026-07-10 20:47:44+00:00,,nan,0.0,neutral
2026-07-10 20:43:18+00:00,Sold my META calls (early) yesterday. Decided to go all-in with $43k into MSFT LEAPs. Breakeven of MSFT is at $443 in June 2028. I make over $100k if it’s at $550 (previous ATH) in two years…,sold my meta calls early yesterday decided to go all in with k into msft leaps breakeven of msft is at in june i make over k if it s at previous ath in two years,0.0,neutral
2026-07-10 20:42:49+00:00,Per everyone’s recommendation I opted not to touch the $200k profits and use the rest to play with. I fucking love thumb drives all the DD I need,per everyone s recommendation i opted not to touch the k profits and use the rest to play with i fucking love thumb drives all the dd i need,0.8687,positive
2026-07-10 20:00:37+00:00,This post contains content not supported on old Reddit. [Click here to view the full post](https://sh.reddit.com/r/wallstreetbets/comments/1usygvs),this post contains content not supported on old reddit click here to view the full post,-0.2411,negative
2026-07-10 20:00:18+00:00,"Bought META recently since the sentiment was all time low while it being the best company to deploy AI to actual consumer business. 

I had success buying GOOG in sub 150 level when everyone was shitting during black George Washington debacle while LLM was first introduced by them! ",bought meta recently since the sentiment was all time low while it being the best company to deploy ai to actual consumer business i had success buying goog in sub level when everyone was shitting during black george washington debacle while llm was first introduced by them,0.6124,positive
2026-07-10 19:10:46+00:00,,nan,0.0,neutral
2026-07-10 18:58:34+00:00,"Details:

* NATO leaders unveiled more than $50B in new defense agreements at the Ankara summit as European allies ramp up military spending.
* Reported beneficiaries include Northrop Grumman (surveillance drones) and Saab (aircraft), while Lockheed Martin, RTX (Raytheon) and other U.S. defense firms are expected to benefit from increased demand for Patriot, Tomahawk, and other missile systems.
* The UK, France, Germany, and nine other European countries also committed to investing $50B+ over the next decade in long-range precision strike capabilities.
* NATO Secretary General Mark Rutte called for a defense-industry “revolution” to address growing security challenges posed by Russia, China, North Korea, and Iran.

Source: [https://www.reuters.com/world/nato-unveil-big-arms-deals-ankara-before-summit-with-trump-2026-07-07/](https://www.reuters.com/world/nato-unveil-big-arms-deals-ankara-before-summit-with-trump-2026-07-07/)",details nato leaders unveiled more than b in new defense agreements at the ankara summit as european allies ramp up military spending reported beneficiaries include northrop grumman surveillance drones and saab aircraft while lockheed martin rtx raytheon and other u s defense firms are expected to benefit from increased demand for patriot tomahawk and other missile systems the uk france germany and nine other european countries also committed to investing b over the next decade in long range precision strike capabilities nato secretary general mark rutte called for a defense industry revolution to address growing security challenges posed by russia china north korea and iran source,0.9325,positive
2026-07-10 18:22:09+00:00,"I'm convinced that if an asteroid were about to wipe out the planet, the S&P would somehow still rally to fresh all-time highs.

[](https://www.reddit.com/submit/?source_id=t3_1usvf54&composer_entry=crosspost_prompt)

Riddle me how the price of oil is near pre-war levels again?

Hopefully Tuesday's inflation figures save my puts, otherwise i'm switching to calls and taking you all down with me.",i m convinced that if an asteroid were about to wipe out the planet the s p would somehow still rally to fresh all time highs riddle me how the price of oil is near pre war levels again hopefully tuesday s inflation figures save my puts otherwise i m switching to calls and taking you all down with me,0.7184,positive
2026-07-10 17:37:45+00:00,,nan,0.0,neutral
2026-07-10 16:23:56+00:00,"Saw soxl oscillate every 3-5 days. put in almost 12k on a 2week out call, thought ill catch a peak sometime in between. 

Don’t be a regard like me. ",saw soxl oscillate every days put in almost k on a week out call thought ill catch a peak sometime in between don t be a regard like me,-0.0772,negative
2026-07-10 15:26:24+00:00,,nan,0.0,neutral
2026-07-10 14:47:48+00:00,,nan,0.0,neutral
2026-07-10 14:42:12+00:00,I sold so fast but this was genuinely a miracle for me 😭 I think I’m done for today lol,i sold so fast but this was genuinely a miracle for me i think i m done for today lol,0.872,positive
2026-07-10 14:38:02+00:00,Caught it while taking a shit and smashed the sell button.,caught it while taking a shit and smashed the sell button,-0.5574,negative
2026-07-10 10:46:41+00:00,,nan,0.0,neutral
2026-07-10 10:00:55+00:00,This post contains content not supported on old Reddit. [Click here to view the full post](https://sh.reddit.com/r/wallstreetbets/comments/1usj8ot),this post contains content not supported on old reddit click here to view the full post,-0.2411,negative
2026-07-10 06:54:14+00:00,"so, explain this cuck fucking piece of shit of a stock market to me  
are we still doing data centers in space? ai ai ai agents continue to shit themselves, while cheap local models get 90% of the job done  
dafuq is the bull case now?  
are we trying to pump snp500 trailing p/e to 46 just for fun?  
i am all ears bulls, give it to me straight",so explain this cuck fucking piece of shit of a stock market to me are we still doing data centers in space ai ai ai agents continue to shit themselves while cheap local models get of the job done dafuq is the bull case now are we trying to pump snp trailing p e to just for fun i am all ears bulls give it to me straight,-0.5465,negative
2026-07-10 06:42:26+00:00,It happens to the best of us ,it happens to the best of us,0.6369,positive
2026-07-10 02:32:00+00:00,,nan,0.0,neutral
2026-07-09 23:29:09+00:00,Sold some of these today near the top but HODLing the rest,sold some of these today near the top but hodling the rest,0.1027,positive
2026-07-09 23:14:38+00:00,,nan,0.0,neutral
2026-07-09 23:10:14+00:00,"Space stocks and chip stocks are the same trade in a trench coat. ASTS makes satellites (chips in orbit). MU makes memory (chips in data centers).

*2026: The Year of Silicon. Realized $1.35M from chips + memory. History books will call this*

**Ticker**	|**Realized Gain**	|**What It Does**	  
MU	|+$772,309.80	|Memory (HBM)	  
CLSK	|+$209,855.99	|Bitcoin mining (ASIC)	  
INTC	|+$188,332.58	|CPU/foundry chips	  
ASTS	|+$173,507.18	|Satellite communication	  
WDC	|+$86,023.51	|Storage (NAND)	  
**Chip Total**	|**+$1,430,028.06**	|**THE ENTIRE ECONOMY**	",space stocks and chip stocks are the same trade in a trench coat asts makes satellites chips in orbit mu makes memory chips in data centers the year of silicon realized m from chips memory history books will call this ticker realized gain what it does mu memory hbm clsk bitcoin mining asic intc cpu foundry chips asts satellite communication wdc storage nand chip total the entire economy,0.5267,positive
2026-07-09 22:49:45+00:00,"Below outlines my journey:

\-May of 2025, I moved my 401k to a personal choice account. I got sick of all the dips occuring mid-month. My port had something like 8 holdings, all index ETFs, 70% VOO. I can buy the dips now.

""I will NEVER buy an individual stock""

\-October 2025, I bought my first individual stock. One I have a personal connection with, a very stable industrial.

""Just this one, and only for 6-9 months""

""I will NEVER trade options.""

\-January 2026, My port now has 25+ holdings, 5-10 individual stocks at any given time, 1-4% allocations.

""I'm just creating my own ETF, it's not like I'm trading options""

\-May 2026, my port at one point is 20% SNDK and 20% MU. I did get out of it with a 10% gain on my entire net worth.

""I will NEVER trade options""

\-July 8 2026, I bought my first leveraged ETF in the after-hours in my taxable account to sell the next day. 50-50 shot and it paid off.

\-July 9 2026, I activated Tier 1 options in my taxable account. Planning on trying some 0DTE tomorrow.

WSB played a big part in this.

**TLDR: Boglehead turned into a degenerate.**",below outlines my journey may of i moved my k to a personal choice account i got sick of all the dips occuring mid month my port had something like holdings all index etfs voo i can buy the dips now i will never buy an individual stock october i bought my first individual stock one i have a personal connection with a very stable industrial just this one and only for months i will never trade options january my port now has holdings individual stocks at any given time allocations i m just creating my own etf it s not like i m trading options may my port at one point is sndk and mu i did get out of it with a gain on my entire net worth i will never trade options july i bought my first leveraged etf in the after hours in my taxable account to sell the next day shot and it paid off july i activated tier options in my taxable account planning on trying some dte tomorrow wsb played a big part in this tldr boglehead turned into a degenerate,0.902,positive
